contentType,title,abstract,abstract_google_cn,affiliations,authorization,authors,citation_text,count_accesses,count_altmetric,count_citations,documentType,doi,doi_url,focus,issue,journal_pcode,journal_title,publishedAt,publishedAtString,subjects,url,volume
editorial,Innovation off the beaten path,,,[],True,[],"Innovation off the beaten path. Nature Nanotech11, 575 (2016).",62,3,1,aplusplus,10.1038/nnano.2016.124,https://doi.org/10.1038/nnano.2016.124,,7,nnano,nature nanotechnology,1467763200,2016-07-06,education;quantum-information,https://www.nature.com/articles/nnano.2016.124,11
editorial,What is Nano?,,,[],True,[],"What is Nano?. Nature Nanotech11, 575 (2016).",578,3,0,aplusplus,10.1038/nnano.2016.133,https://doi.org/10.1038/nnano.2016.133,,7,nnano,nature nanotechnology,1467763200,2016-07-06,nanoscale-devices;nanoscale-materials,https://www.nature.com/articles/nnano.2016.133,11
thesis,Environment matters for all,,,"[{'address': 'Chris Toumey is at the Center for Environmental Nanoscience & Risk at the University of South Carolina', 'authors': ['Chris Toumey']}]",False,['Chris Toumey'],"Toumey, C. Environment matters for all. Nature Nanotech11, 576–577 (2016).",36,3,1,aplusplus,10.1038/nnano.2016.122,https://doi.org/10.1038/nnano.2016.122,,7,nnano,nature nanotechnology,1467763200,2016-07-06,ecotoxicology;environmental-health-and-safety-issues;ethical-legal-and-other-societal-issues,https://www.nature.com/articles/nnano.2016.122,11
research highlights,Our choice from the recent literature,,,[],True,[],"Our choice from the recent literature. Nature Nanotech11, 578 (2016).",52,1,0,aplusplus,10.1038/nnano.2016.130,https://doi.org/10.1038/nnano.2016.130,,7,nnano,nature nanotechnology,1467763200,2016-07-06,atomic-force-microscopy;catalysis;graphene;molecular-self-assembly;nanoparticles;quantum-hall;superconductors;supramolecular-chemistry,https://www.nature.com/articles/nnano.2016.130,11
news & views,Nanoparticles make salty circuits,,,"[{'address': 'Hao Yan and Nicholas Melosh are in the Department of Materials Science and Engineering, Stanford University, 496 Lomita Mall, Stanford, California 94305, USA, and the Stanford Institute for Materials and Energy Sciences, SLAC National Accelerator Laboratory, 2575 Sand Hill Road, Menlo Park, California 94025, USA', 'authors': ['Hao Yan', '\xa0&\xa0Nicholas Melosh']}]",False,"['Hao Yan', 'Nicholas Melosh']","Yan, H., Melosh, N. Nanoparticles make salty circuits. Nature Nanotech11, 579–580 (2016).",157,6,5,aplusplus,10.1038/nnano.2016.46,https://doi.org/10.1038/nnano.2016.46,,7,nnano,nature nanotechnology,1457913600,2016-03-14,electronic-devices;sensors,https://www.nature.com/articles/nnano.2016.46,11
news & views,Going small to beat the high,,,"[{'address': 'Eric C. Peterson and Laura E. Ewing are in the Department of Pharmacology and Toxicology, College of Medicine, University of Arkansas for Medical Sciences, Little Rock, Arkansas 72205, USA', 'authors': ['Eric C. Peterson', '\xa0&\xa0Laura E. Ewing']}]",False,"['Eric C. Peterson', 'Laura E. Ewing']","Peterson, E., Ewing, L. Going small to beat the high. Nature Nanotech11, 580–581 (2016).",98,6,7,aplusplus,10.1038/nnano.2016.45,https://doi.org/10.1038/nnano.2016.45,,7,nnano,nature nanotechnology,1457913600,2016-03-14,nanomedicine,https://www.nature.com/articles/nnano.2016.45,11
news & views,Running on information,,,"[{'address': 'R. Dean Astumian is in the Department of Physics and Astronomy, University of Maine, 120 Bennett Hall, Orono, Maine 04469, USA', 'authors': ['R. Dean Astumian']}]",False,['R. Dean Astumian'],"Astumian, R. Running on information. Nature Nanotech11, 582–583 (2016).",204,1,10,aplusplus,10.1038/nnano.2016.98,https://doi.org/10.1038/nnano.2016.98,,7,nnano,nature nanotechnology,1465776000,2016-06-13,molecular-machines-and-motors,https://www.nature.com/articles/nnano.2016.98,11
perspective,The nanotechnology of life-inspired systems,,,"[{'address': 'IBS Center for Soft and Living Matter and the Department of Chemistry, UNIST-gil 50, Ulsan, 689-798, Eonyang-eup, Ulju-gun, Republic of Korea', 'authors': ['Bartosz A. Grzybowski']}, {'address': 'Radboud University, Institute for Molecules and Materials, Heyendaalseweg 135, Nijmegen, 6525AJ, The Netherlands', 'authors': ['Wilhelm T. S. Huck']}]",False,"['Bartosz A. Grzybowski', 'Wilhelm T. S. Huck']","Grzybowski, B., Huck, W. The nanotechnology of life-inspired systems. Nature Nanotech11, 585–592 (2016).",2323,26,165,aplusplus,10.1038/nnano.2016.116,https://doi.org/10.1038/nnano.2016.116,,7,nnano,nature nanotechnology,1467763200,2016-07-06,molecular-machines-and-motors;molecular-self-assembly;other-nanotechnology,https://www.nature.com/articles/nnano.2016.116,11
letter,Quantum Hall effect in black phosphorus two-dimensional electron system,,,"[{'address': 'State Key Laboratory of Surface Physics and Department of Physics, Fudan University, Shanghai, 200433, China', 'authors': ['Likai Li', ',\xa0Fangyuan Yang', '\xa0&\xa0Yuanbo Zhang']}, {'address': 'Collaborative Innovation Center of Advanced Microstructures, Nanjing, 210093, China', 'authors': ['Likai Li', ',\xa0Fangyuan Yang', ',\xa0Guo Jun Ye', ',\xa0Xian Hui Chen', '\xa0&\xa0Yuanbo Zhang']}, {'address': 'Hefei National Laboratory for Physical Science at Microscale and Department of Physics, University of Science and Technology of China, Hefei, 230026, Anhui, China', 'authors': ['Guo Jun Ye', '\xa0&\xa0Xian Hui Chen']}, {'address': 'Key Laboratory of Strongly Coupled Quantum Matter Physics, University of Science and Technology of China, Hefei, 230026, Anhui, China', 'authors': ['Guo Jun Ye', '\xa0&\xa0Xian Hui Chen']}, {'address': 'Department of Physics, State Key Laboratory of Low Dimensional Quantum Physics, Tsinghua University, Beijing, 100084, China', 'authors': ['Zuocheng Zhang', '\xa0&\xa0Yayu Wang']}, {'address': 'Wuhan National High Magnetic Field Center and School of Physics, Huazhong University of Science and Technology, Wuhan, 430074, China', 'authors': ['Zengwei Zhu', '\xa0&\xa0Liang Li']}, {'address': 'SKLSM, Institute of Semiconductors, Chinese Academy of Sciences, PO Box 912, Beijing, 100083, China', 'authors': ['Wenkai Lou', ',\xa0Xiaoying Zhou', '\xa0&\xa0Kai Chang']}, {'address': 'Synergetic Innovation Center of Quantum Information and Quantum Physics, University of Science and Technology of China, Hefei, 230026, Anhui, China', 'authors': ['Wenkai Lou', ',\xa0Xiaoying Zhou', '\xa0&\xa0Kai Chang']}, {'address': 'Advanced Materials Laboratory, National Institute for Materials Science, 1-1 Namiki, Tsukuba, 305-0044, Japan', 'authors': ['Kenji Watanabe', '\xa0&\xa0Takashi Taniguchi']}]",False,"['Likai Li', 'Fangyuan Yang', 'Guo Jun Ye', 'Zuocheng Zhang', 'Zengwei Zhu', 'Wenkai Lou', 'Xiaoying Zhou', 'Liang Li', 'Kenji Watanabe', 'Takashi Taniguchi', 'Kai Chang', 'Yayu Wang', 'Xian Hui Chen', 'Yuanbo Zhang']","Li, L., Yang, F., Ye, G. et al. Quantum Hall effect in black phosphorus two-dimensional electron system. Nature Nanotech11, 593–597 (2016).",2553,9,219,aplusplus,10.1038/nnano.2016.42,https://doi.org/10.1038/nnano.2016.42,,7,nnano,nature nanotechnology,1459123200,2016-03-28,electronic-properties-and-materials;quantum-hall,https://www.nature.com/articles/nnano.2016.42,11
letter,Electrical generation and control of the valley carriers in a monolayer transition metal dichalcogenide,,,"[{'address': 'NSF Nanoscale Science and Engineering Center, University of California, 3112 Etcheverry Hall, Berkeley, 94720, California, USA', 'authors': ['Yu Ye', ',\xa0Jun Xiao', ',\xa0Ziliang Ye', ',\xa0Hanyu Zhu', ',\xa0Mervin Zhao', ',\xa0Yuan Wang', '\xa0&\xa0Xiang Zhang']}, {'address': 'State Key Laboratory of Superlattices and Microstructures, Institute of Semiconductors, Chinese Academy of Sciences, PO Box 912, Beijing, 10083, China', 'authors': ['Hailong Wang', '\xa0&\xa0Jianhua Zhao']}, {'address': 'Department of Mechanical Engineering and Materials Science and Engineering Program, University of Colorado Boulder, Boulder, 80309, Colorado, USA', 'authors': ['Xiaobo Yin']}, {'address': 'Materials Sciences Division, Lawrence Berkeley National Laboratory, 1 Cyclotron Road, Berkeley, 94720, California, USA', 'authors': ['Xiang Zhang']}, {'address': 'Department of Physics, King Abdulaziz University, Jeddah, 21589, Saudi Arabia', 'authors': ['Xiang Zhang']}]",False,"['Yu Ye', 'Jun Xiao', 'Hailong Wang', 'Ziliang Ye', 'Hanyu Zhu', 'Mervin Zhao', 'Yuan Wang', 'Jianhua Zhao', 'Xiaobo Yin', 'Xiang Zhang']","Ye, Y., Xiao, J., Wang, H. et al. Electrical generation and control of the valley carriers in a monolayer transition metal dichalcogenide. Nature Nanotech11, 598–602 (2016).",2050,116,134,aplusplus,10.1038/nnano.2016.49,https://doi.org/10.1038/nnano.2016.49,,7,nnano,nature nanotechnology,1459728000,2016-04-04,electronic-devices;surfaces-interfaces-and-thin-films,https://www.nature.com/articles/nnano.2016.49,11
letter,Chemoelectronic circuits based on metal nanoparticles,,,"[{'address': 'CAS Key Laboratory of Nanosystem and Hierarchical Fabrication, CAS Center for Excellence in Nanoscience, National Center for Nanoscience and Technology, Beijing, 100190, China', 'authors': ['Yong Yan']}, {'address': 'Department of Chemistry, University of North Carolina at Chapel Hill, Chapel Hill, 27599-3290, North Carolina, USA', 'authors': ['Scott C. Warren']}, {'address': 'Department of Applied Physical Sciences, University of North Carolina at Chapel Hill, Chapel Hill, 27599-3216, North Carolina, USA', 'authors': ['Scott C. Warren']}, {'address': 'NuMat Technologies, Skokie, 60077, Illinois, USA', 'authors': ['Patrick Fuller']}, {'address': 'IBS Center for Soft and Living Matter and the Department of Chemistry, UNIST, Ulsan, South Korea', 'authors': ['Bartosz A. Grzybowski']}]",False,"['Yong Yan', 'Scott C. Warren', 'Patrick Fuller', 'Bartosz A. Grzybowski']","Yan, Y., Warren, S., Fuller, P. et al. Chemoelectronic circuits based on metal nanoparticles. Nature Nanotech11, 603–608 (2016).",1072,23,55,aplusplus,10.1038/nnano.2016.39,https://doi.org/10.1038/nnano.2016.39,,7,nnano,nature nanotechnology,1457913600,2016-03-14,electronic-devices;nanoscale-devices,https://www.nature.com/articles/nnano.2016.39,11
letter,Single-nanowire photoelectrochemistry,,,"[{'address': 'Department of Chemistry, University of California, Berkeley, 94720, California, USA', 'authors': ['Yude Su', ',\xa0Chong Liu', ',\xa0Sarah Brittman', ',\xa0Jinyao Tang', ',\xa0Anthony Fu', ',\xa0Nikolay Kornienko', ',\xa0Qiao Kong', '\xa0&\xa0Peidong Yang']}, {'address': 'Materials Sciences Division, Lawrence Berkeley National Laboratory, Berkeley, 94720, California, USA', 'authors': ['Chong Liu', ',\xa0Sarah Brittman', ',\xa0Jinyao Tang', ',\xa0Anthony Fu', ',\xa0Nikolay Kornienko', '\xa0&\xa0Peidong Yang']}, {'address': 'Department of Materials Science and Engineering, University of California, Berkeley, 94720, California, USA', 'authors': ['Peidong Yang']}, {'address': 'Kavli Energy Nanosciences Institute, Berkeley, 94720, California, USA', 'authors': ['Peidong Yang']}]",False,"['Yude Su', 'Chong Liu', 'Sarah Brittman', 'Jinyao Tang', 'Anthony Fu', 'Nikolay Kornienko', 'Qiao Kong', 'Peidong Yang']","Su, Y., Liu, C., Brittman, S. et al. Single-nanowire photoelectrochemistry. Nature Nanotech11, 609–612 (2016).",1372,11,65,aplusplus,10.1038/nnano.2016.30,https://doi.org/10.1038/nnano.2016.30,,7,nnano,nature nanotechnology,1459123200,2016-03-28,nanoscale-devices;nanowires,https://www.nature.com/articles/nnano.2016.30,11
letter,Aggregated single-walled carbon nanotubes attenuate the behavioural and neurochemical effects of methamphetamine in mice,,,"[{'address': 'CAS Center for Excellence in Nanoscience, Chinese Academy of Sciences and National Center for Nanoscience and Technology of China, Beijing, 100190, China', 'authors': ['Xue Xue', ',\xa0Li-Rong Wang', ',\xa0Tuo Wei', ',\xa0Guang-Lu Ge', '\xa0&\xa0Xing-Jie Liang']}, {'address': 'Department of Pharmacology, Shenyang Pharmaceutical University, Shenyang, 110016, China', 'authors': ['Jing-Yu Yang', ',\xa0Ping Liu', ',\xa0Li-Sha Yu', ',\xa0Ming-Ming Zhu', ',\xa0Yue-Yang Liu', ',\xa0Xiao-Ting Yang', ',\xa0Xin-Yu Fan', ',\xa0Xiao-Min Wang', ',\xa0Wei Cui', '\xa0&\xa0Chun-Fu Wu']}, {'address': 'Intramural Research Program, National Institute on Drug Abuse, National Institutes of Health, Baltimore, 21224, Maryland, USA', 'authors': ['Yi He', ',\xa0Guo-Hua Bi', ',\xa0Jia Qi', '\xa0&\xa0Zheng-Xiong Xi']}, {'address': 'CAS Key Laboratory of Standardization and Measurement for Nanotechnology, National Center for Nanoscience and Technology of China, Beijing, 100190, China', 'authors': ['Li-Rong Wang', '\xa0&\xa0Guang-Lu Ge']}, {'address': 'Department of Biopharmaceutical Information, Shenyang Pharmaceutical University, Shenyang, 110016, China', 'authors': ['Rong-Wu Xiang']}, {'address': 'State Key Laboratory of Biomacromolecules, Institute of Biophysics, Chinese Academy of Sciences, Beijing, 100101, China', 'authors': ['Hong-Jie Zhang']}, {'address': 'CAS Key Laboratory for Biomedical Effects of Nanomaterials and Nanosafety, National Center for Nanoscience and Technology of China, Beijing, 100190, China', 'authors': ['Tuo Wei', '\xa0&\xa0Xing-Jie Liang']}]",False,"['Xue Xue', 'Jing-Yu Yang', 'Yi He', 'Li-Rong Wang', 'Ping Liu', 'Li-Sha Yu', 'Guo-Hua Bi', 'Ming-Ming Zhu', 'Yue-Yang Liu', 'Rong-Wu Xiang', 'Xiao-Ting Yang', 'Xin-Yu Fan', 'Xiao-Min Wang', 'Jia Qi', 'Hong-Jie Zhang', 'Tuo Wei', 'Wei Cui', 'Guang-Lu Ge', 'Zheng-Xiong Xi', 'Chun-Fu Wu', 'Xing-Jie Liang']","Xue, X., Yang, J., He, Y. et al. Aggregated single-walled carbon nanotubes attenuate the behavioural and neurochemical effects of methamphetamine in mice. Nature Nanotech11, 613–620 (2016).",555,24,24,aplusplus,10.1038/nnano.2016.23,https://doi.org/10.1038/nnano.2016.23,,7,nnano,nature nanotechnology,1457913600,2016-03-14,carbon-nanotubes-and-fullerenes;drug-delivery;nanobiotechnology,https://www.nature.com/articles/nnano.2016.23,11
article,A spin–orbit torque switching scheme with collinear magnetic easy axis and current configuration,"<p>Spin&#8211;orbit torque, a torque brought about by in-plane current via the spin&#8211;orbit interactions in heavy-metal/ferromagnet nanostructures, provides a new pathway to switch the magnetization direction. Although there are many recent studies, they all build on one of two structures that have the easy axis of a nanomagnet lying orthogonal to the current, that is, along the z or y axes. Here, we present a new structure with the third geometry, that is, with the easy axis collinear with the current (along the x axis). We fabricate a three-terminal device with a Ta/CoFeB/MgO-based stack and demonstrate the switching operation driven by the spin&#8211;orbit torque due to Ta with a negative spin Hall angle. Comparisons with different geometries highlight the previously unknown mechanisms of spin&#8211;orbit torque switching. Our work offers a new avenue for exploring the physics of spin&#8211;orbit torque switching and its application to spintronics devices.</p>",,"[{'address': 'Center for Spintronics Integrated Systems, Tohoku University, 2-1-1 Katahira, Aoba, 980-8577, Sendai, Japan', 'authors': ['S. Fukami', '\xa0&\xa0H. Ohno']}, {'address': 'Center for Innovative Integrated Electronic Systems, Tohoku University, 468-1 Aoba, Aramaki, Aoba, 980-0845, Sendai, Japan', 'authors': ['S. Fukami', '\xa0&\xa0H. Ohno']}, {'address': 'Laboratory for Nanoelectronics and Spintronics, Research Institute of Electrical Communication, Tohoku University, 2-1-1 Katahira, Aoba, 980-8577, Sendai, Japan', 'authors': ['T. Anekawa', ',\xa0C. Zhang', '\xa0&\xa0H. Ohno']}, {'address': 'WPI Advanced Institute for Materials Research, Tohoku University, 2-1-1 Katahira, Aoba, 980 8577, Sendai, Japan', 'authors': ['H. Ohno']}]",False,"['S. Fukami', 'T. Anekawa', 'C. Zhang', 'H. Ohno']","Fukami, S., Anekawa, T., Zhang, C. et al.A spin–orbit torque switching scheme with collinear magnetic easy axis and current configuration. Nature Nanotech11, 621–625 (2016).",2949,51,163,aplusplus,10.1038/nnano.2016.29,https://doi.org/10.1038/nnano.2016.29,,7,nnano,nature nanotechnology,1458518400,2016-03-21,magnetic-devices;spintronics,https://www.nature.com/articles/nnano.2016.29,11
article,Layered reduced graphene oxide with nanoscale interlayer gaps as a stable host for lithium metal anodes,"<p>Metallic lithium is a promising anode candidate for future high-energy-density lithium batteries. It is a light-weight material, and has the highest theoretical capacity (3,860&#8197;mAh&#8197;g<sup>&#8211;1</sup>) and the lowest electrochemical potential of all candidates. There are, however, at least three major hurdles before lithium metal anodes can become a viable technology: uneven and dendritic lithium deposition, unstable solid electrolyte interphase and almost infinite relative dimension change during cycling. Previous research has tackled the first two issues, but the last is still mostly unsolved. Here we report a composite lithium metal anode that exhibits low dimension variation (&#8764;20%) during cycling and good mechanical flexibility. The anode is composed of 7&#8197;wt% &#8216;lithiophilic&#8217; layered reduced graphene oxide with nanoscale gaps that can host metallic lithium. The anode retains up to &#8764;3,390&#8197;mAh&#8197;g<sup>&#8211;1</sup> of capacity, exhibits low overpotential (&#8764;80&#8197;mV at 3&#8197;mA&#8197;cm<sup>&#8211;2</sup>) and a flat voltage profile in a carbonate electrolyte. A full-cell battery with a LiCoO<sub>2</sub> cathode shows good rate capability and flat voltage profiles.</p>",,"[{'address': 'Department of Materials Science and Engineering, Stanford University, Stanford, 94305, California, USA', 'authors': ['Dingchang Lin', ',\xa0Yayuan Liu', ',\xa0Zheng Liang', ',\xa0Hyun-Wook Lee', ',\xa0Jie Sun', ',\xa0Kai Yan', ',\xa0Jin Xie', '\xa0&\xa0Yi Cui']}, {'address': 'Department of Applied Physics, Stanford University, Stanford, 94305, California, USA', 'authors': ['Haotian Wang']}, {'address': 'Stanford Institute for Materials and Energy Sciences, SLAC National Accelerator Laboratory, 2575 Sand Hill Road, Menlo Park, 94025, California, USA', 'authors': ['Yi Cui']}]",False,"['Dingchang Lin', 'Yayuan Liu', 'Zheng Liang', 'Hyun-Wook Lee', 'Jie Sun', 'Haotian Wang', 'Kai Yan', 'Jin Xie', 'Yi Cui']","Lin, D., Liu, Y., Liang, Z. et al. Layered reduced graphene oxide with nanoscale interlayer gaps as a stable host for lithium metal anodes. Nature Nanotech11, 626–632 (2016).",8600,15,775,aplusplus,10.1038/nnano.2016.32,https://doi.org/10.1038/nnano.2016.32,,7,nnano,nature nanotechnology,1458518400,2016-03-21,batteries;graphene,https://www.nature.com/articles/nnano.2016.32,11
article,Wafer-scale monodomain films of spontaneously aligned single-walled carbon nanotubes,"<p>The one-dimensional character of electrons, phonons and excitons in individual single-walled carbon nanotubes leads to extremely anisotropic electronic, thermal and optical properties. However, despite significant efforts to develop ways to produce large-scale architectures of aligned nanotubes, macroscopic manifestations of such properties remain limited. Here, we show that large (&gt;cm<sup>2</sup>) monodomain films of aligned single-walled carbon nanotubes can be prepared using slow vacuum filtration. The produced films are globally aligned within &#177;1.5&#176; (a nematic order parameter of &#8764;1) and are highly packed, containing 1&#8201;&#215;&#8201;10<sup>6</sup> nanotubes in a cross-sectional area of 1&#8197;&#956;m<sup>2</sup>. The method works for nanotubes synthesized by various methods, and film thickness is controllable from a few nanometres to &#8764;100&#8197;nm. We use the approach to create ideal polarizers in the terahertz frequency range and, by combining the method with recently developed sorting techniques, highly aligned and chirality-enriched nanotube thin-film devices. Semiconductor-enriched devices exhibit polarized light emission and polarization-dependent photocurrent, as well as anisotropic conductivities and transistor action with high on/off ratios.</p>",,"[{'address': 'Department of Electrical and Computer Engineering, Rice University, Houston, 77005, Texas, USA', 'authors': ['Xiaowei He', ',\xa0Weilu Gao', ',\xa0Qi Zhang', ',\xa0John M. Robinson', '\xa0&\xa0Junichiro Kono']}, {'address': 'College of Biosystems Engineering and Food Science, Zhejiang University, Hangzhou, 310058, Zhejiang, China', 'authors': ['Lijuan Xie']}, {'address': 'Department of Materials Science and NanoEngineering, Rice University, Houston, 77005, Texas, USA', 'authors': ['Bo Li', ',\xa0Sidong Lei', ',\xa0Weipeng Wang', ',\xa0Robert Vajtai', ',\xa0Pulickel M. Ajayan', ',\xa0W. Wade Adams', ',\xa0Robert H. Hauge', '\xa0&\xa0Junichiro Kono']}, {'address': 'Center for Integrated Nanotechnologies, Los Alamos National Laboratory, Los Alamos, 87545, New Mexico, USA', 'authors': ['Erik H. Hároz', '\xa0&\xa0Stephen K. Doorn']}, {'address': 'Department of Chemistry, Rice University, Houston, 77005, Texas, USA', 'authors': ['Robert H. Hauge']}, {'address': 'Department of Physics and Astronomy, Rice University, Houston, 77005, Texas, USA', 'authors': ['Junichiro Kono']}]",False,"['Xiaowei He', 'Weilu Gao', 'Lijuan Xie', 'Bo Li', 'Qi Zhang', 'Sidong Lei', 'John M. Robinson', 'Erik H. Hároz', 'Stephen K. Doorn', 'Weipeng Wang', 'Robert Vajtai', 'Pulickel M. Ajayan', 'W. Wade Adams', 'Robert H. Hauge', 'Junichiro Kono']","He, X., Gao, W., Xie, L. et al. Wafer-scale monodomain films of spontaneously aligned single-walled carbon nanotubes. Nature Nanotech11, 633–638 (2016).",2452,149,118,aplusplus,10.1038/nnano.2016.44,https://doi.org/10.1038/nnano.2016.44,,7,nnano,nature nanotechnology,1459728000,2016-04-04,carbon-nanotubes-and-fullerenes;electronic-devices,https://www.nature.com/articles/nnano.2016.44,11
article,Ultrafast proton transport in sub-1-nm diameter carbon nanotube porins,"<p>Proton transport plays an important role in many biological processes due to the ability of protons to rapidly translocate along chains of hydrogen-bonded water molecules. Molecular dynamics simulations have predicted that confinement in hydrophobic nanochannels should enhance the rate of proton transport. Here, we show that 0.8-nm-diameter carbon nanotube porins, which promote the formation of one-dimensional water wires, can support proton transport rates exceeding those of bulk water by an order of magnitude. The transport rates in these narrow nanotube pores also exceed those of biological channels and Nafion. With larger 1.5-nm-diameter nanotube porins, proton transport rates comparable to bulk water are observed. We also show that the proton conductance of these channels can be modulated by the presence of Ca<sup>2+</sup> ions. Our results illustrate the potential of small-diameter carbon nanotube porins as a proton conductor material and suggest that strong spatial confinement is a key factor in enabling efficient proton transport.</p>",,"[{'address': 'Biosciences and Biotechnology Division, Lawrence Livermore National Laboratory, 7000 East Avenue, Livermore, 94550, California, USA', 'authors': ['Ramya H. Tunuguntla', ',\xa0Kyunghoon Kim', ',\xa0Allison Belliveau', '\xa0&\xa0Aleksandr Noy']}, {'address': 'Department of Materials Science and Engineering, University of California, 210 Hearst Avenue, Berkeley, 94720, California, USA', 'authors': ['Frances I. Allen']}, {'address': 'National Center for Electron Microscopy, Molecular Foundry, Lawrence Berkeley National Laboratory, 1 Cyclotron Road, Berkeley, 94720, California, USA', 'authors': ['Frances I. Allen']}, {'address': 'School of Natural Sciences, University of California Merced, 5200 N. Lake Road, Merced, 94343, California, USA', 'authors': ['Aleksandr Noy']}]",False,"['Ramya H. Tunuguntla', 'Frances I. Allen', 'Kyunghoon Kim', 'Allison Belliveau', 'Aleksandr Noy']","Tunuguntla, R., Allen, F., Kim, K. et al. Ultrafast proton transport in sub-1-nm diameter carbon nanotube porins. Nature Nanotech11, 639–644 (2016).",1332,92,75,aplusplus,10.1038/nnano.2016.43,https://doi.org/10.1038/nnano.2016.43,,7,nnano,nature nanotechnology,1459728000,2016-04-04,carbon-nanotubes-and-fullerenes;nanopores,https://www.nature.com/articles/nnano.2016.43,11
