contentType,title,abstract,affiliations,authorization,authors,citation_text,count_accesses,count_altmetric,count_citations,documentType,doi,doi_url,focus,issue,journal_pcode,journal_title,publishedAt,publishedAtString,subjects,url,volume
article,Tapered InP nanowire arrays for efficient broadband high-speed single-photon detection,"<p>Superconducting nanowire single-photon detectors with peak efficiencies above 90% and unrivalled timing jitter (&lt;30&#8201;ps) have emerged as a potent technology for quantum information and sensing applications. However, their high cost and cryogenic operation limit their widespread applicability. Here, we present an approach using tapered InP nanowire p&#8211;n junction arrays for high-efficiency, broadband and high-speed photodetection without the need for cryogenic cooling. The truncated conical nanowire shape enables a broadband, linear photoresponse in the ultraviolet to near-infrared range (~500&#8201;nm bandwidth) with external quantum efficiencies exceeding 85%. The devices exhibit a high gain beyond 10<sup>5</sup>, such that a single photon per pulse can be distinguished from the dark noise, while simultaneously showing a fast pulse rise time (&lt;1&#8201;ns) and excellent timing jitter (&lt;20&#8201;ps). Such detectors open up new possibilities for applications in remote sensing, dose monitoring for cancer treatment, three-dimensional imaging and quantum communication.</p>",[],False,"[""Sandra J. Gibson"", ""Brad van Kasteren"", ""Burak Tekcan"", ""Yingchao Cui"", ""Dick van Dam"", ""Jos E. M. Haverkort"", ""Erik P. A. M. Bakkers"", ""Michael E. Reimer""]","Gibson, S.J., van Kasteren, B., Tekcan, B. et al. Tapered InP nanowire arrays for efficient broadband high-speed single-photon detection. Nat. Nanotechnol. 14, 473–479 (2019).",6750,104,23,aplusplus,10.1038/s41565-019-0393-2,https://doi.org/10.1038/s41565-019-0393-2,,5,nnano,nature nanotechnology,1551657600,2019-03-04,nanowires;single-photons-and-quantum-effects,https://www.nature.com/articles/s41565-019-0393-2,14
article,Simultaneous voltage and current density imaging of flowing electrons in two dimensions,"<p>A variety of physical phenomena associated with nanoscale electron transport often results in non-trivial spatial voltage and current patterns, particularly in nonlocal transport regimes. While numerous techniques have been devised to image electron flows, the need remains for a nanoscale probe capable of simultaneously imaging current and voltage distributions with high sensitivity and minimal invasiveness, in a magnetic field, across a broad range of temperatures and beneath an insulating surface. Here we present a technique for spatially mapping electron flows based on a nanotube single-electron transistor, which achieves high sensitivity for both voltage and current imaging. In a series of experiments using high-mobility graphene devices, we demonstrate the ability of our technique to visualize local aspects of intrinsically nonlocal transport, as in ballistic flows, which are not easily resolvable via existing methods. This technique should aid in understanding the physics of two-dimensional electronic devices and enable new classes of experiments that image electron flow through buried nanostructures in the quantum and interaction-dominated regimes.</p>",[],False,"[""Lior Ella"", ""Asaf Rozen"", ""John Birkbeck"", ""Moshe Ben-Shalom"", ""David Perello"", ""Johanna Zultak"", ""Takashi Taniguchi"", ""Kenji Watanabe"", ""Andre K. Geim"", ""Shahal Ilani"", ""Joseph A. Sulpizio""]","Ella, L., Rozen, A., Birkbeck, J. et al. Simultaneous voltage and current density imaging of flowing electrons in two dimensions. Nat. Nanotechnol. 14, 480–487 (2019).",7069,63,21,aplusplus,10.1038/s41565-019-0398-x,https://doi.org/10.1038/s41565-019-0398-x,,5,nnano,nature nanotechnology,1552262400,2019-03-11,electronic-devices;electronic-properties-and-devices;imaging-techniques,https://www.nature.com/articles/s41565-019-0398-x,14
article,Unidirectional rotary motion in a metal–organic framework,"<p>Overcrowded alkene-based light-driven molecular motors are able to perform large-amplitude repetitive unidirectional rotations. Their behaviour is well understood in solution. However, Brownian motion precludes the precise positioning at the nanoscale needed to harness cooperative action. Here, we demonstrate molecular motors organized in crystalline metal&#8211;organic frameworks (MOFs). The motor unit becomes a part of the organic linker (or strut), and its spatial arrangement is elucidated through powder and single-crystal X-ray analyses and polarized optical and Raman microscopies. We confirm that the light-driven unidirectional rotation of the motor units is retained in the MOF framework and that the motors can operate in the solid state with similar rotary speed (rate of thermal helix inversion) to that in solution. These &#8216;moto-MOFs&#8217; could in the future be used to control dynamic function in crystalline materials.</p>",[],False,"[""Wojciech Danowski"", ""Thomas van Leeuwen"", ""Shaghayegh Abdolahzadeh"", ""Diederik Roke"", ""Wesley R. Browne"", ""Sander J. Wezenberg"", ""Ben L. Feringa""]","Danowski, W., van Leeuwen, T., Abdolahzadeh, S. et al. Unidirectional rotary motion in a metal–organic framework. Nat. Nanotechnol. 14, 488–494 (2019).",12000,69,58,aplusplus,10.1038/s41565-019-0401-6,https://doi.org/10.1038/s41565-019-0401-6,,5,nnano,nature nanotechnology,1552867200,2019-03-18,metal-organic-frameworks;supramolecular-chemistry,https://www.nature.com/articles/s41565-019-0401-6,14
author correction,Author Correction: Magnesium silicide nanoparticles as a deoxygenation agent for cancer starvation therapy,,[],True,"[""Chen Zhang"", ""Dalong Ni"", ""Yanyan Liu"", ""Heliang Yao"", ""Wenbo Bu"", ""Jianlin Shi""]","Zhang, C., Ni, D., Liu, Y. et al. Author Correction: Magnesium silicide nanoparticles as a deoxygenation agent for cancer starvation therapy. Nat. Nanotechnol. 14, 495 (2019).",2566,1,2,aplusplus,10.1038/s41565-019-0418-x,https://doi.org/10.1038/s41565-019-0418-x,,5,nnano,nature nanotechnology,1553817600,2019-03-29,,https://www.nature.com/articles/s41565-019-0418-x,14
publisher correction,Publisher Correction: Precise targeting of POLR2A as a therapeutic strategy for human triple negative breast cancer,,[],True,"[""Jiangsheng Xu"", ""Yunhua Liu"", ""Yujing Li"", ""Hai Wang"", ""Samantha Stewart"", ""Kevin Van der Jeught"", ""Pranay Agarwal"", ""Yuntian Zhang"", ""Sheng Liu"", ""Gang Zhao"", ""Jun Wan"", ""Xiongbin Lu"", ""Xiaoming He""]","Xu, J., Liu, Y., Li, Y. et al. Publisher Correction: Precise targeting ofPOLR2Aas a therapeutic strategy for human triple negative breast cancer. Nat. Nanotechnol. 14, 496 (2019).",1233,1,0,aplusplus,10.1038/s41565-019-0417-y,https://doi.org/10.1038/s41565-019-0417-y,,5,nnano,nature nanotechnology,1551744000,2019-03-05,core-processes;cytoskeleton;drug-delivery;nanoparticles;nanotechnology-in-cancer,https://www.nature.com/articles/s41565-019-0417-y,14
publisher correction,Publisher Correction: Micelles from gemini,,[],True,"[""Alberto Moscatelli""]","Moscatelli, A. Publisher Correction: Micelles from gemini. Nat. Nanotechnol. 14, 496 (2019).",367,2,1,aplusplus,10.1038/s41565-019-0451-9,https://doi.org/10.1038/s41565-019-0451-9,,5,nnano,nature nanotechnology,1554854400,2019-04-10,supramolecular-chemistry,https://www.nature.com/articles/s41565-019-0451-9,14
