contentType,title,abstract,abstract_google_cn,affiliations,authorization,authors,citation_text,count_accesses,count_altmetric,count_citations,documentType,doi,doi_url,focus,issue,journal_pcode,journal_title,publishedAt,publishedAtString,subjects,url,volume
editorial,Fifty years on,,,[],True,[],"Fifty years on. Nature Nanotech10, 825 (2015).",85,2,0,aplusplus,10.1038/nnano.2015.244,https://doi.org/10.1038/nnano.2015.244,,10,nnano,nature nanotechnology,1444089600,2015-10-06,ethical-legal-and-other-societal-issues;policy,https://www.nature.com/articles/nnano.2015.244,10
thesis,Technologies and religions,,,"[{'address': 'Chris Toumey is at the Center for Environmental Nanoscience & Risk at the University of South Carolina', 'authors': ['Chris Toumey']}]",False,['Chris Toumey'],"Toumey, C. Technologies and religions. Nature Nanotech10, 826–827 (2015).",37,2,0,aplusplus,10.1038/nnano.2015.229,https://doi.org/10.1038/nnano.2015.229,,10,nnano,nature nanotechnology,1444089600,2015-10-06,ethical-legal-and-other-societal-issues;scientific-community,https://www.nature.com/articles/nnano.2015.229,10
research highlights,Our choice from the recent literature,,,[],True,[],"Our choice from the recent literature. Nature Nanotech10, 828 (2015).",28,4,0,aplusplus,10.1038/nnano.2015.233,https://doi.org/10.1038/nnano.2015.233,,10,nnano,nature nanotechnology,1444089600,2015-10-06,dna-nanotechnology;molecular-self-assembly;quantum-dots;self-assembly;structural-properties;technology,https://www.nature.com/articles/nnano.2015.233,10
news & views,Nanoscale cable tacking,,,"[{'address': 'Hendrik Dietz is in the Physik Department and Walter Schottky Institute, Technische Universität München, Am Coulombwall 4a, Garching near Munich 85748, Germany', 'authors': ['Hendrik Dietz']}]",False,['Hendrik Dietz'],"Dietz, H. Nanoscale cable tacking. Nature Nanotech10, 829–830 (2015).",80,10,3,aplusplus,10.1038/nnano.2015.223,https://doi.org/10.1038/nnano.2015.223,,10,nnano,nature nanotechnology,1444089600,2015-10-06,dna-nanostructures;molecular-self-assembly,https://www.nature.com/articles/nnano.2015.223,10
news & views,Microcantilevers to lift biomolecules,,,"[{'address': 'Gajendra S. Shekhawat and Vinayak P. Dravid are in the Department of Material Science and Engineering and the NUANCE Center, Northwestern University, Evanston, Illinois 60208, USA', 'authors': ['Gajendra S. Shekhawat', '\xa0&\xa0Vinayak P. Dravid']}]",False,"['Gajendra S. Shekhawat', 'Vinayak P. Dravid']","Shekhawat, G., Dravid, V. Microcantilevers to lift biomolecules. Nature Nanotech10, 830–831 (2015).",113,2,14,aplusplus,10.1038/nnano.2015.187,https://doi.org/10.1038/nnano.2015.187,,10,nnano,nature nanotechnology,1439769600,2015-08-17,applications-of-afm;biosensors,https://www.nature.com/articles/nnano.2015.187,10
news & views,Nanomechanical answer to Einstein,,,"[{'address': 'Philipp Treutlein is in the Department of Physics, University of Basel, Klingelbergstrasse 82, 4056 Basel, Switzerland', 'authors': ['Philipp Treutlein']}]",False,['Philipp Treutlein'],"Treutlein, P. Nanomechanical answer to Einstein. Nature Nanotech10, 832–833 (2015).",64,5,0,aplusplus,10.1038/nnano.2015.241,https://doi.org/10.1038/nnano.2015.241,,10,nnano,nature nanotechnology,1444089600,2015-10-06,optical-properties-and-devices;quantum-mechanics,https://www.nature.com/articles/nnano.2015.241,10
perspective,Bridging the divide between human and environmental nanotoxicology,,,"[{'address': 'Centre for Environmental Risk Assessment and Remediation, University of South Australia, Mawson Lakes, 5095, South Australia, Australia', 'authors': ['Anzhela Malysheva', '\xa0&\xa0Enzo Lombi']}, {'address': 'ARC Centre of Excellence in Convergent Bio-Nano Science and Technology, Mawson Institute, University of South Australia, Mawson Lakes, 5095, South Australia, Australia', 'authors': ['Nicolas H. Voelcker']}]",False,"['Anzhela Malysheva', 'Enzo Lombi', 'Nicolas H. Voelcker']","Malysheva, A., Lombi, E. & Voelcker, N. Bridging the divide between human and environmental nanotoxicology. Nature Nanotech10, 835–844 (2015).",435,5,47,aplusplus,10.1038/nnano.2015.224,https://doi.org/10.1038/nnano.2015.224,Sustainability,10,nnano,nature nanotechnology,1444089600,2015-10-06,cell-particle-interactions;characterization-and-analytical-techniques;ecotoxicology;methods-of-toxicology-studies;nanomedicine,https://www.nature.com/articles/nnano.2015.224,10
letter,An atomically thin matter-wave beamsplitter,,,"[{'address': 'Faculty of Physics, University of Vienna, VCQ, QuNaBioS, Boltzmanngasse 5, Vienna, A-1090, Austria', 'authors': ['Christian Brand', ',\xa0Michele Sclafani', ',\xa0Christian Knobloch', ',\xa0Thomas Juffmann', '\xa0&\xa0Markus Arndt']}, {'address': 'ICFO – Institut de Ciènces Fotòniques, Castelldefels (Barcelona), 08860, Spain', 'authors': ['Michele Sclafani']}, {'address': 'The Center for Nanosciences and Nanotechnology at Tel Aviv University', 'authors': ['Yigal Lilach', '\xa0&\xa0Ori Cheshnovsky']}, {'address': 'Physics Department, Stanford University, 382 Via Pueblo Mall, Stanford, 94305-4060, California, USA', 'authors': ['Thomas Juffmann']}, {'address': 'Faculty of Physics, University of Vienna, PNM, Boltzmanngasse 5, Vienna, A-1090, Austria', 'authors': ['Jani Kotakoski', ',\xa0Clemens Mangler', '\xa0&\xa0Jannik Meyer']}, {'address': 'Friedrich Schiller University Jena, Institute of Physical Chemistry, Lessingstrasse 10, Jena, D-07743, Germany', 'authors': ['Andreas Winter', '\xa0&\xa0Andrey Turchanin']}, {'address': 'Tel Aviv University, School of Chemistry, The Raymond and Beverly Faculty of Exact Sciences, Tel Aviv, 69978, Israel', 'authors': ['Ori Cheshnovsky']}]",False,"['Christian Brand', 'Michele Sclafani', 'Christian Knobloch', 'Yigal Lilach', 'Thomas Juffmann', 'Jani Kotakoski', 'Clemens Mangler', 'Andreas Winter', 'Andrey Turchanin', 'Jannik Meyer', 'Ori Cheshnovsky', 'Markus Arndt']","Brand, C., Sclafani, M., Knobloch, C. et al. An atomically thin matter-wave beamsplitter. Nature Nanotech10, 845–848 (2015).",384,80,20,aplusplus,10.1038/nnano.2015.179,https://doi.org/10.1038/nnano.2015.179,,10,nnano,nature nanotechnology,1440374400,2015-08-24,matter-waves-and-particle-beams;mechanical-and-structural-properties-and-devices,https://www.nature.com/articles/nnano.2015.179,10
letter,Strain engineering Dirac surface states in heteroepitaxial topological crystalline insulator thin films,,,"[{'address': 'Department of Physics, Boston College, Chestnut Hill, 02467, Massachusetts, USA', 'authors': ['Ilija Zeljkovic', ',\xa0Daniel Walkup', ',\xa0Badih A. Assaf', ',\xa0Kane L. Scipioni', '\xa0&\xa0Vidya Madhavan']}, {'address': 'Center for Condensed Matter Sciences, National Taiwan University, Taipei, 10617, Taiwan', 'authors': ['R. Sankar', '\xa0&\xa0Fangcheng Chou']}, {'address': 'Institute of Physics, Academia Sinica, Nankang, 11529, Taipei, Taiwan, Republic of China', 'authors': ['R. Sankar']}, {'address': 'Department of Physics and Frederick Seitz Materials Research Laboratory, University of Illinois Urbana-Champaign, Urbana, 61801, Illinois, USA', 'authors': ['Vidya Madhavan']}]",False,"['Ilija Zeljkovic', 'Daniel Walkup', 'Badih A. Assaf', 'Kane L. Scipioni', 'R. Sankar', 'Fangcheng Chou', 'Vidya Madhavan']","Zeljkovic, I., Walkup, D., Assaf, B. et al. Strain engineering Dirac surface states in heteroepitaxial topological crystalline insulator thin films. Nature Nanotech10, 849–853 (2015).",746,4,41,aplusplus,10.1038/nnano.2015.177,https://doi.org/10.1038/nnano.2015.177,,10,nnano,nature nanotechnology,1440374400,2015-08-24,electronic-properties-and-materials,https://www.nature.com/articles/nnano.2015.177,10
letter,Three-terminal energy harvester with coupled quantum dots,,,"[{'address': 'Physikalisches Institut (EP3), Universität Würzburg, Am Hubland, Würzburg, D-97074, Germany', 'authors': ['Holger Thierschmann', ',\xa0Fabian Arnold', ',\xa0Hartmut Buhmann', '\xa0&\xa0Laurens W. Molenkamp']}, {'address': 'Instituto de Ciencia de Materiales de Madrid, CSIC, Cantoblanco, Madrid, 28049, Spain', 'authors': ['Rafael Sánchez']}, {'address': 'Département de Physique Théorique, Université de Genève, Genève 4, CH-1211, Switzerland', 'authors': ['Björn Sothmann']}, {'address': 'Institute of Applied Physics, University of Hamburg, Jungiusstrasse 11, Hamburg, D-20355, Germany', 'authors': ['Christian Heyn', '\xa0&\xa0Wolfgang Hansen']}]",False,"['Holger Thierschmann', 'Rafael Sánchez', 'Björn Sothmann', 'Fabian Arnold', 'Christian Heyn', 'Wolfgang Hansen', 'Hartmut Buhmann', 'Laurens W. Molenkamp']","Thierschmann, H., Sánchez, R., Sothmann, B. et al. Three-terminal energy harvester with coupled quantum dots. Nature Nanotech10, 854–858 (2015).",686,17,114,aplusplus,10.1038/nnano.2015.176,https://doi.org/10.1038/nnano.2015.176,,10,nnano,nature nanotechnology,1439769600,2015-08-17,applied-physics;electronic-and-spintronic-devices;electronic-devices,https://www.nature.com/articles/nnano.2015.176,10
letter,Fourier magnetic imaging with nanoscale resolution and compressed sensing speed-up using electronic spins in diamond,,,"[{'address': 'Department of Physics, Massachusetts Institute of Technology, Cambridge, 02139, Massachusetts, USA', 'authors': ['K. Arai']}, {'address': 'Harvard-Smithsonian Center for Astrophysics, Cambridge, 02138, Massachusetts, USA', 'authors': ['C. Belthangady', ',\xa0H. Zhang', ',\xa0N. Bar-Gill', '\xa0&\xa0R. L. Walsworth']}, {'address': 'Department of Physics, Harvard University, Cambridge, 02138, Massachusetts, USA', 'authors': ['C. Belthangady', ',\xa0H. Zhang', ',\xa0N. Bar-Gill', ',\xa0A. Yacoby', '\xa0&\xa0R. L. Walsworth']}, {'address': 'Department of Chemistry and Chemical Biology, Harvard University, Cambridge, 02138, Massachusetts, USA', 'authors': ['S. J. DeVience']}, {'address': 'Nuclear Science and Engineering Department, Massachusetts Institute of Technology, Cambridge, 02139, Massachusetts, USA', 'authors': ['P. Cappellaro']}, {'address': 'Center for Brain Science, Harvard University, Cambridge, 02138, Massachusetts, USA', 'authors': ['R. L. Walsworth']}]",False,"['K. Arai', 'C. Belthangady', 'H. Zhang', 'N. Bar-Gill', 'S. J. DeVience', 'P. Cappellaro', 'A. Yacoby', 'R. L. Walsworth']","Arai, K., Belthangady, C., Zhang, H. et al. Fourier magnetic imaging with nanoscale resolution and compressed sensing speed-up using electronic spins in diamond. Nature Nanotech10, 859–864 (2015).",752,5,46,aplusplus,10.1038/nnano.2015.171,https://doi.org/10.1038/nnano.2015.171,,10,nnano,nature nanotechnology,1439164800,2015-08-10,atomic-and-molecular-physics;condensed-matter-physics;nanosensors,https://www.nature.com/articles/nnano.2015.171,10
letter,Distinguishing adjacent molecules on a surface using plasmon-enhanced Raman scattering,,,"[{'address': 'Hefei National Laboratory for Physical Sciences at the Microscale and Synergetic Innovation Center of Quantum Information & Quantum Physics, University of Science and Technology of China, Hefei, 230026, Anhui, China', 'authors': ['Song Jiang', ',\xa0Yao Zhang', ',\xa0Rui Zhang', ',\xa0Chunrui Hu', ',\xa0Menghan Liao', ',\xa0Yi Luo', ',\xa0Jinlong Yang', ',\xa0Zhenchao Dong', '\xa0&\xa0J. G. Hou']}]",False,"['Song Jiang', 'Yao Zhang', 'Rui Zhang', 'Chunrui Hu', 'Menghan Liao', 'Yi Luo', 'Jinlong Yang', 'Zhenchao Dong', 'J. G. Hou']","Jiang, S., Zhang, Y., Zhang, R. et al. Distinguishing adjacent molecules on a surface using plasmon-enhanced Raman scattering. Nature Nanotech10, 865–869 (2015).",1174,16,145,aplusplus,10.1038/nnano.2015.170,https://doi.org/10.1038/nnano.2015.170,,10,nnano,nature nanotechnology,1437955200,2015-07-27,nanophotonics-and-plasmonics;raman-spectroscopy,https://www.nature.com/articles/nnano.2015.170,10
article,Opto-nanomechanical spectroscopic material characterization,"<p>The non-destructive, simultaneous chemical and physical characterization of materials at the nanoscale is an essential and highly sought-after capability. However, a combination of limitations imposed by Abbe diffraction, diffuse scattering, unknown subsurface, electromagnetic fluctuations and Brownian noise, for example, have made achieving this goal challenging. Here, we report a hybrid approach for nanoscale material characterization based on generalized nanomechanical force microscopy in conjunction with infrared photoacoustic spectroscopy. As an application, we tackle the outstanding problem of spatially and spectrally resolving plant cell walls. Nanoscale characterization of plant cell walls and the effect of complex phenotype treatments on biomass are challenging but necessary in the search for sustainable and renewable bioenergy. We present results that reveal both the morphological and compositional substructures of the cell walls. The measured biomolecular traits are in agreement with the lower-resolution chemical maps obtained with infrared and confocal Raman micro-spectroscopies of the same samples. These results should prove relevant in other fields such as cancer research, nanotoxicity, and energy storage and production, where morphological, chemical and subsurface studies of nanocomposites, nanoparticle uptake by cells and nanoscale quality control are in demand.</p>",,"[{'address': 'Oak Ridge National Laboratory, Oak Ridge, 37831, Tennessee, USA', 'authors': ['L. Tetard', ',\xa0A. Passian', ',\xa0R. H. Farahi', '\xa0&\xa0B. H. Davison']}, {'address': 'Department of Physics, University of Tennessee, Knoxville, 37996-1200, Tennessee, USA', 'authors': ['A. Passian']}, {'address': 'Department of Chemical and Biomolecular Engineering, University of Tennessee, Knoxville, 37996, Tennessee, USA', 'authors': ['A. Passian', ',\xa0R. H. Farahi', '\xa0&\xa0B. H. Davison']}, {'address': 'Department of Chemical and Materials Engineering, University of Alberta, Edmonton, T6G 2V4, Alberta, Canada', 'authors': ['T. Thundat']}]",False,"['L. Tetard', 'A. Passian', 'R. H. Farahi', 'T. Thundat', 'B. H. Davison']","Tetard, L., Passian, A., Farahi, R. et al. Opto-nanomechanical spectroscopic material characterization. Nature Nanotech10, 870–877 (2015).",241,81,16,aplusplus,10.1038/nnano.2015.168,https://doi.org/10.1038/nnano.2015.168,,10,nnano,nature nanotechnology,1439164800,2015-08-10,nanoscience-and-technology;techniques-and-instrumentation,https://www.nature.com/articles/nnano.2015.168,10
article,Highly efficient large-area colourless luminescent solar concentrators using heavy-metal-free colloidal quantum dots,"<p>Luminescent solar concentrators serving as semitransparent photovoltaic windows could become an important element in net zero energy consumption buildings of the future. Colloidal quantum dots are promising materials for luminescent solar concentrators as they can be engineered to provide the large Stokes shift necessary for suppressing reabsorption losses in large-area devices. Existing Stokes-shift-engineered quantum dots allow for only partial coverage of the solar spectrum, which limits their light-harvesting ability and leads to colouring of the luminescent solar concentrators, complicating their use in architecture. Here, we use quantum dots of ternary I&#8211;III&#8211;VI<sub>2</sub> semiconductors to realize the first large-area quantum dot&#8211;luminescent solar concentrators free of toxic elements, with reduced reabsorption and extended coverage of the solar spectrum. By incorporating CuInSe<sub>x</sub>S<sub>2&#8211;x</sub> quantum dots into photo-polymerized poly(lauryl methacrylate), we obtain freestanding, colourless slabs that introduce no distortion to perceived colours and are thus well suited for the realization of photovoltaic windows. Thanks to the suppressed reabsorption and high emission efficiencies of the quantum dots, we achieve an optical power efficiency of 3.2%. Ultrafast spectroscopy studies suggest that the Stokes-shifted emission involves a conduction-band electron and a hole residing in an intragap state associated with a native defect.</p>",,"[{'address': 'Dipartimento di Scienza dei Materiali, Università degli Studi di Milano-Bicocca, via Cozzi 55, Milano, I–20125, Italy', 'authors': ['Francesco Meinardi', ',\xa0Francesco Carulli', ',\xa0Annalisa Colombo', ',\xa0Roberto Simonutti', '\xa0&\xa0Sergio Brovelli']}, {'address': 'Center for Advanced Solar Photophysics, Los Alamos National Laboratory, Los Alamos, 87545, New Mexico, USA', 'authors': ['Hunter McDaniel', ',\xa0Nikolay S. Makarov', '\xa0&\xa0Victor I. Klimov']}, {'address': 'UbiQD, Los Alamos, 87544, New Mexico, USA', 'authors': ['Hunter McDaniel']}, {'address': 'Theoretical Division & Center for Advanced Solar Photophysics, Los Alamos National Laboratory, Los Alamos, 87545, New Mexico, USA', 'authors': ['Kirill A. Velizhanin']}]",False,"['Francesco Meinardi', 'Hunter McDaniel', 'Francesco Carulli', 'Annalisa Colombo', 'Kirill A. Velizhanin', 'Nikolay S. Makarov', 'Roberto Simonutti', 'Victor I. Klimov', 'Sergio Brovelli']","Meinardi, F., McDaniel, H., Carulli, F. et al. Highly efficient large-area colourless luminescent solar concentrators using heavy-metal-free colloidal quantum dots. Nature Nanotech10, 878–885 (2015).",2309,158,246,aplusplus,10.1038/nnano.2015.178,https://doi.org/10.1038/nnano.2015.178,,10,nnano,nature nanotechnology,1440374400,2015-08-24,nanoscience-and-technology;optical-materials-and-structures;quantum-dots,https://www.nature.com/articles/nnano.2015.178,10
article,Information storage and retrieval in a single levitating colloidal particle,"<p>The binary switch is a basic component of digital information. From phase-change alloys to nanomechanical beams, molecules and atoms, new strategies for controlled bistability hold great interest for emerging technologies. We present a generic methodology for precise and parallel spatiotemporal control of nanometre-scale matter in a fluid, and demonstrate the ability to attain digital functionalities such as switching, gating and data storage in a single colloid, with further implications for signal amplification and logic operations. This fluid-phase bit can be arrayed at high densities, manipulated by either electrical or optical fields, supports low-energy, high-speed operation and marks a first step toward &#8216;colloidal information&#8217;. The principle generalizes to any system where spatial perturbation of a particle elicits a differential response amenable to readout.</p>",,"[{'address': 'Department of Chemistry, Winterthurerstrasse 190, University of Zurich, Zurich, CH 8057, Switzerland', 'authors': ['Christopher J. Myers', '\xa0&\xa0Madhavi Krishnan']}, {'address': 'Department of Physics, Piazza Leonardo Da Vinci 32, Politecnico di Milano, Milan, 20133, Italy', 'authors': ['Michele Celebrano']}, {'address': 'Department of Physics, Winterthurerstrasse 190, University of Zurich, Zurich, CH 8057, Switzerland', 'authors': ['Madhavi Krishnan']}]",False,"['Christopher J. Myers', 'Michele Celebrano', 'Madhavi Krishnan']","Myers, C., Celebrano, M. & Krishnan, M. Information storage and retrieval in a single levitating colloidal particle. Nature Nanotech10, 886–891 (2015).",369,78,17,aplusplus,10.1038/nnano.2015.173,https://doi.org/10.1038/nnano.2015.173,,10,nnano,nature nanotechnology,1439769600,2015-08-17,nanofluidics;nanoparticles,https://www.nature.com/articles/nnano.2015.173,10
article,Routing of individual polymers in designed patterns,"<p>Synthetic polymers are ubiquitous in the modern world, but our ability to exert control over the molecular conformation of individual polymers is very limited. In particular, although the programmable self-assembly of oligonucleotides and proteins into artificial nanostructures has been demonstrated, we currently lack the tools to handle other types of synthetic polymers individually and thus the ability to utilize and study their single-molecule properties. Here we show that synthetic polymer wires containing short oligonucleotides that extend from each repeat can be made to assemble into arbitrary routings. The wires, which can be more than 200&#8197;nm in length, are soft and bendable, and the DNA strands allow individual polymers to self-assemble into predesigned routings on both two- and three-dimensional DNA origami templates. The polymers are conjugated and potentially conducting, and could therefore be used to create molecular-scale electronic or optical wires in arbitrary geometries.</p>",,"[{'address': 'Centre for DNA Nanotechnology, Interdisciplinary Nanoscience Center, iNANO, Aarhus University, Gustav Wieds Vej 14, 8000, Aarhus C, Denmark', 'authors': ['Jakob Bach Knudsen', ',\xa0Lei Liu', ',\xa0Anne Louise Bank Kodal', ',\xa0Mikael Madsen', ',\xa0Qiang Li', ',\xa0Jie Song', ',\xa0Jesper Vinther', ',\xa0Abhichart Krissanaprasit', ',\xa0Daniel Gudnason', ',\xa0Ryosuke Ogaki', ',\xa0Flemming Besenbacher', ',\xa0Victoria Birkedal', ',\xa0Mingdong Dong', '\xa0&\xa0Kurt V. Gothelf']}, {'address': 'Department of Chemistry, Aarhus University, Langelandsgade 140, 8000 Aarhus C, Denmark', 'authors': ['Jakob Bach Knudsen', ',\xa0Anne Louise Bank Kodal', ',\xa0Mikael Madsen', ',\xa0Jesper Vinther', ',\xa0Anton Allen Abbotsford Smith', ',\xa0Alexander N. Zelikin', '\xa0&\xa0Kurt V. Gothelf']}, {'address': 'Wyss Institute for Biologically Inspired Engineering, Harvard University, 3 Blackfan Circle, Boston, Massachusetts 02115, USA', 'authors': ['Johannes B. Woehrstein', ',\xa0Shelley F. J. Wickham', ',\xa0Maximilian T. Strauss', ',\xa0Florian Schueder', ',\xa0Peng Yin', ',\xa0William M. Shih', '\xa0&\xa0Ralf Jungmann']}, {'address': 'Max Planck Institute of Biochemistry and Ludwig-Maximilians-Universität, Am Klopferspitz 18, 82152 Martinsreid, Munich, Germany', 'authors': ['Johannes B. Woehrstein', ',\xa0Maximilian T. Strauss', '\xa0&\xa0Ralf Jungmann']}, {'address': 'Department of Systems Biology, Harvard Medical School, 200 Longwood Avenue, Warren Alpert Building, Boston, Massachusetts 02115, USA', 'authors': ['Peng Yin', '\xa0&\xa0Ralf Jungmann']}]",False,"['Jakob Bach Knudsen', 'Lei Liu', 'Anne Louise Bank Kodal', 'Mikael Madsen', 'Qiang Li', 'Jie Song', 'Johannes B. Woehrstein', 'Shelley F. J. Wickham', 'Maximilian T. Strauss', 'Florian Schueder', 'Jesper Vinther', 'Abhichart Krissanaprasit', 'Daniel Gudnason', 'Anton Allen Abbotsford Smith', 'Ryosuke Ogaki', 'Alexander N. Zelikin', 'Flemming Besenbacher', 'Victoria Birkedal', 'Peng Yin', 'William M. Shih', 'Ralf Jungmann', 'Mingdong Dong', 'Kurt V. Gothelf']","Knudsen, J., Liu, L., Bank Kodal, A. et al. Routing of individual polymers in designed patterns. Nature Nanotech10, 892–898 (2015).",1063,28,99,aplusplus,10.1038/nnano.2015.190,https://doi.org/10.1038/nnano.2015.190,,10,nnano,nature nanotechnology,1440979200,2015-08-31,bioconjugate-chemistry;conjugated-polymers;organizing-materials-with-dna,https://www.nature.com/articles/nnano.2015.190,10
article,Decoupling competing surface binding kinetics and reconfiguration of receptor footprint for ultrasensitive stress assays,"<p>Cantilever arrays have been used to monitor biochemical interactions and their associated stress. However, it is often necessary to passivate the underside of the cantilever to prevent unwanted ligand adsorption, and this process requires tedious optimization. Here, we show a way to immobilize membrane receptors on nanomechanical cantilevers so that they can function without passivating the underlying surface. Using equilibrium theory, we quantitatively describe the mechanical responses of vancomycin, human immunodeficiency virus type 1 antigens and coagulation factor VIII captured on the cantilever in the presence of competing stresses from the top and bottom cantilever surfaces. We show that the area per receptor molecule on the cantilever surface influences ligand&#8211;receptor binding and plays an important role on stress. Our results offer a new way to sense biomolecules and will aid in the creation of ultrasensitive biosensors.</p>",,"[{'address': 'London Centre for Nanotechnology and Departments of Medicine and Physics, University College London, 17–19 Gordon Street, London, WC1H 0AH, UK', 'authors': ['Samadhan B. Patil', ',\xa0Manuel Vögtli', ',\xa0Benjamin Webb', ',\xa0Rachel A. McKendry', '\xa0&\xa0Joseph W. Ndieyira']}, {'address': 'Department of Materials, Imperial College London, London, SW7 2AZ, UK', 'authors': ['Samadhan B. Patil', '\xa0&\xa0Yeong-Ah Soh']}, {'address': 'Division of Infection & Immunity, University College London, Cruciform Building, Gower Street, London, WC1E 6BT, UK', 'authors': ['Benjamin Webb']}, {'address': 'UCL Institute for Liver and Digestive Health, Royal Free Hospital, London, NW3 2QG, UK', 'authors': ['Giuseppe Mazza', '\xa0&\xa0Massimo Pinzani']}, {'address': 'Department of Chemistry, Jomo Kenyatta University of Agriculture and Technology, Nairobi, PO Box 62000, Kenya', 'authors': ['Joseph W. Ndieyira']}]",False,"['Samadhan B. Patil', 'Manuel Vögtli', 'Benjamin Webb', 'Giuseppe Mazza', 'Massimo Pinzani', 'Yeong-Ah Soh', 'Rachel A. McKendry', 'Joseph W. Ndieyira']","Patil, S., Vögtli, M., Webb, B. et al. Decoupling competing surface binding kinetics and reconfiguration of receptor footprint for ultrasensitive stress assays. Nature Nanotech10, 899–907 (2015).",251,12,16,aplusplus,10.1038/nnano.2015.174,https://doi.org/10.1038/nnano.2015.174,,10,nnano,nature nanotechnology,1439769600,2015-08-17,applications-of-afm;biosensors,https://www.nature.com/articles/nnano.2015.174,10
