contentType,title,abstract,abstract_google_cn,affiliations,authorization,authors,citation_text,count_accesses,count_altmetric,count_citations,documentType,doi,doi_url,focus,issue,journal_pcode,journal_title,publishedAt,publishedAtString,subjects,url,volume
editorial,25 years of C60,,,[],True,[],"25 years of C60. Nature Nanotech5, 691 (2010).",954,3,10,aplusplus,10.1038/nnano.2010.210,https://doi.org/10.1038/nnano.2010.210,,10,nnano,nature nanotechnology,1286323200,2010-10-06,carbon-nanotubes-and-fullerenes;education;scientific-community,https://www.nature.com/articles/nnano.2010.210,5
thesis,Elegance and empiricism,,,"[{'address': 'Chris Toumey is at the University of South Carolina NanoCenter. Toumey@mailbox.sc.edu', 'authors': ['Chris Toumey']}]",False,['Chris Toumey'],"Toumey, C. Elegance and empiricism. Nature Nanotech5, 693–694 (2010).",36,10,9,aplusplus,10.1038/nnano.2010.195,https://doi.org/10.1038/nnano.2010.195,,10,nnano,nature nanotechnology,1284854400,2010-09-19,carbon-nanotubes-and-fullerenes;education;scientific-community,https://www.nature.com/articles/nnano.2010.195,5
research highlights,Our choice from the recent literature,,,[],True,[],"Our choice from the recent literature. Nature Nanotech5, 695 (2010).",10,0,0,aplusplus,10.1038/nnano.2010.204,https://doi.org/10.1038/nnano.2010.204,,10,nnano,nature nanotechnology,1286323200,2010-10-06,nanoscience-and-technology,https://www.nature.com/articles/nnano.2010.204,5
news & views,Graphene opens up to DNA,,,"[{'address': 'Zuzanna S. Siwy and Matthew Davenport are in the Department of Physics and Astronomy, University of California, Irvine, California 92697, USA. zsiwy@uci.edu', 'authors': ['Zuzanna S. Siwy', '\xa0&\xa0Matthew Davenport']}]",False,"['Zuzanna S. Siwy', 'Matthew Davenport']","Siwy, Z., Davenport, M. Graphene opens up to DNA. Nature Nanotech5, 697–698 (2010).",256,0,88,aplusplus,10.1038/nnano.2010.198,https://doi.org/10.1038/nnano.2010.198,,10,nnano,nature nanotechnology,1286323200,2010-10-06,dna;graphene;nanopores;nanosensors,https://www.nature.com/articles/nnano.2010.198,5
news & views,Nanoribbons on the edge,,,"[{'address': 'John A. Rogers is in the Department of Materials Science and Engineering, University of Illinois, Urbana, Illinois 61801, USA. jrogers@illinois.edu', 'authors': ['John A. Rogers']}]",False,['John A. Rogers'],"Rogers, J. Nanoribbons on the edge. Nature Nanotech5, 698–699 (2010).",30,3,5,aplusplus,10.1038/nnano.2010.200,https://doi.org/10.1038/nnano.2010.200,,10,nnano,nature nanotechnology,1286323200,2010-10-06,electronic-properties-and-devices;nanofabrication-and-nanopatterning;nanostructures;synthesis-and-processing,https://www.nature.com/articles/nnano.2010.200,5
news & views,Graphene rests easy,,,"[{'address': 'R. Thomas Weitz and Amir Yacoby are in the Department of Physics, Harvard University, 11 Oxford Street, Cambridge, Massachusetts 02138, USA yacoby@physics.harvard.edu', 'authors': ['R. Thomas Weitz', '\xa0&\xa0Amir Yacoby']}]",False,"['R. Thomas Weitz', 'Amir Yacoby']","Weitz, R., Yacoby, A. Graphene rests easy. Nature Nanotech5, 699–700 (2010).",172,0,33,aplusplus,10.1038/nnano.2010.201,https://doi.org/10.1038/nnano.2010.201,,10,nnano,nature nanotechnology,1286323200,2010-10-06,electronic-properties-and-devices;graphene;nanostructures;synthesis-and-processing,https://www.nature.com/articles/nnano.2010.201,5
news & views,Silicon stops heat in its tracks,,,"[{'address': 'Giulia Galli is in the Department of Chemistry and the Department of Physics, University of California, Davis, California 95616, USA.', 'authors': ['Giulia Galli']}, {'address': 'Davide Donadio is at the Max Planck Institute for Polymer Research, 55128 Mainz, Germany. gagalli@ucdavis.edu; donadio@mpip-mainz.mpg.de', 'authors': ['Davide Donadio']}, {'address': 'donadio@mpip-mainz.mpg.de', 'authors': ['Davide Donadio']}]",False,"['Giulia Galli', 'Davide Donadio']","Galli, G., Donadio, D. Silicon stops heat in its tracks. Nature Nanotech5, 701–702 (2010).",54,0,14,aplusplus,10.1038/nnano.2010.199,https://doi.org/10.1038/nnano.2010.199,,10,nnano,nature nanotechnology,1286323200,2010-10-06,nanostructures;structural-properties;thermoelectrics,https://www.nature.com/articles/nnano.2010.199,5
review article,Hybrid superconductor–quantum dot devices,"<p>Advances in nanofabrication techniques have made it possible to make devices in which superconducting electrodes are connected to non-superconducting nanostructures such as quantum dots. The properties of these hybrid devices result from a combination of a macroscopic quantum phenomenon involving large numbers of electrons (superconductivity) and the ability to control single electrons, offered by quantum dots. Here we review research into electron transport and other fundamental processes that have been studied in these devices. We also describe potential applications, such as a transistor in which the direction of a supercurrent can be reversed by adding just one electron to a quantum dot.</p>",,"[{'address': 'SPSMS/LaTEQS, CEA-INAC/UJF-Grenoble 1, 17 Rue des Martyrs, Grenoble, 38054, Cedex 9, France', 'authors': ['Silvano De Franceschi']}, {'address': 'Kavli Institute of NanoScience, Delft University of Technology, PO Box 5046, Delft, 2600 GA, the Netherlands', 'authors': ['Leo Kouwenhoven']}, {'address': 'Department of Physics, University of Basel, Klingelbergstr. 82, Basel, CH-4056, Switzerland', 'authors': ['Christian Schönenberger']}, {'address': ""Institut Néel, associé à l'UJF, CNRS, BP 166, Grenoble, 38042, Cedex 9, France"", 'authors': ['Wolfgang Wernsdorfer']}]",False,"['Silvano De Franceschi', 'Leo Kouwenhoven', 'Christian Schönenberger', 'Wolfgang Wernsdorfer']","De Franceschi, S., Kouwenhoven, L., Schönenberger, C. et al. Hybrid superconductor–quantum dot devices. Nature Nanotech5, 703–711 (2010).",1367,0,248,aplusplus,10.1038/nnano.2010.173,https://doi.org/10.1038/nnano.2010.173,,10,nnano,nature nanotechnology,1284854400,2010-09-19,quantum-dots;quantum-mechanics;spintronics;superconducting-devices,https://www.nature.com/articles/nnano.2010.173,5
letter,Folding and cutting DNA into reconfigurable topological nanostructures,"<p>Topology is the mathematical study of the spatial properties that are preserved through the deformation, twisting and stretching of objects. Topological architectures are common in nature and can be seen, for example, in DNA molecules that condense and relax during cellular events. Synthetic topological nanostructures, such as catenanes and rotaxanes, have been engineered using supramolecular chemistry, but the fabrication of complex and reconfigurable structures remains challenging. Here, we show that DNA origami can be used to assemble a M&#246;bius strip, a topological ribbon-like structure that has only one side. In addition, we show that the DNA M&#246;bius strip can be reconfigured through strand displacement to create topological objects such as supercoiled ring and catenane structures. This DNA fold-and-cut strategy, analogous to Japanese kirigami, may be used to create and reconfigure programmable topological structures that are unprecedented in molecular engineering.</p>",,"[{'address': 'Center for Single Molecule Biophysics, The Biodesign Institute, Arizona State University, Tempe, 85287, Arizona, USA', 'authors': ['Dongran Han', ',\xa0Suchetan Pal', ',\xa0Yan Liu', '\xa0&\xa0Hao Yan']}, {'address': 'Department of Chemistry and Biochemistry, Arizona State University, Tempe, 85287, Arizona, USA', 'authors': ['Dongran Han', ',\xa0Suchetan Pal', ',\xa0Yan Liu', '\xa0&\xa0Hao Yan']}]",False,"['Dongran Han', 'Suchetan Pal', 'Yan Liu', 'Hao Yan']","Han, D., Pal, S., Liu, Y. et al. Folding and cutting DNA into reconfigurable topological nanostructures. Nature Nanotech5, 712–717 (2010).",532,7,200,aplusplus,10.1038/nnano.2010.193,https://doi.org/10.1038/nnano.2010.193,,10,nnano,nature nanotechnology,1286064000,2010-10-03,dna-nanotechnology;molecular-self-assembly;nanostructures;supramolecular-chemistry,https://www.nature.com/articles/nnano.2010.193,5
letter,Reduction of thermal conductivity in phononic nanomesh structures,"<p>Controlling the thermal conductivity of a material independently of its electrical conductivity continues to be a goal for researchers working on thermoelectric materials for use in energy applications and in the cooling of integrated circuits. In principle, the thermal conductivity &#954; and the electrical conductivity &#963; may be independently optimized in semiconducting nanostructures because different length scales are associated with phonons (which carry heat) and electric charges (which carry current). Phonons are scattered at surfaces and interfaces, so &#954; generally decreases as the surface-to-volume ratio increases. In contrast, &#963; is less sensitive to a decrease in nanostructure size, although at sufficiently small sizes it will degrade through the scattering of charge carriers at interfaces. Here, we demonstrate an approach to independently controlling &#954; based on altering the phonon band structure of a semiconductor thin film through the formation of a phononic nanomesh film. These films are patterned with periodic spacings that are comparable to, or shorter than, the phonon mean free path. The nanomesh structure exhibits a substantially lower thermal conductivity than an equivalently prepared array of silicon nanowires, even though this array has a significantly higher surface-to-volume ratio. Bulk-like electrical conductivity is preserved. We suggest that this development is a step towards a coherent mechanism for lowering thermal conductivity.</p>",,"[{'address': 'Division of Chemistry and Chemical Engineering, MC 127-72 1200 East California Boulevard, California Institute of Technology, Pasadena, 91125, California, USA', 'authors': ['Jen-Kan Yu', ',\xa0Slobodan Mitrovic', ',\xa0Douglas Tham', ',\xa0Joseph Varghese', '\xa0&\xa0James R. Heath']}]",False,"['Jen-Kan Yu', 'Slobodan Mitrovic', 'Douglas Tham', 'Joseph Varghese', 'James R. Heath']","Yu, J., Mitrovic, S., Tham, D. et al. Reduction of thermal conductivity in phononic nanomesh structures. Nature Nanotech5, 718–721 (2010).",1213,9,459,aplusplus,10.1038/nnano.2010.149,https://doi.org/10.1038/nnano.2010.149,,10,nnano,nature nanotechnology,1280016000,2010-07-25,nanostructures;particle-physics;structural-properties;thermodynamics,https://www.nature.com/articles/nnano.2010.149,5
letter,Boron nitride substrates for high-quality graphene electronics,"<p>Graphene devices on standard SiO<sub>2</sub> substrates are highly disordered, exhibiting characteristics that are far inferior to the expected intrinsic properties of graphene. Although suspending the graphene above the substrate leads to a substantial improvement in device quality, this geometry imposes severe limitations on device architecture and functionality. There is a growing need, therefore, to identify dielectrics that allow a substrate-supported geometry while retaining the quality achieved with a suspended sample. Hexagonal boron nitride (h-BN) is an appealing substrate, because it has an atomically smooth surface that is relatively free of dangling bonds and charge traps. It also has a lattice constant similar to that of graphite, and has large optical phonon modes and a large electrical bandgap. Here we report the fabrication and characterization of high-quality exfoliated mono- and bilayer graphene devices on single-crystal h-BN substrates, by using a mechanical transfer process. Graphene devices on h-BN substrates have mobilities and carrier inhomogeneities that are almost an order of magnitude better than devices on SiO<sub>2</sub>. These devices also show reduced roughness, intrinsic doping and chemical reactivity. The ability to assemble crystalline layered materials in a controlled way permits the fabrication of graphene devices on other promising dielectrics and allows for the realization of more complex graphene heterostructures.</p>",,"[{'address': 'Department of Electrical Engineering, Columbia University, New York, 10027, New York, USA', 'authors': ['C. R. Dean', ',\xa0I. Meric', ',\xa0S. Sorgenfrei', '\xa0&\xa0K. L. Shepard']}, {'address': 'Department of Mechanical Engineering, Columbia University, New York, 10027, New York, USA', 'authors': ['C. R. Dean', ',\xa0L. Wang', '\xa0&\xa0J. Hone']}, {'address': 'Department of Physics, Columbia University, New York, 10027, New York, USA', 'authors': ['A. F. Young', '\xa0&\xa0P. Kim']}, {'address': 'SKUU Advanced Institute of Nanotechnology (SAINT), Sungkyunkwa University, Suwon, Korea, 440-746', 'authors': ['C. Lee']}, {'address': 'Department of Mechanical Engineering, Sungkyunkwa University, Suwon, Korea, 440-746', 'authors': ['C. Lee']}, {'address': 'Advanced Materials Laboratory, National Institute for Materials Science, 1-1 Namiki, Tsukuba, 305-0044, Japan', 'authors': ['K. Watanabe', '\xa0&\xa0T. Taniguchi']}]",False,"['C. R. Dean', 'A. F. Young', 'I. Meric', 'C. Lee', 'L. Wang', 'S. Sorgenfrei', 'K. Watanabe', 'T. Taniguchi', 'P. Kim', 'K. L. Shepard', 'J. Hone']","Dean, C., Young, A., Meric, I. et al. Boron nitride substrates for high-quality graphene electronics. Nature Nanotech5, 722–726 (2010).",13000,36,3831,aplusplus,10.1038/nnano.2010.172,https://doi.org/10.1038/nnano.2010.172,,10,nnano,nature nanotechnology,1282435200,2010-08-22,electronic-properties-and-devices;nanofabrication-and-nanopatterning;synthesis-and-processing,https://www.nature.com/articles/nnano.2010.172,5
letter,Scalable templated growth of graphene nanoribbons on SiC,"<p>In spite of its excellent electronic properties, the use of graphene in field-effect transistors is not practical at room temperature without modification of its intrinsically semimetallic nature to introduce a bandgap. Quantum confinement effects can create a bandgap in graphene nanoribbons, but existing nanoribbon fabrication methods are slow and often produce disordered edges that compromise electronic properties. Here, we demonstrate the self-organized growth of graphene nanoribbons on a templated silicon carbide substrate prepared using scalable photolithography and microelectronics processing. Direct nanoribbon growth avoids the need for damaging post-processing. Raman spectroscopy, high-resolution transmission electron microscopy and electrostatic force microscopy confirm that nanoribbons as narrow as 40&#160;nm can be grown at specified positions on the substrate. Our prototype graphene devices exhibit quantum confinement at low temperatures (4&#160;K), and an on&#8211;off ratio of 10 and carrier mobilities up to 2,700&#160;cm<sup>2</sup>&#160;V<sup>&#8722;1</sup>&#160;s<sup>&#8722;1</sup> at room temperature. We demonstrate the scalability of this approach by fabricating 10,000 top-gated graphene transistors on a 0.24&#8208;cm<sup>2</sup> SiC chip, which is the largest density of graphene devices reported to date.</p>",,"[{'address': 'Georgia Institute of Technology, Atlanta, 30332-0430, Georgia, USA', 'authors': ['M. Sprinkle', ',\xa0M. Ruan', ',\xa0Y. Hu', ',\xa0J. Hankinson', ',\xa0M. Rubio-Roy', ',\xa0B. Zhang', ',\xa0X. Wu', ',\xa0C. Berger', '\xa0&\xa0W. A. de Heer']}, {'address': 'CNRS/Institut Néel, BP166, Grenoble, 38042, France', 'authors': ['C. Berger']}]",False,"['M. Sprinkle', 'M. Ruan', 'Y. Hu', 'J. Hankinson', 'M. Rubio-Roy', 'B. Zhang', 'X. Wu', 'C. Berger', 'W. A. de Heer']","Sprinkle, M., Ruan, M., Hu, Y. et al. Scalable templated growth of graphene nanoribbons on SiC. Nature Nanotech5, 727–731 (2010).",718,20,316,aplusplus,10.1038/nnano.2010.192,https://doi.org/10.1038/nnano.2010.192,,10,nnano,nature nanotechnology,1286064000,2010-10-03,electronic-properties-and-devices;nanofabrication-and-nanopatterning;nanostructures;synthesis-and-processing,https://www.nature.com/articles/nnano.2010.192,5
letter,Optical rectification and field enhancement in a plasmonic nanogap,"<p>Metal nanostructures act as powerful optical antennas because collective modes of the electron fluid in the metal are excited when light strikes the surface of the nanostructure. These excitations, known as plasmons, can have evanescent electromagnetic fields that are orders of magnitude larger than the incident electromagnetic field. The largest field enhancements often occur in nanogaps between plasmonically active nanostructures, but it is extremely challenging to measure the fields in such gaps directly. These enhanced fields have applications in surface-enhanced spectroscopies, nonlinear optics and nanophotonics. Here we show that nonlinear tunnelling conduction between gold electrodes separated by a subnanometre gap leads to optical rectification, producing a d.c. photocurrent when the gap is illuminated. Comparing this photocurrent with low-frequency conduction measurements, we determine the optical frequency voltage across the tunnelling region of the nanogap, and also the enhancement of the electric field in the tunnelling region, as a function of gap size. The measured field enhancements exceed 1,000, consistent with estimates from surface-enhanced Raman measurements. Our results highlight the need for more realistic theoretical approaches that are able to model the electromagnetic response of metal nanostructures on scales ranging from the free-space wavelength, &#955;, down to &#8764;&#955;/1,000, and for experiments with new materials, different wavelengths and different incident polarizations.</p>",,"[{'address': 'Department of Physics and Astronomy, Rice University, 6100 Main Street, Houston, 77005, Texas, USA', 'authors': ['Daniel R. Ward', '\xa0&\xa0Douglas Natelson']}, {'address': 'Institut für Theoretische Festkörperphysik, Karlsruhe Institute of Technology, Karlsruhe, 76131, Germany', 'authors': ['Falco Hüser', '\xa0&\xa0Fabian Pauly']}, {'address': 'Departamento de Física Teórica de la Materia Condensada, Universidad Autónoma de Madrid, Madrid, 28049, Spain', 'authors': ['Juan Carlos Cuevas']}, {'address': 'Department of Electrical and Computer Engineering, Rice University, 6100 Main Street, Houston, 77005, Texas, USA', 'authors': ['Douglas Natelson']}]",False,"['Daniel R. Ward', 'Falco Hüser', 'Fabian Pauly', 'Juan Carlos Cuevas', 'Douglas Natelson']","Ward, D., Hüser, F., Pauly, F. et al. Optical rectification and field enhancement in a plasmonic nanogap. Nature Nanotech5, 732–736 (2010).",1065,14,260,aplusplus,10.1038/nnano.2010.176,https://doi.org/10.1038/nnano.2010.176,,10,nnano,nature nanotechnology,1284854400,2010-09-19,nanophotonics-and-plasmonics;nanostructures;nonlinear-optics;optical-materials-and-structures,https://www.nature.com/articles/nnano.2010.176,5
letter,Direct observation of single-charge-detection capability of nanowire field-effect transistors,"<p>A single localized charge can quench the luminescence of a semiconductor nanowire, but relatively little is known about the effect of single charges on the conductance of the nanowire. In one-dimensional nanostructures embedded in a material with a low dielectric permittivity, the Coulomb interaction and excitonic binding energy are much larger than the corresponding values when embedded in a material with the same dielectric permittivity. The stronger Coulomb interaction is also predicted to limit the carrier mobility in nanowires. Here, we experimentally isolate and study the effect of individual localized electrons on carrier transport in InAs nanowire field-effect transistors, and extract the equivalent charge sensitivity. In the low carrier density regime, the electrostatic potential produced by one electron can create an insulating weak link in an otherwise conducting nanowire field-effect transistor, modulating its conductance by as much as 4,200% at 31&#160;K. The equivalent charge sensitivity, 4&#160;&#215;&#160;10<sup>&#8722;5</sup>&#160;e&#160;Hz<sup>&#8722;1/2</sup> at 25&#160;K and 6&#160;&#215;&#160;10<sup>&#8722;5</sup>&#160;e&#160;Hz<sup>&#8722;1/2</sup> at 198&#160;K, is orders of magnitude better than conventional field-effect transistors and nanoelectromechanical systems, and is just a factor of 20&#8211;30 away from the record sensitivity for state-of-the-art single-electron transistors operating below 4&#160;K (ref.&#160;). This work demonstrates the feasibility of nanowire-based single-electron memories and illustrates a physical process of potential relevance for high performance chemical sensors. The charge-state-detection capability we demonstrate also makes the nanowire field-effect transistor a promising host system for impurities (which may be introduced intentionally or unintentionally) with potentially long spin lifetimes, because such transistors offer more sensitive spin-to-charge conversion readout than schemes based on conventional field-effect transistors.</p>",,"[{'address': 'Centre for Advanced Nanotechnology, University of Toronto, 170 College Street, Toronto, M5S 3E3, Ontario, Canada', 'authors': ['J. Salfi', ',\xa0I. G. Savelyev', ',\xa0M. Blumin', ',\xa0S. V. Nair', '\xa0&\xa0H. E. Ruda']}, {'address': ""Department of Electrical and Computer Engineering, University of Toronto, 10 King's College Road, Toronto, M5S 3G4, Ontario, Canada"", 'authors': ['J. Salfi', '\xa0&\xa0H. E. Ruda']}, {'address': 'Department of Materials Science and Engineering, University of Toronto, 184 College Street, Toronto, M5S 3E4, Ontario, Canada', 'authors': ['I. G. Savelyev', ',\xa0M. Blumin', ',\xa0S. V. Nair', '\xa0&\xa0H. E. Ruda']}]",False,"['J. Salfi', 'I. G. Savelyev', 'M. Blumin', 'S. V. Nair', 'H. E. Ruda']","Salfi, J., Savelyev, I., Blumin, M. et al. Direct observation of single-charge-detection capability of nanowire field-effect transistors. Nature Nanotech5, 737–741 (2010).",170,0,38,aplusplus,10.1038/nnano.2010.180,https://doi.org/10.1038/nnano.2010.180,,10,nnano,nature nanotechnology,1284854400,2010-09-19,electronic-devices;electronic-properties-and-materials;nanosensors;nanowires,https://www.nature.com/articles/nnano.2010.180,5
article,Direct nanoprinting by liquid-bridge-mediated nanotransfer moulding,"<p>Several techniques for the direct printing of functional materials have been developed to fabricate micro- and nanoscale structures and devices. We report a new direct patterning method, liquid-bridge-mediated nanotransfer moulding, for the formation of two- or three-dimensional structures with feature sizes as small as tens of nanometres over large areas up to 4&#160;inches across. Liquid-bridge-mediated nanotransfer moulding is based on the direct transfer of various materials from a mould to a substrate through a liquid bridge between them. We demonstrate its usefulness by fabricating nanowire field-effect transistors and arrays of pentacene thin-film transistors.</p>",,"[{'address': 'Department of Chemistry, Hanyang University, Seoul, 133-791, Korea', 'authors': ['Jae K. Hwang', ',\xa0Sangho Cho', ',\xa0Jeong M. Dang', ',\xa0Eun B. Kwak', '\xa0&\xa0Myung M. Sung']}, {'address': 'Department of Materials Science and Engineering, Yonsei University, Seoul, 120-749, Korea', 'authors': ['Keunkyu Song', '\xa0&\xa0Jooho Moon']}]",False,"['Jae K. Hwang', 'Sangho Cho', 'Jeong M. Dang', 'Eun B. Kwak', 'Keunkyu Song', 'Jooho Moon', 'Myung M. Sung']","Hwang, J., Cho, S., Dang, J. et al. Direct nanoprinting by liquid-bridge-mediated nanotransfer moulding. Nature Nanotech5, 742–748 (2010).",549,0,115,aplusplus,10.1038/nnano.2010.175,https://doi.org/10.1038/nnano.2010.175,,10,nnano,nature nanotechnology,1285459200,2010-09-26,nanofabrication-and-nanopatterning;nanoscale-materials;surface-patterning,https://www.nature.com/articles/nnano.2010.175,5
