contentType,title,abstract,abstract_google_cn,affiliations,authorization,authors,citation_text,count_accesses,count_altmetric,count_citations,documentType,doi,doi_url,focus,issue,journal_pcode,journal_title,publishedAt,publishedAtString,subjects,url,volume
editorial,By any other name,,,[],True,[],"By any other name. Nature Nanotech7, 609 (2012).",280,3,0,aplusplus,10.1038/nnano.2012.179,https://doi.org/10.1038/nnano.2012.179,,10,nnano,nature nanotechnology,1349654400,2012-10-08,nanoscience-and-technology;publishing,https://www.nature.com/articles/nnano.2012.179,7
thesis,Lessons from before and after nanotech,,,"[{'address': 'Chris Toumey is at the University of South Carolina NanoCenter', 'authors': ['Chris Toumey']}]",False,['Chris Toumey'],"Toumey, C. Lessons from before and after nanotech. Nature Nanotech7, 611–612 (2012).",29,1,1,aplusplus,10.1038/nnano.2012.173,https://doi.org/10.1038/nnano.2012.173,,10,nnano,nature nanotechnology,1349654400,2012-10-08,biotechnology;ethics;nanoscience-and-technology;synthetic-biology,https://www.nature.com/articles/nnano.2012.173,7
research highlights,Our choice from the recent literature,,,[],True,[],"Our choice from the recent literature. Nature Nanotech7, 613 (2012).",14,1,0,aplusplus,10.1038/nnano.2012.181,https://doi.org/10.1038/nnano.2012.181,,10,nnano,nature nanotechnology,1349654400,2012-10-08,nanoscience-and-technology,https://www.nature.com/articles/nnano.2012.181,7
news & views,Imaging electrocatalysts in action,,,"[{'address': 'Stephen J. Percival and Bo Zhang are in the Department of Chemistry, University of Washington, Seattle, Washington 98195, USA', 'authors': ['Stephen J. Percival', '\xa0&\xa0Bo Zhang']}]",False,"['Stephen J. Percival', 'Bo Zhang']","Percival, S., Zhang, B. Imaging electrocatalysts in action. Nature Nanotech7, 615–616 (2012).",68,3,3,aplusplus,10.1038/nnano.2012.164,https://doi.org/10.1038/nnano.2012.164,,10,nnano,nature nanotechnology,1347148800,2012-09-09,electrocatalysis;imaging-techniques;nanoparticles,https://www.nature.com/articles/nnano.2012.164,7
news & views,A protein in the spotlight,,,"[{'address': 'Nicolas Plumeré is at the Center for Electrochemical Sciences, Faculty for Chemistry and Biochemistry, Ruhr University Bochum, 44780 Bochum, Germany', 'authors': ['Nicolas Plumeré']}]",False,['Nicolas Plumeré'],"Plumeré, N. A protein in the spotlight. Nature Nanotech7, 616–617 (2012).",71,2,14,aplusplus,10.1038/nnano.2012.175,https://doi.org/10.1038/nnano.2012.175,,10,nnano,nature nanotechnology,1349654400,2012-10-08,nanobiotechnology;scanning-probe-microscopy,https://www.nature.com/articles/nnano.2012.175,7
news & views,Blockade at a different level,,,"[{'address': 'Guido Burkard is at the Department of Physics, University of Konstanz, D-76457 Konstanz, Germany', 'authors': ['Guido Burkard']}]",False,['Guido Burkard'],"Burkard, G. Blockade at a different level. Nature Nanotech7, 617–619 (2012).",30,1,2,aplusplus,10.1038/nnano.2012.174,https://doi.org/10.1038/nnano.2012.174,,10,nnano,nature nanotechnology,1349654400,2012-10-08,quantum-dots;quantum-information,https://www.nature.com/articles/nnano.2012.174,7
news & views,A discerning look at the bonds in a molecule,,,[],True,['Owain Vaughan'],"Vaughan, O.  A discerning look at the bonds in a molecule. Nature Nanotech7, 619 (2012).",21,2,1,aplusplus,10.1038/nnano.2012.178,https://doi.org/10.1038/nnano.2012.178,,10,nnano,nature nanotechnology,1349654400,2012-10-08,atomic-force-microscopy;chemistry,https://www.nature.com/articles/nnano.2012.178,7
news & views,Probing intramolecular circuit laws,,,"[{'address': 'Christian Joachim is in the GNS-PicoLab and MANA Satellite, CEMES-CNRS, 29, Rue J. Marvig, BP 94347 31055 Toulouse Cedex, France', 'authors': ['Christian Joachim']}]",False,['Christian Joachim'],"Joachim, C. Probing intramolecular circuit laws. Nature Nanotech7, 620–621 (2012).",94,1,21,aplusplus,10.1038/nnano.2012.172,https://doi.org/10.1038/nnano.2012.172,,10,nnano,nature nanotechnology,1349654400,2012-10-08,molecular-electronics;quantum-physics,https://www.nature.com/articles/nnano.2012.172,7
news & views,Strain is a problem no more,,,"[{'address': 'Daniel Gammon is at the Naval Research Laboratory, Washington DC 20375, USA', 'authors': ['Daniel Gammon']}]",False,['Daniel Gammon'],"Gammon, D. Strain is a problem no more. Nature Nanotech7, 621–622 (2012).",20,0,5,aplusplus,10.1038/nnano.2012.171,https://doi.org/10.1038/nnano.2012.171,,10,nnano,nature nanotechnology,1349654400,2012-10-08,nmr-spectroscopy;quantum-dots,https://www.nature.com/articles/nnano.2012.171,7
news & views,The panoscopic approach,,,[],True,['Fabio Pulizzi'],"Pulizzi, F. The panoscopic approach. Nature Nanotech7, 622 (2012).",38,0,3,aplusplus,10.1038/nnano.2012.177,https://doi.org/10.1038/nnano.2012.177,,10,nnano,nature nanotechnology,1349654400,2012-10-08,nanoscale-materials;thermoelectrics,https://www.nature.com/articles/nnano.2012.177,7
progress article,Microfluidic technologies for accelerating the clinical translation of nanoparticles,,,"[{'address': 'Department of Chemical Engineering, Massachusetts Institute of Technology, Cambridge, 02139, Massachusetts, USA', 'authors': ['Pedro M. Valencia', '\xa0&\xa0Robert Langer']}, {'address': ""Laboratory of Nanomedicine and Biomaterials and Department of Anaesthesiology, Brigham and Women's Hospital, Harvard Medical School, Boston, 02115, Massachusetts, USA"", 'authors': ['Omid C. Farokhzad']}, {'address': 'MIT-Harvard Center for Cancer Nanotechnology Excellence, Massachusetts Institute of Technology, Cambridge, 02139, Massachusetts, USA', 'authors': ['Omid C. Farokhzad', '\xa0&\xa0Robert Langer']}, {'address': 'Department of Mechanical Engineering, Massachusetts Institute of Technology, Cambridge, 02139, Massachusetts, USA', 'authors': ['Rohit Karnik']}]",False,"['Pedro M. Valencia', 'Omid C. Farokhzad', 'Rohit Karnik', 'Robert Langer']","Valencia, P., Farokhzad, O., Karnik, R. et al. Microfluidic technologies for accelerating the clinical translation of nanoparticles. Nature Nanotech7, 623–629 (2012).",1194,15,369,aplusplus,10.1038/nnano.2012.168,https://doi.org/10.1038/nnano.2012.168,,10,nnano,nature nanotechnology,1349654400,2012-10-08,microfluidics;nanomedicine;nanoparticles,https://www.nature.com/articles/nnano.2012.168,7
letter,Valley–spin blockade and spin resonance in carbon nanotubes,"<p>The manipulation and readout of spin qubits in quantum dots have been successfully achieved using Pauli blockade, which forbids transitions between spin&#8211;triplet and spin&#8211;singlet states. Compared with spin qubits realized in III&#8211;V materials, group IV materials such as silicon and carbon are attractive for this application because of their low decoherence rates (nuclei with zero spins). However, valley degeneracies in the electronic band structure of these materials combined with Coulomb interactions reduce the energy difference between the blocked and unblocked states, significantly weakening the selection rules for Pauli blockade. Recent demonstrations of spin qubits in silicon devices have required strain and spatial confinement to lift the valley degeneracy. In carbon nanotubes, Pauli blockade can be observed by lifting valley degeneracy through disorder, but this makes the confinement potential difficult to control. To achieve Pauli blockade in low-disorder nanotubes, quantum dots have to be made ultrasmall, which is incompatible with conventional fabrication methods. Here, we exploit the bandgap of low-disorder nanotubes to demonstrate robust Pauli blockade based on both valley and spin selection rules. We use a novel stamping technique to create a bent nanotube, in which single-electron spin resonance is detected using the blockade. Our results indicate the feasibility of valley&#8211;spin qubits in carbon nanotubes.</p>",,"[{'address': 'Kavli Institute of Nanoscience, Delft University of Technology, PO Box 5046, Delft, 2600 GA, The Netherlands', 'authors': ['Fei Pei', ',\xa0Edward A. Laird', ',\xa0Gary A. Steele', '\xa0&\xa0Leo P. Kouwenhoven']}]",False,"['Fei Pei', 'Edward A. Laird', 'Gary A. Steele', 'Leo P. Kouwenhoven']","Pei, F., Laird, E., Steele, G. et al. Valley–spin blockade and spin resonance in carbon nanotubes. Nature Nanotech7, 630–634 (2012).",305,0,78,aplusplus,10.1038/nnano.2012.160,https://doi.org/10.1038/nnano.2012.160,,10,nnano,nature nanotechnology,1348358400,2012-09-23,carbon-nanotubes-and-fullerenes;quantum-dots;quantum-information,https://www.nature.com/articles/nnano.2012.160,7
letter,Current-induced magnetic domain wall motion below intrinsic threshold triggered by Walker breakdown,"<p>Controlling the position of a magnetic domain wall with electric current may allow for new types of non-volatile memory and logic devices. To be practical, however, the threshold current density necessary for domain wall motion must be reduced below present values. Intrinsic pinning due to magnetic anisotropy, as recently observed in perpendicularly magnetized Co/Ni nanowires, has been shown to give rise to an intrinsic current threshold J<sub>th</sub><sup>0</sup>. Here, we show that domain wall motion can be induced at current densities 40% below J<sub>th</sub><sup>0</sup> when an external magnetic field of the order of the domain wall pinning field is applied. We observe that the velocity of the domain wall motion is the vector sum of current- and field-induced velocities, and that the domain wall can be driven against the direction of a magnetic field as large as 2,000&#160;Oe, even at currents below J<sub>th</sub><sup>0</sup>. We show that this counterintuitive phenomenon is triggered by Walker breakdown, and that the additive velocities provide a unique way of simultaneously determining the spin polarization of current and the Gilbert damping constant.</p>",,"[{'address': 'Institute for Chemical Research, Kyoto University, Gokasho, Uji, 611-0011, Kyoto, Japan', 'authors': ['T. Koyama', ',\xa0K. Ueda', ',\xa0K.-J. Kim', ',\xa0Y. Yoshimura', ',\xa0D. Chiba', ',\xa0K. Kobayashi', '\xa0&\xa0T. Ono']}, {'address': 'PRESTO, Japan Science and Technology Agency, 4-1-8 Honcho, Kawaguchi, 182-8585, Saitama, Japan', 'authors': ['D. Chiba']}, {'address': 'Laboratoire de physique des solides, CNRS UMR, Univ. Paris-sud, Orsay, 91405, France', 'authors': ['K. Yamada', ',\xa0J.-P. Jamet', ',\xa0A. Mougin', '\xa0&\xa0A. Thiaville']}, {'address': 'WPI-Advanced Institute for Materials Research, Tohoku University, Katahira 2-1-1, Sendai, 980-8577, Miyagi, Japan', 'authors': ['S. Mizukami']}, {'address': 'NEC Corporation, 34 Miyukigaoka, Tsukuba, 305-8501, Ibaraki, Japan', 'authors': ['S. Fukami', '\xa0&\xa0N. Ishiwata']}, {'address': 'University of Electro-communications, Chofu, 182-8585, Tokyo, Japan', 'authors': ['Y. Nakatani']}, {'address': 'Graduate School of Engineering Science, Osaka University, Toyonaka, Osaka, 560-8531, Japan', 'authors': ['H. Kohno']}]",False,"['T. Koyama', 'K. Ueda', 'K.-J. Kim', 'Y. Yoshimura', 'D. Chiba', 'K. Yamada', 'J.-P. Jamet', 'A. Mougin', 'A. Thiaville', 'S. Mizukami', 'S. Fukami', 'N. Ishiwata', 'Y. Nakatani', 'H. Kohno', 'K. Kobayashi', 'T. Ono']","Koyama, T., Ueda, K., Kim, K. et al. Current-induced magnetic domain wall motion below intrinsic threshold triggered by Walker breakdown. Nature Nanotech7, 635–639 (2012).",309,0,38,aplusplus,10.1038/nnano.2012.151,https://doi.org/10.1038/nnano.2012.151,,10,nnano,nature nanotechnology,1347148800,2012-09-09,electronic-properties-and-materials;magnetic-properties-and-materials,https://www.nature.com/articles/nnano.2012.151,7
letter,All-optical active switching in individual semiconductor nanowires,"<p>The imminent limitations of electronic integrated circuits are stimulating intense activity in the area of nanophotonics for the development of on-chip optical components, and solutions incorporating direct-bandgap semiconductors are important in achieving this end. Optical processing of data at the nanometre scale is promising for circumventing these limitations, but requires the development of a toolbox of components including emitters, detectors, modulators, waveguides and switches. In comparison to components fabricated using top-down methods, semiconductor nanowires offer superior surface properties and stronger optical confinement. They are therefore ideal candidates for nanoscale optical network components, as well as model systems for understanding optical confinement. Here, we demonstrate all-optical switching in individual CdS nanowire cavities with subwavelength dimensions through stimulated polariton scattering, as well as a functional NAND gate built from multiple switches. The device design exploits the strong light&#8211;matter coupling present in these nanowires, leading to footprints that are a fraction of those of comparable silicon-based dielectric contrast and photonic crystal devices.</p>",,"[{'address': 'Department of Materials Science and Engineering, University of Pennsylvania, Philadelphia, 19104, Pennsylvania, USA', 'authors': ['Brian Piccione', ',\xa0Chang-Hee Cho', ',\xa0Lambert K. van Vugt', '\xa0&\xa0Ritesh Agarwal']}]",False,"['Brian Piccione', 'Chang-Hee Cho', 'Lambert K. van Vugt', 'Ritesh Agarwal']","Piccione, B., Cho, C., van Vugt, L. et al. All-optical active switching in individual semiconductor nanowires. Nature Nanotech7, 640–645 (2012).",578,51,182,aplusplus,10.1038/nnano.2012.144,https://doi.org/10.1038/nnano.2012.144,,10,nnano,nature nanotechnology,1346544000,2012-09-02,nanophotonics-and-plasmonics;nanowires,https://www.nature.com/articles/nnano.2012.144,7
letter,Structural analysis of strained quantum dots using nuclear magnetic resonance,"<p>Strained semiconductor nanostructures can be used to make single-photon sources, detectors and photovoltaic devices, and could potentially be used to create quantum logic devices. The development of such applications requires techniques capable of nanoscale structural analysis, but the microscopy methods typically used to analyse these materials are destructive. NMR techniques can provide non-invasive structural analysis, but have been restricted to strain-free semiconductor nanostructures because of the significant strain-induced quadrupole broadening of the NMR spectra. Here, we show that optically detected NMR spectroscopy can be used to analyse individual strained quantum dots. Our approach uses continuous-wave broadband radiofrequency excitation with a specially designed spectral pattern and can probe individual strained nanostructures containing only 1&#160;&#215;&#160;10<sup>5</sup> quadrupole nuclear spins. With this technique, we are able to measure the strain distribution and chemical composition of quantum dots in the volume occupied by the single confined electron. The approach could also be used to address problems in quantum information processing such as the precise control of nuclear spins in the presence of strong quadrupole effects.</p>",,"[{'address': 'Department of Physics and Astronomy, University of Sheffield, Sheffield, S3 7RH, UK', 'authors': ['E. A. Chekhovich', ',\xa0J. Puebla', ',\xa0M. S. Skolnick', '\xa0&\xa0A. I. Tartakovskii']}, {'address': 'A. F. Ioffe Physico-Technical Institute, 194021, and Spin Optics Laboratory, St Petersburg State University, St Petersburg, 198504, Russia', 'authors': ['K. V. Kavokin']}, {'address': 'Department of Electronic and Electrical Engineering, University of Sheffield, Sheffield, S1 3JD, UK', 'authors': ['A. B. Krysa', '\xa0&\xa0M. Hopkinson']}, {'address': 'Hitachi Cambridge Laboratory, Cavendish Laboratory, Madingley Road, Cambridge, CB3 0HE, UK', 'authors': ['A. D. Andreev']}, {'address': 'Department of Physics, University of Warwick, Coventry, CV4 7AL, UK', 'authors': ['A. M. Sanchez', '\xa0&\xa0R. Beanland']}]",False,"['E. A. Chekhovich', 'K. V. Kavokin', 'J. Puebla', 'A. B. Krysa', 'M. Hopkinson', 'A. D. Andreev', 'A. M. Sanchez', 'R. Beanland', 'M. S. Skolnick', 'A. I. Tartakovskii']","Chekhovich, E., Kavokin, K., Puebla, J. et al. Structural analysis of strained quantum dots using nuclear magnetic resonance. Nature Nanotech7, 646–650 (2012).",247,28,49,aplusplus,10.1038/nnano.2012.142,https://doi.org/10.1038/nnano.2012.142,,10,nnano,nature nanotechnology,1345939200,2012-08-26,nmr-spectroscopy;quantum-dots;structural-properties,https://www.nature.com/articles/nnano.2012.142,7
letter,Site- and alignment-controlled growth of graphene nanoribbons from nickel nanobars,"<p>Graphene nanoribbons combine the unique electronic and spin properties of graphene with a transport gap that arises from quantum confinement and edge effects. This makes them an attractive candidate material for the channels of next-generation transistors. Nanoribbons can be made in a variety of ways, including lithographic, chemical and sonochemical approaches, the unzipping of carbon nanotubes, the thermal decomposition of SiC and organic synthesis. However, the reliable site and alignment control of nanoribbons with high on/off current ratios remains a challenge. Here we control the site and alignment of narrow (&#8764;23 nm) graphene nanoribbons by directly converting a nickel nanobar into a graphene nanoribbon using rapid-heating plasma chemical vapour deposition. The nanoribbons grow directly between the source and drain electrodes of a field-effect transistor without transfer, lithography and other postgrowth treatments, and exhibit a clear transport gap (58.5 meV), a high on/off ratio (&gt;10<sup>4</sup>) and no hysteresis. Complex architectures, including parallel and radial arrays of supported and suspended ribbons, are demonstrated. The process is scalable and completely compatible with existing semiconductor processes, and is expected to allow integration of graphene nanoribbons with silicon technology.</p>",,"[{'address': 'Department of Electronic Engineering, Tohoku University, Sendai, 980-8579, Japan', 'authors': ['Toshiaki Kato', '\xa0&\xa0Rikizo Hatakeyama']}]",False,"['Toshiaki Kato', 'Rikizo Hatakeyama']","Kato, T., Hatakeyama, R. Site- and alignment-controlled growth of graphene nanoribbons from nickel nanobars. Nature Nanotech7, 651–656 (2012).",330,14,110,aplusplus,10.1038/nnano.2012.145,https://doi.org/10.1038/nnano.2012.145,,10,nnano,nature nanotechnology,1347148800,2012-09-09,electronic-properties-and-devices;graphene;surface-patterning,https://www.nature.com/articles/nnano.2012.145,7
letter,Sensing single remote nuclear spins,"<p>The detection of single nuclear spins would be useful for fields ranging from basic science to quantum information technology. However, although sensing based on diamond defects and other methods have shown high sensitivity, they have not been capable of detecting single nuclear spins, and defect-based techniques further require strong defect&#8211;spin coupling. Here, we present the detection and identification of single and remote <sup>13</sup>C nuclear spins embedded in nuclear spin baths surrounding a single electron spin of a nitrogen-vacancy centre in diamond. We are able to amplify and detect the weak magnetic field noise (&#8764;10 nT) from a single nuclear spin located &#8764;3 nm from the centre using dynamical decoupling control, and achieve a detectable hyperfine coupling strength as weak as &#8764;300 Hz. We also confirm the quantum nature of the coupling, and measure the spin-defect distance and the vector components of the nuclear field. The technique marks a step towards imaging, detecting and controlling nuclear spins in single molecules.</p>",,"[{'address': '3 Physikalisches Institut and Research Center SCOPE, University Stuttgart, Pfaffenwaldring 57, Stuttgart, 70569, Germany', 'authors': ['Nan Zhao', ',\xa0Jan Honert', ',\xa0Bernhard Schmid', ',\xa0Michael Klas', ',\xa0Helmut Fedder', '\xa0&\xa0Jörg Wrachtrup']}, {'address': 'Graduate School of Library, Information and Media Studies, University of Tsukuba, 1-2 Kasuga, Tsukuba, 305-8550, Ibaraki, Japan', 'authors': ['Junichi Isoya']}, {'address': 'Element Six Ltd, Ascot SL5 8BP, Berkshire, UK', 'authors': ['Matthew Markham', '\xa0&\xa0Daniel Twitchen']}, {'address': 'Institut für Quantenoptik, Universität Ulm, Ulm, 89081, Germany', 'authors': ['Fedor Jelezko']}, {'address': 'Department of Physics and Centre for Quantum Coherence, The Chinese University of Hong Kong, Shatin, New Territories, Hong Kong, China', 'authors': ['Ren-Bao Liu']}]",False,"['Nan Zhao', 'Jan Honert', 'Bernhard Schmid', 'Michael Klas', 'Junichi Isoya', 'Matthew Markham', 'Daniel Twitchen', 'Fedor Jelezko', 'Ren-Bao Liu', 'Helmut Fedder', 'Jörg Wrachtrup']","Zhao, N., Honert, J., Schmid, B. et al. Sensing single remote nuclear spins. Nature Nanotech7, 657–662 (2012).",753,3,154,aplusplus,10.1038/nnano.2012.152,https://doi.org/10.1038/nnano.2012.152,,10,nnano,nature nanotechnology,1346544000,2012-09-02,nanometrology;nanosensors;quantum-information;quantum-mechanics,https://www.nature.com/articles/nnano.2012.152,7
letter,Probing the conductance superposition law in single-molecule circuits with parallel paths,"<p>According to Kirchhoff's circuit laws, the net conductance of two parallel components in an electronic circuit is the sum of the individual conductances. However, when the circuit dimensions are comparable to the electronic phase coherence length, quantum interference effects play a critical role, as exemplified by the Aharonov&#8211;Bohm effect in metal rings. At the molecular scale, interference effects dramatically reduce the electron transfer rate through a meta-connected benzene ring when compared with a para-connected benzene ring. For longer conjugated and cross-conjugated molecules, destructive interference effects have been observed in the tunnelling conductance through molecular junctions. Here, we investigate the conductance superposition law for parallel components in single-molecule circuits, particularly the role of interference. We synthesize a series of molecular systems that contain either one backbone or two backbones in parallel, bonded together cofacially by a common linker on each end. Single-molecule conductance measurements and transport calculations based on density functional theory show that the conductance of a double-backbone molecular junction can be more than twice that of a single-backbone junction, providing clear evidence for constructive interference.</p>",,"[{'address': 'Department of Applied Physics and Applied Mathematics, Columbia University, 500 W. 120th Street, New York, New York 10027, USA', 'authors': ['H. Vazquez', ',\xa0M. Kamenetska', '\xa0&\xa0L. Venkataraman']}, {'address': 'Department of Chemistry, Columbia University, 3000 Broadway, New York 10027, USA', 'authors': ['R. Skouta', ',\xa0S. Schneebeli', '\xa0&\xa0R. Breslow']}, {'address': 'Center for Functional Nanomaterials, Brookhaven National Laboratory, Upton, New York 11973, USA', 'authors': ['M.S. Hybertsen']}]",False,"['H. Vazquez', 'R. Skouta', 'S. Schneebeli', 'M. Kamenetska', 'R. Breslow', 'L. Venkataraman', 'M.S. Hybertsen']","Vazquez, H., Skouta, R., Schneebeli, S. et al. Probing the conductance superposition law in single-molecule circuits with parallel paths. Nature Nanotech7, 663–667 (2012).",742,19,205,aplusplus,10.1038/nnano.2012.147,https://doi.org/10.1038/nnano.2012.147,,10,nnano,nature nanotechnology,1346544000,2012-09-02,electronic-properties-and-materials;organic-inorganic-nanostructures,https://www.nature.com/articles/nnano.2012.147,7
