doi,title,title_cn,abstract,abstract_cn
10.1038/nnano.2008.322,Papers about papers,关于论文的论文 ,,
10.1038/nnano.2008.323,The US must help set international standards for nanotechnology,美国必须帮助制定纳米技术的国际标准 ,,
10.1038/nnano.2008.324,Rhapsody in C,C狂想曲 ,,
10.1038/nnano.2008.325,"Hanging by a nanotube, graphite oxide takes a breather, molecular electronics with fullerenes, optical nanotomography for fluids, and more",挂在纳米管上的氧化石墨可以通气，带有富勒烯的分子电子学，用于流体的光学纳米断层摄影等等 ,,
10.1038/nnano.2008.326,Top down bottom up: Working in harmony,自上而下自下而上：和谐地工作 ,,
10.1038/nnano.2008.328,Microscopy with single spins,单旋转显微镜 ,,
10.1038/nnano.2008.320,Order and control,秩序与控制 ,,
10.1038/nnano.2008.294,New leverage against superbugs,针对超级错误的新杠杆 ,,
10.1038/nnano.2008.321,Catalysis live,现场催化 ,,
10.1038/nnano.2008.327,Designing biomimetic nanomachines,设计仿生纳米机 ,,
10.1038/nnano.2008.310,Erratum: Nano-selenium captures mercury,勘误：纳米硒捕获汞 ,,
10.1038/nnano.2008.269,Spatial periodicity in molecular switching,分子转换中的空间周期性 ,"<p>The ultimate miniaturization of future devices will require the use of functional molecules at the nanoscale and their integration into larger architectures. Switches represent a prototype of such functional molecules because they exhibit characteristic states of different physical/chemical properties, which can be addressed reversibly. Recently, various switching entities have been studied and switching of single molecules on surfaces has been demonstrated. However, for functional molecules to be used in a future device, it will be necessary to selectively address individual molecules, preferentially in an ordered pattern. Here, we show that azobenzene derivatives in the trans form, adsorbed in a homogeneous two-dimensional layer, can be collectively switched with spatial selectivity, thus forming a periodic pattern of cis isomers. We find that the probability of a molecule switching is not equally distributed, but is strongly dependent on both the surrounding molecules and the supporting surface, which precisely determine the switching capability of each individual molecule. Consequently, exactly the same lattices of cis isomers are created in repeated erasing and re-switching cycles. Our results demonstrate a conceptually new approach to spatially addressing single functional molecules.</p>",<p>未来设备的最终微型化将需要在纳米级使用功能分子并将其集成到更大的架构中。开关代表了这种功能分子的原型，因为它们表现出不同物理/化学特性的特征状态，可以可逆地解决。近来，已经研究了各种开关实体并且已经证明了表面上单分子的开关。然而，对于要在未来的设备中使用的功能分子，将有必要选择性地寻址单个分子，优先选择有序模式。在这里，我们表明，吸附在均质二维层中的反式偶氮苯衍生物可以通过空间选择性共同转换，从而形成顺式异构体的周期性图案。我们发现，分子切换的概率不是均匀分布的，而是强烈地依赖于周围的分子和支撑表面，而精确地确定每个单个分子的切换能力。因此，在重复的擦除和重新切换循环中会产生完全相同的顺式异构体晶格。我们的结果证明了一种在空间上解决单个功能分子的概念新方法。</ p> 
10.1038/nnano.2008.268,"Current saturation in zero-bandgap, top-gated graphene field-effect transistors",零带隙，顶栅石墨烯场效应晶体管中的电流饱和 ,"<p>The novel electronic properties of graphene, including a linear energy dispersion relation and purely two-dimensional structure, have led to intense research into possible applications of this material in nanoscale devices. Here we report the first observation of saturating transistor characteristics in a graphene field-effect transistor. The saturation velocity depends on the charge-carrier concentration and we attribute this to scattering by interfacial phonons in the SiO<sub>2</sub> layer supporting the graphene channels. Unusual features in the current&#8211;voltage characteristic are explained by a field-effect model and diffusive carrier transport in the presence of a singular point in the density of states. The electrostatic modulation of the channel through an efficiently coupled top gate yields transconductances as high as 150&#160;&#181;S&#160;&#181;m<sup>&#8722;1</sup> despite low on&#8211;off current ratios. These results demonstrate the feasibility of two-dimensional graphene devices for analogue and radio-frequency circuit applications without the need for bandgap engineering.</p>",<p>石墨烯的新颖电子特性，包括线性能量色散关系和纯二维结构，已导致人们对该材料在纳米级器件中的可能应用进行了深入研究。在这里，我们报告对石墨烯场效应晶体管中饱和晶体管特性的首次观察。饱和速度取决于电荷载流子浓度，我们将其归因于支撑石墨烯通道的SiO <sub> 2 </ sub>层中界面声子的散射。通过场效应模型和在状态密度中存在奇异点的扩散载流子传输来解释电流电压特性中的异常特征。尽管导通较低，但通过有效耦合的顶栅对通道进行的静电调制仍可产生高达150＆＃160;＆＃181; S＆＃160;＆＃181; m <sup>＆＃8722; 1 </ sup>的跨导8211;关闭电流比这些结果证明了二维石墨烯器件在模拟和射频电路应用中的可行性，而无需带隙工程。</ p> 
10.1038/nnano.2008.281,Integration of photonic and silver nanowire plasmonic waveguides,光子和银纳米线等离子体波导的集成 ,"<p>Future optical data transmission modules will require the integration of more than 10,000&#160;&#215;&#160;10,000 input and output channels to increase data transmission rates and capacity. This level of integration, which greatly exceeds that of a conventional diffraction-limited photonic integrated circuit, will require the use of waveguides with a mode confinement below the diffraction limit, and also the integration of these waveguides with diffraction-limited components. We propose to integrate multiple silver nanowire plasmonic waveguides with polymer optical waveguides for the nanoscale confinement and guiding of light on a chip. In our device, the nanowires lay perpendicular to the polymer waveguide with one end inside the polymer. We theoretically predict and experimentally demonstrate coupling of light into multiple nanowires from the same waveguide, and also demonstrate control over the degree of coupling by changing the light polarization.</p>","<p>未来的光学数据传输模块将需要集成10,000多个输入和输出通道，以提高数据传输速率和容量。 这种集成水平大大超过了常规的衍射极限光子集成电路的集成水平，将需要使用模式限制在衍射极限以下的波导，以及这些波导与衍射极限组件的集成。 我们建议将多个银纳米线等离激元波导与聚合物光波导集成在一起，以对芯片上的光进行纳米级限制和引导。 在我们的设备中，纳米线垂直于聚合物波导放置，其一端位于聚合物内部。 我们从理论上预测和实验证明了将光从同一波导耦合到多条纳米线中，并演示了通过改变光的偏振来控制耦合程度。</ p> "
10.1038/nnano.2008.274,Designing artificial cells to harness the biological ion concentration gradient,设计人造细胞以利用生物离子浓度梯度 ,"<p>Cell membranes contain numerous nanoscale conductors in the form of ion channels and ion pumps that work together to form ion concentration gradients across the membrane to trigger the release of an action potential. It seems natural to ask if artificial cells can be built to use ion transport as effectively as natural cells. Here we report a mathematical calculation of the conversion of ion concentration gradients into action potentials across different nanoscale conductors in a model electrogenic cell (electrocyte) of an electric eel. Using the parameters extracted from the numerical model, we designed an artificial cell based on an optimized selection of conductors. The resulting cell is similar to the electrocyte but has higher power output density and greater energy conversion efficiency. We suggest methods for producing these artificial cells that could potentially be used to power medical implants and other tiny devices.</p>",细胞膜包含许多离子通道和离子泵形式的纳米级导体，它们共同作用以形成跨膜的离子浓度梯度，从而触发动作电位的释放。 似乎自然可以问人造细胞是否可以像天然细胞一样有效地利用离子传输。 在这里，我们报告了在电鳗的模型电致细胞（电细胞）中，跨不同纳米级导体的离子浓度梯度到动作电位的转换的数学计算。 使用从数值模型中提取的参数，我们基于优化的导体选择设计了一个人造细胞。 所得的电池类似于电池，但具有较高的功率输出密度和较高的能量转换效率。 我们建议了生产这些人造细胞的方法，这些方法可能会用于为医疗植入物和其他微型设备提供动力。</ p> 
10.1038/nnano.2008.270,A thixotropic nanocomposite gel for three-dimensional cell culture,用于三维细胞培养的触变纳米复合凝胶 ,"<p>Thixotropic materials, which become less viscous under stress and return to their original state when stress is removed, have been used to deliver gel&#8211;cell constructs and therapeutic agents. Here we show that a polymer&#8211;silica nanocomposite thixotropic gel can be used as a three-dimensional cell culture material. The gel liquefies when vortexed&#8212;allowing cells and biological components to be added&#8212;and resolidifies to trap the components when the shear force from spinning is removed. Good permeability of nutrients and gases through the gel allows various cell types to proliferate and be viable for up to three weeks. Human mesenchymal stem cells cultured in stiffer gels developed bone-like behaviour, showing that the rheological properties of the gel can control cell differentiation. No enzymatic, chemical, or photo-crosslinking, changes in ionic strength or temperature are required to form or liquefy the gel, offering a way to sub-culture cells without using trypsin&#8212;a protease commonly used in traditional cell culture techniques.</p>",<p>触变材料在压力下变粘并在去除压力后恢复其原始状态，已用于递送凝胶细胞构造和治疗剂。在这里，我们表明聚合物二氧化硅纳米复合触变凝胶可以用作三维细胞培养材料。涡旋流动时，凝胶会液化，允许添加细胞和生物成分，并且在去除纺丝产生的剪切力时会重新凝固，以捕获这些成分。营养物质和气体通过凝胶具有良好的渗透性，可以使各种类型的细胞增殖并存活长达三周。在较硬的凝胶中培养的人间充质干细胞发展为骨样行为，表明该凝胶的流变特性可以控制细胞分化。无需酶，化学或光交联，离子强度或温度的变化即可形成或液化凝胶，从而提供了一种无需使用胰蛋白酶的传代培养方法，而胰蛋白酶是传统细胞培养技术中常用的蛋白酶。 / p> 
10.1038/nnano.2008.280,Free-standing graphene at atomic resolution,原子分辨率的独立式石墨烯 ,"<p>Research interest in graphene, a two-dimensional crystal consisting of a single atomic plane of carbon atoms, has been driven by its extraordinary properties, including charge carriers that mimic ultra-relativistic elementary particles. Moreover, graphene exhibits ballistic electron transport on the submicrometre scale, even at room temperature, which has allowed the demonstration of graphene-based field-effect transistors and the observation of a room-temperature quantum Hall effect. Here we confirm the presence of free-standing, single-layer graphene with directly interpretable atomic-resolution imaging combined with the spatially resolved study of both the &#960;&#160;&#8594;&#160;&#960;* transition and the &#960;&#160;+&#160;&#963; plasmon. We also present atomic-scale observations of the morphology of free-standing graphene and explore the role of microstructural peculiarities that affect the stability of the sheets. We also follow the evolution and interaction of point defects and suggest a mechanism by which they form ring defects.</p>",<p>石墨烯是由碳原子的单个原子平面组成的二维晶体的研究兴趣一直由其非凡的特性驱动，包括模仿超相对论基本粒子的电荷载体。此外，石墨烯甚至在室温下也表现出亚微米级的弹道电子传输，这已经证明了基于石墨烯的场效应晶体管的演示以及室温量子霍尔效应的观察。在这里，我们通过直接可解释的原子分辨率成像结合对空间分辨的研究，确定了独立的单层石墨烯的存在。＆＃960;＆＃160;＆＃8594;＆＃160;＆＃960; *过渡和＆＃960;＆＃160; +＃160;＆＃963;等离子体激元。我们还介绍了独立式石墨烯形态的原子尺度观察结果，并探讨了影响薄板稳定性的微结构特性的作用。我们还跟踪了点缺陷的演变和相互作用，并提出了形成点缺陷的机制。</ p> 
10.1038/nnano.2008.279,Nanopatterning self-assembled nanoparticle superlattices by moulding microdroplets,通过成型微滴进行纳米构图自组装的纳米颗粒超晶格 ,"<p>Highly ordered arrays of nanoparticles exhibit many properties that are not found in their disordered counterparts. However, these nanoparticle superlattices usually form in a far-from-equilibrium dewetting process, which precludes the use of conventional patterning methods owing to a lack of control over the local dewetting dynamics. Here, we report a simple yet efficient approach for patterning such superlattices that involves moulding microdroplets containing the nanoparticles and spatially regulating their dewetting process. This approach can provide rational control over the local nucleation and growth of the nanoparticle superlattices. Using DNA-capped gold nanoparticles as a model system, we have patterned nanoparticle superlattices over large areas into a number of versatile structures with high degrees of internal order, including single-particle-width corrals, single-particle-thickness microdiscs and submicrometre-sized &#8216;supra-crystals&#8217;. Remarkably, these features could be addressed by micropatterned electrode arrays, suggesting potential applications in bottom-up nanodevices.</p>",<p>纳米颗粒的高度有序阵列表现出许多无序对应物所没有的特性。然而，这些纳米粒子超晶格通常在远离平衡的去湿过程中形成，由于缺乏对局部去湿动力学的控制，因此其无法使用常规的构图方法。在这里，我们报告了一种用于图案化此类超晶格的简单而有效的方法，该方法涉及成型包含纳米颗粒的微滴并在空间上调节其去湿过程。该方法可以提供对纳米颗粒超晶格的局部成核和生长的合理控制。我们使用DNA封端的金纳米颗粒作为模型系统，将大面积的纳米颗粒超晶格图案化为具有高度内部有序性的多种通用结构，包括单颗粒宽度的畜栏，单颗粒厚度的微盘和亚微米大小＆＃8216;超晶体＆＃8217;。值得注意的是，这些特征可以通过微图案化的电极阵列解决，这表明在自底向上的纳米器件中有潜在的应用。</ p> 
10.1038/nnano.2008.275,Nanomechanical detection of antibiotic–mucopeptide binding in a model for superbug drug resistance,在超级细菌耐药性模型中抗生素-粘肽结合的纳米力学检测 ,"<p>The alarming growth of the antibiotic-resistant superbugs methicillin-resistant Staphylococcus aureus (MRSA) and vancomycin-resistant Enterococcus (VRE) is driving the development of new technologies to investigate antibiotics and their modes of action. We report the label-free detection of vancomycin binding to bacterial cell wall precursor analogues (mucopeptides) on cantilever arrays, with 10&#160;nM sensitivity and at clinically relevant concentrations in blood serum. Differential measurements have quantified binding constants for vancomycin-sensitive and vancomycin-resistant mucopeptide analogues. Moreover, by systematically modifying the mucopeptide density we gain new insights into the origin of surface stress. We propose that stress is a product of a local chemical binding factor and a geometrical factor describing the mechanical connectivity of regions activated by local binding in terms of a percolation process. Our findings place BioMEMS devices in a new class of percolative systems. The percolation concept will underpin the design of devices and coatings to significantly lower the drug detection limit and may also have an impact on our understanding of antibiotic drug action in bacteria.</p>",<p>对抗生素耐药的超级细菌对耐甲氧西林的金黄色葡萄球菌（MRSA）和对万古霉素耐药的肠球菌（VRE）的惊人增长，正在推动研究抗生素及其作用方式的新技术的发展。我们报告了在悬臂阵列上万古霉素结合细菌细胞壁前体类似物（粘肽）的无标记检测，灵敏度为10＆＃160;在血清中具有临床相关浓度。差异测量具有对万古霉素敏感和耐万古霉素的粘肽类似物的结合常数。此外，通过系统地修改粘肽的密度，我们获得了有关表面应力起源的新见解。我们建议应力是局部化学结合因子和几何因子的乘积，该几何因子描述了根据渗流过程被局部结合激活的区域的机械连通性。我们的发现将BioMEMS器件置于一类新的渗透系统中。渗滤概念将为设备和涂层的设计奠定基础，以大大降低药物检出限，也可能会影响我们对细菌中抗生素作用的理解。</ p> 
