doi,title,title_cn,abstract,abstract_cn
10.1038/nnano.2016.278,Refreshing the strategy,刷新策略 ,,
10.1038/nnano.2016.279,Analyse that,分析一下 ,,
10.1038/nnano.2016.270,'Safe handling of nanotechnology' ten years on,十年的“安全处理纳米技术” ,,
10.1038/nnano.2016.271,Our choice from the recent literature,我们从最近的文献中选择 ,,
10.1038/nnano.2016.229,Superstructures simplified,上层建筑简化 ,,
10.1038/nnano.2016.222,Light-seeking synthetic trees,寻求光的合成树 ,,
10.1038/nnano.2016.276,Nanotech in motion,运动中的纳米技术 ,,
10.1038/nnano.2016.259,An electrifying journey,激动人心的旅程 ,,
10.1038/nnano.2016.194,Developing a scalable artificial photosynthesis technology through nanomaterials by design,通过纳米材料开发可扩展的人造光合作用技术 ,,
10.1038/nnano.2016.265,Activity targets for nanostructured platinum-group-metal-free catalysts in hydroxide exchange membrane fuel cells,氢氧化物交换膜燃料电池中纳米结构无铂族金属无催化剂的活性目标 ,,
10.1038/nnano.2016.262,Polymer matrix nanocomposites for automotive structural components,用于汽车结构部件的聚合物基纳米复合材料 ,,
10.1038/nnano.2016.207,The role of nanotechnology in the development of battery materials for electric vehicles,纳米技术在电动汽车电池材料开发中的作用 ,,
10.1038/nnano.2016.237,Nanotechnology for environmentally sustainable electromobility,用于环境可持续的电动汽车的纳米技术 ,,
10.1038/nnano.2016.247,Life as a fuel cell engineer,生命作为燃料电池工程师 ,,
10.1038/nnano.2016.157,The ω-SQUIPT as a tool to phase-engineer Josephson topological materials,ω-SQUIPT作为对约瑟夫森拓扑材料进行相工程设计的工具 ,,
10.1038/nnano.2016.158,Gate-controlled topological conducting channels in bilayer graphene,双层石墨烯中的门控拓扑传导通道 ,,
10.1038/nnano.2016.139,Integrated optical addressing of an ion qubit,离子量子位的集成光学寻址 ,,
10.1038/nnano.2016.162,Quantifying losses and thermodynamic limits in nanophotonic solar cells,量化纳米光子太阳能电池的损耗和热力学极限 ,,
10.1038/nnano.2016.142,DNA condensation in one dimension,一维DNA缩合 ,,
10.1038/nnano.2016.151,Multiwalled nanotube faceting unravelled,揭开多壁纳米管刻面 ,"<p>Nanotubes show great promise for miniaturizing advanced technologies. Their exceptional physical properties are intimately related to their morphological and crystal structure. Circumferential faceting of multiwalled nanotubes reinforces their mechanical strength and alters their tribological and electronic properties. Here, the nature of this important phenomenon is fully rationalized in terms of interlayer registry patterns. Regardless of the nanotube identity (that is, diameter, chirality, chemical composition), faceting requires the matching of the chiral angles of adjacent layers. Above a critical diameter that corresponds well with experimental results, achiral multiwalled nanotubes display evenly spaced extended axial facets whose number equals the interlayer difference in circumferential unit cells. Elongated helical facets, commonly observed in experiment, appear in nanotubes that exhibit small interlayer chiral angle mismatch. When the wall chiralities are uncorrelated, faceting is suppressed and outer layer corrugation, which is induced by the Moir&#233; superlattice, is obtained in agreement with experiments. Finally, we offer an explanation for the higher incidence of faceting in multiwalled boron nitride nanotubes with respect to their carbon-based counterparts.</p>",<p> Nanotubes显示出使先进技术小型化的巨大希望。它们出色的物理性能与其形态和晶体结构密切相关。多层纳米管的周向刻面增强了它们的机械强度，并改变了它们的摩擦学和电子性能。在这里，就层间注册表模式而言，此重要现象的性质已完全合理化。无论纳米管的身份如何（即直径，手性，化学组成）如何，刻面都需要匹配相邻层的手性角。在与实验结果很好对应的临界直径之上，非手性多壁纳米管显示出均匀间隔的延伸轴向小平面，其数量等于圆周单元中的层间差。在实验中通常观察到的细长螺旋面出现在表现出较小的层间手性角失配的纳米管中。当壁的手性不相关时，由莫尔条纹引起的刻面被抑制并且外层起皱。经实验获得超晶格。最后，我们提供了一种解释，即多壁氮化硼纳米管相对于碳基对应物而言，其多面现象的发生率更高。</ p> 
10.1038/nnano.2016.187,Programmable artificial phototactic microswimmer,可编程的人造光战术微游泳器 ,"<p>Phototaxis is commonly observed in motile photosynthetic microorganisms. For example, green algae are capable of swimming towards a light source (positive phototaxis) to receive more energy for photosynthesis, or away from a light source (negative phototaxis) to avoid radiation damage or to hide from predators. Recently, with the aim of applying nanoscale machinery to biomedical applications, various inorganic nanomotors based on different propulsion mechanisms have been demonstrated. The only method to control the direction of motion of these self-propelled micro/nanomotors is to incorporate a ferromagnetic material into their structure and use an external magnetic field for steering. Here, we show an artificial microswimmer that can sense and orient to the illumination direction of an external light source. Our microswimmer is a Janus nanotree containing a nanostructured photocathode and photoanode at opposite ends that release cations and anions, respectively, propelling the microswimmer by self-electrophoresis. Using chemical modifications, we can control the zeta potential of the photoanode and program the microswimmer to exhibit either positive or negative phototaxis. Finally, we show that a school of microswimmers mimics the collective phototactic behaviour of green algae in solution.</p>",<p>趋光性通常在运动性光合微生物中观察到。例如，绿藻能够游向光源（正趋光性）以接收更多的能量用于光合作用，或者远离光源（负趋光性）以避免辐射损伤或躲避捕食者。近来，以将纳米级机械应用于生物医学应用为目的，已经证明了基于不同推进机制的各种无机纳米电机。控制这些自行式微型/纳米电动机的运动方向的唯一方法是将铁磁材料并入其结构中，并使用外部磁场进行转向。在这里，我们展示了一种人造微游泳器，它可以感应并定向到外部光源的照明方向。我们的微泳器是一台Janus纳米树，在相对的末端包含纳米结构的光电阴极和光阳极，分别释放阳离子和阴离子，通过自电泳推动微泳器。使用化学修饰，我们可以控制光电阳极的zeta电位，并对微扫描器进行编程以显示正或负趋光性。最后，我们证明了一所微游泳者模仿了溶液中绿藻的集体光战术行为。</ p> 
10.1038/nnano.2016.153,Direct observation of DNA knots using a solid-state nanopore,使用固态纳米孔直接观察DNA结 ,"<p>Long DNA molecules can self-entangle into knots. Experimental techniques for observing such DNA knots (primarily gel electrophoresis) are limited to bulk methods and circular molecules below 10 kilobase pairs in length. Here, we show that solid-state nanopores can be used to directly observe individual knots in both linear and circular single DNA molecules of arbitrary length. The DNA knots are observed as short spikes in the nanopore current traces of the traversing DNA molecules and their detection is dependent on a sufficiently high measurement resolution, which can be achieved using high-concentration LiCl buffers. We study the percentage of molecules with knots for DNA molecules of up to 166 kilobase pairs in length and find that the knotting occurrence rises with the length of the DNA molecule, consistent with a constant knotting probability per unit length. Our experimental data compare favourably with previous simulation-based predictions for long polymers. From the translocation time of the knot through the nanopore, we estimate that the majority of the DNA knots are tight, with remarkably small sizes below 100&#8197;nm. In the case of linear molecules, we also observe that knots are able to slide out on application of high driving forces (voltage).</p>",<p>长DNA分子可以自我缠结。观察此类DNA结的实验技术（主要是凝胶电泳）仅限于本体法和长度小于10 kb对的环状分子。在这里，我们表明固态纳米孔可用于直接观察任意长度的线性和圆形单个DNA分子中的单个结。在穿过的DNA分子的纳米孔电流迹线中观察到的DNA结为短峰，它们的检测取决于足够高的测量分辨率，这可以使用高浓度LiCl缓冲液实现。我们研究了长度不超过166千对碱基对的DNA分子带有打结的分子的百分比，发现打结的发生随着DNA分子长度的增加而增加，这与单位长度的打结概率保持一致。我们的实验数据可与以前基于模拟的长聚合物预测相媲美。从结穿过纳米孔的移位时间，我们估计大多数DNA结是紧密的，在100到8nm以下的尺寸很小。对于线性分子，我们还观察到，在高驱动力（电压）的作用下，结能够滑出。</ p> 
10.1038/nnano.2016.138,Rapid water disinfection using vertically aligned MoS2 nanofilms and visible light,使用垂直排列的MoS2纳米膜和可见光进行快速水消毒 ,"<p>Solar energy is readily available in most climates and can be used for water purification. However, solar disinfection of drinking water mostly relies on ultraviolet light, which represents only 4% of the total solar energy, and this leads to a slow treatment speed. Therefore, the development of new materials that can harvest visible light for water disinfection, and so speed up solar water purification, is highly desirable. Here we show that few-layered vertically aligned MoS<sub>2</sub> (FLV-MoS<sub>2</sub>) films can be used to harvest the whole spectrum of visible light (&#8764;50% of solar energy) and achieve highly efficient water disinfection. The bandgap of MoS<sub>2</sub> was increased from 1.3 to 1.55&#8197;eV by decreasing the domain size, which allowed the FLV-MoS<sub>2</sub> to generate reactive oxygen species (ROS) for bacterial inactivation in the water. The FLV-MoS<sub>2</sub> showed a &#8764;15 times better log inactivation efficiency of the indicator bacteria compared with that of bulk MoS<sub>2</sub>, and a much faster inactivation of bacteria under both visible light and sunlight illumination compared with the widely used TiO<sub>2</sub>. Moreover, by using a 5&#8197;nm copper film on top of the FLV-MoS<sub>2</sub> as a catalyst to facilitate electron&#8211;hole pair separation and promote the generation of ROS, the disinfection rate was increased a further sixfold. With our approach, we achieved water disinfection of &gt;99.999% inactivation of bacteria in 20&#8197;min with a small amount of material (1.6&#8197;mg&#8197;l<sup>&#8211;1</sup>) under simulated visible light.</p>",<p>太阳能在大多数气候下都很容易获得，可用于水净化。然而，饮用水的太阳能消毒主要依靠紫外线，紫外线仅占总太阳能的4％，这导致处理速度缓慢。因此，迫切需要开发能够收集可见光用于水消毒并因此加速太阳能水净化的新材料。在这里，我们显示了几层垂直排列的MoS <sub> 2 </ sub>（FLV-MoS <sub> 2 </ sub>）膜可用于收获可见光的整个光谱（＆＃8764; 50％太阳能）并实现高效的水消毒。通过减小畴尺寸，使MoS <sub> 2 </ sub>的带隙从1.3增加到1.55＆＃8197; eV，这使得FLV-MoS <sub> 2 </ sub>产生活性氧（ROS） ）用于水中的细菌灭活。 FLV-MoS <sub> 2 </ sub>的指示细菌对数灭活效率是批量MoS <sub> 2 </ sub>的15倍，对细菌的灭活效率要高15倍，细菌的灭活速度要快得多与广泛使用的TiO <sub> 2 </ sub>相比，在可见光和日光照射下都可以。此外，通过在FLV-MoS <sub> 2 </ sub>的顶部使用5nm的铜膜作为催化剂，促进电子与空穴对的分离并促进ROS的产生，消毒速率为进一步增加了六倍。通过我们的方法，我们用少量材料（1.6＆＃8197; mg＆＃8197; l <sup>＆＃8211; 1 </ sup）在20分钟内实现了大于99.999％的细菌灭活的水消毒。 >）在可见光下。</ p> 
10.1038/nnano.2016.172,Modular assembly of superstructures from polyphenol-functionalized building blocks,用多酚官能化砌块模块化组装上层建筑 ,"<p>The organized assembly of particles into superstructures is typically governed by specific molecular interactions or external directing factors associated with the particle building blocks, both of which are particle-dependent. These superstructures are of interest to a variety of fields because of their distinct mechanical, electronic, magnetic and optical properties. Here, we establish a facile route to a diverse range of superstructures based on the polyphenol surface-functionalization of micro- and nanoparticles, nanowires, nanosheets, nanocubes and even cells. This strategy can be used to access a large number of modularly assembled superstructures, including core&#8211;satellite, hollow and hierarchically organized supraparticles. Colloidal-probe atomic force microscopy and molecular dynamics simulations provide detailed insights into the role of surface functionalization and how this facilitates superstructure construction. Our work provides a platform for the rapid generation of superstructured assemblies across a wide range of length scales, from nanometres to centimetres.</p>",<p>粒子到上层结构的有组织组装通常由特定的分子相互作用或与粒子构建块相关的外部导向因素控制，两者均取决于粒子。这些上层建筑因其独特的机械，电子，磁性和光学性质而受到各个领域的关注。在这里，我们基于微米和纳米颗粒，纳米线，纳米片，纳米立方体甚至细胞的多酚表面官能化，建立了通往各种上层建筑的简便途径。此策略可用于访问大量模块化组装的上部结构，包括核心卫星，中空和分层组织的超粒子。胶体探针原子力显微镜和分子动力学模拟为表面功能化的作用以及这如何促进超结构的构建提供了详细的见识。我们的工作为从纳米到厘米的各种长度尺度的超结构组件的快速生成提供了一个平台。</ p> 
10.1038/nnano.2016.150,Quantum dot-loaded monofunctionalized DNA icosahedra for single-particle tracking of endocytic pathways,量子点加载单功能DNA二十面体用于内吞途径的单粒子跟踪 ,"<p>Functionalization of quantum dots (QDs) with a single biomolecular tag using traditional approaches in bulk solution has met with limited success. DNA polyhedra consist of an internal void bounded by a well-defined three-dimensional structured surface. The void can house cargo and the surface can be functionalized with stoichiometric and spatial precision. Here, we show that monofunctionalized QDs can be realized by encapsulating QDs inside DNA icosahedra and functionalizing the DNA shell with an endocytic ligand. We deployed the DNA-encapsulated QDs for real-time imaging of three different endocytic ligands&#8212;folic acid, galectin-3 (Gal3) and the Shiga toxin B-subunit (STxB). Single-particle tracking of Gal3- or STxB-functionalized QD-loaded DNA icosahedra allows us to monitor compartmental dynamics along endocytic pathways. These DNA-encapsulated QDs, which bear a unique stoichiometry of endocytic ligands, represent a new class of molecular probes for quantitative imaging of endocytic receptor dynamics.</p>",<p>使用大容量解决方案中的传统方法通过单个生物分子标签对量子点（QD）进行功能化，取得了有限的成功。 DNA多面体由内部空隙组成，内部空隙由定义明确的三维结构化表面界定。该空隙可以容纳货物，并且表面可以以化学计量和空间精度进行功能化。在这里，我们表明可以通过将QD封装在DNA二十面体内部并用内吞配体对DNA壳进行功能化来实现单功能化QD。我们部署了DNA封装的QD，可对三种不同的内吞配体＆＃8212;叶酸，galectin-3（Gal3）和志贺毒素B亚基（STxB）进行实时成像。对Gal3或STxB功能化的QD加载的DNA二十面体进行单粒子跟踪，使我们能够监测沿内吞途径的区室动力学。这些DNA包裹的量子点具有独特的内吞配体化学计量，代表了一类用于定量成像内吞受体动力学的新型分子探针。</ p> 
