doi,title,title_cn,abstract,abstract_cn,affiliations,affiliations_cn
10.1038/nnano.2010.27,Polyethylene nanofibres with very high thermal conductivities,具有极高导热率的聚乙烯纳米纤维 ,"<p>Bulk polymers are generally regarded as thermal insulators, and typically have thermal conductivities on the order of 0.1&#160;W&#160;m<sup>&#8722;1</sup>&#160;K<sup>&#8722;1</sup> (ref.&#160;). However, recent work suggests that individual chains of polyethylene&#8212;the simplest and most widely used polymer&#8212;can have extremely high thermal conductivity. Practical applications of these polymers may also require that the individual chains form fibres or films. Here, we report the fabrication of high-quality ultra-drawn polyethylene nanofibres with diameters of 50&#8211;500 nm and lengths up to tens of millimetres. The thermal conductivity of the nanofibres was found to be as high as &#8764;104 W m<sup>&#8722;1</sup>&#160;K<sup>&#8722;1</sup>, which is larger than the conductivities of about half of the pure metals. The high thermal conductivity is attributed to the restructuring of the polymer chains by stretching, which improves the fibre quality toward an &#8216;ideal&#8217; single crystalline fibre. Such thermally conductive polymers are potentially useful as heat spreaders and could supplement conventional metallic heat-transfer materials, which are used in applications such as solar hot-water collectors, heat exchangers and electronic packaging.</p>",<p>大块聚合物通常被认为是绝热材料，并且通常具有约0.1＆＃160; W＆＃160; m <sup>＆＃8722; 1 </ sup>＆＃160; K <sup >＆＃8722; 1 </ sup>（参考。＆＃160;）。但是，最近的工作表明，聚乙烯的单个链最简单，使用最广泛的聚合物可以具有极高的导热率。这些聚合物的实际应用也可能要求各个链形成纤维或薄膜。在这里，我们报告了高质量的超拉伸聚乙烯纳米纤维的制造，该纳米纤维的直径为50＆＃8211; 500 nm，长度可达数十毫米。发现纳米纤维的热导率高达＆＃8764; 104 W m <sup>＆＃8722; 1 </ sup>＆＃160; K <sup>＆＃8722; 1 </ sup>，它比约一半的纯金属的电导率大。高热导率归因于通过拉伸使聚合物链重组，这改善了朝“理想”纤维的质量。单晶纤维。这种导热聚合物可能会用作散热器，并可以补充常规的金属传热材料，这些材料可用于太阳能热水收集器，热交换器和电子包装等应用中。</ p> ,"[{'address': 'Department of Mechanical Engineering, Massachusetts Institute of Technology, Cambridge, 02139, Massachusetts, USA', 'authors': ['Sheng Shen', ',\xa0Asegun Henry', ',\xa0Jonathan Tong', ',\xa0Ruiting Zheng', '\xa0&\xa0Gang Chen']}, {'address': 'Key Laboratory of Radiation Beam Technology and Materials Modification of Ministry of Education, College of Nuclear Science and Technology, Beijing Normal University, Beijing, 100875, China', 'authors': ['Ruiting Zheng']}]",[{'地址'：'麻省理工学院机械工程系，美国马萨诸塞州剑桥市02139'，'作者'：['Sheng Shen'，'，\ xa0Asegun Henry'，'，\ xa0Jonathan Tong'， '，\ xa0Ruiting Zheng'，'\ xa0＆\ xa0Gang Chen']}，{'address'：北京师范大学核科学技术学院，辐射束技术与材料改性教育部重点实验室，北京， 100875，中国”，“作者”：['Ruiting Zheng']}] 
10.1038/nnano.2010.30,Complex self-assembled patterns using sparse commensurate templates with locally varying motifs,使用带有局部变化图案的稀疏相称模板进行复杂的自组装图案 ,"<p>Templated self-assembly of block copolymer thin films can generate periodic arrays of microdomains within a sparse template, or complex patterns using 1:1 templates. However, arbitrary pattern generation directed by sparse templates remains elusive. Here, we show that an array of carefully spaced and shaped posts, prepared by electron-beam patterning of an inorganic resist, can be used to template complex patterns in a cylindrical-morphology block copolymer. We use two distinct methods: making the post spacing commensurate with the equilibrium periodicity of the polymer, which controls the orientation of the linear features, and making local changes to the shape or distribution of the posts, which direct the formation of bends, junctions and other aperiodic features in specific locations. The first of these methods permits linear patterns to be directed by a sparse template that occupies only a few percent of the area of the final self-assembled pattern, while the second method can be used to selectively and locally template complex linear patterns.</p>",嵌段共聚物薄膜的模板化自组装可以在稀疏模板或使用1：1模板的复杂图案中生成微区的周期性阵列。但是，由稀疏模板指导的任意模式生成仍然难以捉摸。在这里，我们表明，通过对无机抗蚀剂进行电子束图案化而制备的精心排列和成形的柱阵列可用于模板化圆柱状嵌段共聚物中的复杂图案。我们使用两种不同的方法：使柱间距与聚合物的平衡周期性相称，以控制线性特征的取向；对柱的形状或分布进行局部更改，从而指导弯曲，连接和弯曲的形成。在特定位置的其他非周期性特征。第一种方法允许线性图案由稀疏模板控制，该模板仅占最终自组装图案面积的百分之几，而第二种方法可以用于选择性地和局部地模板复杂的线性图案。 > ,"[{'address': 'Department of Electrical Engineering and Computer Science, Massachusetts Institute of Technology, 77 Massachusetts Avenue, Cambridge, 02139, Massachusetts, USA', 'authors': ['Joel K. W. Yang', '\xa0&\xa0Karl K. Berggren']}, {'address': 'Department of Materials Science and Engineering, Massachusetts Institute of Technology, 77 Massachusetts Avenue, Cambridge, 02139, Massachusetts, USA', 'authors': ['Yeon Sik Jung', ',\xa0Jae-Byum Chang', ',\xa0R. A. Mickiewicz', ',\xa0A. Alexander-Katz', '\xa0&\xa0C. A. Ross']}]",[{'地址'：'麻省理工学院电气工程与计算机科学系，马萨诸塞州大道77号，剑桥，美国马萨诸塞州02139'，'作者'：['Joel KW Yang'，'\ xa0＆\ xa0Karl K 。Berggren']}，{'地址'：'麻省理工学院材料科学与工程系，马萨诸塞州大道77号，剑桥，美国马萨诸塞州02139'，'作者'：['Yeon Sik Jung'，'， \ xa0Jae-Byum Chang'，'，\ xa0R。 A. Mickiewicz'，'，\ xa0A。 亚历山大·卡兹（Alexander-Katz），'\ xa0＆\ xa0C。 A.罗斯']}] 
10.1038/nnano.2010.41,Superconductivity in just four pairs of (BETS)2GaCl4 molecules,仅仅四对（BETS）2GaCl4分子中的超导性 ,"<p>How small can a sample of superconducting material be and still display superconductivity? This question is relevant to our fundamental understanding of superconductivity, and also to applications in nanoscale electronics, because Joule heating of interconnecting wires is a major problem in nanoscale devices. It has been shown that ultrathin layers of metal can display superconductivity, but any limits on the size of superconducting systems remain a mystery. (BETS)<sub>2</sub>GaCl<sub>4</sub>, where BETS is bis(ethylenedithio)tetraselenafulvalene, is an organic superconductor, and in bulk it has a superconducting transition temperature T<sub>c</sub> of &#8764;8 K (ref.) and a two-dimensional layered structure that is reminiscent of the high-T<sub>c</sub> cuprate superconductors. Here, we use scanning tunnelling spectroscopy to show that a single layer of (BETS)<sub>2</sub>GaCl<sub>4</sub> molecules on an Ag(111) surface displays a superconducting gap that increases exponentially with the length of the molecular chain. Moreover, we show that a superconducting gap can still be detected for just four pairs of (BETS)<sub>2</sub>GaCl<sub>4</sub> molecules. Real-space spectroscopic images directly visualize the chains of BETS molecules as the origin of the superconductivity.</p>",<p>超导材料的样品有多少能显示超导性？这个问题与我们对超导性的基本理解有关，也与纳米级电子学中的应用有关，因为互连线的焦耳热是纳米级设备中的主要问题。已经表明，金属的超薄层可以显示超导性，但是对超导系统尺寸的任何限制仍然是个谜。 （BETS）<sub> 2 </ sub> GaCl <sub> 4 </ sub>，其中BETS是双（亚乙基二硫代）四硒富勒烯，是有机超导体，总体上讲，它具有超导转变温度T <sub> c < / sub> 8 K（参考）和二维分层结构，让人联想到高T <sub> c </ sub>铜酸盐超导体。在这里，我们使用扫描隧道光谱法显示Ag（111）表面上的（BETS）<sub> 2 </ sub> GaCl <sub> 4 </ sub>分子单层显示出超导间隙，该间隙随分子链的长度。此外，我们表明，仅四对（BETS）<sub> 2 </ sub> GaCl <sub> 4 </ sub>分子仍然可以检测到超导间隙。真实空间的光谱图像直接将BETS分子的链可视化为超导性的起源。</ p> ,"[{'address': 'Physics & Astronomy Department, Nanoscale & Quantum Phenomena Institute, Ohio University, Athens, 45701, Ohio, USA', 'authors': ['K. Clark', ',\xa0A. Hassanien', ',\xa0S. Khan', ',\xa0K.-F. Braun', '\xa0&\xa0S.-W. Hla']}, {'address': 'School of Electrical Engineering & Computer Science, Ohio University, Athens, 45701, Ohio, USA', 'authors': ['K. Clark']}, {'address': 'Nanotechnology Research Institute, AIST, 1-1-1 Umezono, Tsukuba, 305-8568, Ibaraki, Japan', 'authors': ['A. Hassanien', '\xa0&\xa0H. Tanaka']}, {'address': 'JST-CREST, Kawaguchi, 332-0012, Japan', 'authors': ['A. Hassanien', '\xa0&\xa0H. Tanaka']}, {'address': 'Physikalisch Technische Bundesanstalt, Braunschweig, 38116, Germany', 'authors': ['K.-F. Braun']}]",[{'address'：'Ohioscale＆Quantum Phenomena Institute，俄亥俄州大学，雅典，45701，美国俄亥俄州，物理与天文学系，'作者'：['K。 Clark'，'，\ xa0A。 Hassanien'，'，\ xa0S。 Khan'，'，\ xa0K.-F。 Braun'，'\ xa0＆\ xa0S.-W。 Hla']}，{'地址'：'俄亥俄州大学，电气工程与计算机科学学院，雅典，美国，俄亥俄州，45701，'作者'：['K。 克拉克（Clark）]]，{'地址'：'纳米技术研究所，美国科学技术研究院，筑波市1-1-1梅梅诺，筑波，305-8568，日本茨城县，'，'作者'：['A。 Hassanien”，“ \ xa0＆\ xa0H。 田中（Tanaka）]}，{'地址'：'JST-CREST，日本河口，332-0012'，'作者'：['A。 Hassanien”，“ \ xa0＆\ xa0H。 Tanaka']}，{'地址'：'Physikalisch Technische Bundesanstalt，不伦瑞克，德国38116'，'作者'：['K.-F。 布朗']}] 
10.1038/nnano.2010.31,Proposal for an all-spin logic device with built-in memory,关于具有内置存储器的全旋转逻辑设备的建议 ,"<p>The possible use of spin rather than charge as a state variable in devices for processing and storing information has been widely discussed, because it could allow low-power operation and might also have applications in quantum computing. However, spin-based experiments and proposals for logic applications typically use spin only as an internal variable, the terminal quantities for each individual logic gate still being charge-based. This requires repeated spin-to-charge conversion, using extra hardware that offsets any possible advantage. Here we propose a spintronic device that uses spin at every stage of its operation. Input and output information are represented by the magnetization of nanomagnets that communicate through spin-coherent channels. Based on simulations with an experimentally benchmarked model, we argue that the device is both feasible and shows the five essential characteristics for logic applications: concatenability, nonlinearity, feedback elimination, gain and a complete set of Boolean operations.</p>",<p>自旋而不是电荷作为状态变量在处理和存储信息的设备中的可能用途已被广泛讨论，因为它可以实现低功耗操作，并且还可以在量子计算中应用。但是，基于自旋的实验和针对逻辑应用的建议通常仅将自旋用作内部变量，每个单独逻辑门的端子数量仍基于电荷。这需要使用额外的硬件来抵消自旋到电荷的反复转换，从而抵消了任何可能的优势。在这里，我们提出一种自旋电子设备，该设备在其操作的每个阶段都使用自旋。输入和输出信息由通过自旋相干通道进行通信的纳米磁铁的磁化强度表示。基于具有实验基准模型的仿真，我们认为该设备既可行，又显示了逻辑应用的五个基本特征：可连接性，非线性，反馈消除，增益和完整的布尔运算集。</ p> ,"[{'address': 'School of Electrical and Computer Engineering and NSF Network for Computational Nanotechnology (NCN) Purdue University, West Lafayette, 47907, Indiana, USA', 'authors': ['Behtash Behin-Aein', ',\xa0Deepanjan Datta', '\xa0&\xa0Supriyo Datta']}, {'address': 'School of Electrical Engineering and Computer Science, UC Berkeley, Berkeley, 94720, California, USA', 'authors': ['Sayeef Salahuddin']}]",[{'地址'：'电气与计算机工程学院和NSF计算纳米技术（NCN）网络，普渡大学，西拉法叶，47907，美国印第安纳州，'作者'：['Behtash Behin-Aein'，'，\ xa0Deepanjan Datta'，'\ xa0＆\ xa0Supriyo Datta']}，{'地址'：'加州大学伯克利分校电气工程与计算机科学学院，美国加利福尼亚州94720'，'作者'：['Sayeef Salahuddin'] }] 
10.1038/nnano.2010.25,"One-to-one comparison of sunscreen efficacy, aesthetics and potential nanotoxicity",防晒功效，美学和潜在的纳米毒性一对一比较 ,"<p>Numerous reports have described the superior properties of nanoparticles and their diverse range of applications. Issues of toxicity, workplace safety and environmental impact have also been a concern. Here we show a theoretical comparison of how the size of titanium dioxide nanoparticles and their concentration in sunscreens can affect efficacy, aesthetics and potential toxicity from free radical production. The simulation results reveal that, unless very small nanoparticles can be shown to be safe, there is no combination of particle size and concentration that will deliver optimal performance in terms of sun protection and aesthetics. Such a theoretical method complements well the experimental approach for identifying these characteristics.</p>",<p>许多报告描述了纳米颗粒的优越性能及其不同的应用范围。 毒性，工作场所安全和环境影响等问题也令人关注。 在这里，我们显示了钛白粉纳米粒子的大小及其在防晒霜中的浓度如何影响自由基产生的功效，美观性和潜在毒性的理论比较。 仿真结果表明，除非能够证明非常小的纳米颗粒是安全的，否则没有任何大小和浓度的组合可以提供最佳的防晒和美观性能。 这种理论方法很好地补充了识别这些特征的实验方法。</ p> ,"[{'address': 'CSIRO Materials Science and Engineering, Clayton, 3168, Victoria, Australia', 'authors': ['Amanda S. Barnard']}]",[{'地址'：'CSIRO材料科学与工程，克莱顿，澳大利亚维多利亚州3168，'作者'：['Amanda S. Barnard']}] 
10.1038/nnano.2010.17,Lipid multilayer gratings,脂质多层光栅 ,"<p>The interaction of electromagnetic waves with matter can be controlled by structuring the matter on the scale of the wavelength of light, and various photonic components have been made by structuring materials using top-down or bottom-up approaches. Dip-pen nanolithography is a scanning-probe-based fabrication technique that can be used to deposit materials on surfaces with high resolution and, when carried out in parallel, with high throughput. Here, we show that lyotropic optical diffraction gratings&#8212;composed of biofunctional lipid multilayers with controllable heights between &#8764;5 and 100 nm&#8212;can be fabricated by lipid dip-pen nanolithography. Multiple materials can be simultaneously written into arbitrary patterns on pre-structured surfaces to generate complex structures and devices, allowing nanostructures to be interfaced by combinations of top-down and bottom-up fabrication methods. We also show that fluid and biocompatible lipid multilayer gratings allow label-free and specific detection of lipid&#8211;protein interactions in solution. This biosensing capability takes advantage of the adhesion properties of the phospholipid superstructures and the changes in the size and shape of the grating elements that take place in response to analyte binding.</p>",可以通过在光的波长范围内构造物质来控制电磁波与物质的相互作用，并且已经通过使用自上而下或自下而上的方法来构造材料来制造各种光子组件。浸笔式纳米光刻技术是一种基于扫描探针的制造技术，可用于以高分辨率将材料沉积在表面上，并在并行执行时以高通量进行沉积。在这里，我们表明，可以通过脂质浸渍笔纳米光刻技术制造由高度可控制的生物功能脂质多层膜组成的溶致光学衍射光栅，该生物功能脂质多层膜的高度可控制在5至100 nm之间。可将多种材料同时写入到预结构化表面上的任意图案中，以生成复杂的结构和设备，从而允许通过自上而下和自下而上的制造方法的组合来使纳米结构相互连接。我们还显示，流体和生物相容性脂质多层光栅可实现溶液中脂质与蛋白质相互作用的无标记和特异性检测。这种生物传感能力利用了磷脂超结构的粘附特性以及响应于分析物结合而发生的光栅元件的尺寸和形状变化。</ p> ,"[{'address': 'Institute of Nanotechnology, Karlsruhe Institute of Technology, Karlsruhe, 76021, Germany', 'authors': ['Steven Lenhert', ',\xa0Falko Brinkmann', ',\xa0Thomas Laue', ',\xa0Stefan Walheim', ',\xa0Miao Xu', ',\xa0Sylwia Sekula', ',\xa0Thomas Schimmel', '\xa0&\xa0Harald Fuchs']}, {'address': 'Physikalisches Institut, Westfälische Wilhelms-Universität, and Center for Nanotechnology (CeNTech), Münster, 48149, Germany', 'authors': ['Steven Lenhert', ',\xa0Falko Brinkmann', '\xa0&\xa0Harald Fuchs']}, {'address': 'Department of Biological Science and Integrative NanoScience Institute, Florida State University, Tallahassee, 32306-4370, Florida, USA', 'authors': ['Steven Lenhert']}, {'address': 'Institute of Applied Physics, Center for Functional Nanostructures (CFN), Karlsruhe Institute of Technology, Karlsruhe, 76128, Germany', 'authors': ['Stefan Walheim', '\xa0&\xa0Thomas Schimmel']}, {'address': 'Institut für Mikrostrukturtechnik, Karlsruhe Institute of Technology, Karlsruhe, 76128, Germany', 'authors': ['Christoph Vannahme', '\xa0&\xa0Timo Mappes']}, {'address': 'Light Technology Institute, and Center for Functional Nanostructures (CFN), Karlsruhe Institute of Technology, Karlsruhe, 76128, Germany', 'authors': ['Soenke Klinkhammer']}, {'address': 'Department of Nanobio Materials and Electronics, Gwangju Institute of Science and Technology, Gwangju, Korea', 'authors': ['Harald Fuchs']}]",[{'address'：“德国卡尔斯鲁厄卡尔斯鲁厄理工学院纳米技术研究所，76021，德国”，“作者”：['Steven Lenhert，'，\ xa0Falko Brinkmann'，'，\ xa0Thomas Laue'，'，\ xa0Stefan Walheim'，'，\ xa0Miao Xu'，'，\ xa0Sylwia Sekula'，'，\ xa0Thomas Schimmel'，'\ xa0＆\ xa0Harald Fuchs']}，{'address'：'Physikalisches Institut，WestfälischeWilhelms-Universität，纳米技术中心（CeNTech），德国明斯特，48149，“作者”：['Steven Lenhert'，'，\ xa0Falko Brinkmann'，'\ xa0＆\ xa0Harald Fuchs']}，{'address'：'生物系佛罗里达州立大学科学与综合纳米科学研究院，塔拉哈西，美国佛罗里达州32306-4370”，“作者”：['Steven Lenhert']}，{'地址'：'应用物理研究所，功能纳米结构中心（CFN ），卡尔斯鲁厄技术学院，德国卡尔斯鲁厄，76128”，“作者”：['Stefan Walheim'，'\ xa0＆\ xa0Thomas Schimmel']}，{'地址'：'卡尔斯鲁厄技术学院Mikrostrukturtechnik研究所，卡尔斯鲁厄， 76128，德国”，“作者”：['Christoph Vannahme'，'\ xa0＆\ xa0Timo Mappes']}，{'address'：'卡尔斯鲁厄技术学院光技术研究所和功能纳米结构中心（CFN），卡尔斯鲁厄，76128，德国”，“作者”：['Soenke Klinkhammer']}，{'地址'：'韩国光州光州科技学院纳米生物材料与电子学系'，'作者'：['Harald Fuchs']}] 
10.1038/nnano.2010.29,Kinetics of antimicrobial peptide activity measured on individual bacterial cells using high-speed atomic force microscopy,使用高速原子力显微镜在单个细菌细胞上测定的抗菌肽活性动力学 ,"<p>Observations of real-time changes in living cells have contributed much to the field of cellular biology. The ability to image whole, living cells with nanometre resolution on a timescale that is relevant to dynamic cellular processes has so far been elusive. Here, we investigate the kinetics of individual bacterial cell death using a novel high-speed atomic force microscope optimized for imaging live cells in real time. The increased time resolution (13&#160;s per image) allows the characterization of the initial stages of the action of the antimicrobial peptide CM15 on individual Escherichia coli cells with nanometre resolution. Our results indicate that the killing process is a combination of a time-variable incubation phase (which takes seconds to minutes to complete) and a more rapid execution phase.</p>",<p>活细胞实时变化的观察为细胞生物学领域做出了巨大贡献。 迄今为止，在与动态细胞过程有关的时间尺度上以纳米分辨率成像整个活细胞的能力还难以捉摸。 在这里，我们使用一种新型的高速原子力显微镜研究了单个细菌细胞死亡的动力学，该显微镜针对实时活细胞进行了优化。 增加的时间分辨率（每个图像13秒）可以以纳米分辨率表征抗菌肽CM15对单个大肠杆菌细胞作用的初始阶段。 我们的结果表明，杀死过程是随时间变化的潜伏阶段（需要几秒钟到几分钟才能完成）和更快速的执行阶段的组合。</ p> ,"[{'address': 'Department of Materials Science and Engineering, Massachusetts Institute of Technology, Cambridge, 02139, Massachusetts, USA', 'authors': ['Georg E. Fantner', ',\xa0David S. Gray', '\xa0&\xa0Angela M. Belcher']}, {'address': 'Department of Biological Engineering, Massachusetts Institute of Technology, Cambridge, 02139, Massachusetts, USA', 'authors': ['Roberto J. Barbero', '\xa0&\xa0Angela M. Belcher']}]",[{'地址'：'麻省理工学院材料科学与工程系，剑桥，美国马萨诸塞州02139'，'作者'：['Georg E. Fantner'，'，\ xa0David S. Gray'，' \ xa0＆\ xa0Angela M. Belcher']}，{'地址'：'麻省理工学院生物工程系，剑桥，美国马萨诸塞州02139'，'作者'：['Roberto J. Barbero'，'\ xa0＆\ xa0Angela M. Belcher']}] 
10.1038/nnano.2010.42,Identifying single nucleotides by tunnelling current,通过隧道电流识别单个核苷酸 ,"<p>A major goal in medical research is to develop a DNA sequencing technique that is capable of reading an entire human genome at low cost. Recently, it was proposed that DNA sequencing could be performed by measuring the electron transport properties of the individual nucleotides in a DNA molecule. Here, we report electrical detection of single nucleotides using two configurable nanoelectrodes and show that electron transport through single nucleotides occurs by tunnelling. We also demonstrate statistical identification of the nucleotides based on their electrical conductivity, thereby providing an experimental basis for a DNA sequencing technology based on measurements of electron transport.</p>",医学研究的主要目标是开发一种能够以低成本读取整个人类基因组的DNA测序技术。 最近，有人提出可以通过测量DNA分子中各个核苷酸的电子传递性质来进行DNA测序。 在这里，我们报告使用两个可配置的纳米电极的单个核苷酸的电学检测，并显示通过单个核苷酸发生电子传输通过隧穿。 我们还证明了基于核苷酸的电导率的统计鉴定，从而为基于电子传输测量的DNA测序技术提供了实验基础。</ p> ,"[{'address': 'The Institute of Scientific and Industrial Research, Osaka University, 8-1 Mihogaoka, Ibaraki, 567-0047, Osaka, Japan', 'authors': ['Makusu Tsutsui', ',\xa0Masateru Taniguchi', ',\xa0Kazumichi Yokota', '\xa0&\xa0Tomoji Kawai']}, {'address': 'PRESTO, Japan Science and Technology Agency, Honcho, Kawaguchi, 332-0012, Saitama, Japan', 'authors': ['Masateru Taniguchi']}, {'address': 'Division of Quantum Phases & Devices, Department of Physics, Konkuk University, Seoul, 143-701, Republic of Korea', 'authors': ['Tomoji Kawai']}]",[{'地址'：'大阪大学科学与工业研究所，日本大阪市茨城县美高冈市8-1，567-0047，'作者'：['Makusu Tsutsui'，'，\ xa0谷口正德' ，'，\ xa0Kazumichi Yokota'，'\ xa0＆\ xa0Tomoji Kawai']}，{'address'：'PRESTO，日本科学技术厅，河口本町，河口市，332-0012，日本Sa玉市，'作者'：[ ''Masateru Taniguchi']}，{'address'：'大韩民国首尔市建国大学物理系，量子相与器件部，143-701，'作者'：['Tomoji Kawai']}]] 
