doi,title,title_cn,abstract,abstract_cn,affiliations,affiliations_cn
10.1038/nnano.2009.232,Self-assembly of soft nanoparticles with tunable patchiness,具有可调节斑点的软纳米粒子的自组装 ,"<p>Details of the forces between nanoparticles determine the ways in which the nanoparticles can self-assemble into larger structures. The use of directed interactions has led to new concepts in self-assembly such as asymmetric dendrons, Janus particles, patchy colloids and colloidal molecules. Recent models that include attractive regions or &#8216;patches&#8217; on the surface of the nanoparticles predict a wealth of intricate modes of assembly. Interactions between such particles are also important in a range of phenomena including protein aggregation and crystallization, re-entrant phase transitions, assembly of nanoemulsions and the organization of nanoparticles into nanowires. Here, we report the synthesis of 6-nm nanoparticles with dynamic hydrophobic patches and show that they can form reversible self-assembled structures in aqueous solution that become topologically more connected upon dilution. The organization is based on guest&#8211;host supramolecular chemistry with the nanoparticles composed of a hydrophobic dendrimer host molecule and water-soluble hydrophilic guest molecules. The work demonstrates that subtle changes in hierarchal composition and/or concentration can dramatically change mesoscopic ordering.</p>",<p>纳米颗粒之间的力的细节决定了纳米颗粒可以自组装成更大结构的方式。定向相互作用的使用导致了自组装中的新概念，例如不对称树突，Janus颗粒，斑片状胶体和胶体分子。最近的模型包括吸引人的区域或“补丁”纳米粒子表面上的纳米粒子预测了许多复杂的组装模式。此类粒子之间的相互作用在一系列现象中也很重要，这些现象包括蛋白质聚集和结晶，凹腔相变，纳米乳剂的组装以及纳米粒子组织成纳米线。在这里，我们报告具有动态疏水性斑块的6 nm纳米颗粒的合成，并显示它们可以在水溶液中形成可逆的自组装结构，稀释后拓扑上的连接变得更加紧密。该组织基于来宾宿主超分子化学，该纳米颗粒由疏水性树枝状聚合物主体分子和水溶性亲水性来宾分子组成。这项工作表明，层次结构和/或浓度的细微变化可以显着改变介观顺序。</ p> ,"[{'address': 'Institute for Complex Molecular Systems, Eindhoven University of Technology, PO Box 513, Eindhoven, 5600, MB, The Netherlands', 'authors': ['Thomas M. Hermans', ',\xa0Marcel H. P. van Genderen', '\xa0&\xa0E. W. Meijer']}, {'address': 'Laboratory of Macromolecular and Organic Chemistry, Eindhoven University of Technology, PO Box 513, Eindhoven, 5600, MB, The Netherlands', 'authors': ['Thomas M. Hermans', ',\xa0Maarten A. C. Broeren', ',\xa0Marcel H. P. van Genderen', '\xa0&\xa0E. W. Meijer']}, {'address': 'Department of Materials Science and Technology, University of Crete and F.O.R.T.H., PO Box 1527, Heraklion, 71110, Greece', 'authors': ['Nikos Gomopoulos', '\xa0&\xa0George Fytas']}, {'address': 'Group Theory of Polymers and Soft Matter, Eindhoven University of Technology, PO Box 513, Eindhoven, 5600, MB, The Netherlands', 'authors': ['Paul van der Schoot']}, {'address': 'Soft Matter CryoTEM Research Unit, Eindhoven University of Technology, PO Box 513, Eindhoven, 5600, MB, The Netherlands', 'authors': ['Nico A. J. M. Sommerdijk']}]",[{'address'：“复杂分子系统研究所，埃因霍温科技大学，PO Box 513，Eindhoven，5600，MB，荷兰”，“作者”：['Thomas M. Hermans'，'，\ xa0Marcel HP van性别”，“ \ xa0＆\ xa0E”。 W. Meijer']}，{'地址'：'埃因霍温科技大学高分子与有机化学实验室，邮政信箱513，埃因霍温，荷兰，5600，MB'，'作者'：['Thomas M. Hermans' ，'，\ xa0Maarten AC Broeren'，'，\ xa0Marcel HP van Genderen'，'\ xa0＆\ xa0E。 W. Meijer']}，{'地址'：'克里特和福斯大学材料科学与技术系，希腊邮政信箱1527，伊拉克利翁，邮政编码71110，'作者'：['Nikos Gomopoulos'，'\ xa0＆ \ xa0George Fytas']}，{'address'：“聚合物和软物质的群论”，埃因霍温科技大学，PO Box 513，Eindhoven，5600，MB，荷兰，“作者”：['Paul van der Schoot ']}，{'地址'：'艾恩德霍芬科技大学软物质低温TEM研究室，荷兰埃因霍温，Box Box 513，5600，MB，'，'作者'：['Nico AJM Sommerdijk']}]] 
10.1038/nnano.2009.260,Ultrahigh-density phase-change data storage without the use of heating,超高密度相变数据存储，无需加热 ,"<p>Non-volatile memories based on scanning probes offer very high data densities, but existing approaches require the probe to be heated, which increases the energy expenditure and complexity of fabrication. Here, we demonstrate the writing, reading and erasure of an ultrahigh-density array of nanoscopic indentations without heating either the scanning probe tip or the substrate. An atomic force microscope tip causes microphase transitions of the polystyrene-block-poly(n-pentyl methacrylate) of a block copolymer to occur at room temperature by application of pressure alone. We demonstrate a data storage density of 1&#160;Tb&#160;in<sup>&#8722;2</sup>, which is limited only by the size of the tip. This demonstration of a pressure-based phase-change memory at room temperature may expedite the development of next-generation ultrahigh-density data storage media.</p>",<p>基于扫描探针的非易失性存储器提供了很高的数据密度，但是现有的方法要求对探针进行加热，这增加了能量消耗和制造的复杂性。 在这里，我们展示了纳米凹痕的超高密度阵列的写入，读取和擦除，而无需加热扫描探针的尖端或基板。 原子力显微镜尖端导致仅在施加压力的情况下在室温下发生嵌段共聚物的聚苯乙烯-嵌段-聚（甲基丙烯酸正戊酯）的微相转变。 我们在<sup>＆＃8722; 2 </ sup>中展示了1＆＃160; Tb＆＃160; 2的数据存储密度，该密度仅受尖端尺寸的限制。 这种基于压力的相变存储器在室温下的演示可能会加快下一代超高密度数据存储介质的开发。</ p> ,"[{'address': 'Department of Chemical Engineering, National Creative Research Center for Block Copolymer Self-Assembly, Pohang University of Science and Technology, Kyungbuk, 790-784, Korea', 'authors': ['Ara Jo', ',\xa0Wonchul Joo', '\xa0&\xa0Jin Kon Kim']}, {'address': 'MS Group, Devices and Materials Lab, LG Electronics Advanced Research Institute, #16, Woomyeon-dong, Seocho-gu, Seoul, 137-724, Korea', 'authors': ['Won-Hyeog Jin', '\xa0&\xa0Hyojin Nam']}]",[{'地址'：'浦项科技大学化学工程系，嵌段共聚物自组装国家创新研究中心，韩国庆北790-784，'作者'：['Ara Jo'，' ，\ xa0Wonchul Joo'，'\ xa0＆\ xa0Jin Kon Kim']}，{'address'：'首尔市瑞草区Woomyeon-dong，LG电子技术高级研究所，设备与材料实验室，MS组， 137-724，韩国”，“作者”：['Won-Hyeog Jin'，'\ xa0＆\ xa0Hyojin Nam']}]] 
10.1038/nnano.2009.266,Strain engineering and one-dimensional organization of metal–insulator domains in single-crystal vanadium dioxide beams,单晶二氧化钒光束中金属-绝缘体域的应变工程和一维组织 ,"<p>Correlated electron materials can undergo a variety of phase transitions, including superconductivity, the metal&#8211;insulator transition and colossal magnetoresistance. Moreover, multiple physical phases or domains with dimensions of nanometres to micrometres can coexist in these materials at temperatures where a pure phase is expected. Making use of the properties of correlated electron materials in device applications will require the ability to control domain structures and phase transitions in these materials. Lattice strain has been shown to cause the coexistence of metallic and insulating phases in the Mott insulator VO<sub>2</sub>. Here, we show that we can nucleate and manipulate ordered arrays of metallic and insulating domains along single-crystal beams of VO<sub>2</sub> by continuously tuning the strain over a wide range of values. The Mott transition between a low-temperature insulating phase and a high-temperature metallic phase usually occurs at 341&#160;K in VO<sub>2</sub>, but the active control of strain allows us to reduce this transition temperature to room temperature. In addition to device applications, the ability to control the phase structure of VO<sub>2</sub> with strain could lead to a deeper understanding of the correlated electron materials in general.</p>",<p>相关的电子材料可能会经历各种相变，包括超导性，金属绝缘体转变和巨大的磁阻。而且，在预期纯相的温度下，这些材料中可以存在纳米级到微米级的多个物理相或畴。在器件应用中利用相关电子材料的特性将需要具有控制这些材料中的畴结构和相变的能力。研究表明，晶格应变会导致Mott绝缘子VO <sub> 2 </ sub>中的金属相和绝缘相共存。在这里，我们表明可以通过在宽范围的值上连续调整应变来沿VO <sub> 2 </ sub>单晶束成核和操纵金属域和绝缘域的有序阵列。低温绝缘相和高温金属相之间的莫特跃迁通常发生在VO <sub> 2 </ sub>中的341＆＃160; K，但是应变的主动控制使我们可以将跃迁温度降低到室内温度。除了器件的应用之外，通过应变控制VO <sub> 2 </ sub>的相结构的能力通常可以使人们对相关的电子材料有更深入的了解。</ p> ,"[{'address': 'Department of Materials Science and Engineering, University of California, Berkeley, 94720, California, USA', 'authors': ['J. Cao', ',\xa0W. Fan', ',\xa0S. Huang', ',\xa0J. W. L. Yim', ',\xa0D. R. Khanal', '\xa0&\xa0J. Wu']}, {'address': 'Materials Sciences Division, Lawrence Berkeley National Laboratory, Berkeley, 94720, California, USA', 'authors': ['J. Cao', ',\xa0H. Zheng', ',\xa0J. W. L. Yim', ',\xa0D. R. Khanal', ',\xa0D. F. Ogletree', '\xa0&\xa0J. Wu']}, {'address': 'Berkeley Nanosciences and Nanoengineering Institute, University of California, Berkeley, 94720, California, USA', 'authors': ['E. Ertekin', ',\xa0V. Srinivasan', ',\xa0J. C. Grossman', '\xa0&\xa0J. Wu']}, {'address': 'Department of Thermal Science and Energy Engineering, University of Science and Technology of China, Hefei, China', 'authors': ['W. Fan']}, {'address': 'National Centre for Electron Microscopy, Lawrence Berkeley National Laboratory, Berkeley, 94720, California, USA', 'authors': ['H. Zheng']}, {'address': 'Molecular Foundry, Lawrence Berkeley National Laboratory, Berkeley, 94720, California, USA', 'authors': ['D. F. Ogletree']}]",[{'address'：'美国加利福尼亚大学伯克利分校材料科学与工程系，94720，美国加利福尼亚，'作者'：['J。 Cao'，'，\ xa0W。风扇'，'，\ xa0S。 Huang'，'，\ xa0J。 W. L. Yim'，'，\ xa0D。 R. Khanal'，“ \ xa0＆\ xa0J”。 Wu']}，{'address'：'劳伦斯伯克利国家实验室材料科学系，美国加利福尼亚州伯克利，94720'，'作者'：['J。 Cao'，'，\ xa0H。 Zheng'，'，\ xa0J。 W. L. Yim'，'，\ xa0D。 R. Khanal'，'，\ xa0D。 F.Ogletree'，'\ xa0＆\ xa0J。 Wu']}，{'address'：'Berkeley Nanosciences and Nanoengineering Institute，California University，Berkeley，94720，USA，USA'，'作者'：['E。 Ertekin'，'，\ xa0V。 Srinivasan'，'，\ xa0J。 C. Grossman'，'\ xa0＆\ xa0J。 Wu']}，{'address'：'中国科学技术大学热科学与能源工程系，中国合肥'，'作者'：['W.范']}，{'地址'：'国家电子显微镜技术中心，劳伦斯伯克利国家实验室，伯克利，美国加利福尼亚州94720'，'作者'：['H。郑']}，{'地址'：'分子铸造厂，劳伦斯伯克利国家实验室，伯克利，美国加利福尼亚州94720'，'作者'：['D。 F. Ogletree']}] 
10.1038/nnano.2009.264,Electrochromatic carbon nanotube/polydiacetylene nanocomposite fibres,电致变色碳纳米管/聚二乙炔纳米复合纤维 ,"<p>Chromatic materials such as polydiacetylene change colour in response to a wide variety of environmental stimuli, including changes in temperature, pH and chemical or mechanical stress, and have been extensively explored as sensing devices. Here, we report the facile synthesis of carbon nanotube/polydiacetylene nanocomposite fibres that rapidly and reversibly respond to electrical current, with the resulting colour change being readily observable with the naked eye. These composite fibres also chromatically respond to a broad spectrum of other stimulations. For example, they exhibit rapid and reversible stress-induced chromatism with negligible elongation. These electrochromatic nanocomposite fibres could have various applications in sensing.</p>",<p>诸如聚二乙炔之类的彩色材料会响应各种环境刺激而改变颜色，包括温度，pH值以及化学或机械应力的变化，并且已经广泛地用作传感装置。 在这里，我们报道了快速且可逆地响应电流的碳纳米管/聚二乙炔纳米复合纤维的简便合成方法，用肉眼可以轻易观察到所产生的颜色变化。 这些复合纤维还对多种其他刺激产生色反应。 例如，它们表现出快速且可逆的应力诱导色差，而伸长率可忽略不计。 这些电致变色纳米复合纤维在传感中具有多种应用。</ p> ,"[{'address': 'Laboratory of Advanced Materials and Department of Macromolecular Science, Key Laboratory of Molecular Engineering of Polymers of Ministry of Education, Fudan University, Shanghai, 200438, China', 'authors': ['Huisheng Peng', ',\xa0Xuemei Sun', ',\xa0Fangjing Cai', ',\xa0Xuli Chen', ',\xa0Yinchao Zhu', ',\xa0Guipan Liao', '\xa0&\xa0Daoyong Chen']}, {'address': 'Suzhou Institute of Nano-tech and Nano-bionics, Chinese Academy of Sciences, Suzhou, Jiangsu, 215125, China', 'authors': ['Qingwen Li']}, {'address': 'Department of Chemical and Biomolecular Engineering, The University of California at Los Angeles, California, 90095, USA', 'authors': ['Yunfeng Lu']}, {'address': 'Department of Materials Science and Engineering, North Carolina State University, Raleigh, 27695, North Carolina, USA', 'authors': ['Yuntian Zhu']}, {'address': 'Materials Physics and Applications Division, Los Alamos National Laboratory, Los Alamos, 87545, New Mexico, USA', 'authors': ['Quanxi Jia']}]",[{'地址'：'复旦大学'高分子材料分子工程教育部先进材料实验室和高分子科学教研室，上海，200438，'作者'：['辉慧鹏'，' ，\ xa0Xuemei Sun'，'，\ xa0Fangjing Cai'，'，\ xa0Xuli Chen'，'，\ xa0Yinchao Zhu'，'，\ xa0Guipan Liao'，'\ xa0＆\ xa0Daoyong Chen']}，{'address'：' 中国科学院苏州纳米技术与纳米仿生研究所，江苏苏州215125'，'作者'：['Qingwen Li']}，{'address'：'化学与生物分子工程系， 加利福尼亚大学洛杉矶分校，美国加利福尼亚州90095”，“作者”：['Yunfeng Lu']}，{'address'：'北卡罗来纳州立大学材料科学与工程系，北罗利27695 美国，卡罗莱纳州”，“作者”：['Yuntian Zhu']}，{'地址'：美国新墨西哥州，洛斯阿拉莫斯国家实验室，材料物理与应用部，洛斯阿拉莫斯，87545，'作者'：[ '全溪佳']}] 
10.1038/nnano.2009.258,Selective and sensitive detection of metal ions by plasmonic resonance energy transfer-based nanospectroscopy,基于等离子体共振能量转移的纳米光谱对金属离子的选择性和灵敏检测 ,"<p>Highly selective and sensitive optical methods for the detection of metal ions have had a substantial impact on molecular biology, environmental monitoring and other areas of research. Here we demonstrate a new method for detecting metal ions that is based on selective plasmonic resonance energy transfer (PRET) between conjugated metal&#8211;ligand complexes and a single gold nanoplasmonic probe. In addition to offering high spatial resolution due to the small size of the probe, our method is 100 to 1,000 times more sensitive than organic reporter-based methods. Moreover, it can achieve high selectivity owing to the selective formation of Cu<sup>2+</sup> complexes and selective resonant quenching of the gold nanoplasmonic probe by the conjugated complexes. We expect that PRET-based metal ion sensing could have applications in cellular imaging, systems biology and environmental monitoring.</p>","<p>用于检测金属离子的高度选择性和灵敏的光学方法对分子生物学，环境监测和其他研究领域产生了重大影响。 在这里，我们演示了一种基于共轭金属配体与单个金纳米等离子体探针之间的选择性等离子体共振能量转移（PRET）的检测金属离子的新方法。 除了由于探针的小尺寸而提供高空间分辨率外，我们的方法比基于有机报告基因的方法灵敏度高100到1,000倍。 此外，由于Cu <sup> 2 + </ sup>配合物的选择性形成和共轭配合物对金纳米等离子体探针的选择性共振猝灭，可实现较高的选择性。 我们希望基于PRET的金属离子传感技术可以在细胞成像，系统生物学和环境监测中得到应用。</ p> ","[{'address': 'Department of Bioengineering, Biomolecular Nanotechnology Center, Berkeley Sensor and Actuator Center, University of California at Berkeley, Berkeley, 94720, California, USA', 'authors': ['Yeonho Choi', '\xa0&\xa0Luke P. Lee']}, {'address': 'Department of Chemical and Biomolecular Engineering, Sogang University, Seoul, 121-742, Korea', 'authors': ['Younggeun Park', '\xa0&\xa0Taewook Kang']}]",[{'地址'：'美国加州大学伯克利分校生物工程系，生物分子纳米技术中心，伯克利传感器和致动器中心，美国加利福尼亚州94720，'作者'：['Yeonho Choi'，'\ xa0＆\ xa0Luke P. Lee']}，{'地址'：'首尔西江大学化学与生物分子工程系，韩国121-742'，'作者'：['Younggeun Park'，'\ xa0＆\ xa0Taewook Kang' ]}] 
10.1038/nnano.2009.305,Inhaled carbon nanotubes reach the subpleural tissue in mice,吸入的碳纳米管到达小鼠的胸膜下组织 ,"<p>Carbon nanotubes are shaped like fibres and can stimulate inflammation at the surface of the peritoneum when injected into the abdominal cavity of mice, raising concerns that inhaled nanotubes may cause pleural fibrosis and/or mesothelioma. Here, we show that multiwalled carbon nanotubes reach the subpleura in mice after a single inhalation exposure of 30&#160;mg&#160;m<sup>&#8722;3</sup> for 6&#160;h. Nanotubes were embedded in the subpleural wall and within subpleural macrophages. Mononuclear cell aggregates on the pleural surface increased in number and size after 1 day and nanotube-containing macrophages were observed within these foci. Subpleural fibrosis unique to this form of nanotubes increased after 2 and 6 weeks following inhalation. None of these effects was seen in mice that inhaled carbon black nanoparticles or a lower dose of nanotubes (1&#160;mg&#160;m<sup>&#8722;3</sup>). This work suggests that minimizing inhalation of nanotubes during handling is prudent until further long-term assessments are conducted.</p>",碳纳米管的形状像纤维，当注入小鼠腹腔时可刺激腹膜表面的炎症，引起人们对吸入的纳米管可能引起胸膜纤维化和/或间皮瘤的担忧。在这里，我们显示了多壁碳纳米管在一次吸入暴露30毫克/毫克160 m <sup>＆＃8722; 3 </ sup> 6小时后到达小鼠胸膜下。纳米管被嵌入胸膜下壁和胸膜巨噬细胞内。 1天后，胸膜表面的单核细胞聚集体的数量和大小增加，并且在这些病灶中观察到含有纳米管的巨噬细胞。这种形式的纳米管独特的胸膜下纤维化在吸入后2周和6周后增加。在吸入炭黑纳米颗粒或较低剂量的纳米管（1＆＃160; mg＆＃160; m <sup>＆＃8722; 3 </ sup>）的小鼠中，这些作用均未见。这项工作表明，在进行进一步的长期评估之前，应尽量减少处理过程中纳米管的吸入。</ p> ,"[{'address': 'Department of Environmental and Molecular Toxicology, College of Agricultural and Life Sciences, North Carolina State University, Raleigh, 27695, North Carolina, USA', 'authors': ['Jessica P. Ryman-Rasmussen', ',\xa0Mark F. Cesta', '\xa0&\xa0James C. Bonner']}, {'address': 'The Hamner Institutes for Health Sciences, Research Triangle Park, North Carolina, 27709, USA', 'authors': ['Jessica P. Ryman-Rasmussen', ',\xa0Mark F. Cesta', ',\xa0Earl W. Tewksbury', ',\xa0Owen R. Moss', ',\xa0Brian A. Wong', ',\xa0Darol E. Dodd', '\xa0&\xa0Melvin E. Andersen']}, {'address': 'Laboratory of Experimental Pathology, National Institute of Environmental Health Sciences, Research Triangle Park, North Carolina, 27709, USA', 'authors': ['Mark F. Cesta']}, {'address': 'Department of Molecular Biomedical Sciences, North Carolina State University, Raleigh, 27695, North Carolina, USA', 'authors': ['Arnold R. Brody']}, {'address': 'Department of Population Health and Pathobiology, College of Veterinary Medicine, North Carolina State University, Raleigh, 27695, North Carolina, USA', 'authors': ['Jeanette K. Shipley-Phillips', '\xa0&\xa0Jeffrey I. Everitt']}]",[{'地址'：'北卡罗来纳州立大学农业与生命科学学院环境与分子毒理学系，美国北卡罗来纳州罗利市27695，'作者'：['Jessica P. Ryman-Rasmussen'， '，\ xa0Mark F. Cesta'，'\ xa0＆\ xa0James C. Bonner']}，{'address'：'The Hamner Institutes for Health Sciences，Research Triangle Park，North Carolina，27709，USA'，'作者'： ['Jessica P. Ryman-Rasmussen'，'，\ xa0Mark F. Cesta'，'，\ xa0Earl W. Tewksbury'，'，\ xa0Owen R. Moss'，'，\ xa0Brian A. Wong'，'，\ xa0Darol E. Dodd'，'\ xa0＆\ xa0Melvin E. Andersen']}，{'address'：“美国北卡罗来纳州三角研究园国家环境健康科学研究所实验病理学实验室，美国27709”，“作者” ：['Mark F. Cesta']}，{'address'：'北卡罗来纳州立大学分子生物医学科学系，美国北卡罗来纳州罗利市27695，'作者'：['Arnold R. Brody'] }，{'address'：'兽医学院人口健康与病理生物学系北卡罗莱纳州立大学，罗纳市，美国27695，美国，'作者'：['Jeanette K. Shipley-Phillips'，'\ xa0＆\ xa0Jeffrey I. Everitt']] 
