doi,title,title_cn,abstract,abstract_cn,affiliations,affiliations_cn
10.1038/nnano.2007.378,Molecular beam epitaxy growth of free-standing plane-parallel InAs nanoplates,独立式平面平行InAs纳米板的分子束外延生长 ,"<p>Free-standing nanostructures such as suspended carbon nanotubes, graphene layers, III-V nanorod photonic crystals and three-dimensional structures have recently attracted attention because they could form the basis of devices with unique electronic, optoelectronic and electromechanical characteristics. Here we report the growth by molecular beam epitaxy of free-standing nanoplates of InAs that are close to being atomically plane. The structural and transport properties of these semiconducting nanoplates have been examined with scanning electron microscopy, transmission electron microscopy, X-ray diffraction and low-temperature electron transport measurements. The carrier density of the nanoplates can be reduced to zero by applying a voltage to a nearby gate electrode, creating a new type of suspended quantum well that can be used to explore low-dimensional electron transport. The electronic and optical properties of such systems also make them potentially attractive for photovoltaic and sensing applications.</p>",<p>诸如悬浮碳纳米管，石墨烯层，III-V纳米棒光子晶体和三维结构等独立的纳米结构最近吸引了人们的注意力，因为它们可以构成具有独特电子，光电和机电特性的器件的基础。在这里，我们报告了分子束外延法生长的接近于原子平面的InAs独立纳米板。这些半导体纳米板的结构和传输性能已通过扫描电子显微镜，透射电子显微镜，X射线衍射和低温电子传输测量得到了检验。通过向附近的栅电极施加电压，可以将纳米板的载流子密度降低到零，从而创建一种新型的悬浮量子阱，该量子阱可以用于探索低维电子传输。这种系统的电子和光学特性也使其对于光伏和传感应用具有潜在的吸引力。</ p> ,"[{'address': 'Nano-Science Center, Niels Bohr Institute, University of Copenhagen, Universitetsparken 5, Copenhagen, DK-2100, Denmark', 'authors': ['Martin Aagesen', ',\xa0Erik Johnson', ',\xa0Claus B. Sørensen', ',\xa0Simon O. Mariager', "",\xa0Robert Feidenhans'l"", ',\xa0Jesper Nygård', '\xa0&\xa0Poul Erik Lindelof']}, {'address': 'SunFlake A/S, Nano-Science Center, Universitetsparken 5, Copenhagen, DK-2100, Denmark', 'authors': ['Martin Aagesen']}, {'address': 'Department of Materials Research, Risø National Laboratory, Technical University of Denmark, Roskilde, DK-4000, Denmark', 'authors': ['Erik Johnson']}, {'address': 'Faculty of Engineering, Christian-Albrecht-University Kiel, Kaiserstrasse 2, Kiel, 24143, Germany', 'authors': ['Erdmann Spiecker']}]",[{'地址'：'哥本哈根大学尼尔斯·波尔研究所纳米科学中心，丹麦DK-2100，哥本哈根，Universitetsparken 5，'作者'：'[Martin Aagesen'，'，\\ xa0Erik Johnson'，' ，\ xa0Claus B.Sørensen'，'，\ xa0Simon O. Mariager'，“，\ xa0Robert Feidenhans'l”，'，\ xa0JesperNygård'，'\ xa0＆\ xa0Poul Erik Lindelof']}，{'地址'： '丹麦DK-2100哥本哈根，Universitetsparken 5，纳米科学中心，SunFlake A / S，'作者'：['Martin Aagesen']}，{'地址'：'Risø国家实验室材料研究部，丹麦工业大学，罗斯基勒（Roskilde），丹麦DK-4000，'，作者'：['Erik Johnson']}，{'地址'：'基尔基督教阿尔布雷希特大学工程学院，基尔Kaiserstrasse 2，基尔，24143，德国'，'作者'：['Erdmann Spiecker']}] 
10.1038/nnano.2007.379,A versatile approach for the processing of polymer nanocomposites with self-assembled nanofibre templates,使用自组装纳米纤维模板处理聚合物纳米复合材料的通用方法 ,"<p>The incorporation of nanoparticles into polymers is a design approach that is used in many areas of materials science. The concept is attractive because it enables the creation of materials with new or improved properties by mixing multiple constituents and exploiting synergistic effects. One important technological thrust is the development of structural materials with improved mechanical and thermal characteristics. Equally intriguing is the possibility to design functional materials with unique optical or electronic properties, catalytic activity or selective permeation. The broad technological exploitation of polymer nanocomposites is, however, stifled by the lack of effective methods to control nanoparticle dispersion. We report a simple and versatile process for the formation of homogeneous polymer/nanofibre composites. The approach is based on the formation of a three-dimensional template of well-individualized nanofibres, which is filled with any polymer of choice. We demonstrate that this template approach is broadly applicable and allows for the fabrication of otherwise inaccessible nanocomposites of immiscible components.</p>",<p>将纳米颗粒结合到聚合物中是一种设计方法，已在材料科学的许多领域中使用。这个概念很有吸引力，因为它可以通过混合多种成分并利用协同效应来创建具有新特性或改进特性的材料。一种重要的技术重点是开发具有改善的机械和热特性的结构材料。同样有趣的是，可以设计具有独特的光学或电子特性，催化活性或选择性渗透的功能材料。然而，由于缺乏控制纳米颗粒分散的有效方法，聚合物纳米复合材料的广泛技术开发受到抑制。我们报告了形成均相聚合物/纳米纤维复合材料的简单而通用的过程。该方法基于形成个性化良好的纳米纤维的三维模板，其中填充了任何选择的聚合物。我们证明了这种模板方法具有广泛的适用性，并且可以用于制造否则无法获得的不混溶组分的纳米复合材料。</ p> ,"[{'address': 'Department of Macromolecular Science and Engineering, Case Western Reserve University, 2100 Adelbert Road, Cleveland, 44106, Ohio, USA', 'authors': ['Jeffrey R. Capadona', ',\xa0Otto Van Den Berg', ',\xa0Michael Schroeter', ',\xa0Stuart J. Rowan', '\xa0&\xa0Christoph Weder']}, {'address': 'Rehabilitation Research and Development, Louis Stokes Cleveland DVA Medical Center, 10701 East Blvd., Cleveland, 44106, Ohio, USA', 'authors': ['Jeffrey R. Capadona', ',\xa0Stuart J. Rowan', ',\xa0Dustin J. Tyler', '\xa0&\xa0Christoph Weder']}, {'address': 'Department of Biomedical Engineering, Case Western Reserve University, 10900 Euclid Avenue, Cleveland, 44106, Ohio, USA', 'authors': ['Jeffrey R. Capadona', ',\xa0Stuart J. Rowan', '\xa0&\xa0Dustin J. Tyler']}, {'address': 'Polymeric Materials Branch, NASA Glenn Research Center, 21000 Brookpark Road, Cleveland, 44135, Ohio, USA', 'authors': ['Lynn A. Capadona']}, {'address': 'Institute for Polymer Research, GKSS Research Center Geesthacht GmbH, Kantstrasse 55, Teltow, 14513, Germany', 'authors': ['Michael Schroeter']}, {'address': 'Department of Chemistry, Case Western Reserve University, 2100 Adelbert Road, Cleveland, 44106, Ohio, USA', 'authors': ['Stuart J. Rowan', '\xa0&\xa0Christoph Weder']}]",[{'地址'：'凯斯西储大学大分子科学与工程系，美国俄亥俄州克利夫兰2100 Adelbert Road，44106，美国，'作者'：['Jeffrey R. Capadona'，'，\ xa0Otto Van Den Berg'，'，\ xa0Michael Schroeter'，'，\ xa0Stuart J. Rowan'，'\ xa0＆\ xa0Christoph Weder']}，{'address'：'康复研究与发展，路易斯·斯托克斯·克利夫兰DVA医疗中心，东大街10701 。，Cleveland，44106，Ohio，USA“，'authors'：['Jeffrey R. Capadona'，'，\ xa0Stuart J. Rowan'，'，\ xa0Dustin J. Tyler'，'\ xa0＆\ xa0Christoph Weder']} ，{“地址”：“凯斯西储大学生物医学工程系，美国俄亥俄州克利夫兰10900 Euclid Avenue，44106，美国”，“作者”：['Jeffrey R. Capadona'，'，\ xa0Stuart J. Rowan' ，'\ xa0＆\ xa0Dustin J. Tyler']}，{'地址'：'美国俄亥俄州俄亥俄州克利夫兰市布鲁克公园路21000号美国宇航局格伦研究中心聚合物材料分公司，地址：44135，'作者'：['Lynn A. Capadona']}，{'地址'：'GKSS研究中心Geest聚合物研究所hacht GmbH，Kantstrasse 55，Teltow，14513，Germany”，“作者”：['Michael Schroeter']}，{'address'：“凯斯西储大学化学系，俄亥俄州克利夫兰2100 Adelbert Road，44106，美国”，“作者”：['Stuart J. Rowan'，'\ xa0＆\ xa0Christoph Weder']}] 
10.1038/nnano.2007.389,Improved broadband and quasi-omnidirectional anti-reflection properties with biomimetic silicon nanostructures,仿生硅纳米结构改善了宽带和准全向抗反射性能 ,"<p>Nature routinely produces nanostructured surfaces with useful properties, such as the self-cleaning lotus leaf, the colour of the butterfly wing, the photoreceptor in brittlestar and the anti-reflection observed in the moth eye. Scientists and engineers have been able to mimic some of these natural structures in the laboratory and in real-world applications. Here, we report a simple aperiodic array of silicon nanotips on a 6-inch wafer with a sub-wavelength structure that can suppress the reflection of light at a range of wavelengths from the ultraviolet, through the visible part of the spectrum, to the terahertz region. Reflection is suppressed for a wide range of angles of incidence and for both s- and p-polarized light. The antireflection properties of the silicon result from changes in the refractive index caused by variations in the height of the silicon nanotips, and can be simulated with models that have been used to explain the low reflection from moth eyes. The improved anti-reflection properties of the surfaces could have applications in renewable energy and electro-optical devices for the military.</p>",<p>自然界通常会产生具有有用特性的纳米结构表面，例如自洁荷叶，蝴蝶翅膀的颜色，脆星中的感光体以及在蛾眼中观察到的抗反射性。科学家和工程师已经能够在实验室和实际应用中模拟其中的某些自然结构。在这里，我们报告了一个6英寸晶圆上的简单的非周期性硅纳米尖端阵列，该阵列具有亚波长结构，可以抑制从紫外线到光谱的可见光部分到太赫兹的波长范围内的光反射。地区。对于大范围的入射角以及s偏振和p偏振光，反射都得到抑制。硅的抗反射特性是由于硅纳米尖端的高度变化所引起的折射率变化而产生的，可以用已经用来解释蛾眼低反射的模型进行模拟。改善的表面抗反射性能可用于军事领域的可再生能源和电光设备中。</ p> ,"[{'address': 'Department of Electro-Optical Engineering, National Taipei University of Technology, Taipei, 106, Taiwan', 'authors': ['Yi-Fan Huang', ',\xa0Yi-Jun Jen', '\xa0&\xa0Cheng-Yu Peng']}, {'address': 'Institute of Atomic and Molecular Sciences, Academia Sinica, Taipei, 106, Taiwan', 'authors': ['Yi-Fan Huang', ',\xa0Yu-Kuei Hsu', '\xa0&\xa0Kuei-Hsien Chen']}, {'address': 'Department of Electrical Engineering, National Chung Hsing University, Taichung, 402, Taiwan', 'authors': ['Surojit Chattopadhyay']}, {'address': 'Center for Measurement Standards, Industrial Technology Research Institute, Hsinchu, 300, Taiwan', 'authors': ['Tze-An Liu']}, {'address': 'Department of Photonics and Institute of Electro-Optical Engineering, National Chiao Tung University, Hsinchu, 300, Taiwan', 'authors': ['Ci-Ling Pan']}, {'address': 'Department of Materials Science and Engineering, National Chiao Tung University, Hsinchu, 300, Taiwan', 'authors': ['Hung-Chun Lo']}, {'address': 'Center for Condensed Matter Sciences, National Taiwan University, Taipei, 106, Taiwan', 'authors': ['Chih-Hsun Hsu', '\xa0&\xa0Li-Chyong Chen']}, {'address': 'Department of Physics National Taiwan University, Taipei 106, Taiwan', 'authors': ['Yuan-Huei Chang', '\xa0&\xa0Chih-Shan Lee']}]",[{'address'：'台湾国立台北科技大学光电工程系，台湾台北市106，'作者'：['Yi-Fan Huang'，'，\ xa0Yi-Jun Jen'，'\ xa0＆\ xa0Cheng-Yu Peng']}，{'address'：'中国科学院原子与分子科学研究所，台北，106，台湾'，'作者'：['Yi-Fan Huang'，'，\ xa0Yu-许奎，'\'xa0＆\ xa0陈奎贤''}}，{'地址'：'国立中兴大学电机工程系，台湾台中402'，'作者'：['Surojit Chattopadhyay']} ，{'地址'：'台湾新竹工业技术研究院测量标准中心'，'300'，'作者'：['Tze-An Liu']}，{'地址'：'光子学与电子技术研究所国立交通大学电子工程系，新竹，台湾300），“作者”：['Ci-Ling Pan']}，{'地址'：'国立交通大学材料科学与工程系，新竹，300，Taiwan'，'authors'：['Hung-Chun Lo']}，{'address'：'Conde Center nsed Matter Sciences，国立台湾大学，台北，台湾106），“作者”：['Chih-Hsun Hsu'，'\ xa0＆\ xa0Li-Chyong Chen']}，{'address'：'台湾国立物理系大学，台北106，台湾”，“作者”：['Yuan-Huei Chang'，'\ xa0＆\ xa0Chih-Shan Lee']}]] 
10.1038/nnano.2007.381,Recapturing and trapping single molecules with a solid-state nanopore,用固态纳米孔捕获和捕获单个分子 ,"<p>The development of solid-state nanopores, inspired by their biological counterparts, shows great potential for the study of single macromolecules. Applications such as DNA sequencing and the exploration of protein folding require control of the dynamics of the molecule's interaction with the pore, but DNA capture by a solid-state nanopore is not well understood. By recapturing individual molecules soon after they pass through a nanopore, we reveal the mechanism by which double-stranded DNA enters the pore. The observed recapture rates and times agree with solutions of a drift-diffusion model. Electric forces draw DNA to the pore over micrometer-scale distances, and upon arrival at the pore, molecules begin translocation almost immediately. Repeated translocation of the same molecule improves measurement accuracy, offers a way to probe the chemical transformations and internal dynamics of macromolecules on sub-millisecond time and sub-micrometre length scales, and demonstrates the ability to trap, study and manipulate individual macromolecules in solution.</p>",<p>固态纳米孔的发展受到其生物学对应物的启发，显示出研究单个大分子的巨大潜力。 DNA测序和蛋白质折叠探索等应用程序需要控制分子与孔之间相互作用的动力学，但是对固态纳米孔捕获DNA的了解还很少。通过在单个分子通过纳米孔后立即重新捕获，我们揭示了双链DNA进入孔的机理。观察到的重新捕获速率和时间与漂移扩散模型的解一致。电动势将DNA吸引到微米级距离以上的孔中，到达孔后，分子几乎立即开始移位。相同分子的反复易位可提高测量精度，提供了一种方法来探测亚毫秒级和亚微米级的大分子的化学转化和内部动力学，并展示了捕获，研究和处理溶液中单个大分子的能力。 </ p> ,"[{'address': 'Department of Physics, Harvard University, Cambridge, 02138, Massachusetts, USA', 'authors': ['Marc Gershow', '\xa0&\xa0J. A. Golovchenko']}, {'address': 'School of Engineering and Applied Science, Harvard University, Cambridge, 02138, Massachusetts, USA', 'authors': ['J. A. Golovchenko']}]",[{'地址'：'哈佛大学物理系，剑桥，美国马萨诸塞州02138'，'作者'：['Marc Gershow'，'\ xa0＆\ xa0J。 A. Golovchenko']}，{'地址'：'哈佛大学工程与应用科学学院，剑桥，美国马萨诸塞州02138'，'作者'：['J。 A. Golovchenko']}] 
10.1038/nnano.2007.388,Nanomechanical analysis of cells from cancer patients,癌症患者细胞的纳米力学分析 ,"<p>Change in cell stiffness is a new characteristic of cancer cells that affects the way they spread. Despite several studies on architectural changes in cultured cell lines, no ex vivo mechanical analyses of cancer cells obtained from patients have been reported. Using atomic force microscopy, we report the stiffness of live metastatic cancer cells taken from the body (pleural) fluids of patients with suspected lung, breast and pancreas cancer. Within the same sample, we find that the cell stiffness of metastatic cancer cells is more than 70% softer, with a standard deviation over five times narrower, than the benign cells that line the body cavity. Different cancer types were found to display a common stiffness. Our work shows that mechanical analysis can distinguish cancerous cells from normal ones even when they show similar shapes. These results show that nanomechanical analysis correlates well with immunohistochemical testing currently used for detecting cancer.</p>",<p>细胞刚度的变化是影响癌细胞扩散方式的新特征。 尽管对培养的细胞系的结构变化进行了数项研究，但尚无关于从患者获得的癌细胞的离体力学分析的报道。 使用原子力显微镜，我们报告了从怀疑患有肺癌，乳腺癌和胰腺癌的患者的体液（胸膜液）中提取的活转移癌细胞的硬度。 在同一样本中，我们发现转移性癌细胞的细胞刚度比排列在体腔中的良性细胞更软70％以上，标准差缩小了五倍。 发现不同类型的癌症表现出共同的僵硬。 我们的工作表明，即使癌细胞的形状相似，机械分析也可以将其与正常细胞区分开。 这些结果表明，纳米力学分析与目前用于检测癌症的免疫组织化学测试有很好的相关性。</ p> ,"[{'address': 'Department of Chemistry and Biochemistry, University of California, Los Angeles, 90095, California, USA', 'authors': ['Sarah E. Cross', '\xa0&\xa0James K. Gimzewski']}, {'address': 'California NanoSystems Institute, University of California, Los Angeles, 90095, California, USA', 'authors': ['Sarah E. Cross', '\xa0&\xa0James K. Gimzewski']}, {'address': 'Department of Pathology and Laboratory Medicine, University of California, Los Angeles, 90095, California, USA', 'authors': ['Yu-Sheng Jin', '\xa0&\xa0Jianyu Rao']}]",[{'地址'：'加利福尼亚大学洛杉矶分校化学与生物化学系，美国加利福尼亚州90095'，'作者'：['Sarah E. Cross'，'\ xa0＆\ xa0James K. Gimzewski']} ，{“地址”：“加利福尼亚大学洛杉矶分校加利福尼亚纳米系统研究所，美国加利福尼亚州90095”，“作者”：['Sarah E. Cross'，'\ xa0＆\ xa0James K. Gimzewski']}，{ '地址'：'美国加利福尼亚大学洛杉矶分校病理学与检验医学系，美国加利福尼亚州90095'，'作者'：['Yu-Sheng Jin'，'\ xa0＆\ xa0Jianyu Rao']}]] 
10.1038/nnano.2007.365,"Downscaling of self-aligned, all-printed polymer thin-film transistors",自对准，全印刷聚合物薄膜晶体管的缩小尺寸 ,"<p>Printing is an emerging approach for low-cost, large-area manufacturing of electronic circuits, but it has the disadvantages of poor resolution, large overlap capacitances, and film thickness limitations, resulting in slow circuit speeds and high operating voltages. Here, we demonstrate a self-aligned printing approach that allows downscaling of printed organic thin-film transistors to channel lengths of 100&#8211;400&#160;nm. The use of a crosslinkable polymer gate dielectric with 30&#8211;50&#160;nm thickness ensures that basic scaling requirements are fulfilled and that operating voltages are below 5&#160;V. The device architecture minimizes contact resistance effects, enabling clean scaling of transistor current with channel length. A self-aligned gate configuration minimizes parasitic overlap capacitance to values as low as 0.2&#8211;0.6&#160;pF&#160;mm<sup>&#8722;1</sup>, and allows transition frequencies of f<sub>T</sub>&#160;=&#160;1.6&#160;MHz to be reached. Our self-aligned process provides a way to improve the performance of printed organic transistor circuits by downscaling, while remaining compatible with the requirements of large-area, flexible electronics manufacturing.</p>",<p>印刷是一种低成本，大面积制造电子电路的新兴方法，但是它的缺点是分辨率低，重叠电容大和膜厚受限，导致电路速度慢和工作电压高。在这里，我们演示了一种自动对齐的打印方法，该方法可以将已打印的有机薄膜晶体管缩小为沟道长度为100＆＃8211; 400＆＃160; nm。厚度为30＆＃8211; 50＆＃160; nm的可交联聚合物栅极电介质的使用可确保满足基本的缩放要求，并且工作电压低于5＆＃160V。该器件架构最大程度地减小了接触电阻的影响，可根据沟道长度对晶体管电流进行整洁缩放。自对准栅极配置可将寄生重叠电容最小化到低至0.2＆＃8211; 0.6＆＃160; pF＆＃160; mm <sup>＆＃8722; 1 </ sup>的值，并允许f < sub> T </ sub>＆＃160; =＆＃160; 1.6＆＃160; MHz达到。我们的自对准工艺提供了一种通过缩小尺寸来提高印刷有机晶体管电路性能的方法，同时又与大面积，灵活的电子制造要求保持兼容。</ p> ,"[{'address': 'Cavendish Laboratory, University of Cambridge, JJ Thomson Avenue, Cambridge, CB3 0HE, UK', 'authors': ['Yong-Young Noh', ',\xa0Ni Zhao', ',\xa0Mario Caironi', '\xa0&\xa0Henning Sirringhaus']}]",[{'address'：'剑桥大学范文实验室，英国剑桥JJ Thomson Avenue，CB3 0HE，'，'作者'：['Yong-Young Noh'，'，\ xa0Ni Zhao'，'，\ xa0Mario Caironi '，'\ xa0＆\ xa0Henning Sirringhaus']}] 
10.1038/nnano.2007.380,Layer-by-layer assembled charge-trap memory devices with adjustable electronic properties,具有可调电子特性的逐层组装电荷陷阱存储设备 ,"<p>We describe a versatile approach for preparing flash memory devices composed of polyelectrolyte/gold nanoparticle multilayer films. Anionic gold nanoparticles were used as the charge storage elements, and poly(allylamine)/poly(styrenesulfonate) multilayers deposited onto hafnium oxide (HfO<sub>2</sub>)-coated silicon substrates formed the insulating layers. The top contact was formed by depositing HfO<sub>2</sub> and platinum. In this study, we investigated the effect of increasing the number of polyelectrolyte and gold nanoparticle layers on memory performance, including the size of the memory window (the critical voltage difference between the &#8216;programmed&#8217; and &#8216;erased&#8217; states of the devices) and programming speed. We observed a maximum memory window of about 1.8&#160;V, with a stored electron density of 4.2&#160;&#215;&#160;10<sup>12</sup>&#160;cm<sup>&#8722;2</sup> in the gold nanoparticle layers, when the devices consist of three polyelectrolyte/gold nanoparticle layers. The reported approach offers new opportunities to prepare nanostructured polyelectrolyte/gold nanoparticle-based memory devices with tailored performance.</p>",我们描述了一种制备由聚电解质/金纳米颗粒多层膜组成的闪存器件的通用方法。阴离子金纳米颗粒用作电荷存储元件，沉积在氧化ha（HfO <sub> 2 </ sub>）的硅基板上的聚（烯丙胺）/聚（苯乙烯磺酸盐）多层膜形成绝缘层。通过沉积HfO <sub> 2 </ sub>和铂形成顶部接触。在这项研究中，我们研究了增加聚电解质和金纳米颗粒层数对存储性能的影响，包括存储窗口的大小（“已编程”和“已擦除”之间的临界电压差）。 ＃8217；设备状态）和编程速度。我们观察到最大存储窗口约为1.8V，存储的电子密度为4.2＆＃160;＆＃160; 10 <sup> 12 </ sup>＆＃160; cm <sup当设备由三个聚电解质/金纳米颗粒层组成时，在金纳米颗粒层中>＆＃8722; 2 </ sup>。该方法为制备具有定制性能的纳米结构聚电解质/金纳米颗粒基存储器件提供了新的机会。</ p> ,"[{'address': 'School of Advanced Materials Engineering, Kookmin University, Jeongneung-dong, Seongbuk-gu, Seoul, 136-702, Korea', 'authors': ['Jang-Sik Lee', ',\xa0Jinhan Cho', ',\xa0Chiyoung Lee', ',\xa0Inpyo Kim', ',\xa0Jeongju Park', ',\xa0Yong-Mu Kim', ',\xa0Hyunjung Shin', '\xa0&\xa0Jaegab Lee']}, {'address': 'Department of Chemical and Biomolecular Engineering, Centre for Nanoscience and Nanotechnology, The University of Melbourne, Victoria, 3010, Australia', 'authors': ['Frank Caruso']}]",[{'address'：'韩国首尔市城北区正陵洞国民大学先进材料工程学院，韩国136-702，'作者'：['Jang-Sik Lee'，'，\ xa0 Choinhan Cho '，'，\ xa0Chiyoung Lee'，'，\ xa0Inpyo Kim'，'，\ xa0Jeongju Park'，'，\ xa0Yong-Mu Kim'，'，\ xa0Hyunjung Shin'，'\ xa0＆\ xa0Jaegab Lee']}，{ “地址”：“澳大利亚维多利亚大学，墨尔本大学，纳米科学与纳米技术中心，化学和生物分子工程系，3010，澳大利亚”，“作者”：['弗兰克·卡鲁索']} 
