doi,title,title_cn,abstract,abstract_cn
10.1038/nnano.2016.180,A matter of scale,规模问题 ,,
10.1038/nnano.2016.167,Is nanotech failing casual learners?,纳米技术使休闲学习者失败吗？ ,,
10.1038/nnano.2016.177,Our choice from the recent literature,我们从最近的文献中选择 ,,
10.1038/nnano.2016.165,Seeing the smaller picture,看小图 ,,
10.1038/nnano.2016.123,Nanoelectronics for the heart,心脏的纳米电子学 ,,
10.1038/nnano.2016.143,Net charge of trace proteins,微量蛋白质的净电荷 ,,
10.1038/nnano.2016.86,Tunable phonon-cavity coupling in graphene membranes,石墨烯膜中的可调声子-腔耦合 ,,
10.1038/nnano.2016.94,Dynamical strong coupling and parametric amplification of mechanical modes of graphene drums,石墨烯鼓力学模式的动态强耦合和参数放大 ,,
10.1038/nnano.2016.85,Coherent commensurate electronic states at the interface between misoriented graphene layers,取向不正确的石墨烯层之间界面处的相干相称电子态 ,,
10.1038/nnano.2016.84,Spin–orbit torque switching without an external field using interlayer exchange coupling,使用层间交换耦合在无外部场的情况下自旋轨道转矩切换 ,,
10.1038/nnano.2016.83,Spatial metrology of dopants in silicon with exact lattice site precision,具有精确晶格位点精度的硅中掺杂剂的空间计量 ,"<p>Scaling of Si-based nanoelectronics has reached the regime where device function is affected not only by the presence of individual dopants, but also by their positions in the crystal. Determination of the precise dopant location is an unsolved problem in applications from channel doping in ultrascaled transistors to quantum information processing. Here, we establish a metrology combining low-temperature scanning tunnelling microscopy (STM) imaging and a comprehensive quantum treatment of the dopant&#8211;STM system to pinpoint the exact coordinates of the dopant in the Si crystal. The technique is underpinned by the observation that STM images contain atomic-sized features in ordered patterns that are highly sensitive to the STM tip orbital and the absolute dopant lattice site. The demonstrated ability to determine the locations of P and As dopants to 5&#8197;nm depths will provide critical information for the design and optimization of nanoscale devices for classical and quantum computing applications.</p>",硅基纳米电子学的规模化已经达到了一种机制，其中器件功能不仅受单个掺杂剂的存在影响，还受到它们在晶体中的位置的影响。从超规模晶体管的沟道掺杂到量子信息处理的应用中，确定精确的掺杂剂位置是一个未解决的问题。在这里，我们建立了一种将低温扫描隧道显微镜（STM）成像与掺杂剂STM系统的全面量子处理相结合的计量技术，以精确指出Si晶体中掺杂剂的确切坐标。该技术的基础是观察到STM图像包含有序模式的原子尺寸特征，这些特征对STM尖端轨道和绝对掺杂剂晶格位点高度敏感。确定的确定P和As掺杂物位置至5＆＃8197nm深度的能力将为经典和量子计算应用的纳米级器件的设计和优化提供关键信息。</ p> 
10.1038/nnano.2016.87,Flexible non-volatile optical memory thin-film transistor device with over 256 distinct levels based on an organic bicomponent blend,基于有机双组分共混物的具有256种以上不同能级的柔性非易失性光学存储器薄膜晶体管器件 ,"<p>Organic nanomaterials are attracting a great deal of interest for use in flexible electronic applications such as logic circuits, displays and solar cells. These technologies have already demonstrated good performances, but flexible organic memories are yet to deliver on all their promise in terms of volatility, operational voltage, write/erase speed, as well as the number of distinct attainable levels. Here, we report a multilevel non-volatile flexible optical memory thin-film transistor based on a blend of a reference polymer semiconductor, namely poly(3-hexylthiophene), and a photochromic diarylethene, switched with ultraviolet and green light irradiation. A three-terminal device featuring over 256 (8&#8197;bit storage) distinct current levels was fabricated, the memory states of which could be switched with 3&#8197;ns laser pulses. We also report robustness over 70 write&#8211;erase cycles and non-volatility exceeding 500&#8197;days. The device was implemented on a flexible polyethylene terephthalate substrate, validating the concept for integration into wearable electronics and smart nanodevices.</p>",<p>有机纳米材料在诸如逻辑电路，显示器和太阳能电池之类的柔性电子应用中引起了极大的兴趣。这些技术已经表现出良好的性能，但是灵活的有机存储器在挥发性，工作电压，写入/擦除速度以及可达到的不同级别数方面尚未兑现其所有承诺。在这里，我们报告了一种基于参考聚合物半导体（即聚（3-己基噻吩）和光致变色二芳基乙烯）的混合物的多级非易失性柔性光学存储薄膜晶体管，该混合物通过紫外和绿光照射进行切换。制造了具有超过256个（8位存储）不同电流电平的三端子设备，其存储状态可以通过3ns激光脉冲进行切换。我们还报告了超过70个写入擦除周期的健壮性和超过500天的非易失性。该设备在柔性聚对苯二甲酸乙二醇酯衬底上实施，验证了将其集成到可穿戴电子设备和智能纳米设备中的概念。</ p> 
10.1038/nnano.2016.96,Three-dimensional mapping and regulation of action potential propagation in nanoelectronics-innervated tissues,纳米电子化组织中的动作电位传播的三维映射和调控 ,"<p>Real-time mapping and manipulation of electrophysiology in three-dimensional (3D) tissues could have important impacts on fundamental scientific and clinical studies, yet realization is hampered by a lack of effective methods. Here we introduce tissue-scaffold-mimicking 3D nanoelectronic arrays consisting of 64 addressable devices with subcellular dimensions and a submillisecond temporal resolution. Real-time extracellular action potential (AP) recordings reveal quantitative maps of AP propagation in 3D cardiac tissues, enable in situ tracing of the evolving topology of 3D conducting pathways in developing cardiac tissues and probe the dynamics of AP conduction characteristics in a transient arrhythmia disease model and subsequent tissue self-adaptation. We further demonstrate simultaneous multisite stimulation and mapping to actively manipulate the frequency and direction of AP propagation. These results establish new methodologies for 3D spatiotemporal tissue recording and control, and demonstrate the potential to impact regenerative medicine, pharmacology and electronic therapeutics.</p>",<p>三维（3D）组织中电生理的实时映射和操作可能会对基础科学和临床研究产生重要影响，但由于缺乏有效的方法而阻碍了实现。在这里，我们介绍了模仿组织支架的3D纳米电子阵列，该阵列由具有亚细胞尺寸和亚毫秒级时间分辨率的64个可寻址设备组成。实时细胞外动作电位（AP）记录揭示了3D心脏组织中AP传播的定量图，能够在发育中的心脏组织中对3D传导途径的不断发展的拓扑结构进行原位追踪，并探查短暂性心律失常疾病中AP传导特征的动态模型和随后的组织自适应。我们进一步演示了同时进行多站点刺激和映射以主动控制AP传播的频率和方向。这些结果建立了3D时空组织记录和控制的新方法，并证明了影响再生医学，药理学和电子疗法的潜力。</ p> 
10.1038/nnano.2016.89,High-speed atomic force microscopy shows that annexin V stabilizes membranes on the second timescale,高速原子力显微镜显示膜联蛋白V在第二时间尺度上稳定膜 ,"<p>Annexins are abundant cytoplasmic proteins that can bind to negatively charged phospholipids in a Ca<sup>2+</sup>-dependent manner, and are known to play a role in the storage of Ca<sup>2+</sup> and membrane healing. Little is known, however, about the dynamic processes of protein&#8211;Ca<sup>2+</sup>&#8211;membrane assembly and disassembly. Here we show that high-speed atomic force microscopy (HS-AFM) can be used to repeatedly induce and disrupt annexin assemblies and study their structure, dynamics and interactions. Our HS-AFM set-up is adapted for such biological applications through the integration of a pumping system for buffer exchange and a pulsed laser system for uncaging caged compounds. We find that biochemically identical annexins (annexin V) display different effective Ca<sup>2+</sup> and membrane affinities depending on the assembly location, providing a wide Ca<sup>2+</sup> buffering regime while maintaining membrane stabilization. We also show that annexin is membrane-recruited and forms stable supramolecular assemblies within &#8764;5&#8197;s in conditions that are comparable to a membrane lesion in a cell. Molecular dynamics simulations provide atomic detail of the role played by Ca<sup>2+</sup> in the reversible binding of annexin to the membrane surface.</p>",<p> Annexins是丰富的细胞质蛋白，可以以Ca <sup> 2 + </ sup>依赖的方式与带负电荷的磷脂结合，并已知在Ca <sup> 2+的存储中发挥作用</ sup>和膜愈合。然而，关于蛋白质Ca 2+的动态过程的了解甚少。在这里，我们表明，高速原子力显微镜（HS-AFM）可用于重复诱导和破坏膜联蛋白装配并研究其结构，动力学和相互作用。我们的HS-AFM装置通过集成用于缓冲液交换的泵系统和用于对笼中化合物开笼的脉冲激光系统而适合于此类生物学应用。我们发现，生化上相同的膜联蛋白（膜联蛋白V）根据组装位置显示出不同的有效Ca <sup> 2 + </ sup>和膜亲和力，在维持膜的同时提供宽泛的Ca <sup> 2 + </ sup>缓冲机制稳定。我们还显示，膜联蛋白是膜募集的，并且在与细胞中膜病变相当的条件下在5876内形成稳定的超分子组装。分子动力学模拟提供了Ca <sup> 2 + </ sup>在膜联蛋白与膜表面可逆结合中所起的作用的原子细节。</ p> 
10.1038/nnano.2016.91,Anomalous water expulsion from carbon-based rods at high humidity,在高湿度下从碳基棒中异常排出水 ,"<p>Three water adsorption&#8211;desorption mechanisms are common in inorganic materials: chemisorption, which can lead to the modification of the first coordination sphere; simple adsorption, which is reversible; and condensation, which is irreversible. Regardless of the sorption mechanism, all known materials exhibit an isotherm in which the quantity of water adsorbed increases with an increase in relative humidity. Here, we show that carbon-based rods can adsorb water at low humidity and spontaneously expel about half of the adsorbed water when the relative humidity exceeds a 50&#8211;80% threshold. The water expulsion is reversible, and is attributed to the interfacial forces between the confined rod surfaces. At wide rod spacings, a monolayer of water can form on the surface of the carbon-based rods, which subsequently leads to condensation in the confined space between adjacent rods. As the relative humidity increases, adjacent rods (confining surfaces) in the bundles are drawn closer together via capillary forces. At high relative humidity, and once the size of the confining surfaces has decreased to a critical length, a surface-induced evaporation phenomenon known as solvent cavitation occurs and water that had condensed inside the confined area is released as a vapour.</p>",<p>无机材料中常见的三种水吸附解吸机理：化学吸附，可导致第一配位球的改性；简单吸附，可逆；和凝结，这是不可逆的。不管吸附机理如何，所有已知的材料都具有等温线，其中吸附的水量随相对湿度的增加而增加。在这里，我们表明碳基棒可以在低湿度下吸附水，并且当相对湿度超过50％到80％的阈值时，会自发排出大约一半的吸附水。水的排出是可逆的，并且归因于约束杆表面之间的界面力。在较大的杆间距下，单层水会在碳基杆的表面上形成，随后导致相邻杆之间的狭窄空间内发生冷凝。随着相对湿度的增加，束中的相邻杆（约束面）通过毛细作用力拉近。在相对湿度较高的情况下，一旦约束表面的尺寸减小到临界长度，就会发生称为溶剂气蚀的表面诱导蒸发现象，并且将在约束区域内冷凝的水作为蒸气释放。</ p> 
10.1038/nnano.2016.95,Optical imaging of individual biomolecules in densely packed clusters,密集堆积簇中单个生物分子的光学成像 ,"<p>Recent advances in fluorescence super-resolution microscopy have allowed subcellular features and synthetic nanostructures down to 10&#8211;20 nm in size to be imaged. However, the direct optical observation of individual molecular targets (&#8764;5&#8197;nm) in a densely packed biomolecular cluster remains a challenge. Here, we show that such discrete molecular imaging is possible using DNA-PAINT (points accumulation for imaging in nanoscale topography)&#8212;a super-resolution fluorescence microscopy technique that exploits programmable transient oligonucleotide hybridization&#8212;on synthetic DNA nanostructures. We examined the effects of a high photon count, high blinking statistics and an appropriate blinking duty cycle on imaging quality, and developed a software-based drift correction method that achieves &lt;1&#8197;nm residual drift (root mean squared) over hours. This allowed us to image a densely packed triangular lattice pattern with &#8764;5&#8197;nm point-to-point distance and to analyse the DNA origami structural offset with &#229;ngstr&#246;m-level precision (2&#8197;&#197;) from single-molecule studies. By combining the approach with multiplexed exchange-PAINT imaging, we further demonstrated an optical nanodisplay with 5&#8201;&#215;&#8201;5&#8197;nm pixel size and three distinct colours with &lt;1&#8197;nm cross-channel registration accuracy.</p>",<p>荧光超分辨率显微镜的最新进展已使亚细胞特征和尺寸小于10＆＃8211; 20 nm的合成纳米结构成像。但是，在密集堆积的生物分子簇中对单个分子靶标（＆＃8764; 5＆＃8197; nm）进行直接光学观察仍然是一个挑战。在这里，我们表明使用DNA-PAINT（用于纳米尺度地形学成像的点累加）＆＃8212;这种超分辨率荧光显微镜技术可以实现这种离散的分子成像，该技术在合成DNA纳米结构上利用了可编程的瞬时寡核苷酸杂交技术。我们研究了高光子计数，高闪烁统计数据和适当的闪烁占空比对成像质量的影响，并开发了基于软件的漂移校正方法，该方法可以在数小时内达到＆lt; 1＆＃8197; nm残余漂移（均方根） 。这使我们能够成像密集的三角形格子图案，点间距为＆＃8764; 5＆＃8197; nm，并以＆＃229; ngstr＆＃246; m级精度分析DNA折纸的结构偏移量（2 ＃8197;＆＃197;）来自单分子研究。通过将该方法与多路交换PAINT成像相结合，我们进一步展示了一种光学纳米显示器，该光学纳米显示器的像素尺寸为5＆＃8201;＆＃215;＆＃8201; 5＆＃8197; nm且具有3种不同的颜色，且十字交叉＆lt; 1通道注册精度。</ p> 
10.1038/nnano.2016.88,Metal nanoparticles in the presence of lipopolysaccharides trigger the onset of metal allergy in mice,脂多糖存在下的金属纳米颗粒触发小鼠金属过敏的发作 ,"<p>Many people suffer from metal allergy, and the recently demonstrated presence of naturally occurring metal nanoparticles in our environment could present a new candidate for inducing metal allergy. Here, we show that mice pretreated with silver nanoparticles (nAg) and lipopolysaccharides, but not with the silver ions that are thought to cause allergies, developed allergic inflammation in response to the silver. nAg-induced acquired immune responses depended on CD4<sup>+</sup> T cells and elicited IL-17A-mediated inflammation, similar to that observed in human metal allergy. Nickel nanoparticles also caused sensitization in the mice, whereas gold and silica nanoparticles, which are minimally ionizable, did not. Quantitative analysis of the silver distribution suggested that small nAg (&#8804;10&#8197;nm) transferred to the draining lymph node and released ions more readily than large nAg (&gt;10&#8197;nm). These results suggest that metal nanoparticles served as ion carriers to enable metal sensitization. Our data demonstrate a potentially new trigger for metal allergy.</p>",<p>许多人都患有金属过敏，最近在我们的环境中证明存在天然存在的金属纳米颗粒可能会成为诱导金属过敏的新候选者。在这里，我们显示了用银纳米颗粒（nAg）和脂多糖预处理但未用被认为会引起过敏的银离子预处理的小鼠，对银有反应，产生了过敏性炎症。 nAg诱导的获得性免疫反应依赖于CD4 <sup> + </ sup> T细胞并引发IL-17A介导的炎症，类似于在人类金属过敏中观察到的。镍纳米粒子也会引起小鼠过敏，而金和二氧化硅纳米粒子的电离作用却很小。银分布的定量分析表明，小nAg（＆＃8804; 10＆＃8197; nm）转移到引流淋巴结并比大nAg（＆gt; 10＆＃8197; nm）更容易释放离子。这些结果表明，金属纳米粒子充当离子载体使金属敏化。我们的数据证明了金属过敏的潜在新诱因。</ p> 
10.1038/nnano.2016.118,Measuring protein isoelectric points by AFM-based force spectroscopy using trace amounts of sample,通过基于AFM的力谱法使用痕量样品测量蛋白质等电点 ,"<p>Protein charge at various pH and isoelectric point (pI) values is important in understanding protein function. However, often only trace amounts of unknown proteins are available and pI measurements cannot be obtained using conventional methods. Here, we show a method based on the atomic force microscope (AFM) to determine pI using minute quantities of proteins. The protein of interest is immobilized on AFM colloidal probes and the adhesion force of the protein is measured against a positively and a negatively charged substrate made by layer-by-layer deposition of polyelectrolytes. From the AFM force&#8211;distance curves, pI values with an estimated accuracy of &#177;0.25 were obtained for bovine serum albumin, myoglobin, fibrinogen and ribonuclease A over a range of 4.7&#8211;9.8. Using this method, we show that the pI of the &#8216;footprint&#8217; of the temporary adhesive proteins secreted by the barnacle cyprid larvae of Amphibalanus amphitrite is in the range 9.6&#8211;9.7.</p>",<p>在各种pH和等电点（pI）值下的蛋白质电荷对于理解蛋白质功能很重要。但是，通常只能使用痕量的未知蛋白质，并且无法使用常规方法获得pI测量值。在这里，我们展示了一种基于原子力显微镜（AFM）的方法，可以使用微量的蛋白质确定pI。将感兴趣的蛋白质固定在AFM胶体探针上，并通过逐层沉积聚电解质制成的蛋白质，对带正电荷和负电荷的底物测量粘附力。从AFM力-距离曲线，获得的牛血清白蛋白，肌红蛋白，纤维蛋白原和核糖核酸酶A的pI值的准确度估计为＆＃177; 0.25，范围为4.7＆9.8。使用此方法，我们显示了“足迹”的pI。 Amphibalanus amphitrite的藤壶塞浦路斯幼虫分泌的临时黏附蛋白的范围为9.6＆＃8211; 9.7。</ p> 
10.1038/nnano.2016.161,Learning to 'think systems',学习“思考系统” ,,
