doi,title,title_cn,abstract,abstract_cn
10.1038/nnano.2007.273,True colours,本色 ,,
10.1038/nnano.2007.251a,Atomic motion in ferromagnetic break junctions,铁磁断裂连接处的原子运动 ,,
10.1038/nnano.2007.251b,Atomic motion in ferromagnetic break junctions,铁磁断裂连接处的原子运动 ,,
10.1038/nnano.2007.275,Does REACH go too far?,REACH是否走得太远？ ,,
10.1038/nnano.2007.276,Details are important,细节很重要 ,,
10.1038/nnano.2007.277,"Imaging defects in nanotubes, detecting molecules with graphene, tracking cells with quantum dots, and more",成像纳米管中的缺陷，使用石墨烯检测分子，使用量子点跟踪细胞等 ,,
10.1038/nnano.2007.278,Strengthening old ties,加强旧联系 ,,
10.1038/nnano.2007.281,Available in print,有印刷版 ,,
10.1038/nnano.2007.280,Regime change for nanowire growth,纳米线增长的制度改变 ,,
10.1038/nnano.2007.282,Hidden talent,隐藏的人才 ,,
10.1038/nnano.2007.279,Breaking up is a grating experience,分手是令人难忘的经历 ,,
10.1038/nnano.2007.284,Cooling electrons one by one,一对一冷却电子 ,,
10.1038/nnano.2007.263,Synergetic nanowire growth,协同纳米线生长 ,"<p>Interest in nanowires continues to grow because they hold the promise of monolithic integration of high-performance semiconductors with new functionality into existing silicon technology. Most nanowires are grown using vapour&#8211;liquid&#8211;solid growth, and despite many years of study this growth mechanism remains under lively debate. In particular, the role of the metal particle is unclear. For instance, contradictory results have been reported on the effect of particle size on nanowire growth rate. Additionally, nanowire growth from a patterned array of catalysts has shown that small wire-to-wire spacing leads to materials competition and a reduction in growth rates. Here, we report on a counterintuitive synergetic effect resulting in an increase of the growth rate for decreasing wire-to-wire distance. We show that the growth rate is proportional to the catalyst area fraction. The effect has its origin in the catalytic decomposition of precursors and is applicable to a variety of nanowire materials and growth techniques.</p>",<p>对纳米线的兴趣持续增长，因为它们具有将高性能半导体与新功能集成到现有硅技术中的希望。大多数纳米线是利用蒸气和液体的固体生长来生长的，尽管进行了多年的研究，但这种生长机制仍处于激烈的争论之中。特别地，金属颗粒的作用尚不清楚。例如，已经报道了关于粒度对纳米线生长速率的影响的矛盾结果。另外，从图案化的催化剂阵列生长纳米线已经表明，较小的线对线间隔导致材料竞争和生长速率降低。在这里，我们报告了一种反直觉的协同效应，该效应导致增长速率的增加，从而减小了线对线的距离。我们表明，增长率与催化剂面积分数成正比。该作用起源于前体的催化分解，适用于多种纳米线材料和生长技术。</ p> 
10.1038/nnano.2007.264,Self-formation of sub-60-nm half-pitch gratings with large areas through fracturing,通过破裂自形成大面积的60 nm以下半节距光栅 ,"<p>Periodic micro- and nanostructures (gratings) have many significant applications in electronic, optical, magnetic, chemical and biological devices and materials. Traditional methods for fabricating gratings by writing with electrons, ions or a mechanical tip are limited to very small areas and suffer from extremely low throughput. Interference lithography can achieve relatively large fabrication areas, but has a low yield for small-period gratings. Photolithography, nanoimprint lithography, soft lithography and lithographically induced self-construction all require a prefabricated mask, and although electrohydrodynamic instabilities can self-produce periodic dots without a mask, gratings remain challenging. Here, we report a new low-cost maskless method to self-generate nano- and microgratings from an initially featureless polymer thin film sandwiched between two relatively rigid flat plates. By simply prising apart the plates, the film fractures into two complementary sets of nonsymmetrical gratings, one on each plate, of the same period. The grating period is always four times the thickness of the glassy film, regardless of its molecular weight and chemical composition. Periods from 120&#160;nm to 200&#160;&#181;m have been demonstrated across areas as large as two square centimetres.</p>",<p>周期性的微结构和纳米结构（光栅）在电子，光学，磁性，化学和生物装置和材料中具有许多重要的应用。通过用电子，离子或机械尖端进行写入来制造光栅的传统方法被限制在非常小的面积上，并且吞吐量极低。干涉光刻可以实现相对较大的制造面积，但是对于小周期光栅而言产率较低。照相平版印刷术，纳米压印平版印刷术，软平版印刷术和平版印刷术引起的自构造都需要预制的掩模，并且尽管电液动力学不稳定性可以在没有掩模的情况下自行产生周期性的点，但是光栅仍然具有挑战性。在这里，我们报告了一种新的低成本无掩模方法，该方法可从夹在两个相对刚性的平板之间的最初无特征的聚合物薄膜中自动生成纳米和微光栅。通过简单地将板分开，膜就分裂成两个互补的非对称光栅组，每个周期相同。无论其分子量和化学组成如何，光栅周期始终是玻璃膜厚度的四倍。从120纳米到200微米的周期已经在面积达2平方厘米的区域得到证实。</ p> 
10.1038/nnano.2007.252,Multiscale patterning of plasmonic metamaterials,等离子体超材料的多尺度图案化 ,"<p>The interaction of light with surface plasmons&#8212;collective oscillations of free electrons&#8212;in metallic nanostructures has resulted in demonstrations of enhanced optical transmission, collimation of light through a subwavelength aperture, negative permeability and refraction at visible wavelengths, and second-harmonic generation from magnetic metamaterials. The structures that display these plasmonic phenomena typically consist of ordered arrays of particles or holes with sizes of the order of 100&#160;nm. However, surface plasmons can interact with each other over much longer distances, so the ability to organize nanoscale particles or holes over multiple length scales could lead to new plasmonic metamaterials with novel optical properties. Here, we present a high-throughput nanofabrication technique&#8212;soft interference lithography&#8212;that combines the ability of interference lithography to produce wafer-scale nanopatterns with the versatility of soft lithography, and use it to create such plasmonic metamaterials. Metal films perforated with quasi-infinite arrays of 100-nm holes were generated over areas greater than 10&#160;cm<sup>2</sup>, exhibiting sharp spectral features that changed in relative amplitude and shifted to longer wavelengths when exposed to increased refractive index environments. Moreover, gold nanohole arrays patterned into microscale patches exhibited strikingly different transmission properties; for instance, patches of nanoholes displayed narrow resonances (&lt;14.5&#160;nm full-width-at-half-maximum) that resulted in high refractive index sensitivities far exceeding those reported previously. Soft interference lithography was also used to produce various infinite and finite-area arrays of nanoparticles, including patterns that contained optically distinct particles side by side and arrays that contained both metallic and dielectric materials.</p>",<p>光与金属纳米结构中的表面等离子体激元的相互作用以及自由电子的集体振荡导致了光传输增强，通过亚波长孔径的光准直，可见光波长处的负磁导率和折射以及磁性超材料产生的第二谐波。显示这些等离子体现象的结构通常由大小为100纳米的粒子或孔的有序阵列组成。但是，表面等离激元可以在更长的距离上相互作用，因此在多个长度尺度上组织纳米级粒子或孔的能力可能会导致具有新的光学特性的新型等离激元超材料。在这里，我们提出了一种高通量的纳米加工技术，即软干涉光刻技术，该技术将干涉光刻技术的生产能力与软光刻技术的多功能性相结合，并利用它来创建此类等离子超材料。在大于10＆＃160; cm <sup> 2 </ sup>的区域上产生了穿孔有100-nm准无限阵列的金属膜，这些金属膜显示出尖锐的光谱特征，当暴露于20-＃<sup> 2 </ sup>增加折射率的环境。此外，金纳米孔阵列被图案化成微米级的斑块，显示出显着不同的透射特性。例如，纳米孔的补丁显示出狭窄的共振（＜14.5＆＃160nm，半峰全宽最大），这导致高折射率敏感性远远超过先前报道的那些。软干涉光刻技术还用于生产各种无限的和无限区域的纳米粒子阵列，包括并排包含光学上不同的粒子的图案以及同时包含金属和介电材料的阵列。</ p> 
10.1038/nnano.2007.253,Highly efficient resonant coupling of optical excitations in hybrid organic/inorganic semiconductor nanostructures,杂化有机/无机半导体纳米结构中光激发的高效共振耦合 ,"<p>The integration of organic and inorganic semiconductors on the nanoscale offers the possibility of developing new photonic devices that combine the best features of these two distinct classes of material. Such devices could, for example, benefit from the large oscillator strengths found in organic materials and the nonlinear optical properties of inorganic species. Here we describe a novel hybrid organic/inorganic nanocomposite in which alternating monolayers of J-aggregates of cyanine dye and crystalline semiconductor quantum dots are grown by a layer-by-layer self-assembly technique. We demonstrate near-field photon-mediated coupling of vastly dissimilar optical excitations in the two materials that can reach efficiencies of up to 98% at room temperature. By varying the size of the quantum dots and thus tuning their optical resonance for absorption and emission, we also show how the ability of J-aggregates to harvest light can be harnessed to increase the effective absorption cross section of the quantum dots by up to a factor of ten. Combining organic and inorganic semiconductors in this way could lead to novel nanoscale designs for light-emitting, photovoltaic and sensor applications.</p>",<p>有机和无机半导体在纳米尺度上的集成提供了开发结合了这两类不同材料的最佳功能的新型光子器件的可能性。例如，此类设备可能会受益于有机材料中的大型振荡器强度以及无机物类的非线性光学特性。在这里，我们描述了一种新颖的杂化有机/无机纳米复合材料，其中通过层-层自组装技术生长了菁染料的J-聚集体和晶体半导体量子点的交替单层。我们展示了两种材料中完全不同的光激发的近场光子介导的耦合，在室温下可以达到高达98％的效率。通过改变量子点的大小，从而调整其吸收和发射的光学共振，我们还展示了如何利用J聚集体收集光的能力将量子点的有效吸收横截面增加多达一个。十分之一。通过这种方式将有机和无机半导体结合在一起，可以为发光，光电和传感器应用带来新颖的纳米级设计。</ p> 
10.1038/nnano.2007.261,Reversible fluorescence quenching in carbon nanotubes for biomolecular sensing,碳纳米管中的可逆荧光猝灭，用于生物分子传感 ,"<p>Biosensing applications of single-walled carbon nanotubes have been demonstrated in solid-state device structures. Bioanalyte sensing schemes based on coupling of reversible nanotube fluorescence quenching to redox reactions paired to enzymatic peroxide generation have also been pursued. Here we show a new approach to highly sensitive nanotube-based optical sensing. Single-walled carbon nanotubes interacting with dye&#8211;ligand conjugates&#8212;a redox-active dye molecule that is covalently bound to a biological receptor ligand (such as biotin in this case)&#8212;showed fluorescence quenching. Further interaction between the receptor ligand on the conjugates and target analytes (avidin in this case) induced the recovery of the quenched fluorescence, forming the basis of the sensing scheme. Nanomolar sensitivity was attained with high specificity for the target analyte. This is a versatile approach because a wide range of conjugation possibilities exists between the potential receptors and redox quenchers.</p>",在固态器件结构中已经证明了单壁碳纳米管的生物传感应用。还研究了基于可逆纳米管荧光猝灭与氧化还原反应的偶联的生物分析物传感方案，所述氧化还原反应与酶促过氧化物的产生配对。在这里，我们展示了一种基于高灵敏度纳米管的光学传感的新方法。与染料配体偶联物相互作用的单壁碳纳米管与生物受体配体（在这种情况下为生物素）共价结合的氧化还原活性染料分子显示出荧光猝灭。偶联物上的受体配体与目标分析物（在这种情况下为亲和素）之间的进一步相互作用导致淬灭的荧光的恢复，从而形成了传感方案的基础。对目标分析物具有高特异性的纳摩尔灵敏度。这是一种通用的方法，因为潜在受体和氧化还原猝灭剂之间存在广泛的共轭可能性。</ p> 
10.1038/nnano.2007.250,Hinged nanorods made using a chemical approach to flexible nanostructures,用化学方法制成的铰接纳米棒，用于柔性纳米结构 ,"<p>The fabrication of multifunctional nanomaterials and their subsequent use for novel applications in various branches of nanotechnology has been under intense scrutiny. Particularly in the area of nanomechanics, the design of multicomponent nanostructures with an integrated multifunctionality would enable the construction of building blocks for nanoscale analogues of macroscopic objects. Here, we introduce a new class of flexible nanostructures: metallic nanorods with polyelectrolyte hinges, synthesized using layer-by-layer electrostatic self-assembly of oppositely charged polyelectrolytes on barcode metal nanorods followed by segment-selective chemical etching. Nanorods with hinges that consist of one polyelectrolyte bilayer display considerable flexibility, but with a greater number of bilayers the flexibility of the hinge is significantly reduced. Magnetically induced bending about the polymer hinge is illustrated through the incorporation of nickel segments into the barcodes and the application of an external fluctuating magnetic field.</p>",<p>多功能纳米材料的制造及其在纳米技术各个分支中的新颖应用的后续用途一直受到严格审查。特别是在纳米力学领域，具有集成多功能性的多组分纳米结构的设计将能够为宏观物体的纳米尺度类似物构建构件。在这里，我们介绍了一类新的柔性纳米结构：带有聚电解质铰链的金属纳米棒，该合成方法是使用条码金属纳米棒上带相反电荷的聚电解质的逐层静电自组装，然后进行段选择性化学刻蚀而合成的。具有由一个聚电解质双层构成的铰链的纳米棒显示出相当大的柔韧性，但是随着双层数量的增加，铰链的柔韧性显着降低。通过将镍链段结合到条形码中并施加外部波动磁场，可以说明围绕聚合物铰链的磁感应弯曲。</ p> 
10.1038/nnano.2007.262,Nanoparticle printing with single-particle resolution,具有单颗粒分辨率的纳米颗粒打印 ,"<p>Bulk syntheses of colloids efficiently produce nanoparticles with unique and useful properties. Their integration onto surfaces is a prerequisite for exploiting these properties in practice. Ideally, the integration would be compatible with a variety of surfaces and particles, while also enabling the fabrication of large areas and arbitrarily high-accuracy patterns. Whereas printing routinely meets these demands at larger length scales, we have developed a novel printing process that enables positioning of sub-100-nm particles individually with high placement accuracy. A colloidal suspension is inked directly onto printing plates, whose wetting properties and geometry ensure that the nanoparticles only fill predefined topographical features. The dry particle assembly is subsequently printed from the plate onto plain substrates through tailored adhesion. We demonstrate that the process can create a variety of particle arrangements including lines, arrays and bitmaps, while preserving the catalytic and optical activity of the individual nanoparticles.</p>",<p>胶体的本体合成有效地产生了具有独特和有用特性的纳米粒子。它们整合到表面上是在实践中利用这些特性的先决条件。理想地，集成将与各种表面和粒子兼容，同时还能够制造大面积和任意高精度的图案。尽管印刷通常可以在更大的长度范围内满足这些要求，但我们开发了一种新颖的印刷工艺，该工艺能够以较高的贴装精度单独定位100 nm以下的颗粒。胶体悬浮液直接涂在印版上，其润湿特性和几何形状确保纳米颗粒仅填充预定义的形貌特征。随后通过定制的粘附力将干颗粒组件从板上印刷到普通基材上。我们证明了该过程可以创建各种粒子排列，包括线，阵列和位图，同时保留单个纳米粒子的催化和光学活性。</ p> 
10.1038/nnano.2007.260,Intrinsic peroxidase-like activity of ferromagnetic nanoparticles,铁磁性纳米粒子的内在过氧化物酶样活性 ,"<p>Nanoparticles containing magnetic materials, such as magnetite (Fe<sub>3</sub>O<sub>4</sub>), are particularly useful for imaging and separation techniques. As these nanoparticles are generally considered to be biologically and chemically inert, they are typically coated with metal catalysts, antibodies or enzymes to increase their functionality as separation agents. Here, we report that magnetite nanoparticles in fact possess an intrinsic enzyme mimetic activity similar to that found in natural peroxidases, which are widely used to oxidize organic substrates in the treatment of wastewater or as detection tools. Based on this finding, we have developed a novel immunoassay in which antibody-modified magnetite nanoparticles provide three functions: capture, separation and detection. The stability, ease of production and versatility of these nanoparticles makes them a powerful tool for a wide range of potential applications in medicine, biotechnology and environmental chemistry.</p>",包含磁性材料（如磁铁矿（Fe <sub> 3 </ sub> O <sub> 4 </ sub>））的<p>纳米颗粒对于成像和分离技术特别有用。 由于通常认为这些纳米粒子在生物学和化学上是惰性的，因此通常将它们用金属催化剂，抗体或酶包被以增加其作为分离剂的功能。 在这里，我们报告说，磁铁矿纳米粒子实际上具有类似于天然过氧化物酶的内在酶模拟活性，后者在废水处理或检测工具中广泛用于氧化有机底物。 基于这一发现，我们开发了一种新型的免疫分析方法，其中抗体修饰的磁铁矿纳米颗粒提供三种功能：捕获，分离和检测。 这些纳米粒子的稳定性，易生产性和多功能性使其成为在医学，生物技术和环境化学中广泛应用的强大工具。</ p> 
10.1038/nnano.2007.285,This issue,这个问题 ,,
