doi,title,title_cn,abstract,abstract_cn,affiliations,affiliations_cn
10.1038/nnano.2010.54,Facile synthesis of high-quality graphene nanoribbons,轻松合成高质量石墨烯纳米带 ,"<p>Graphene nanoribbons have attracted attention because of their novel electronic and spin transport properties, and also because nanoribbons less than 10&#160;nm wide have a bandgap that can be used to make field-effect transistors. However, producing nanoribbons of very high quality, or in high volumes, remains a challenge. Here, we show that pristine few-layer nanoribbons can be produced by unzipping mildly gas-phase oxidized multiwalled carbon nanotubes using mechanical sonication in an organic solvent. The nanoribbons are of very high quality, with smooth edges (as seen by high-resolution transmission electron microscopy), low ratios of disorder to graphitic Raman bands, and the highest electrical conductance and mobility reported so far (up to 5e<sup>2</sup>/h and 1,500&#160;cm<sup>2</sup>&#160;V<sup>&#8722;1</sup>&#160;s<sup>&#8722;1</sup> for ribbons 10&#8211;20 nm in width). Furthermore, at low temperatures, the nanoribbons show phase-coherent transport and Fabry&#8211;Perot interference, suggesting minimal defects and edge roughness. The yield of nanoribbons is &#8764;2% of the starting raw nanotube soot material, significantly higher than previous methods capable of producing high-quality narrow nanoribbons. The relatively high-yield synthesis of pristine graphene nanoribbons will make these materials easily accessible for a wide range of fundamental and practical applications.</p>","石墨烯纳米带由于其新颖的电子和自旋传输特性而引起人们的关注，并且还因为宽度小于10纳米的纳米带具有可用于制造场效应晶体管的带隙。然而，生产非常高质量或大量的纳米带仍然是一个挑战。在这里，我们表明可以通过在有机溶剂中使用机械声处理将温和的气相氧化的多壁碳纳米管解压缩来生产原始的几层纳米带。纳米带具有很高的质量，具有光滑的边缘（如通过高分辨率透射电子显微镜观察到的），无序与石墨拉曼谱带的比率低以及迄今为止所报道的最高电导率和迁移率（高达5e <sup> 2 </ sup> / h和1,500＆＃160; cm <sup> 2 </ sup>＆＃160; V <sup>＆＃8722; 1 </ sup>＆＃160; s <sup>＆＃8722; 1 </ sup>适用于宽度为10＆＃8211; 20 nm的色带。此外，在低温下，纳米带显示出相干传输和Fabry Perot干涉，表明缺陷和边缘粗糙度最小。纳米带的产率是原料纳米管原始烟灰材料的2％，明显高于以前的能够生产高质量的窄纳米带的方法。原始石墨烯纳米带的相对高产率的合成将使这些材料易于在广泛的基础和实际应用中使用。</ p> ","[{'address': 'Department of Chemistry and Laboratory for Advanced Materials, Stanford University, Stanford, 94305, California, USA', 'authors': ['Liying Jiao', ',\xa0Xinran Wang', ',\xa0Georgi Diankov', ',\xa0Hailiang Wang', '\xa0&\xa0Hongjie Dai']}]",[{'address'：'斯坦福大学化学与化学与化学实验室，斯坦福大学，美国加利福尼亚州94305'，'作者'：['Liying Jiao'，'，\ xa0Xinran Wang'，'，\ xa0Georgi Diankov '，'，\ xa0Hailiang Wang'，'\ xa0＆\ xa0Hongjie Dai']}]] 
10.1038/nnano.2010.53,An extended defect in graphene as a metallic wire,石墨烯作为金属线的扩展缺陷 ,"<p>Many proposed applications of graphene require the ability to tune its electronic structure at the nanoscale. Although charge transfer and field-effect doping can be applied to manipulate charge carrier concentrations, using them to achieve nanoscale control remains a challenge. An alternative approach is &#8216;self-doping&#8217;, in which extended defects are introduced into the graphene lattice. The controlled engineering of these defects represents a viable approach to creation and nanoscale control of one-dimensional charge distributions with widths of several atoms. However, the only experimentally realized extended defects so far have been the edges of graphene nanoribbons, which show dangling bonds that make them chemically unstable. Here, we report the realization of a one-dimensional topological defect in graphene, containing octagonal and pentagonal sp<sup>2</sup>-hybridized carbon rings embedded in a perfect graphene sheet. By doping the surrounding graphene lattice, the defect acts as a quasi-one-dimensional metallic wire. Such wires may form building blocks for atomic-scale, all-carbon electronics.</p>",<p>许多提出的石墨烯应用都需要具有在纳米级调整其电子结构的能力。尽管可以将电荷转移和场效应掺杂应用于操纵载流子浓度，但是使用它们来实现纳米级控制仍然是一个挑战。另一种方法是“自掺杂”，其中将扩展的缺陷引入石墨烯晶格中。这些缺陷的受控工程代表了一种可行的方法，可用于创建和纳米级控制宽度为几个原子的一维电荷分布。但是，到目前为止，唯一通过实验实现的扩展缺陷是石墨烯纳米带的边缘，该边缘显示出使它们化学不稳定的悬挂键。在此，我们报告了石墨烯中一维拓扑缺陷的实现，该缺陷包含嵌入完美石墨烯片材中的八角形和五角形sp <sup> 2 </ sup>-杂化碳环。通过掺杂周围的石墨烯晶格，缺陷可充当准一维金属线。这些导线可能构成原子级全碳电子产品的构建块。</ p> ,"[{'address': 'Department of Physics, University of South Florida, Tampa, 33620, Florida, USA', 'authors': ['Jayeeta Lahiri', ',\xa0You Lin', ',\xa0Pinar Bozkurt', ',\xa0Ivan I. Oleynik', '\xa0&\xa0Matthias Batzill']}]",[{'address'：'南佛罗里达大学物理系，美国佛罗里达州坦帕市33620'，'authors'：['Jayeeta Lahiri'，'，\ xa0You Lin'，'，\ xa0Pinar Bozkurt'，' ，\ xa0Ivan I. Oleynik'，'\ xa0＆\ xa0Matthias Batzill']}] 
10.1038/nnano.2010.35,Optical heating and rapid transformation of functionalized fullerenes,光学加热和功能化富勒烯的快速转化 ,"<p>Irradiating single-walled carbon nanotubes can lead to heat generation or ignition. These processes could be used in medical and industrial applications, but the poor solvent compatibility and high aspect ratios of nanotubes have led to concerns about safety. Here, we show that certain functionalized fullerenes, including polyhydroxy fullerenes (which are known to be environmentally safe and to have therapeutic properties) are heated or ignited by exposure to low-intensity (&lt;10<sup>2</sup>&#160;W&#160;cm<sup>&#8722;2</sup>) continuous-wave laser irradiation. We also show that polyhydroxy fullerenes and other functionalized fullerenes can be transformed into single-walled nanotubes, multiwalled nanotubes and carbon onions without the presence of a catalyst by exposure to low-intensity laser irradiation in an oxygen-free environment. To demonstrate the potential usefulness of these processes in applications, we disrupted animal cells dosed with polyhydroxy fullerenes by exposing them to a near-infrared laser for a few seconds, and also ignited an explosive charge in contact with a particle of carboxy fullerenes.</p>",<p>辐射单壁碳纳米管会导致发热或着火。这些工艺可以用于医疗和工业应用，但是不良的溶剂相容性和纳米管的高长径比导致人们对安全性的担忧。在此，我们显示某些功能化的富勒烯，包括多羟基富勒烯（已知对环境安全且具有治疗特性），可通过暴露于低强度（<10 <sup> 2 </ sup>＆＃ 160; W＆＃160; cm <sup>＆＃8722; 2 </ sup>）连续波激光照射。我们还显示，通过在无氧环境中暴露于低强度激光辐照，无需催化剂，多羟基富勒烯和其他官能化的富勒烯可以转化为单壁纳米管，多壁纳米管和碳洋葱。为了证明这些方法在应用中的潜在用途，我们通过将掺有多羟基富勒烯的动物细胞暴露于近红外激光中几秒钟来破坏它们，并点燃了与羧基富勒烯颗粒接触的炸药。 > ,"[{'address': 'Particle Engineering Research Center, University of Florida, Gainesville, 32611, Florida, USA', 'authors': ['Vijay Krishna', ',\xa0Nathanael Stevens', ',\xa0Ben Koopman', '\xa0&\xa0Brij Moudgil']}, {'address': 'Department of Environmental Engineering Sciences, University of Florida, Gainesville, 32611, Florida, USA', 'authors': ['Ben Koopman']}, {'address': 'Department of Materials Science and Engineering, University of Florida, Gainesville, 32611, Florida, USA', 'authors': ['Brij Moudgil']}]",[{'地址'：'美国佛罗里达大学盖恩斯维尔分校的粒子工程研究中心，美国佛罗里达州32611'，'作者'：['Vijay Krishna'，'，\ xa0Nathanael Stevens'，'，\ xa0Ben Koopman'，' \ xa0＆\ xa0Brij Moudgil']}，{'地址'：'佛罗里达大学，盖恩斯维尔，佛罗里达大学环境工程科学系，美国佛罗里达州32611'，'作者'：['Ben Koopman']}，{'地址' ：“佛罗里达大学盖恩斯维尔材料科学与工程系，美国佛罗里达州32611”，“作者”：['Brij Moudgil']} 
10.1038/nnano.2010.45,Penetration of thin C60 films by metal nanoparticles,金属纳米粒子穿透C60薄膜 ,"<p>Metal nanoparticles supported by thin films are important in the fields of molecular electronics, biotechnology and catalysis, among others. Penetration of these nanoparticles through their supporting films can be undesirable in some circumstances but desirable in others, and is often considered to be a diffusive process. Here, we demonstrate a mechanism for the penetration of thin films and other nanoscopic barriers that is different from simple diffusion. Silver clusters that are soft-landed onto a monolayer of C<sub>60</sub> supported by gold sink through the monolayer in a matter of hours. However, the clusters are stable when landed onto two monolayers of C<sub>60</sub> supported on gold, or on one monolayer of C<sub>60</sub> supported on graphite. With backing from atomistic calculations, these results demonstrate that a metallic substrate exerts attractive forces on metallic nanoparticles that are separated from the substrate by a single monolayer.</p>",<p>由薄膜支撑的金属纳米颗粒在分子电子，生物技术和催化等领域中非常重要。 这些纳米颗粒通过其支撑膜的渗透在某些情况下可能是不希望的，但在另一些情况下则是希望的，并且通常被认为是扩散过程。 在这里，我们演示了不同于简单扩散的薄膜和其他纳米屏障渗透的机制。 将银团软着陆到由金支撑的C <sub> 60 </ sub>单层膜上，使其在数小时内就沉入单层膜中。 但是，当簇落在金负载的两个C <sub> 60 </ sub>单层或石墨负载的一个C <sub> 60 </ sub>单层上时，团簇是稳定的。 在原子计算的支持下，这些结果表明金属基底对由单个单层与基底分离的金属纳米粒子施加吸引力。</ p> ,"[{'address': 'Technische Universität Dortmund, Experimentelle Physik I, Dortmund, 44221, Germany', 'authors': ['Stefanie Duffe', ',\xa0Niklas Grönhagen', ',\xa0Lukas Patryarcha', ',\xa0Benedikt Sieben', '\xa0&\xa0Heinz Hövel']}, {'address': 'Universität Freiburg, Fakultät für Physik, Hermann-Herder-Straße 3, Freiburg, 79104, Germany', 'authors': ['Chunrong Yin', ',\xa0Bernd von Issendorff', '\xa0&\xa0Michael Moseler']}, {'address': 'Fraunhofer Institute for Mechanics of Materials IWM, Wöhlerstraße 11, Freiburg, 79108, Germany', 'authors': ['Michael Moseler']}, {'address': 'Freiburg Material Research Center, Stefan-Meier-Straße 21, Freiburg, 79104, Germany', 'authors': ['Michael Moseler']}]",[{'地址'：'多特蒙德工业大学，实验物理I，多特蒙德，44221，德国'，'作者'：['Stefanie Duffe'，'，\ xa0NiklasGrönhagen'，'，\ xa0Lukas Patryarcha'，'，\ xa0Benedikt Sieben'，'\ xa0＆\ xa0HeinzHövel']}，{'address'：“弗赖堡大学物理学院，赫尔曼-赫德-斯特拉塞3号，弗赖堡，德国79104，”，“作者”：['Chunrong Yin '，'，\ xa0Bernd von Issendorff'，'\ xa0＆\ xa0Michael Moseler']}，{'address'：'弗劳恩霍夫材料力学研究所IWM，Wöhlerstraße11，弗莱堡，79108，德国'，'作者'：[ 'Michael Moseler']}，{'地址'：'Freiburg材料研究中心，Stefan-Meier-Straße21，弗莱堡，79104，德国'，'作者'：['Michael Moseler']}]] 
10.1038/nnano.2010.57,Biologically templated photocatalytic nanostructures for sustained light-driven water oxidation,生物模板光催化纳米结构，用于持续的光驱动水氧化 ,"<p>Over several billion years, cyanobacteria and plants have evolved highly organized photosynthetic systems to shuttle both electronic and chemical species for the efficient oxidation of water. In a similar manner to reaction centres in natural photosystems, molecular and metal oxide catalysts have been used to photochemically oxidize water. However, the various approaches involving the molecular design of ligands, surface modification and immobilization still have limitations in terms of catalytic efficiency and sustainability. Here, we demonstrate a biologically templated nanostructure for visible light-driven water oxidation that uses a genetically engineered M13 virus scaffold to mediate the co-assembly of zinc porphyrins (photosensitizer) and iridium oxide hydrosol clusters (catalyst). Porous polymer microgels are used as an immobilization matrix to improve the structural durability of the assembled nanostructures and to allow the materials to be recycled. Our results suggest that the biotemplated nanoscale assembly of functional components is a promising route to significantly improved photocatalytic water-splitting systems.</p>",<p>数十亿年来，蓝细菌和植物已经进化出高度组织化的光合作用系统，以使电子和化学物质穿梭，从而有效地氧化水。与自然光系统中的反应中心相似，分子和金属氧化物催化剂已用于光化学氧化水。然而，涉及配体的分子设计，表面改性和固定化的各种方法在催化效率和可持续性方面仍具有局限性。在这里，我们展示了一种生物模板化的纳米结构，用于可见光驱动的水氧化，它使用基因工程的M13病毒支架来介导锌卟啉（光敏剂）和氧化铱水溶胶簇（催化剂）的共组装。多孔聚合物微凝胶被用作固定基质，以改善组装的纳米结构的结构耐久性并允许材料被回收。我们的结果表明，生物模板化的功能部件的纳米组装是显着改善光催化水分解体系的有前途的途径。</ p> ,"[{'address': 'Department of Biological Engineering, Massachusetts Institute of Technology, Cambridge, 02139, Massachusetts, USA', 'authors': ['Yoon Sung Nam', ',\xa0Thomas S. Pollom Jr', '\xa0&\xa0Angela M. Belcher']}, {'address': 'Department of Materials Science and Engineering, Massachusetts Institute of Technology, Cambridge, 02139, Massachusetts, USA', 'authors': ['Andrew P. Magyar', ',\xa0Dong Soo Yun', ',\xa0Heechul Park', '\xa0&\xa0Angela M. Belcher']}, {'address': 'School of Engineering and Applied Sciences, Harvard University, Cambridge, 02138, Massachusetts, USA', 'authors': ['Daeyeon Lee', ',\xa0Jin-Woong Kim', '\xa0&\xa0David A. Weitz']}, {'address': 'Department of Physics, Harvard University, Cambridge, 02138, Massachusetts, USA', 'authors': ['David A. Weitz']}]",[{'地址'：'麻省理工学院生物工程系，剑桥，美国马萨诸塞州02139'，'作者'：['Yoon Sung Nam'，'，\ xa0Thomas S. Pollom Jr'，'\ xa0＆ \ xa0Angela M. Belcher']}，{'地址'：'麻省理工学院材料科学与工程系，剑桥，美国马萨诸塞州02139'，'作者'：['Andrew P. Magyar'，'， \ xa0Dong Soo Yun'，'，\ xa0Heechul Park'，'\ xa0＆\ xa0Angela M. Belcher']}，{'address'：'哈佛大学工程与应用科学学院，剑桥，美国马萨诸塞州02138'， 'authors'：['Daeyeon Lee'，'，\ xa0Jin-Woong Kim'，'\ xa0＆\ xa0David A. Weitz']}，{'address'：'物理系，哈佛大学，剑桥，马萨诸塞州02138， 美国”，“作者”：['David A. Weitz']}] 
10.1038/nnano.2010.56,Observation and control of blinking nitrogen-vacancy centres in discrete nanodiamonds,离散纳米金刚石闪烁氮空位中心的观察与控制 ,"<p>Nitrogen-vacancy colour centres in diamond can undergo strong, spin-sensitive optical transitions under ambient conditions, which makes them attractive for applications in quantum optics, nanoscale magnetometry and biolabelling. Although nitrogen-vacancy centres have been observed in aggregated detonation nanodiamonds and milled nanodiamonds, they have not been observed in very small isolated nanodiamonds. Here, we report the first direct observation of nitrogen-vacancy centres in discrete 5-nm nanodiamonds at room temperature, including evidence for intermittency in the luminescence (blinking) from the nanodiamonds. We also show that it is possible to control this blinking by modifying the surface of the nanodiamonds.</p>",<p>钻石的氮空位色心在环境条件下会发生强烈的自旋敏感的光学跃迁，这使其对于量子光学，纳米级磁力测量和生物标记中的应用具有吸引力。 尽管在聚集的爆轰纳米金刚石和磨碎的纳米金刚石中已观察到氮空位中心，但在非常小的分离的纳米金刚石中未观察到氮空位中心。 在这里，我们报道了在室温下离散5纳米纳米金刚石中氮空位中心的首次直接观察，包括纳米金刚石的发光（闪烁）间歇性证据。 我们还表明，可以通过修饰纳米金刚石的表面来控制这种闪烁。</ p> ,"[{'address': 'Department of Physics, Centre for Quantum Science and Technology, Macquarie University, Sydney, 2109, New South Wales, Australia', 'authors': ['C. Bradac', ',\xa0T. Gaebel', ',\xa0N. Naidoo', ',\xa0J. Twamley', '\xa0&\xa0J. R. Rabeau']}, {'address': 'Department of Physics, MQ Photonics Research Centre, Macquarie University, Sydney, 2109, New South Wales, Australia', 'authors': ['C. Bradac', ',\xa0T. Gaebel', ',\xa0A. V. Zvyagin', '\xa0&\xa0J. R. Rabeau']}, {'address': 'Laser Physics Centre, Research School of Physics and Engineering, Australian National University, Australian Capital Territory, 0200, Australia', 'authors': ['M. J. Sellars']}, {'address': 'Department of Chemistry and Biomolecular Science, Macquarie University, Sydney, 2109, New South Wales, Australia', 'authors': ['L. J. Brown']}, {'address': 'Virtual Nanoscience Laboratory, CSIRO Materials Science and Engineering, Clayton, 3168, Victoria, Australia', 'authors': ['A. S. Barnard']}, {'address': 'Department of Physics, University of Queensland, Brisbane, Queensland, Australia', 'authors': ['T. Plakhotnik']}]",[{'地址'：'麦格理大学量子科学与技术中心物理系，悉尼，澳大利亚新南威尔士州2109，'作者'：['C。 Bradac'，'，\ xa0T。 Gaebel'，'，\ xa0N。 Naidoo'，'，\ xa0J。 Twamley'，'\ xa0＆\ xa0J。 R. Rabeau']}，{'地址'：'物理系，Mc光子学研究中心，麦格理大学，悉尼，澳大利亚，新南威尔士州2109，'，'作者'：['C。 Bradac'，'，\ xa0T。 Gaebel'，'，\ xa0A。 V.Zvyagin'，'\ xa0＆\ xa0J。 R. Rabeau']}，{'地址'：'澳大利亚国立大学物理与工程研究学院激光物理中心，澳大利亚首都特区，0200，澳大利亚'，'作者'：['M。 J. Sellars']}，{'地址'：'澳大利亚麦格理大学化学与生物分子科学系，悉尼，澳大利亚新南威尔士州2109'，'作者'：['L。 J. Brown']}，{'address'：“ CSIRO材料科学与工程虚拟纳米科学实验室，Clayton，3168，澳大利亚维多利亚”，“作者”：['A。 S. Barnard']}，{'地址'：'澳大利亚昆士兰州布里斯班昆士兰大学物理系'，'作者'：['T。 Plakhotnik']}] 
10.1038/nnano.2010.64,Imaging and manipulating the spin direction of individual atoms,成像和操纵单个原子的自旋方向 ,"<p>Single magnetic atoms on surfaces are the smallest conceivable units for two-dimensional magnetic data storage. Previous experiments on such systems have investigated magnetization curves, the many-body Kondo effect and magnetic excitations in quantum spin systems, but a stable magnetization has not yet been detected for an atom on a non-magnetic surface in the absence of a magnetic field. The spin direction of a single magnetic atom can be fixed by coupling it to an underlying magnetic substrate via the exchange interaction, but it is then difficult to differentiate between the magnetism of the atom and the surface. Here, we take advantage of the orbital symmetry of the spin-polarized density of states of single cobalt atoms to unambiguously determine their spin direction in real space using a combination of spin-resolved scanning tunnelling microscopy experiments and ab initio calculations. By laterally moving atoms on our non-collinear magnetic template, the spin direction can also be controlled while maintaining magnetic sensitivity, thereby providing an approach for constructing and characterizing artificial atomic-scale magnetic structures.</p>",<p>表面上的单个磁性原子是二维磁性数据存储的最小可能单位。在此类系统上进行的先前实验已经研究了量子自旋系统中的磁化曲线，多体近藤效应和磁激发，但是在没有磁场的情况下，尚未检测到非磁性表面上原子的稳定磁化。单个磁性原子的自旋方向可以通过交换相互作用将其耦合到下面的磁性基板上，从而固定下来，但是很难区分原子的磁性和表面的磁性。在这里，我们利用自旋分辨扫描隧道显微镜实验和从头算的组合，利用单个钴原子态的自旋极化态密度的轨道对称性，明确确定其在真实空间中的自旋方向。通过在非共线磁性模板上横向移动原子，还可以在保持磁灵敏度的同时控制自旋方向，从而为构造和表征人工原子级磁性结构提供了一种方法。</ p> ,"[{'address': 'Institute of Applied Physics, University of Hamburg, Jungiusstrasse 11, Hamburg, D-20355, Germany', 'authors': ['David Serrate', ',\xa0Paolo Ferriani', ',\xa0Yasuo Yoshida', ',\xa0Saw-Wai Hla', ',\xa0Matthias Menzel', ',\xa0Kirsten von Bergmann', ',\xa0Stefan Heinze', ',\xa0Andre Kubetzka', '\xa0&\xa0Roland Wiesendanger']}, {'address': 'Institute of Theoretical Physics and Astrophysics, Christian-Albrechts-Universität zu Kiel, Leibnizstraße 15, Kiel, 24098, Germany', 'authors': ['Paolo Ferriani', '\xa0&\xa0Stefan Heinze']}, {'address': 'Physics & Astronomy Department, Nanoscale & Quantum Phenomena Institute, Ohio University, Athens, Ohio, 45701, USA', 'authors': ['Saw-Wai Hla']}]",[{'address'：“汉堡大学应用物理研究所，Jungiusstrasse 11，汉堡，D-20355，德国”，“作者”：['David Serrate'，'，\ xa0Paolo Ferriani'，'，\ xa0Yasuo Yoshida '，'，\ xa0Saw-Wai Hla'，'，\ xa0Matthias Menzel'，'，\ xa0Kirsten von Bergmann'，'，\ xa0Stefan Heinze'，'，\ xa0Andre Kubetzka'，'\ xa0 \ xa0Roland Wiesendanger']}， {“地址”：“德国基尔克里斯蒂安-阿尔布雷希兹大学大学理论物理和天体物理研究所，莱尔布尼兹大街15号，基尔，24098，德国”，“作者”：['保罗·费里亚尼'，'\ xa0＆\ xa0Stefan Heinze']} ，{“地址”：“俄亥俄州大学，纳米级和量子现象研究所物理与天文学系，俄亥俄州，俄亥俄州，美国45701”，“作者”：['Saw-Wai Hla']}]] 
