contentType,title,abstract,abstract_google_cn,affiliations,authorization,authors,citation_text,count_accesses,count_altmetric,count_citations,documentType,doi,doi_url,focus,issue,journal_pcode,journal_title,publishedAt,publishedAtString,subjects,url,volume
letter,Collective energy gap of preformed Cooper pairs in disordered superconductors,"<p>In most superconductors, the transition to the superconducting state is driven by the binding of electrons into Cooper pairs. The condensation of these pairs into a single, phase-coherent, quantum state takes place at the same time as their formation at the transition temperature, T<sub>c</sub>. A different scenario occurs in some disordered, amorphous, superconductors: instead of a pairing-driven transition, incoherent Cooper pairs first preform above T<sub>c</sub>, causing the opening of a pseudogap, and then, at T<sub>c</sub>, condense into the phase-coherent superconducting state. Such a two-step scenario implies the existence of a new energy scale, &#916;<sub>c</sub>, driving the collective superconducting transition of the preformed pairs. Here we unveil this energy scale by means of Andreev spectroscopy in superconducting thin films of amorphous indium oxide. We observe two Andreev conductance peaks at &#177;&#916;<sub>c</sub> that develop only below T<sub>c</sub> and for highly disordered films on the verge of the transition to insulator. Our findings demonstrate that amorphous superconducting films provide prototypical disordered quantum systems to explore the collective superfluid transition of preformed Cooper pairs.</p>",,"[{'address': 'Univ. Grenoble Alpes, CEA, INAC, PHELIQS, Grenoble, France', 'authors': ['Thomas Dubouchet', ',\xa0Marc Sanquer', '\xa0&\xa0Claude Chapelier']}, {'address': 'Univ. Grenoble Alpes, CNRS, Grenoble INP, Institut Néel, Grenoble, France', 'authors': ['Benjamin Sacépé', '\xa0&\xa0Johanna Seidemann']}, {'address': 'Department of Condensed Matter Physics, Weizmann Institute of Science, Rehovot, Israel', 'authors': ['Dan Shahar']}]",False,"['Thomas Dubouchet', 'Benjamin Sacépé', 'Johanna Seidemann', 'Dan Shahar', 'Marc Sanquer', 'Claude Chapelier']","Dubouchet, T., Sacépé, B., Seidemann, J. et al. Collective energy gap of preformed Cooper pairs in disordered superconductors. Nat. Phys. 15, 233–236 (2019).",4166,5,3,aplusplus,10.1038/s41567-018-0365-8,https://doi.org/10.1038/s41567-018-0365-8,,3,nphys,nature physics,1544400000,2018-12-10,physics;superconducting-properties-and-materials,https://www.nature.com/articles/s41567-018-0365-8,15
letter,Evidence of a gate-tunable Mott insulator in a trilayer graphene moiré superlattice,"<p>The Mott insulator is a central concept in strongly correlated physics and manifests when the repulsive Coulomb interaction between electrons dominates over their kinetic energy. Doping additional carriers into a Mott insulator can give rise to other correlated phenomena such as unusual magnetism and even high-temperature superconductivity. A tunable Mott insulator, where the competition between the Coulomb interaction and the kinetic energy can be varied in situ, can provide an invaluable model system for the study of Mott physics. Here we report the possible realization of such a tunable Mott insulator in a trilayer graphene heterostructure with a moir&#233; superlattice. The combination of the cubic energy dispersion in ABC-stacked trilayer graphene and the narrow electronic minibands induced by the moir&#233; potential leads to the observation of insulating states at the predicted band fillings for the Mott insulator. Moreover, the insulating states in the heterostructure can be tuned: the bandgap can be modulated by a vertical electrical field, and at the same time the electron doping can be modified by a gate to fill the band from one insulating state to another. This opens up exciting opportunities to explore strongly correlated phenomena in two-dimensional moir&#233; superlattice heterostructures.</p>",,"[{'address': 'Department of Physics, University of California at Berkeley, Berkeley, CA, USA', 'authors': ['Guorui Chen', ',\xa0Lili Jiang', '\xa0&\xa0Feng Wang']}, {'address': 'State Key Laboratory of Surface Physics and Department of Physics, Fudan University, Shanghai, China', 'authors': ['Guorui Chen', '\xa0&\xa0Yuanbo Zhang']}, {'address': 'Collaborative Innovation Center of Advanced Microstructures, Nanjing, China', 'authors': ['Guorui Chen', ',\xa0Bosai Lyu', ',\xa0Hongyuan Li', ',\xa0Zhiwen Shi', '\xa0&\xa0Yuanbo Zhang']}, {'address': 'Department of Electrical Engineering and Computer Sciences, University of California, Berkeley, CA, USA', 'authors': ['Shuang Wu']}, {'address': 'Key Laboratory of Artificial Structures and Quantum Control (Ministry of Education), School of Physics and Astronomy, Shanghai Jiao Tong University, Shanghai, China', 'authors': ['Bosai Lyu', ',\xa0Hongyuan Li', '\xa0&\xa0Zhiwen Shi']}, {'address': 'Department of Physics, University of Seoul, Seoul, Korea', 'authors': ['Bheema Lingam Chittari', '\xa0&\xa0Jeil Jung']}, {'address': 'National Institute for Materials Science, Tsukuba, Japan', 'authors': ['Kenji Watanabe', '\xa0&\xa0Takashi Taniguchi']}, {'address': 'Institute for Nanoelectronic Devices and Quantum Computing, Fudan University, Shanghai, China', 'authors': ['Yuanbo Zhang']}, {'address': 'Materials Science Division, Lawrence Berkeley National Laboratory, Berkeley, CA, USA', 'authors': ['Feng Wang']}, {'address': 'Kavli Energy NanoSciences Institute at the University of California, Berkeley and the Lawrence Berkeley National Laboratory, Berkeley, CA, USA', 'authors': ['Feng Wang']}]",False,"['Guorui Chen', 'Lili Jiang', 'Shuang Wu', 'Bosai Lyu', 'Hongyuan Li', 'Bheema Lingam Chittari', 'Kenji Watanabe', 'Takashi Taniguchi', 'Zhiwen Shi', 'Jeil Jung', 'Yuanbo Zhang', 'Feng Wang']","Chen, G., Jiang, L., Wu, S. et al. Evidence of a gate-tunable Mott insulator in a trilayer graphene moiré superlattice. Nat. Phys. 15, 237–241 (2019).",12000,78,64,aplusplus,10.1038/s41567-018-0387-2,https://doi.org/10.1038/s41567-018-0387-2,,3,nphys,nature physics,1548028800,2019-01-21,condensed-matter-physics;electronic-properties-and-devices,https://www.nature.com/articles/s41567-018-0387-2,15
letter,Quantum interference in second-harmonic generation from monolayer WSe2,"<p>A hallmark of wave&#8211;matter duality is the emergence of quantum-interference phenomena when an electronic transition follows different trajectories. This type of interference results in asymmetric absorption lines such as Fano resonances, and gives rise to secondary effects such as electromagnetically induced transparency when multiple optical transitions are pumped. Few solid-state systems show quantum interference and electromagnetically induced transparency, with quantum-well intersubband transitions in the infrared region offering the most promising avenue to date to devices exploiting optical gain without inversion. Quantum interference is usually hampered by inhomogeneous broadening of electronic transitions, making it challenging to achieve in solids at visible wavelengths and elevated temperatures. However, disorder effects can be mitigated by raising the oscillator strength of atom-like electronic transitions&#8212;excitons&#8212;that arise in monolayers of transition-metal dichalcogenides. Quantum interference, probed by second-harmonic generation, emerges in monolayer WSe<sub>2</sub>, without a cavity, to split the frequency-doubled laser spectrum. The splitting exhibits spectral anticrossing behaviour, and is related to the number of Rabi flops the strongly driven system undergoes. The second-harmonic generation power-law exponent deviates strongly from the canonical value of 2, showing a Fano-like wavelength dependence that is retained at room temperature. The work opens opportunities in solid-state quantum-nonlinear optics for optical mixing, gain without inversion and quantum-information processing.</p>",,"[{'address': 'Institut für Experimentelle und Angewandte Physik, Universität Regensburg, Regensburg, Germany', 'authors': ['Kai-Qiang Lin', ',\xa0Sebastian Bange', '\xa0&\xa0John M. Lupton']}, {'address': 'Collaborative Innovation Center of Chemistry for Energy Materials, College of Chemistry and Chemical Engineering, Xiamen University, Xiamen, China', 'authors': ['Kai-Qiang Lin']}]",False,"['Kai-Qiang Lin', 'Sebastian Bange', 'John M. Lupton']","Lin, K., Bange, S. & Lupton, J.M. Quantum interference in second-harmonic generation from monolayer WSe2. Nat. Phys. 15, 242–246 (2019).",7093,24,10,aplusplus,10.1038/s41567-018-0384-5,https://doi.org/10.1038/s41567-018-0384-5,,3,nphys,nature physics,1546819200,2019-01-07,electronic-properties-and-materials;quantum-optics;two-dimensional-materials,https://www.nature.com/articles/s41567-018-0384-5,15
letter,Highly efficient double ionization of mixed alkali dimers by intermolecular Coulombic decay,"<p>As opposed to purely molecular systems where electron dynamics proceed only through intramolecular processes, weakly bound complexes such as He droplets offer an environment where local excitations can interact with neighbouring embedded molecules leading to new intermolecular relaxation mechanisms. Here, we report on a new decay mechanism leading to the double ionization of alkali dimers attached to He droplets by intermolecular energy transfer. From the electron spectra, the process is similar to the well-known shake-off mechanism observed in double Auger decay and single-photon double ionization, however, in this case, the process is dominant, occurring with efficiencies equal to, or greater than, single ionization by energy transfer. Although an alkali dimer attached to a He droplet is a model case, the decay mechanism is relevant for any system where the excitation energy of one constituent exceeds the double ionization potential of another neighbouring molecule. The process is, in particular, relevant for biological systems, where radicals and slow electrons are known to cause radiation damage.</p>",,"[{'address': 'Physikalisches Institut, Universität Freiburg, Freiburg, Germany', 'authors': ['A. C. LaForge', '\xa0&\xa0F. Stienkemeier']}, {'address': 'Department of Physics, University of Connecticut, Storrs, CT, USA', 'authors': ['A. C. LaForge']}, {'address': 'Department of Physics and Astronomy, Aarhus University, Aarhus C, Denmark', 'authors': ['M. Shcherbinin', '\xa0&\xa0M. Mudrich']}, {'address': 'Elettra-Sincrotrone Trieste, Basovizza, Italy', 'authors': ['R. Richter']}, {'address': 'Max-Planck-Institut für Kernphysik, Heidelberg, Germany', 'authors': ['R. Moshammer', '\xa0&\xa0T. Pfeifer']}]",False,"['A. C. LaForge', 'M. Shcherbinin', 'F. Stienkemeier', 'R. Richter', 'R. Moshammer', 'T. Pfeifer', 'M. Mudrich']","LaForge, A.C., Shcherbinin, M., Stienkemeier, F. et al. Highly efficient double ionization of mixed alkali dimers by intermolecular Coulombic decay. Nat. Phys. 15, 247–250 (2019).",2413,2,9,aplusplus,10.1038/s41567-018-0376-5,https://doi.org/10.1038/s41567-018-0376-5,,3,nphys,nature physics,1546819200,2019-01-07,atomic-and-molecular-physics;chemical-physics,https://www.nature.com/articles/s41567-018-0376-5,15
letter,Emergence of three-dimensional order and structure in growing biofilms,"<p>Surface-attached bacterial biofilms are self-replicating active liquid crystals and the dominant form of bacterial life on Earth. In conventional liquid crystals and solid-state materials, the interaction potentials between the molecules that comprise the system determine the material properties. However, for growth-active biofilms it is unclear whether potential-based descriptions can account for the experimentally observed morphologies, and which potentials would be relevant. Here, we have overcome previous limitations of single-cell imaging techniques to reconstruct and track all individual cells inside growing three-dimensional biofilms with up to 10,000 individuals. Based on these data, we identify, constrain and provide a microscopic basis for an effective cell&#8211;cell interaction potential, which captures and predicts the growth dynamics, emergent architecture and local liquid-crystalline order of Vibrio cholerae biofilms. Furthermore, we show how external fluid flows control the microscopic structure and three-dimensional morphology of biofilms. Our analysis implies that local cellular order and global biofilm architecture in these active bacterial communities can arise from mechanical cell&#8211;cell interactions, which cells can modulate by regulating the production of particular matrix components. These results establish an experimentally validated foundation for improved continuum theories of active matter and thereby contribute to solving the important problem of controlling biofilm growth.</p>",,"[{'address': 'Max Planck Institute for Terrestrial Microbiology, Marburg, Germany', 'authors': ['Raimo Hartmann', ',\xa0Praveen K. Singh', ',\xa0Francisco Díaz-Pascual', '\xa0&\xa0Knut Drescher']}, {'address': 'Department of Physics, Philipps-Universität Marburg, Marburg, Germany', 'authors': ['Raimo Hartmann', '\xa0&\xa0Knut Drescher']}, {'address': 'Department of Mathematics, Massachusetts Institute of Technology, Cambridge, Massachusetts, USA', 'authors': ['Philip Pearce', ',\xa0Rachel Mok', ',\xa0Boya Song', '\xa0&\xa0Jörn Dunkel']}, {'address': 'Department of Mechanical Engineering, Massachusetts Institute of Technology, Cambridge, Massachusetts, USA', 'authors': ['Rachel Mok']}]",False,"['Raimo Hartmann', 'Praveen K. Singh', 'Philip Pearce', 'Rachel Mok', 'Boya Song', 'Francisco Díaz-Pascual', 'Jörn Dunkel', 'Knut Drescher']","Hartmann, R., Singh, P.K., Pearce, P. et al. Emergence of three-dimensional order and structure in growing biofilms. Nat. Phys. 15, 251–256 (2019).",10000,75,30,aplusplus,10.1038/s41567-018-0356-9,https://doi.org/10.1038/s41567-018-0356-9,Active Matter,3,nphys,nature physics,1543190400,2018-11-26,biological-physics;biophysics;nonlinear-phenomena;soft-materials,https://www.nature.com/articles/s41567-018-0356-9,15
article,Topological marker currents in Chern insulators,"<p>Topological states of matter exhibit many novel properties due to the presence of robust topological invariants such as the Chern index. These global characteristics pertain to the system as a whole and are not locally defined. However, local topological markers can distinguish between topological phases, and they can vary in space. In equilibrium, we show that the topological marker can be used to extract the critical behaviour of topological phase transitions. Out of equilibrium, we show that the topological marker spreads via a flow of currents emanating from the sample boundaries, and with a bounded maximum propagation speed. We discuss the possibilities for measuring the topological marker and its flow in experiment.</p>",,"[{'address': 'Instituut-Lorentz, Universiteit Leiden, Leiden, the Netherlands', 'authors': ['M. D. Caio']}, {'address': 'Functional Materials Group, School of Physical Sciences, University of Kent, Canterbury, UK', 'authors': ['G. Möller']}, {'address': 'TCM Group, Cavendish Laboratory, University of Cambridge, Cambridge, UK', 'authors': ['N. R. Cooper']}, {'address': 'Department of Physics, King’s College London, London, UK', 'authors': ['M. J. Bhaseen']}]",False,"['M. D. Caio', 'G. Möller', 'N. R. Cooper', 'M. J. Bhaseen']","Caio, M.D., Möller, G., Cooper, N.R. et al. Topological marker currents in Chern insulators. Nat. Phys. 15, 257–261 (2019).",4643,22,9,aplusplus,10.1038/s41567-018-0390-7,https://doi.org/10.1038/s41567-018-0390-7,,3,nphys,nature physics,1547424000,2019-01-14,condensed-matter-physics;phase-transitions-and-critical-phenomena;topological-matter;ultracold-gases,https://www.nature.com/articles/s41567-018-0390-7,15
article,Two-dimensional spin liquid behaviour in the triangular-honeycomb antiferromagnet TbInO3,"<p>Spin liquid ground states are predicted to arise within several distinct scenarios in condensed matter physics. The observation of these disordered magnetic states is particularly pervasive among a class of materials known as frustrated magnets, in which the competition between various magnetic exchange interactions prevents the system from adopting long-range magnetic order at low temperatures. Spin liquids continue to be of great interest due to their exotic nature and the possibility that they may support fractionalized excitations, such as Majorana fermions. Systems that allow for such phenomena are not only fascinating from a fundamental perspective but may also be practically significant in future technologies based on quantum computation. Here we show that the underlying antiferromagnetic sublattice in TbInO<sub>3</sub> can undergo a crystal field-induced distortion of its buckled triangular arrangement to one based on a honeycomb. The absence of a conventional magnetic ordering transition at the lowest measurable temperatures indicates that another critical mechanism must govern in the ground-state selection of TbInO<sub>3</sub>. We suggest that anisotropic exchange interactions&#8212;mediated through strong spin&#8211;orbit coupling on the emergent honeycomb lattice of TbInO<sub>3</sub>&#8212;give rise to a highly frustrated spin liquid.</p>",,"[{'address': 'Departments of Chemistry and Physics, Materials Innovation Factory, University of Liverpool, Liverpool, UK', 'authors': ['Lucy Clark']}, {'address': 'Department of Physics and Astronomy, McMaster University, Hamilton, Ontario, Canada', 'authors': ['Lucy Clark', ',\xa0Gabriele Sala', ',\xa0Dalini D. Maharaj', '\xa0&\xa0Bruce D. Gaulin']}, {'address': 'Neutron Scattering Division, Oak Ridge National Laboratory, Oak Ridge, TN, USA', 'authors': ['Gabriele Sala', '\xa0&\xa0Matthew B. Stone']}, {'address': 'Department of Earth Sciences, University College London, London, UK', 'authors': ['Kevin S. Knight']}, {'address': 'Department of Earth Sciences, Natural History Museum, London, UK', 'authors': ['Kevin S. Knight']}, {'address': 'ISIS Facility, Rutherford Appleton Laboratory, Didcot, UK', 'authors': ['Kevin S. Knight', '\xa0&\xa0Mark T. F. Telling']}, {'address': 'Rutgers Center for Emergent Materials and Department of Physics and Astronomy, Rutgers University, Piscataway, NJ, USA', 'authors': ['Xueyun Wang', ',\xa0Xianghan Xu', ',\xa0Jaewook Kim', ',\xa0Yanbin Li', '\xa0&\xa0Sang-Wook Cheong']}, {'address': 'State Key Laboratory of Crystal Materials, Shandong University, Jinan, China', 'authors': ['Yanbin Li']}, {'address': 'Brockhouse Institute for Materials Research, Hamilton, Ontario, Canada', 'authors': ['Bruce D. Gaulin']}, {'address': 'Canadian Institute for Advanced Research, Toronto, Ontario, Canada', 'authors': ['Bruce D. Gaulin']}]",False,"['Lucy Clark', 'Gabriele Sala', 'Dalini D. Maharaj', 'Matthew B. Stone', 'Kevin S. Knight', 'Mark T. F. Telling', 'Xueyun Wang', 'Xianghan Xu', 'Jaewook Kim', 'Yanbin Li', 'Sang-Wook Cheong', 'Bruce D. Gaulin']","Clark, L., Sala, G., Maharaj, D.D. et al. Two-dimensional spin liquid behaviour in the triangular-honeycomb antiferromagnet TbInO3. Nat. Phys. 15, 262–268 (2019).",5322,51,14,aplusplus,10.1038/s41567-018-0407-2,https://doi.org/10.1038/s41567-018-0407-2,,3,nphys,nature physics,1548028800,2019-01-21,condensed-matter-physics;materials-science;physics,https://www.nature.com/articles/s41567-018-0407-2,15
article,Strain-tunable magnetism at oxide domain walls,"<p>Applying stress to a ferroelastic material results in a nonlinear strain response as domains of different orientations mechanically switch. The ability to write, erase and move domain walls between such ferroelastic domains suggests a method for making nanoelectronics where the domain wall is the device. However, little is known about the magnetic properties of such domain walls. A fascinating model system is SrTiO<sub>3</sub>, where the ferroelastic domain walls display strain-tunable polarity and enhanced conductivity. Here, we reveal a long-range magnetic order with modulations along the ferroelastic domain walls in SrTiO<sub>3</sub> and SrTiO<sub>3</sub>-based heterointerfaces, which manifests itself as a striped pattern in scanning superconducting quantum interference device maps of the magnetic landscape. In conducting interfaces, the magnetism is coupled to itinerant electrons with clear signatures in magnetotransport measurements. The magnetic state is also coupled dynamically to the lattice and can be reversibly tuned by applying local external forces. This study raises the possibility of designing nanoscale devices based on domain walls where strain-tunable ferroelectric, ferroelastic and ferromagnetic orders may coexist.</p>",,"[{'address': 'Department of Energy Conversion and Storage, Technical University of Denmark, Roskilde, Denmark', 'authors': ['D. V. Christensen', ',\xa0Y. Z. Chen', ',\xa0A. Smith', '\xa0&\xa0N. Pryds']}, {'address': 'Department of Physics and Institute of Nanotechnology and Advanced Materials, Bar-Ilan University, Ramat-Gan, Israel', 'authors': ['Y. Frenkel', '\xa0&\xa0B. Kalisky']}, {'address': 'Stanford Institute for Materials and Energy Sciences, SLAC National Accelerator Laboratory, Menlo Park, CA, USA', 'authors': ['Y. W. Xie', ',\xa0Z. Y. Chen', ',\xa0Y. Hikita', '\xa0&\xa0H. Y. Hwang']}, {'address': 'Department of Applied Physics, Geballe Laboratory for Advanced Materials, Stanford University, Stanford, CA, USA', 'authors': ['Y. W. Xie', ',\xa0Z. Y. Chen', '\xa0&\xa0H. Y. Hwang']}, {'address': 'Department of Physics, Zhejiang University, Hangzhou, China', 'authors': ['Y. W. Xie']}, {'address': 'Department of Physics, Nano-magnetism Research Center, Institute of Nanotechnology and Advanced Materials, Bar-Ilan University, Ramat-Gan, Israel', 'authors': ['L. Klein']}]",False,"['D. V. Christensen', 'Y. Frenkel', 'Y. Z. Chen', 'Y. W. Xie', 'Z. Y. Chen', 'Y. Hikita', 'A. Smith', 'L. Klein', 'H. Y. Hwang', 'N. Pryds', 'B. Kalisky']","Christensen, D.V., Frenkel, Y., Chen, Y.Z. et al. Strain-tunable magnetism at oxide domain walls. Nat. Phys. 15, 269–274 (2019).",4983,51,13,aplusplus,10.1038/s41567-018-0363-x,https://doi.org/10.1038/s41567-018-0363-x,,3,nphys,nature physics,1545004800,2018-12-17,electronic-and-spintronic-devices;magnetic-properties-and-materials;surfaces-interfaces-and-thin-films,https://www.nature.com/articles/s41567-018-0363-x,15
article,Plasmonic quantum size effects in silver nanoparticles are dominated by interfaces and local environments,"<p>The physical properties of metals change when their dimensions are reduced to the nano-scale and new phenomena such as the localized surface-plasmon resonance (LSPR) appear. This collective electronic excitation can be tuned over a large spectral range by adapting the material, size and shape. The existing literature is as rich as it is controversial&#8212;for example, size-dependent spectral shifts of the LSPR in small metal nanoparticles, induced by quantum effects, are reported to the red, to the blue or entirely absent. Here we report how complementary experiments on size-selected small silver nanoparticles embedded in silica can yield inconsistent results on the same system: whereas optical absorption shows no size effect in the range between only a few atoms and ~10&#8201;nm, a clear spectral shift is observed in single-particle electron spectroscopy. Our quantitative interpretation, based on a mixed classical/quantum model, resolves the apparent contradictions, not only within our experimental data, but also in the literature. Our comprehensive model describes how the local environment is the crucial parameter controlling the manifestation or absence of quantum size effects.</p>",,"[{'address': 'Laboratoire de Physique des Solides, UMR 8502 CNRS and Université Paris-Sud, Orsay, France', 'authors': ['Alfredo Campos', '\xa0&\xa0Mathieu Kociak']}, {'address': 'Institut Lumière Matière, Université de Lyon, Université Claude Bernard Lyon 1, CNRS, UMR5306, Villeurbanne, France', 'authors': ['Nicolas Troc', ',\xa0Emmanuel Cottancin', ',\xa0Michel Pellarin', ',\xa0Jean Lermé', '\xa0&\xa0Matthias Hillenkamp']}, {'address': 'Aix Marseille University, CNRS, CINaM UMR 7325, Marseille, France', 'authors': ['Hans-Christian Weissker']}, {'address': 'European Theoretical Spectroscopy Facility', 'authors': ['Hans-Christian Weissker']}, {'address': 'Instituto de Física Gleb Wataghin, Universidade Estadual de Campinas, R. Sergio B. de Holanda 777, Campinas-SP, Brazil', 'authors': ['Matthias Hillenkamp']}]",False,"['Alfredo Campos', 'Nicolas Troc', 'Emmanuel Cottancin', 'Michel Pellarin', 'Hans-Christian Weissker', 'Jean Lermé', 'Mathieu Kociak', 'Matthias Hillenkamp']","Campos, A., Troc, N., Cottancin, E. et al. Plasmonic quantum size effects in silver nanoparticles are dominated by interfaces and local environments. Nat. Phys. 15, 275–280 (2019).",5250,27,28,aplusplus,10.1038/s41567-018-0345-z,https://doi.org/10.1038/s41567-018-0345-z,,3,nphys,nature physics,1542585600,2018-11-19,materials-science;nanoscale-materials;nanoscience-and-technology;techniques-and-instrumentation,https://www.nature.com/articles/s41567-018-0345-z,15
