contentType,title,abstract,affiliations,authorization,authors,citation_text,count_accesses,count_altmetric,count_citations,documentType,doi,doi_url,focus,issue,journal_pcode,journal_title,publishedAt,publishedAtString,subjects,url,volume
article,Dynamic interdependence and competition in multilayer networks,"<p>From critical infrastructure to physiology and the human brain, complex systems rarely occur in isolation. Instead, the functioning of nodes in one system often promotes or suppresses the functioning of nodes in another. Structural interdependence&#8212;that is, when the functionality of the nodes is determined exclusively by connectivity between layers&#8212;can be characterized via percolation processes on interdependent networks. However, modelling more general interactions between dynamical systems has remained an open problem. Here, we present a dynamic dependency framework that can capture interdependent and competitive interactions between dynamic systems, which we use to study synchronization and spreading processes in multilayer networks with interacting layers. By developing a mean-field theory, which we verify by simulations, we find coupled collective phenomena, including multistability, regions of coexistence, and macroscopic chaos. In interdependent dynamics, in particular, we observe hysteretic behaviours with abrupt (hybrid and explosive) transitions, that exhibit universal features that match those emerging from interdependent percolation. This dynamic dependency framework provides a powerful tool with which to improve our understanding of many of the interacting complex systems surrounding us.</p>",[],False,"[""Michael M. Danziger"", ""Ivan Bonamassa"", ""Stefano Boccaletti"", ""Shlomo Havlin""]","Danziger, M.M., Bonamassa, I., Boccaletti, S. et al. Dynamic interdependence and competition in multilayer networks. Nature Phys15, 178–185 (2019).",5554,62,28,aplusplus,10.1038/s41567-018-0343-1,https://doi.org/10.1038/s41567-018-0343-1,Networks,2,nphys,nature physics,1543190400,2018-11-26,complex-networks;nonlinear-phenomena;phase-transitions-and-critical-phenomena,https://www.nature.com/articles/s41567-018-0343-1,15
article,Magneto-transport controlled by Landau polariton states,"<p>Hybrid excitations, called polaritons, emerge in systems with strong light&#8211;matter coupling. Usually, they dominate the linear and nonlinear optical properties with applications in quantum optics. Here, we show the crucial role of the electronic component of polaritons in the magneto-transport of a cavity-embedded two-dimensional electron gas in the ultrastrong coupling regime. We show that the linear direct-current resistivity is substantially modified by the coupling to the cavity even without external irradiation. Our observations confirm recent predictions of vacuum-induced modification of the resistivity. Furthermore, photo-assisted transport in the presence of a weak irradiation field at sub-terahertz frequencies highlights the different roles of localized and delocalized states.</p>",[],False,"[""Gian L. Paravicini-Bagliani"", ""Felice Appugliese"", ""Eli Richter"", ""Federico Valmorra"", ""Janine Keller"", ""Mattias Beck"", ""Nicola Bartolo"", ""Clemens R\u00f6ssler"", ""Thomas Ihn"", ""Klaus Ensslin"", ""Cristiano Ciuti"", ""Giacomo Scalari"", ""J\u00e9r\u00f4me Faist""]","Paravicini-Bagliani, G.L., Appugliese, F., Richter, E. et al. Magneto-transport controlled by Landau polariton states. Nature Phys15, 186–190 (2019).",5111,11,34,aplusplus,10.1038/s41567-018-0346-y,https://doi.org/10.1038/s41567-018-0346-y,,2,nphys,nature physics,1543795200,2018-12-03,electronic-properties-and-materials;polaritons;quantum-hall;terahertz-optics;two-dimensional-materials,https://www.nature.com/articles/s41567-018-0346-y,15
article,Field-induced phase coexistence in an artificial spin ice,"<p>Artificial spin-ice systems are magnetic metamaterials consisting of nanomagnet arrays that can be designed to study exotic magnetic states not found in natural materials. Typically, these arrays are modelled as interacting binary macrospins that can only be in an up or down state and are described by the Ising model. These materials have demonstrated ordering transitions, but only via a spontaneous symmetry-breaking mechanism. We have designed and studied a quadrupole artificial spin-ice system consisting of interacting plaquettes of coupled single-domain nanomagnets that can be interpreted as a composite, ternary variable. After annealing this system in an external magnetic field, we observe both a ferroquadrupolar and an antiferroquadrupolar phase, with an apparent first-order phase boundary and a coexistence regime. The phase diagram of this material is reminiscent of a model used to describe phase coexistence in the superfluid transition of <sup>4</sup>He with <sup>3</sup>He impurities. These results illustrate how composite magnetic objects realize exotic statistical physics models beyond the Ising model.</p>",[],False,"[""Joseph Sklenar"", ""Yuyang Lao"", ""Alan Albrecht"", ""Justin D. Watts"", ""Cristiano Nisoli"", ""Gia-Wei Chern"", ""Peter Schiffer""]","Sklenar, J., Lao, Y., Albrecht, A. et al. Field-induced phase coexistence in an artificial spin ice. Nature Phys15, 191–195 (2019).",3954,3,24,aplusplus,10.1038/s41567-018-0348-9,https://doi.org/10.1038/s41567-018-0348-9,,2,nphys,nature physics,1543795200,2018-12-03,magnetic-properties-and-materials;phase-transitions-and-critical-phenomena,https://www.nature.com/articles/s41567-018-0348-9,15
publisher correction,Publisher Correction: Open is not enough,,[],True,"[""Xiaoli Chen"", ""S\u00fcnje Dallmeier-Tiessen"", ""Robin Dasler"", ""Sebastian Feger"", ""Pamfilos Fokianos"", ""Jose Benito Gonzalez"", ""Harri Hirvonsalo"", ""Dinos Kousidis"", ""Artemis Lavasa"", ""Salvatore Mele"", ""Diego Rodriguez Rodriguez"", ""Tibor \u0160imko"", ""Tim Smith"", ""Ana Trisovic"", ""Anna Trzcinska"", ""Ioannis Tsanaktsidis"", ""Markus Zimmermann"", ""Kyle Cranmer"", ""Lukas Heinrich"", ""Gordon Watts"", ""Michael Hildreth"", ""Lara Lloret Iglesias"", ""Kati Lassila-Perini"", ""Sebastian Neubert""]","Chen, X., Dallmeier-Tiessen, S., Dasler, R. et al. Publisher Correction: Open is not enough. Nature Phys15, 197 (2019).",633,1,0,aplusplus,10.1038/s41567-018-0382-7,https://doi.org/10.1038/s41567-018-0382-7,,2,nphys,nature physics,1542931200,2018-11-23,particle-physics;publishing;research-management,https://www.nature.com/articles/s41567-018-0382-7,15
publisher correction,Publisher Correction: Spin transport and spin torque in antiferromagnetic devices,,[],True,"[""J. \u017delezn\u00fd"", ""P. Wadley"", ""K. Olejn\u00edk"", ""A. Hoffmann"", ""H. Ohno""]","Železný, J., Wadley, P., Olejník, K. et al. Publisher Correction: Spin transport and spin torque in antiferromagnetic devices. Nature Phys15, 197 (2019).",1044,2,2,aplusplus,10.1038/s41567-018-0402-7,https://doi.org/10.1038/s41567-018-0402-7,,2,nphys,nature physics,1545091200,2018-12-18,magnetic-properties-and-materials;spintronics,https://www.nature.com/articles/s41567-018-0402-7,15
publisher correction,Publisher Correction: High-harmonic generation from solids,,[],True,"[""Shambhu Ghimire"", ""David A. Reis""]","Ghimire, S., Reis, D.A. Publisher Correction: High-harmonic generation from solids. Nature Phys15, 197 (2019).",820,1,0,aplusplus,10.1038/s41567-019-0421-z,https://doi.org/10.1038/s41567-019-0421-z,,2,nphys,nature physics,1547424000,2019-01-14,electronic-properties-and-materials;high-harmonic-generation;ultrafast-photonics,https://www.nature.com/articles/s41567-019-0421-z,15
measure for measure,Diagnostics of brewing,,[],True,"[""Stefanie Reichert"", ""Bart Verberck""]","Reichert, S., Verberck, B. Diagnostics of brewing. Nature Phys15, 198 (2019).",2311,6,0,aplusplus,10.1038/s41567-019-0419-6,https://doi.org/10.1038/s41567-019-0419-6,,2,nphys,nature physics,1548979200,2019-02-01,scientific-community-and-society;technology,https://www.nature.com/articles/s41567-019-0419-6,15
