contentType,title,abstract,abstract_google_cn,affiliations,authorization,authors,citation_text,count_accesses,count_altmetric,count_citations,documentType,doi,doi_url,focus,issue,journal_pcode,journal_title,publishedAt,publishedAtString,subjects,url,volume
letter,Bridging length scales in colloidal liquids and interfaces from near-critical divergence to single particles,"<p>Boiling and condensation are among the best recognized phase transitions of condensed matter. Approaching the critical point, a liquid becomes indistinguishable from its vapour, the interfacial thickness diverges and the system is dominated by long-wavelength density fluctuations. Long wavelength usually means hundreds of particle diameters, but here we consider the limits of this assumption, using a mesoscopic analogue of simple liquids, a colloid&#8211;polymer mixture. We simultaneously visualize both the colloidal particles and near-critical density fluctuations, and reveal particle-level images of the critical clusters and liquid&#8211;gas interface. Surprisingly, we find that critical scaling does not break down until the correlation length approaches the size of the constituent particles, where there is a smooth transition to non-critical classical behaviour. Our results could provide a framework for unifying the disparate particle and correlation length scales, and bring new insight into the nature of the liquid&#8211;gas interface and the limit of the critical&#160;regime.</p>",,"[{'address': 'Institute of Industrial Science, University of Tokyo, 4-6-1 Komaba, Meguro-ku, Tokyo 153-8505, Japan', 'authors': ['C. Patrick Royall', '\xa0&\xa0Hajime Tanaka']}, {'address': 'School of Chemistry, University of Bristol, Bristol, BS8 1TS, UK', 'authors': ['C. Patrick Royall']}, {'address': 'Physical and Theoretical Chemistry Laboratory, University of Oxford, South Parks Road, Oxford, OX1 3QZ, UK', 'authors': ['Dirk G. A. L. Aarts']}]",True,"['C. Patrick Royall', 'Dirk G. A. L. Aarts', 'Hajime Tanaka']","Patrick Royall, C., Aarts, D. & Tanaka, H. Bridging length scales in colloidal liquids and interfaces from near-critical divergence to single particles. Nature Phys3, 636–640 (2007).",190,0,40,aplusplus,10.1038/nphys679,https://doi.org/10.1038/nphys679,,9,nphys,nature physics,1185062400,2007-07-22,,https://www.nature.com/articles/nphys679,3
letter,Charge inversion accompanies DNA condensation by multivalent ions,"<p>The condensation of stiff, highly charged DNA molecules into compact structures by condensing agents ranging from multivalent ions to small cationic proteins is of major biological and therapeutic importance, yet the underlying microscopic mechanism remains poorly understood. It has been proposed that DNA condensation is a purely electrostatic phenomenon driven by the existence of a strongly correlated liquid (SCL) of counterions at the DNA surface. The same theoretical argument predicts that multivalent counterions overcompensate the DNA charge when present at high concentration, in turn destabilizing the condensates. Here, we demonstrate the occurrence of DNA charge inversion by multivalent ions through measurements of the electrophoretic mobility of condensed DNA. By observing the multivalent-ion-induced condensation of a single DNA molecule using magnetic tweezers, we further show that charge inversion influences condensation by modulating the barrier for condensate nucleation in a manner consistent with the SCL mechanism.</p>",,"[{'address': 'Kavli Institute of Nanoscience, Delft University of Technology, 2628 CJ Delft, The Netherlands', 'authors': ['K. Besteman', ',\xa0K. Van Eijk', '\xa0&\xa0S. G. Lemay']}]",True,"['K. Besteman', 'K. Van Eijk', 'S. G. Lemay']","Besteman, K., Van Eijk, K. & Lemay, S. Charge inversion accompanies DNA condensation by multivalent ions. Nature Phys3, 641–644 (2007).",505,0,165,aplusplus,10.1038/nphys697,https://doi.org/10.1038/nphys697,,9,nphys,nature physics,1186272000,2007-08-05,,https://www.nature.com/articles/nphys697,3
article,Symmetry of large physical systems implies independence of subsystems,"<p>Composite systems consisting of a large number of similar subsystems play an important role in many areas of physics as well as in information theory. Their analysis, however, often relies on the assumption that the subsystems are mutually independent (or only weakly correlated). Here, we show that this assumption is generally justified for quantum systems that are symmetric, that is, invariant under permutations of the subsystems. Because symmetry is often implied by natural properties, for example, the indistinguishability of identical particles, the result has a wide range of consequences. In particular, it implies that global properties of a large composite system can be estimated by measurements applied to a limited number of (randomly chosen) sample subsystems, a fact that is important for the interpretation of experimental data. Moreover, it generalizes statements in quantum information theory and cryptography, which previously have only been known to hold under certain independence assumptions.</p>",,"[{'address': 'Department of Applied Mathematics and Theoretical Physics (DAMTP), University of Cambridge, Cambridge CB3 OWA, UK', 'authors': ['Renato Renner']}]",False,['Renato Renner'],"Renner, R. Symmetry of large physical systems implies independence of subsystems. Nature Phys3, 645–649 (2007).",327,2,141,aplusplus,10.1038/nphys684,https://doi.org/10.1038/nphys684,,9,nphys,nature physics,1185667200,2007-07-29,,https://www.nature.com/articles/nphys684,3
article,Measurement of Rashba and Dresselhaus spin–orbit magnetic fields,"<p>Spin&#8211;orbit coupling is a manifestation of special relativity. In the reference frame of a moving electron, electric fields transform into magnetic fields, which interact with the electron spin and lift the degeneracy of spin-up and spin-down states. In solid-state systems, the resulting spin&#8211;orbit fields are referred to as Dresselhaus and Rashba fields, depending on whether the electric fields originate from bulk or structure inversion asymmetry, respectively. Yet, it remains a challenge to determine the absolute value of both contributions in a single sample. Here, we show that both fields can be measured by optically monitoring the angular dependence of the electrons&#8217; spin precession on their direction of motion with respect to the crystal lattice. Furthermore, we demonstrate spin resonance induced by the spin&#8211;orbit fields. We apply our method to GaAs/InGaAs quantum-well electrons, but it should be universally useful to characterize spin&#8211;orbit interactions in semiconductors, and therefore could facilitate the design of spintronic devices.</p>",,"[{'address': 'IBM Research, Zurich Research Laboratory, Säumerstrasse 4, 8803 Rüschlikon, Switzerland', 'authors': ['Lorenz Meier', '\xa0&\xa0Gian Salis']}, {'address': 'Solid State Physics Laboratory, ETH Zurich, 8093 Zurich, Switzerland', 'authors': ['Lorenz Meier', ',\xa0Ivan Shorubalko', '\xa0&\xa0Klaus Ensslin']}, {'address': 'FIRST Center for Micro- and Nanosciences, ETH Zurich, 8093 Zurich, Switzerland', 'authors': ['Emilio Gini', '\xa0&\xa0Silke Schön']}]",False,"['Lorenz Meier', 'Gian Salis', 'Ivan Shorubalko', 'Emilio Gini', 'Silke Schön', 'Klaus Ensslin']","Meier, L., Salis, G., Shorubalko, I. et al. Measurement of Rashba and Dresselhaus spin–orbit magnetic fields. Nature Phys3, 650–654 (2007).",617,0,231,aplusplus,10.1038/nphys675,https://doi.org/10.1038/nphys675,,9,nphys,nature physics,1184457600,2007-07-15,,https://www.nature.com/articles/nphys675,3
article,Dynamics of cell orientation,"<p>Many physiological processes depend on the response of biological cells to mechanical forces generated by the contractile activity of the cell or by external stresses. Using a simple theoretical model that includes the forces due to both the mechanosensitivity of cells and the elasticity of the matrix, we predict the dynamics and orientation of cells in both the absence and presence of applied stresses. The model predicts many features observed in measurements of cellular forces and orientation including the increase with time of the cellular forces in the absence of applied stress and the consequent decrease of the force in the presence of quasi-static stresses. We also explain the puzzling observation of parallel alignment of cells for static and quasi-static stresses and of nearly perpendicular alignment for dynamically varying stresses. In addition, we predict the response of the cellular orientation to a sinusoidally varying applied stress as a function of frequency.</p>",,"[{'address': 'Department of Materials and Interfaces, Weizmann Institute of Science, Rehovot 76100, Israel', 'authors': ['Rumi De', ',\xa0Assaf Zemel', '\xa0&\xa0Samuel A. Safran']}, {'address': 'Department of Neurobiology, Physiology and Behavior, University of California, Davis, California 95616, USA', 'authors': ['Assaf Zemel']}]",False,"['Rumi De', 'Assaf Zemel', 'Samuel A. Safran']","De, R., Zemel, A. & Safran, S. Dynamics of cell orientation. Nature Phys3, 655–659 (2007).",431,0,162,aplusplus,10.1038/nphys680,https://doi.org/10.1038/nphys680,,9,nphys,nature physics,1185667200,2007-07-29,,https://www.nature.com/articles/nphys680,3
futures,Big Dave's last stand,,,"[{'address': 'John Gilbey is a writer living in west Wales. The views expressed are his alone, and he is keen to point out that this is a work of fiction. No physical laws were put at risk during the creation of this story.', 'authors': ['John Gilbey']}]",True,['John Gilbey'],"Gilbey, J. Big Dave's last stand. Nature Phys3, 662 (2007).",66,0,0,aplusplus,10.1038/nphys721,https://doi.org/10.1038/nphys721,,9,nphys,nature physics,1188604800,2007-09-01,,https://www.nature.com/articles/nphys721,3
in this issue,This issue,,,[],True,[],"This issue. Nature Phys3,v (2007).",5,0,0,aplusplus,10.1038/nphys723,https://doi.org/10.1038/nphys723,,9,nphys,nature physics,1188604800,2007-09-01,,https://www.nature.com/articles/nphys723,3
