contentType,title,abstract,affiliations,authorization,authors,citation_text,count_accesses,count_altmetric,count_citations,documentType,doi,doi_url,focus,issue,journal_pcode,journal_title,publishedAt,publishedAtString,subjects,url,volume
article,Entanglement between distant macroscopic mechanical and spin systems,"<p>Entanglement is an essential property of multipartite quantum systems, characterized by the inseparability of quantum states of objects regardless of their spatial separation. Generation of entanglement between increasingly macroscopic and disparate systems is an ongoing effort in quantum science, as it enables hybrid quantum networks, quantum-enhanced sensing and probing of the fundamental limits of quantum theory. The disparity of hybrid systems and the vulnerability of quantum correlations have thus far hampered the generation of macroscopic hybrid entanglement. Here, we generate an entangled state between the motion of a macroscopic mechanical oscillator and a collective atomic spin oscillator, as witnessed by an Einstein&#8211;Podolsky&#8211;Rosen variance below the separability limit, 0.83 &#177; 0.02 &lt; 1. The mechanical oscillator is a millimetre-size dielectric membrane and the spin oscillator is an ensemble of 10<sup>9</sup> atoms in a magnetic field. Light propagating through the two spatially separated systems generates entanglement because the collective spin plays the role of an effective negative-mass reference frame and provides&#8212;under ideal circumstances&#8212;a back-action-free subspace; in the experiment, quantum back-action is suppressed by 4.6 dB.</p>",[],False,"[""Rodrigo A. Thomas"", ""Micha\u0142 Parniak"", ""Christoffer \u00d8stfeldt"", ""Christoffer B. M\u00f8ller"", ""Christian B\u00e6rentsen"", ""Yeghishe Tsaturyan"", ""Albert Schliesser"", ""J\u00fcrgen Appel"", ""Emil Zeuthen"", ""Eugene S. Polzik""]","Thomas, R.A., Parniak, M., Østfeldt, C. et al. Entanglement between distant macroscopic mechanical and spin systems. Nat. Phys. 17, 228–233 (2021).",3886,225,2,aplusplus,10.1038/s41567-020-1031-5,https://doi.org/10.1038/s41567-020-1031-5,,2,nphys,nature physics,1600646400,2020-09-21,atomic-and-molecular-interactions-with-photons;quantum-mechanics;quantum-metrology;quantum-optics,https://www.nature.com/articles/s41567-020-1031-5,17
article,Observation of energy-resolved many-body localization,"<p>Many-body localization (MBL) describes a quantum phase where an isolated interacting system subject to sufficient disorder displays non-ergodic behaviour, evading thermal equilibrium that occurs under its own dynamics. Previously, the thermalization&#8211;MBL transition has been largely characterized with the growth of disorder. Here, we explore a new axis, reporting on an energy-resolved MBL transition using a 19-qubit programmable superconducting processor, which enables precise control and flexibility of both disorder strength and initial state preparation. We observe that the onset of localization occurs at different disorder strengths, with distinguishable energy scales, by measuring time-evolved observables and quantities related to many-body wave functions. Our results open avenues for the experimental exploration of many-body mobility edges in MBL systems, whose existence is widely debated due to the finiteness of the system size, and where exact simulations in classical computers become unfeasible.</p>",[],False,"[""Qiujiang Guo"", ""Chen Cheng"", ""Zheng-Hang Sun"", ""Zixuan Song"", ""Hekang Li"", ""Zhen Wang"", ""Wenhui Ren"", ""Hang Dong"", ""Dongning Zheng"", ""Yu-Ran Zhang"", ""Rubem Mondaini"", ""Heng Fan"", ""H. Wang""]","Guo, Q., Cheng, C., Sun, ZH. et al. Observation of energy-resolved many-body localization. Nat. Phys. 17, 234–239 (2021).",2728,5,1,aplusplus,10.1038/s41567-020-1035-1,https://doi.org/10.1038/s41567-020-1035-1,,2,nphys,nature physics,1600646400,2020-09-21,quantum-simulation;qubits,https://www.nature.com/articles/s41567-020-1035-1,17
article,Scale-invariant magnetic anisotropy in RuCl3 at high magnetic fields,"<p>In RuCl<sub>3</sub>, inelastic neutron scattering and Raman spectroscopy reveal a continuum of non-spin-wave excitations that persists to high temperature, suggesting the presence of a spin liquid state on a honeycomb lattice. In the context of the Kitaev model, finite magnetic fields introduce interactions between the elementary excitations, and thus the effects of high magnetic fields that are comparable to the spin-exchange energy scale must be explored. Here, we report measurements of the magnetotropic coefficient&#8212;the thermodynamic coefficient associated with magnetic anisotropy&#8212;over a wide range of magnetic fields and temperatures. We find that magnetic field and temperature compete to determine the magnetic response in a way that is independent of the large intrinsic exchange-interaction energy. This emergent scale-invariant magnetic anisotropy provides evidence for a high degree of exchange frustration that favours the formation of a spin liquid state in RuCl<sub>3</sub>.</p>",[],False,"[""K. A. Modic"", ""Ross D. McDonald"", ""J. P. C. Ruff"", ""Maja D. Bachmann"", ""You Lai"", ""Johanna C. Palmstrom"", ""David Graf"", ""Mun K. Chan"", ""F. F. Balakirev"", ""J. B. Betts"", ""G. S. Boebinger"", ""Marcus Schmidt"", ""Michael J. Lawler"", ""D. A. Sokolov"", ""Philip J. W. Moll"", ""B. J. Ramshaw"", ""Arkady Shekhter""]","Modic, K.A., McDonald, R.D., Ruff, J.P.C. et al. Scale-invariant magnetic anisotropy in RuCl3at high magnetic fields. Nat. Phys. 17, 240–244 (2021).",2884,125,0,aplusplus,10.1038/s41567-020-1028-0,https://doi.org/10.1038/s41567-020-1028-0,,2,nphys,nature physics,1601856000,2020-10-05,magnetic-properties-and-materials;quantum-fluids-and-solids,https://www.nature.com/articles/s41567-020-1028-0,17
article,Inertial spin dynamics in ferromagnets,"<p>The understanding of how spins move and can be manipulated at pico- and femtosecond timescales has implications for ultrafast and energy-efficient data-processing and storage applications. However, the possibility of realizing commercial technologies based on ultrafast spin dynamics has been hampered by our limited knowledge of the physics behind processes on this timescale. Recently, it has been suggested that inertial effects should be considered in the full description of the spin dynamics at these ultrafast timescales, but a clear observation of such effects in ferromagnets is still lacking. Here, we report direct experimental evidence of intrinsic inertial spin dynamics in ferromagnetic thin films in the form of a nutation of the magnetization at a frequency of ~0.5&#8201;THz. This allows us to reveal that the angular momentum relaxation time in ferromagnets is on the order of 10&#8201;ps.</p>",[],False,"[""Kumar Neeraj"", ""Nilesh Awari"", ""Sergey Kovalev"", ""Debanjan Polley"", ""Nanna Zhou Hagstr\u00f6m"", ""Sri Sai Phani Kanth Arekapudi"", ""Anna Semisalova"", ""Kilian Lenz"", ""Bertram Green"", ""Jan-Christoph Deinert"", ""Igor Ilyakov"", ""Min Chen"", ""Mohammed Bawatna"", ""Valentino Scalera"", ""Massimiliano d\u2019Aquino"", ""Claudio Serpico"", ""Olav Hellwig"", ""Jean-Eric Wegrowe"", ""Michael Gensch"", ""Stefano Bonetti""]","Neeraj, K., Awari, N., Kovalev, S. et al. Inertial spin dynamics in ferromagnets. Nat. Phys. 17, 245–250 (2021).",3561,128,3,aplusplus,10.1038/s41567-020-01040-y,https://doi.org/10.1038/s41567-020-01040-y,,2,nphys,nature physics,1601251200,2020-09-28,ferromagnetism;magnetic-properties-and-materials;magneto-optics;surfaces-interfaces-and-thin-films;ultrafast-lasers,https://www.nature.com/articles/s41567-020-01040-y,17
article,Topological defects in the nematic order of actin fibres as organization centres of Hydra morphogenesis,"<p>Animal morphogenesis arises from the complex interplay between multiple mechanical and biochemical processes with mutual feedback. Developing an effective, coarse-grained description of morphogenesis is essential for understanding how these processes are coordinated across scales to form robust, functional outcomes. Here we show that the nematic order of the supracellular actin fibres in regenerating Hydra defines a slowly varying field, whose dynamics provide an effective description of the morphogenesis process. We show that topological defects in this field, which are long-lived yet display rich dynamics, act as organization centres with morphological features developing at defect sites. These observations suggest that the nematic orientation field can be considered a &#8216;mechanical morphogen&#8217; whose dynamics, in conjugation with various biochemical and mechanical signalling processes, result in the robust emergence of functional patterns during morphogenesis.</p>",[],False,"[""Yonit Maroudas-Sacks"", ""Liora Garion"", ""Lital Shani-Zerbib"", ""Anton Livshits"", ""Erez Braun"", ""Kinneret Keren""]","Maroudas-Sacks, Y., Garion, L., Shani-Zerbib, L. et al. Topological defects in the nematic order of actin fibres as organization centres ofHydramorphogenesis. Nat. Phys. 17, 251–259 (2021).",1729,17,3,aplusplus,10.1038/s41567-020-01083-1,https://doi.org/10.1038/s41567-020-01083-1,,2,nphys,nature physics,1606089600,2020-11-23,biological-physics;biophysics,https://www.nature.com/articles/s41567-020-01083-1,17
article,Directional self-locomotion of active droplets enabled by nematic environment,"<p>Active matter composed of self-propelled interacting units holds a major promise for the extraction of useful work from its seemingly chaotic dynamics. Streamlining active matter is especially important at the microscale, where the viscous forces prevail over inertia and transport requires a non-reciprocal motion. Here we report that microscopic active droplets representing aqueous dispersions of swimming bacteria Bacillus subtilis become unidirectionally motile when placed in an inactive nematic liquid-crystal medium. Random motion of bacteria inside the droplet is rectified into a directional self-locomotion of the droplet by the polar director structure that the droplet creates in the surrounding nematic through anisotropic molecular interactions at its surface. Droplets without active swimmers show no net displacement. The trajectory of the active droplet can be predesigned by patterning the molecular orientation of the nematic. The effect demonstrates that broken spatial symmetry of the medium can be the reason for and the means to control directional microscale transport.</p>",[],False,"[""Mojtaba Rajabi"", ""Hend Baza"", ""Taras Turiv"", ""Oleg D. Lavrentovich""]","Rajabi, M., Baza, H., Turiv, T. et al. Directional self-locomotion of active droplets enabled by nematic environment. Nat. Phys. 17, 260–266 (2021).",1968,23,0,aplusplus,10.1038/s41567-020-01055-5,https://doi.org/10.1038/s41567-020-01055-5,,2,nphys,nature physics,1602460800,2020-10-12,biological-physics;liquid-crystals,https://www.nature.com/articles/s41567-020-01055-5,17
article,Theory of mechanochemical patterning and optimal migration in cell monolayers,"<p>Collective cell migration offers a rich field of study for non-equilibrium physics and cellular biology, revealing phenomena such as glassy dynamics, pattern formation and active turbulence. However, how mechanical and chemical signalling are integrated at the cellular level to give rise to such collective behaviours remains unclear. We address this by focusing on the highly conserved phenomenon of spatiotemporal waves of density and extracellular signal-regulated kinase (ERK) activation, which appear both in vitro and in vivo during collective cell migration and wound healing. First, we propose a biophysical theory, backed by mechanical and optogenetic perturbation experiments, showing that patterns can be quantitatively explained by a mechanochemical coupling between active cellular tensions and the mechanosensitive ERK pathway. Next, we demonstrate how this biophysical mechanism can robustly induce long-ranged order and migration in a desired orientation, and we determine the theoretically optimal wavelength and period for inducing maximal migration towards free edges, which fits well with experimentally observed dynamics. We thereby provide a bridge between the biophysical origin of spatiotemporal instabilities and the design principles of robust and efficient long-ranged migration.</p>",[],False,"[""Daniel Boocock"", ""Naoya Hino"", ""Natalia Ruzickova"", ""Tsuyoshi Hirashima"", ""Edouard Hannezo""]","Boocock, D., Hino, N., Ruzickova, N. et al. Theory of mechanochemical patterning and optimal migration in cell monolayers. Nat. Phys. 17, 267–274 (2021).",2489,129,3,aplusplus,10.1038/s41567-020-01037-7,https://doi.org/10.1038/s41567-020-01037-7,,2,nphys,nature physics,1601251200,2020-09-28,biological-physics;biophysics,https://www.nature.com/articles/s41567-020-01037-7,17
article,Capturing the continuous complexity of behaviour in Caenorhabditis elegans,"<p>Animal behaviour is often quantified through subjective, incomplete variables that mask essential dynamics. Here, we develop a maximally predictive behavioural-state space from multivariate measurements, in which the full instantaneous state is smoothly unfolded as a combination of short-time posture sequences. In the off-food behaviour of the roundworm Caenorhabditis elegans, we discover a low-dimensional state space dominated by three sets of cyclic trajectories corresponding to the worm&#8217;s basic stereotyped motifs: forward, backward and turning locomotion. We find similar results in the on-food behaviour of foraging worms and npr-1 mutants. In contrast to this broad stereotypy, we find variability in the presence of locally unstable dynamics with signatures of deterministic chaos: a collection of unstable periodic orbits together with a positive maximal Lyapunov exponent. The full Lyapunov spectrum is symmetric with positive, chaotic exponents driving variability balanced by negative, dissipative exponents driving stereotypy. The symmetry is indicative of damped&#8211;driven Hamiltonian dynamics underlying the worm&#8217;s movement control.</p>",[],False,"[""Tosif Ahamed"", ""Antonio C. Costa"", ""Greg J. Stephens""]","Ahamed, T., Costa, A.C. & Stephens, G.J. Capturing the continuous complexity of behaviour inCaenorhabditis elegans. Nat. Phys. 17, 275–283 (2021).",2034,75,1,aplusplus,10.1038/s41567-020-01036-8,https://doi.org/10.1038/s41567-020-01036-8,,2,nphys,nature physics,1601856000,2020-10-05,biological-physics;statistical-physics-thermodynamics-and-nonlinear-dynamics,https://www.nature.com/articles/s41567-020-01036-8,17
author correction,Author Correction: 15 years of Nature Physics,,[],True,"[""Alison Wright"", ""Ed Gerstner"", ""Richard Brierley"", ""Andreas Trabesinger"", ""May Chiao"", ""Iulia Georgescu"", ""Bart Verberck"", ""Luke Fleet"", ""Abigail Klopper"", ""Andrea Taroni"", ""Federico Levi"", ""Yun Li"", ""Jan Philip Kraack"", ""David Abergel"", ""Stefanie Reichert"", ""Nina Meinzer"", ""Elizaveta Dubrovina""]","Wright, A., Gerstner, E., Brierley, R. et al. Author Correction: 15 years ofNature Physics. Nat. Phys.(2020).",302,1,0,aplusplus,10.1038/s41567-020-01113-y,https://doi.org/10.1038/s41567-020-01113-y,,2,nphys,nature physics,1606176000,2020-11-24,,https://www.nature.com/articles/s41567-020-01113-y,17
publisher correction,Publisher Correction: A charge-density-wave topological semimetal,,[],True,"[""Wujun Shi"", ""Benjamin J. Wieder"", ""Holger L. Meyerheim"", ""Yan Sun"", ""Yang Zhang"", ""Yiwei Li"", ""Lei Shen"", ""Yanpeng Qi"", ""Lexian Yang"", ""Jagannath Jena"", ""Peter Werner"", ""Klaus Koepernik"", ""Stuart Parkin"", ""Yulin Chen"", ""Claudia Felser"", ""B. Andrei Bernevig"", ""Zhijun Wang""]","Shi, W., Wieder, B.J., Meyerheim, H.L. et al. Publisher Correction: A charge-density-wave topological semimetal. Nat. Phys.(2021).",348,1,0,aplusplus,10.1038/s41567-021-01169-4,https://doi.org/10.1038/s41567-021-01169-4,,2,nphys,nature physics,1610928000,2021-01-18,electronic-properties-and-materials;topological-matter,https://www.nature.com/articles/s41567-021-01169-4,17
measure for measure,Political union through science,,[],True,"[""Martin J. T. Milton""]","Milton, M.J.T. Political union through science. Nat. Phys. 17, 286 (2021).",101,1,0,aplusplus,10.1038/s41567-020-01155-2,https://doi.org/10.1038/s41567-020-01155-2,,2,nphys,nature physics,1612742400,2021-02-08,applied-physics;history;techniques-and-instrumentation,https://www.nature.com/articles/s41567-020-01155-2,17
