contentType,title,abstract,affiliations,authorization,authors,citation_text,count_accesses,count_altmetric,count_citations,documentType,doi,doi_url,focus,issue,journal_pcode,journal_title,publishedAt,publishedAtString,subjects,url,volume
letter,Negative representation and instability in democratic elections,"<p>The challenge of understanding the collective behaviours of social systems can benefit from methods and concepts from physics, not because humans are similar to electrons, but because certain large-scale behaviours can be understood without an understanding of the small-scale details, in much the same way that sound waves can be understood without an understanding of atoms. Democratic elections are one such behaviour. Over the past few decades, physicists have explored scaling patterns in voting and the dynamics of political opinion formation (for example, see refs. ). Here, we define the concepts of negative representation, in which a shift in electorate opinions produces a shift in the election outcome in the opposite direction, and electoral instability, in which an arbitrarily small change in electorate opinions can dramatically swing the election outcome, and prove that unstable elections necessarily contain negatively represented opinions. Furthermore, in the presence of low voter turnout, increasing polarization of the electorate can drive elections through a transition from a stable to an unstable regime, analogous to the phase transition by which some materials become ferromagnetic below their critical temperatures. Empirical data suggest that the United States&#8217; presidential elections underwent such a phase transition in the 1970s and have since become increasingly unstable.</p>",[],False,"[""Alexander F. Siegenfeld"", ""Yaneer Bar-Yam""]","Siegenfeld, A.F., Bar-Yam, Y. Negative representation and instability in democratic elections. Nat. Phys. 16, 186–190 (2020).",3846,12,4,aplusplus,10.1038/s41567-019-0739-6,https://doi.org/10.1038/s41567-019-0739-6,,2,nphys,nature physics,1578873600,2020-01-13,nonlinear-phenomena;phase-transitions-and-critical-phenomena,https://www.nature.com/articles/s41567-019-0739-6,16
article,Deeply virtual Compton scattering off the neutron,"<p>The three-dimensional structure of nucleons (protons and neutrons) is embedded in so-called generalized parton distributions, which are accessible from deeply virtual Compton scattering. In this process, a high-energy electron is scattered off a nucleon by exchanging a virtual photon. Then, a highly energetic real photon is emitted from one of the quarks inside the nucleon, which carries information on the quark&#8217;s transverse position and longitudinal momentum. By measuring the cross-section of deeply virtual Compton scattering, Compton form factors related to the generalized parton distributions can be extracted. Here, we report the observation of unpolarized deeply virtual Compton scattering off a deuterium target. From the measured photon-electroproduction cross-sections, we have extracted the cross-section of a quasifree neutron and a coherent deuteron. Due to the approximate isospin symmetry of quantum chromodynamics, we can determine the contributions from the different quark flavours to the helicity-conserved Compton form factors by combining our measurements with previous ones probing the proton&#8217;s internal structure. These results advance our understanding of the description of the nucleon structure, which is important to solve the proton spin puzzle.</p>",[],False,"[""M. Benali"", ""C. Desnault"", ""M. Mazouz"", ""Z. Ahmed"", ""H. Albataineh"", ""K. Allada"", ""K. A. Aniol"", ""V. Bellini"", ""W. Boeglin"", ""P. Bertin"", ""M. Brossard"", ""A. Camsonne"", ""M. Canan"", ""S. Chandavar"", ""C. Chen"", ""J.-P. Chen"", ""M. Defurne"", ""C. W. de Jager"", ""R. de Leo"", ""A. Deur"", ""L. El Fassi"", ""R. Ent"", ""D. Flay"", ""M. Friend"", ""E. Fuchey"", ""S. Frullani"", ""F. Garibaldi"", ""D. Gaskell"", ""A. Giusa"", ""O. Glamazdin"", ""S. Golge"", ""J. Gomez"", ""O. Hansen"", ""D. Higinbotham"", ""T. Holmstrom"", ""T. Horn"", ""J. Huang"", ""M. Huang"", ""G. M. Huber"", ""C. E. Hyde"", ""S. Iqbal"", ""F. Itard"", ""Ho. Kang"", ""Hy. Kang"", ""A. Kelleher"", ""C. Keppel"", ""S. Koirala"", ""I. Korover"", ""J. J. LeRose"", ""R. Lindgren"", ""E. Long"", ""M. Magne"", ""J. Mammei"", ""D. J. Margaziotis"", ""P. Markowitz"", ""A. Mart\u00ed Jim\u00e9nez-Arg\u00fcello"", ""F. Meddi"", ""D. Meekins"", ""R. Michaels"", ""M. Mihovilovic"", ""N. Muangma"", ""C. Mu\u00f1oz Camacho"", ""P. Nadel-Turonski"", ""N. Nuruzzaman"", ""R. Paremuzyan"", ""R. Pomatsalyuk"", ""A. Puckett"", ""V. Punjabi"", ""Y. Qiang"", ""A. Rakhman"", ""M. N. H. Rashad"", ""S. Riordan"", ""J. Roche"", ""G. Russo"", ""F. Sabati\u00e9"", ""K. Saenboonruang"", ""A. Saha"", ""B. Sawatzky"", ""L. Selvy"", ""A. Shahinyan"", ""S. Sirca"", ""P. Solvignon"", ""M. L. Sperduto"", ""R. Subedi"", ""V. Sulkosky"", ""C. Sutera"", ""W. A. Tobias"", ""G. M. Urciuoli"", ""D. Wang"", ""B. Wojtsekhowski"", ""H. Yao"", ""Z. Ye"", ""L. Zana"", ""X. Zhan"", ""J. Zhang"", ""B. Zhao"", ""Z. Zhao"", ""X. Zheng"", ""P. Zhu""]","Benali, M., Desnault, C., Mazouz, M. et al. Deeply virtual Compton scattering off the neutron. Nat. Phys. 16, 191–198 (2020).",1186,16,3,aplusplus,10.1038/s41567-019-0774-3,https://doi.org/10.1038/s41567-019-0774-3,,2,nphys,nature physics,1580083200,2020-01-27,experimental-nuclear-physics;experimental-particle-physics;phenomenology,https://www.nature.com/articles/s41567-019-0774-3,16
article,Accessing scrambling using matrix product operators,"<p>Scrambling, a process in which quantum information spreads over a complex quantum system, becoming inaccessible to simple probes, occurs in generic chaotic quantum many-body systems, ranging from spin chains to metals and even to black holes. Scrambling can be measured using out-of-time-ordered correlators (OTOCs), which are closely tied to the growth of Heisenberg operators. We present a general method to calculate OTOCs of local operators in one-dimensional systems based on approximating Heisenberg operators as matrix product operators (MPOs). Contrary to the common belief that such tensor network methods work only at early times, we show that the entire early growth region of the OTOC can be captured using an MPO approximation with modest bond dimension. We analytically establish the goodness of the approximation by showing that, if an appropriate OTOC is close to its initial value, then the associated Heisenberg operator has low entanglement across a given cut. We use the method to study scrambling in a chaotic spin chain with \(201\) sites. On the basis of these data and previous results, we conjecture a universal form for the dynamics of the OTOC near the wavefront. We show that this form collapses the chaotic spin chain data over more than 15 orders of magnitude.</p>",[],False,"[""Shenglong Xu"", ""Brian Swingle""]","Xu, S., Swingle, B. Accessing scrambling using matrix product operators. Nat. Phys. 16, 199–204 (2020).",2985,18,24,aplusplus,10.1038/s41567-019-0712-4,https://doi.org/10.1038/s41567-019-0712-4,,2,nphys,nature physics,1574035200,2019-11-18,magnetic-properties-and-materials;quantum-information,https://www.nature.com/articles/s41567-019-0712-4,16
article,Determining eigenstates and thermal states on a quantum computer using quantum imaginary time evolution,"<p>The accurate computation of Hamiltonian ground, excited and thermal states on quantum computers stands to impact many problems in the physical and computer sciences, from quantum simulation to machine learning. Given the challenges posed in constructing large-scale quantum computers, these tasks should be carried out in a resource-efficient way. In this regard, existing techniques based on phase estimation or variational algorithms display potential disadvantages; phase estimation requires deep circuits with ancillae, that are hard to execute reliably without error correction, while variational algorithms, while flexible with respect to circuit depth, entail additional high-dimensional classical optimization. Here, we introduce the quantum imaginary time evolution and quantum Lanczos algorithms, which are analogues of classical algorithms for finding ground and excited states. Compared with their classical counterparts, they require exponentially less space and time per iteration, and can be implemented without deep circuits and ancillae, or high-dimensional optimization. We furthermore discuss quantum imaginary time evolution as a subroutine to generate Gibbs averages through an analogue of minimally entangled typical thermal states. Finally, we demonstrate the potential of these algorithms via an implementation using exact classical emulation as well as through prototype circuits on the Rigetti quantum virtual machine and Aspen-1 quantum processing unit.</p>",[],True,"[""Mario Motta"", ""Chong Sun"", ""Adrian T. K. Tan"", ""Matthew J. O\u2019Rourke"", ""Erika Ye"", ""Austin J. Minnich"", ""Fernando G. S. L. Brand\u00e3o"", ""Garnet Kin-Lic Chan""]","Motta, M., Sun, C., Tan, A.T.K. et al. Determining eigenstates and thermal states on a quantum computer using quantum imaginary time evolution. Nat. Phys. 16, 205–210 (2020).",7715,6,31,aplusplus,10.1038/s41567-019-0704-4,https://doi.org/10.1038/s41567-019-0704-4,,2,nphys,nature physics,1573430400,2019-11-11,information-theory-and-computation;quantum-information;quantum-simulation,https://www.nature.com/articles/s41567-019-0704-4,16
article,Quantum control of an oscillator using a stimulated Josephson nonlinearity,"<p>Superconducting circuits extensively rely on the Josephson junction as a nonlinear electronic element for manipulating quantum information and mediating photon interactions. Despite continuing efforts in pushing the coherence of Josephson circuits, the best photon lifetimes have been demonstrated in microwave cavities. Nevertheless, architectures based on quantum memories require a qubit element for logical operations at the cost of introducing additional loss channels and limiting process fidelities. Here, we directly operate the oscillator as an isolated two-level system by tailoring its Hilbert space. Implementing a flux-tunable inductive coupling between two resonators, we can selectively Rabi drive the lowest eigenstates by dynamically activating a three-wave interaction through parametric flux modulation. Measuring the Wigner function confirms that we can prepare arbitrary states confined in the single-photon manifold, with measured coherence times limited by the oscillator intrinsic quality factor. This architectural shift in engineering oscillators with stimulated nonlinearity can be exploited for designing long-lived quantum modules and offers flexibility in studying non-equilibrium physics with photons in a field-programmable simulator.</p>",[],False,"[""Andrei Vrajitoarea"", ""Ziwen Huang"", ""Peter Groszkowski"", ""Jens Koch"", ""Andrew A. Houck""]","Vrajitoarea, A., Huang, Z., Groszkowski, P. et al. Quantum control of an oscillator using a stimulated Josephson nonlinearity. Nat. Phys. 16, 211–217 (2020).",5174,27,5,aplusplus,10.1038/s41567-019-0703-5,https://doi.org/10.1038/s41567-019-0703-5,,2,nphys,nature physics,1574035200,2019-11-18,quantum-information;quantum-optics;single-photons-and-quantum-effects;superconducting-devices,https://www.nature.com/articles/s41567-019-0703-5,16
article,Strong correlations and orbital texture in single-layer 1T-TaSe2,"<p>Strong electron correlation can induce Mott insulating behaviour and produce intriguing states of matter such as unconventional superconductivity and quantum spin liquids. Recent advances in van der Waals material synthesis enable the exploration of Mott systems in the two-dimensional limit. Here we report characterization of the local electronic properties of single- and few-layer 1T-TaSe<sub>2</sub> via spatial- and momentum-resolved spectroscopy involving scanning tunnelling microscopy and angle-resolved photoemission. Our results indicate that electron correlation induces a robust Mott insulator state in single-layer 1T-TaSe<sub>2</sub> that is accompanied by unusual orbital texture. Interlayer coupling weakens the insulating phase, as shown by reduction of the energy gap and quenching of the correlation-driven orbital texture in bilayer and trilayer 1T-TaSe<sub>2</sub>. This establishes single-layer 1T-TaSe<sub>2</sub> as a useful platform for investigating strong correlation physics in two dimensions.</p>",[],False,"[""Yi Chen"", ""Wei Ruan"", ""Meng Wu"", ""Shujie Tang"", ""Hyejin Ryu"", ""Hsin-Zon Tsai"", ""Ryan Lee"", ""Salman Kahn"", ""Franklin Liou"", ""Caihong Jia"", ""Oliver R. Albertini"", ""Hongyu Xiong"", ""Tao Jia"", ""Zhi Liu"", ""Jonathan A. Sobota"", ""Amy Y. Liu"", ""Joel E. Moore"", ""Zhi-Xun Shen"", ""Steven G. Louie"", ""Sung-Kwan Mo"", ""Michael F. Crommie""]","Chen, Y., Ruan, W., Wu, M. et al. Strong correlations and orbital texture in single-layer 1T-TaSe2. Nat. Phys. 16, 218–224 (2020).",7546,14,16,aplusplus,10.1038/s41567-019-0744-9,https://doi.org/10.1038/s41567-019-0744-9,,2,nphys,nature physics,1578268800,2020-01-06,electronic-properties-and-materials;quantum-fluids-and-solids;surfaces-interfaces-and-thin-films,https://www.nature.com/articles/s41567-019-0744-9,16
article,Electrical charging overcomes the bouncing barrier in planet formation,"<p>In protoplanetary disks, solid objects (so-called planetesimals) are formed from dust. Micrometre-sized dust grains grow into millimetre-sized aggregates. Once those aggregates have diameters exceeding a few centimetres, they become subject to concentration mechanisms such as the streaming instability, permitting the formation of self-gravitating clusters, which might eventually collapse into kilometre-sized planetesimals. However, for the streaming instability to set in, clumps spanning sizes from centimetres to decimetres are required in the centre of a protoplanetary disk. In the size range between millimetres and centimetres, aggregates bounce off each other rather than sticking together, and growth is stalled. Here we show in microgravity experiments that collisions between millimetre-sized grains lead to sufficient electrical charging for aggregation to bridge this gap between the bouncing barrier and the onset of the streaming instability. We computationally simulate aggregation and find that models agree with the experimental data only if electrical charging is present. We therefore propose that collisional charging may promote early growth in the size gap that current models of planetesimal formation cannot account for.</p>",[],False,"[""Tobias Steinpilz"", ""Kolja Joeris"", ""Felix Jungmann"", ""Dietrich Wolf"", ""Lothar Brendel"", ""Jens Teiser"", ""Troy Shinbrot"", ""Gerhard Wurm""]","Steinpilz, T., Joeris, K., Jungmann, F. et al. Electrical charging overcomes the bouncing barrier in planet formation. Nat. Phys. 16, 225–229 (2020).",2742,326,11,aplusplus,10.1038/s41567-019-0728-9,https://doi.org/10.1038/s41567-019-0728-9,,2,nphys,nature physics,1575849600,2019-12-09,astrophysical-dust;laboratory-astrophysics;planetary-science,https://www.nature.com/articles/s41567-019-0728-9,16
publisher correction,Publisher Correction: Determining eigenstates and thermal states on a quantum computer using quantum imaginary time evolution,,[],True,"[""Mario Motta"", ""Chong Sun"", ""Adrian T. K. Tan"", ""Matthew J. O\u2019Rourke"", ""Erika Ye"", ""Austin J. Minnich"", ""Fernando G. S. L. Brand\u00e3o"", ""Garnet Kin-Lic Chan""]","Motta, M., Sun, C., Tan, A.T.K. et al. Publisher Correction: Determining eigenstates and thermal states on a quantum computer using quantum imaginary time evolution. Nat. Phys. 16, 231 (2020).",996,1,2,aplusplus,10.1038/s41567-019-0756-5,https://doi.org/10.1038/s41567-019-0756-5,,2,nphys,nature physics,1574294400,2019-11-21,information-theory-and-computation;quantum-information;quantum-simulation,https://www.nature.com/articles/s41567-019-0756-5,16
publisher correction,Publisher Correction: Determining eigenstates and thermal states on a quantum computer using quantum imaginary time evolution,,[],True,"[""Mario Motta"", ""Chong Sun"", ""Adrian T. K. Tan"", ""Matthew J. O\u2019Rourke"", ""Erika Ye"", ""Austin J. Minnich"", ""Fernando G. S. L. Brand\u00e3o"", ""Garnet Kin-Lic Chan""]","Motta, M., Sun, C., Tan, A.T.K. et al. Publisher Correction: Determining eigenstates and thermal states on a quantum computer using quantum imaginary time evolution. Nat. Phys. 16, 231 (2020).",616,1,1,aplusplus,10.1038/s41567-020-0798-8,https://doi.org/10.1038/s41567-020-0798-8,,2,nphys,nature physics,1580256000,2020-01-29,information-theory-and-computation;quantum-information;quantum-simulation,https://www.nature.com/articles/s41567-020-0798-8,16
publisher correction,Publisher Correction: Mathematical languages shape our understanding of time in physics,,[],True,"[""Nicolas Gisin""]","Gisin, N. Publisher Correction: Mathematical languages shape our understanding of time in physics. Nat. Phys. 16, 231 (2020).",1813,26,0,aplusplus,10.1038/s41567-020-0794-z,https://doi.org/10.1038/s41567-020-0794-z,,2,nphys,nature physics,1579132800,2020-01-16,information-theory-and-computation;techniques-and-instrumentation,https://www.nature.com/articles/s41567-020-0794-z,16
measure for measure,Plenty of pitches,,[],True,"[""Fanny Gribenski""]","Gribenski, F. Plenty of pitches. Nat. Phys. 16, 232 (2020).",1956,7,0,aplusplus,10.1038/s41567-019-0707-1,https://doi.org/10.1038/s41567-019-0707-1,,2,nphys,nature physics,1580947200,2020-02-06,acoustics;history;scientific-community,https://www.nature.com/articles/s41567-019-0707-1,16
