contentType,title,abstract,abstract_google_cn,affiliations,authorization,authors,citation_text,count_accesses,count_altmetric,count_citations,documentType,doi,doi_url,focus,issue,journal_pcode,journal_title,publishedAt,publishedAtString,subjects,url,volume
article,Imaging chiral symmetry breaking from Kekulé bond order in graphene,"<p>Chirality&#8212;or &#8216;handedness&#8217;&#8212;is a symmetry property crucial to fields as diverse as biology, chemistry and high-energy physics. In graphene, chiral symmetry emerges naturally as a consequence of the carbon honeycomb lattice. This symmetry can be broken by interactions that couple electrons with opposite momenta in graphene. Here we directly visualize the formation of Kekul&#233; bond order, one such phase of broken chiral symmetry, in an ultraflat graphene sheet grown epitaxially on a copper substrate. We show that its origin lies in the interactions between individual vacancies in the copper substrate that are mediated electronically by the graphene. We show that this interaction causes the bonds in graphene to distort, creating a phase with broken chiral symmetry. The Kekul&#233; ordering is robust at ambient temperature and atmospheric conditions, indicating that intercalated atoms may be harnessed to drive graphene and other two-dimensional materials towards electronically desirable and exotic collective phases.</p>",,"[{'address': 'Department of Physics, Columbia University, New York, New York 10027, USA', 'authors': ['Christopher Gutiérrez', '\xa0&\xa0Abhay N. Pasupathy']}, {'address': 'Department of Chemistry and Chemical Biology, Cornell University, Ithaca, New York 14853, USA', 'authors': ['Cheol-Joo Kim', ',\xa0Lola Brown', '\xa0&\xa0Jiwoong Park']}, {'address': 'Department of Science and Mathematics, Fashion Institute of Technology, State University of New York, New York, New\xa0York 10001, USA', 'authors': ['Theanne Schiros']}, {'address': 'Stanford Synchrotron Radiation Lightsource, Stanford Linear Accelerator Center, Menlo Park, California 94025, USA', 'authors': ['Dennis Nordlund']}, {'address': 'Department of Physics, Laboratory of Atomic and Solid State Physics, Cornell University, Ithaca, New York 14853, USA', 'authors': ['Edward\xa0B. Lochocki', '\xa0&\xa0Kyle M. Shen']}, {'address': 'Kavli Institute at Cornell for Nanoscale Science, Ithaca, New York 14853, USA', 'authors': ['Kyle M. Shen', '\xa0&\xa0Jiwoong Park']}]",False,"['Christopher Gutiérrez', 'Cheol-Joo Kim', 'Lola Brown', 'Theanne Schiros', 'Dennis Nordlund', 'Edward\xa0B. Lochocki', 'Kyle M. Shen', 'Jiwoong Park', 'Abhay N. Pasupathy']","Gutiérrez, C., Kim, C., Brown, L. et al. Imaging chiral symmetry breaking from Kekulé bond order in graphene. Nature Phys12, 950–958 (2016).",1066,4,37,aplusplus,10.1038/nphys3776,https://doi.org/10.1038/nphys3776,,10,nphys,nature physics,1463961600,2016-05-23,electronic-properties-and-devices;electronic-properties-and-materials,https://www.nature.com/articles/nphys3776,12
article,Observation of quantum Hawking radiation and its entanglement in an analogue black hole,"<p>We observe spontaneous Hawking radiation, stimulated by quantum vacuum fluctuations, emanating from an analogue black hole in an atomic Bose&#8211;Einstein condensate. Correlations are observed between the Hawking particles outside the black hole and the partner particles inside. These correlations indicate an approximately thermal distribution of Hawking radiation. We find that the high-energy pairs are entangled, while the low-energy pairs are not, within the reasonable assumption that excitations with different frequencies are not correlated. The entanglement verifies the quantum nature of the Hawking radiation. The results are consistent with a driven oscillation experiment and a numerical simulation.</p>",,"[{'address': 'Department of Physics, Technion—Israel Institute of Technology, Technion City, Haifa 32000, Israel', 'authors': ['Jeff Steinhauer']}]",False,['Jeff Steinhauer'],"Steinhauer, J. Observation of quantum Hawking radiation and its entanglement in an analogue black hole. Nature Phys12, 959–965 (2016).",2382,772,162,aplusplus,10.1038/nphys3863,https://doi.org/10.1038/nphys3863,The biggest questions in science,10,nphys,nature physics,1471219200,2016-08-15,bose-einstein-condensates;single-photons-and-quantum-effects;ultracold-gases,https://www.nature.com/articles/nphys3863,12
article,Liquid explosions induced by X-ray laser pulses,"<p>Explosions are spectacular and intriguing phenomena that expose the dynamics of matter under extreme conditions. We investigated, using time-resolved imaging, explosions induced by ultraintense X-ray laser pulses in water drops and jets. Our observations revealed an explosive vaporization followed by high-velocity interacting flows of liquid and vapour, and by the generation of shock trains in the liquid jets. These flows are different from those previously observed in laser ablation, owing to a simpler spatial pattern of X-ray absorption. We show that the explosion dynamics in our experiments is consistent with a redistribution of absorbed energy, mediated by a pressure or shock wave in the liquid, and we model the effects of explosions, including their adverse impact on X-ray laser experiments. X-ray laser explosions have predictable dynamics that may prove useful for controlling the state of pure liquids over broad energy scales and timescales, and for triggering pressure-sensitive molecular dynamics in solutions.</p>",,"[{'address': 'Stanford PULSE Institute, Menlo Park, California 94025, USA', 'authors': ['Claudiu A. Stan', ',\xa0Hartawan Laksmono', '\xa0&\xa0Raymond G. Sierra']}, {'address': 'Linac Coherent Light Source, SLAC National Accelerator Laboratory, Menlo Park, California\xa094025, USA', 'authors': ['Despina Milathianaki', ',\xa0Marc Messerschmidt', ',\xa0Garth J. Williams', ',\xa0Jason E. Koglin', ',\xa0Thomas J. Lane', ',\xa0Matt\xa0J. Hayes', ',\xa0Serge A. H. Guillet', ',\xa0Mengning Liang', ',\xa0Andrew L. Aquila', ',\xa0Philip R. Willmott', ',\xa0Joseph\xa0S. Robinson', ',\xa0Karl L. Gumerlock', '\xa0&\xa0Sébastien Boutet']}, {'address': 'SUNCAT Center for Interface Science and Catalysis, SLAC National Accelerator Laboratory, Menlo Park, California 94025, USA', 'authors': ['Trevor\xa0A. McQueen']}, {'address': 'Paul Scherrer Institute, CH-5232 Villigen, Switzerland', 'authors': ['Philip R. Willmott']}, {'address': 'Max-Planck-Institut für medizinische Forschung, 69120 Heidelberg, Germany', 'authors': ['Sabine Botha', ',\xa0Karol Nass', ',\xa0Ilme Schlichting', '\xa0&\xa0Robert\xa0L. Shoeman']}, {'address': 'Department of Mechanical and Aerospace Engineering, Princeton University, Princeton, New Jersey 08544, USA', 'authors': ['Howard A. Stone']}]",False,"['Claudiu A. Stan', 'Despina Milathianaki', 'Hartawan Laksmono', 'Raymond G. Sierra', 'Trevor\xa0A. McQueen', 'Marc Messerschmidt', 'Garth J. Williams', 'Jason E. Koglin', 'Thomas J. Lane', 'Matt\xa0J. Hayes', 'Serge A. H. Guillet', 'Mengning Liang', 'Andrew L. Aquila', 'Philip R. Willmott', 'Joseph\xa0S. Robinson', 'Karl L. Gumerlock', 'Sabine Botha', 'Karol Nass', 'Ilme Schlichting', 'Robert\xa0L. Shoeman', 'Howard A. Stone', 'Sébastien Boutet']","Stan, C., Milathianaki, D., Laksmono, H. et al. Liquid explosions induced by X-ray laser pulses. Nature Phys12, 966–971 (2016).",1091,304,51,aplusplus,10.1038/nphys3779,https://doi.org/10.1038/nphys3779,,10,nphys,nature physics,1463961600,2016-05-23,fluid-dynamics;laser-material-processing;ultrafast-photonics;x-rays,https://www.nature.com/articles/nphys3779,12
article,Time reversal and holography with spacetime transformations,"<p>Wave control is usually performed by spatially engineering the properties of a medium. Because time and space play similar roles in wave propagation, manipulating time boundaries provides a complementary approach. Here, we experimentally demonstrate the relevance of this concept by introducing instantaneous time mirrors. We show with water waves that a sudden change of the effective gravity generates time-reversed waves that refocus at the source. We generalize this concept for all kinds of waves, introducing a universal framework which explains the effect of any time disruption on wave propagation. We show that sudden changes of the medium properties generate instant wave sources that emerge instantaneously from the entire space at the time disruption. The time-reversed waves originate from these &#8216;Cauchy sources&#8217;, which are the counterpart of Huygens virtual sources on a time boundary. It allows us to revisit the holographic method and introduce a new approach for wave&#160;control.</p>",,"[{'address': 'Institut Langevin, ESPCI, CNRS, PSL Research University, 1\xa0rue\xa0Jussieu, 75005\xa0Paris, France', 'authors': ['Vincent Bacot', ',\xa0Matthieu Labousse', ',\xa0Mathias Fink', '\xa0&\xa0Emmanuel Fort']}, {'address': 'Matière et Systèmes Complexes, Université Paris Diderot, CNRS 7057, Sorbonne Paris Cité, 10 Rue A. Domon et L. Duquet, 75013 Paris, France', 'authors': ['Matthieu Labousse']}, {'address': 'Laboratoire de Physique et Mécanique des Milieux Hétérogènes, ESPCI, CNRS, PSL Research University, 10\xa0rue\xa0Vauquelin, 75005\xa0Paris, France', 'authors': ['Antonin Eddi']}]",False,"['Vincent Bacot', 'Matthieu Labousse', 'Antonin Eddi', 'Mathias Fink', 'Emmanuel Fort']","Bacot, V., Labousse, M., Eddi, A. et al. Time reversal and holography with spacetime transformations. Nature Phys12, 972–977 (2016).",1029,113,45,aplusplus,10.1038/nphys3810,https://doi.org/10.1038/nphys3810,,10,nphys,nature physics,1468195200,2016-07-11,fluid-dynamics;optical-physics;physics,https://www.nature.com/articles/nphys3810,12
article,Explaining the dynamics of the ultra-relativistic third Van Allen radiation belt,"<p>Since the discovery of the Van&#160;Allen radiation belts over 50 years ago, an explanation for their complete dynamics has remained elusive. Especially challenging is understanding the recently discovered ultra-relativistic third electron radiation belt. Current theory asserts that loss in the heart of the outer belt, essential to the formation of the third belt, must be controlled by high-frequency plasma wave&#8211;particle scattering into the atmosphere, via whistler mode chorus, plasmaspheric hiss, or electromagnetic ion cyclotron waves. However, this has failed to accurately reproduce the third belt. Using a data-driven, time-dependent specification of ultra-low-frequency (ULF) waves we show for the first time how the third radiation belt is established as a simple, elegant consequence of storm-time extremely fast outward ULF wave transport. High-frequency wave&#8211;particle scattering loss into the atmosphere is not needed in this case. When rapid ULF wave transport coupled to a dynamic boundary is accurately specified, the sensitive dynamics controlling the enigmatic ultra-relativistic third radiation belt are naturally explained.</p>",,"[{'address': 'Department of Physics, University of Alberta, Edmonton, Alberta T6G 2G7, Canada', 'authors': ['I. R. Mann', ',\xa0L. G. Ozeke', ',\xa0K. R. Murphy', ',\xa0A. Kale', '\xa0&\xa0D. K. Milling']}, {'address': 'NASA Goddard Spaceflight Center, Code 674 Greenbelt, Maryland\xa020771, USA', 'authors': ['K. R. Murphy']}, {'address': 'The Aerospace Corporation, Los Angeles, California 90009, USA', 'authors': ['S. G. Claudepierre', '\xa0&\xa0D. L. Turner']}, {'address': 'Laboratory for Atmospheric and Space Physics, University of Colorado, Boulder, Colorado 80309, USA', 'authors': ['D. N. Baker']}, {'address': 'Mullard Space Science Laboratory, University College London, Holmbury St. Mary, Dorking, Surrey RH5 6NT, UK', 'authors': ['I. J. Rae']}, {'address': 'Institute for the Study of Earth, Oceans, and Space, University of New Hampshire, Durham, New Hampshire 03824-3525, USA', 'authors': ['A. J. Boyd', '\xa0&\xa0H. E. Spence']}, {'address': 'Space and Atmospheric Sciences, NIS-1, Los Alamos National Laboratory, Los Alamos, New Mexico 87544, USA', 'authors': ['G. D. Reeves']}, {'address': 'Space Weather Prediction Center, NOAA, Boulder, Colorado 80305, USA', 'authors': ['H. J. Singer']}, {'address': 'National Observatory of Athens, Institute for Astronomy, Astrophysics, Space Applications and Remote Sensing, 15236 Penteli, Greece', 'authors': ['S. Dimitrakoudis', '\xa0&\xa0I. A. Daglis']}, {'address': 'Department of Physics, National and Kapodistrian University of Athens, 15784 Athens, Greece', 'authors': ['I. A. Daglis']}, {'address': 'Department of Physics, Lancaster University, Lancaster, LA1 4YB, UK', 'authors': ['F. Honary']}]",False,"['I. R. Mann', 'L. G. Ozeke', 'K. R. Murphy', 'S. G. Claudepierre', 'D. L. Turner', 'D. N. Baker', 'I. J. Rae', 'A. Kale', 'D. K. Milling', 'A. J. Boyd', 'H. E. Spence', 'G. D. Reeves', 'H. J. Singer', 'S. Dimitrakoudis', 'I. A. Daglis', 'F. Honary']","Mann, I., Ozeke, L., Murphy, K. et al. Explaining the dynamics of the ultra-relativistic third Van Allen radiation belt. Nature Phys12, 978–983 (2016).",354,141,57,aplusplus,10.1038/nphys3799,https://doi.org/10.1038/nphys3799,,10,nphys,nature physics,1466380800,2016-06-20,astrophysical-plasmas;magnetospheric-physics,https://www.nature.com/articles/nphys3799,12
erratum,Erratum: Josephson φ0-junction in nanowire quantum dots,,,[],True,"['D. B. Szombati', 'S. Nadj-Perge', 'D. Car', 'S. R. Plissard', 'E. P. A. M. Bakkers', 'L. P. Kouwenhoven']","Szombati, D., Nadj-Perge, S., Car, D. et al. Erratum: Josephsonφ0-junction in nanowire quantum dots. Nature Phys12, 984 (2016).",230,1,0,aplusplus,10.1038/nphys3898,https://doi.org/10.1038/nphys3898,,10,nphys,nature physics,1475539200,2016-10-04,,https://www.nature.com/articles/nphys3898,12
measure for measure,A tale of two masses,,,"[{'address': 'Edmund G. Myers is in the Department of Physics, Florida State University, Tallahassee, Florida 32306-4350, USA', 'authors': ['Edmund G. Myers']}]",True,['Edmund G. Myers'],"Myers, E. A tale of two masses. Nature Phys12, 986 (2016).",73,6,1,aplusplus,10.1038/nphys3896,https://doi.org/10.1038/nphys3896,,10,nphys,nature physics,1475539200,2016-10-04,particle-physics;quantum-physics;scientific-community;techniques-and-instrumentation,https://www.nature.com/articles/nphys3896,12
