contentType,title,abstract,abstract_google_cn,affiliations,authorization,authors,citation_text,count_accesses,count_altmetric,count_citations,documentType,doi,doi_url,focus,issue,journal_pcode,journal_title,publishedAt,publishedAtString,subjects,url,volume
editorial,Onwards and upwards,,,[],True,[],"Onwards and upwards. Nature Phys7, 93 (2011).",41,0,0,aplusplus,10.1038/nphys1934,https://doi.org/10.1038/nphys1934,,2,nphys,nature physics,1296518400,2011-02-01,,https://www.nature.com/articles/nphys1934,7
thesis,Pleats are in fashion,,,[],True,['Mark Buchanan'],"Buchanan, M. Pleats are in fashion. Nature Phys7, 95 (2011).",16,0,0,aplusplus,10.1038/nphys1924,https://doi.org/10.1038/nphys1924,,2,nphys,nature physics,1296518400,2011-02-01,,https://www.nature.com/articles/nphys1924,7
research highlights,Our choice from the recent literature,,,[],True,[],"Our choice from the recent literature. Nature Phys7, 96 (2011).",4,0,0,aplusplus,10.1038/nphys1929,https://doi.org/10.1038/nphys1929,,2,nphys,nature physics,1296518400,2011-02-01,,https://www.nature.com/articles/nphys1929,7
news & views,Solid progress,,,"[{'address': 'Jon P. Marangos is at the Blackett Laboratory, Imperial College London, South Kensington, London SW7 2AZ, UK. j.marangos@imperial.ac.uk', 'authors': ['Jon P. Marangos']}]",False,['Jon P. Marangos'],"Marangos, J. Solid progress. Nature Phys7, 97–98 (2011).",128,1,8,aplusplus,10.1038/nphys1913,https://doi.org/10.1038/nphys1913,,2,nphys,nature physics,1296518400,2011-02-01,,https://www.nature.com/articles/nphys1913,7
news & views,Solutions for assembly,,,[],True,['Ed Gerstner'],"Gerstner, E. Solutions for assembly. Nature Phys7, 98 (2011).",9,0,5,aplusplus,10.1038/nphys1927,https://doi.org/10.1038/nphys1927,,2,nphys,nature physics,1296518400,2011-02-01,,https://www.nature.com/articles/nphys1927,7
news & views,Quantum glass forging,,,"[{'address': 'Francesco Zamponi is in the Laboratoire de Physique Théorique of Ecole Normale Supérieure, 24 Rue Lhomond, 75005 Paris, France. francesco.zamponi@lpt.ens.fr', 'authors': ['Francesco Zamponi']}]",False,['Francesco Zamponi'],"Zamponi, F. Quantum glass forging. Nature Phys7, 99–100 (2011).",38,1,7,aplusplus,10.1038/nphys1901,https://doi.org/10.1038/nphys1901,,2,nphys,nature physics,1294531200,2011-01-09,,https://www.nature.com/articles/nphys1901,7
news & views,Quantum pendula locked in,,,"[{'address': 'Adrian Lupascu is at the Institute for Quantum Computing, University of Waterloo, 200 University Avenue West, Waterloo, Ontario N2L 3G1, Canada. alupascu@iqc.ca', 'authors': ['Adrian Lupascu']}]",False,['Adrian Lupascu'],"Lupascu, A. Quantum pendula locked in. Nature Phys7, 100–101 (2011).",16,0,0,aplusplus,10.1038/nphys1917,https://doi.org/10.1038/nphys1917,,2,nphys,nature physics,1296518400,2011-02-01,,https://www.nature.com/articles/nphys1917,7
news & views,Orbital dance,,,"[{'address': 'Maciej Lewenstein is at the ICFO, Mediterranean Technology Park, 08860 Castelldefels (Barcelona), Spain, the ICREA, 08010 Barcelona, Spain, and the Kavli Institute for Theoretical Physics, University of California, Santa Barbara, California 93106, USA maciej.lewenstein@icfo.es', 'authors': ['Maciej Lewenstein']}, {'address': 'W. Vincent Liu is in the Department of Physics and Astronomy, University of Pittsburgh, Pittsburgh, Pennsylvania 15260, USA and the Kavli Institute for Theoretical Physics, University of California, Santa Barbara, California 93106, USA. w.vincent.liu@gmail.com', 'authors': ['W. Vincent Liu']}]",False,"['Maciej Lewenstein', 'W. Vincent Liu']","Lewenstein, M., Liu, W. Orbital dance. Nature Phys7, 101–103 (2011).",158,0,55,aplusplus,10.1038/nphys1894,https://doi.org/10.1038/nphys1894,,2,nphys,nature physics,1296518400,2011-02-01,,https://www.nature.com/articles/nphys1894,7
news & views,Happier for longer,,,"[{'address': 'Manfred Bayer is in the Department of Physics, Dortmund University of Technology, Otto-Hahn-Strasse 4, D-44221 Dortmund, Germany. manfred.bayer@tu-dortmund.de', 'authors': ['Manfred Bayer']}]",False,['Manfred Bayer'],"Bayer, M. Happier for longer. Nature Phys7, 103–104 (2011).",19,0,4,aplusplus,10.1038/nphys1922,https://doi.org/10.1038/nphys1922,,2,nphys,nature physics,1296518400,2011-02-01,,https://www.nature.com/articles/nphys1922,7
letter,Quantum fluctuations in the chirped pendulum,,,"[{'address': 'Department of Physics, Quantum Nanoelectronics Laboratory, University of California, Berkeley, California 94720, USA', 'authors': ['K. W. Murch', ',\xa0R. Vijay', ',\xa0O. Naaman', '\xa0&\xa0I. Siddiqi']}, {'address': 'Racah Institute of Physics, Hebrew University, Jerusalem 91904, Israel', 'authors': ['I. Barth', '\xa0&\xa0L. Friedland']}, {'address': 'National Institute of Standards and Technology, 325 Broadway, Boulder, Colorado 80305, USA', 'authors': ['J. Aumentado']}]",True,"['K. W. Murch', 'R. Vijay', 'I. Barth', 'O. Naaman', 'J. Aumentado', 'L. Friedland', 'I. Siddiqi']","Murch, K., Vijay, R., Barth, I. et al. Quantum fluctuations in the chirped pendulum. Nature Phys7, 105–108 (2011).",123,3,33,aplusplus,10.1038/nphys1867,https://doi.org/10.1038/nphys1867,,2,nphys,nature physics,1292716800,2010-12-19,,https://www.nature.com/articles/nphys1867,7
letter,Dephasing time of GaAs electron-spin qubits coupled to a nuclear bath exceeding 200 μs,,,"[{'address': 'Department of Physics, Harvard University, Cambridge, Massachusetts 02138, USA', 'authors': ['Hendrik Bluhm', ',\xa0Sandra Foletti', ',\xa0Izhar Neder', ',\xa0Mark Rudner', '\xa0&\xa0Amir Yacoby']}, {'address': 'Department of Condensed Matter Physics, Braun Center for Submicron Research, Weizmann Institute of Science, Rehovot 76100, Israel', 'authors': ['Diana Mahalu', '\xa0&\xa0Vladimir Umansky']}]",True,"['Hendrik Bluhm', 'Sandra Foletti', 'Izhar Neder', 'Mark Rudner', 'Diana Mahalu', 'Vladimir Umansky', 'Amir Yacoby']","Bluhm, H., Foletti, S., Neder, I. et al. Dephasing time of GaAs electron-spin qubits coupled to a nuclear bath exceeding 200 μs. Nature Phys7, 109–113 (2011).",1109,0,411,aplusplus,10.1038/nphys1856,https://doi.org/10.1038/nphys1856,,2,nphys,nature physics,1292112000,2010-12-12,,https://www.nature.com/articles/nphys1856,7
letter,Quantum interference between charge excitation paths in a solid-state Mott insulator,,,"[{'address': 'Department of Physics, Clarendon Laboratory, Oxford OX1 3PU, UK', 'authors': ['S. Wall', ',\xa0S. R. Clark', ',\xa0H. P. Ehrke', ',\xa0D. Jaksch', ',\xa0A. Ardavan', '\xa0&\xa0A. Cavalleri']}, {'address': 'Dipartimento di Fisica, IFN-CNR, Politecnico di Milano, Milano 20133, Italy', 'authors': ['D. Brida', ',\xa0S. Bonora', '\xa0&\xa0G. Cerullo']}, {'address': 'Centre for Quantum Technologies, National University of Singapore, Singapore 117543, Singapore', 'authors': ['S. R. Clark', '\xa0&\xa0D. Jaksch']}, {'address': 'Max Planck Research Group for Structural Dynamics, University of Hamburg-CFEL, 22607 Hamburg, Germany', 'authors': ['H. P. Ehrke', '\xa0&\xa0A. Cavalleri']}, {'address': 'Department of Advanced Materials Science, University of Tokyo, Kashiwa 277-8561, Japan', 'authors': ['H. Uemura', '\xa0&\xa0H. Okamoto']}, {'address': 'Department of Chemistry, Hokkaido University, Sapporo 060-0810, Japan', 'authors': ['Y. Takahashi']}, {'address': 'Photonics Research Institute, AIST, Tsukuba 305-8562, Japan', 'authors': ['T. Hasegawa', '\xa0&\xa0H. Okamoto']}, {'address': 'CREST-JST, Chiyoda-ku, Tokyo 102-0075, Japan', 'authors': ['H. Okamoto']}]",True,"['S. Wall', 'D. Brida', 'S. R. Clark', 'H. P. Ehrke', 'D. Jaksch', 'A. Ardavan', 'S. Bonora', 'H. Uemura', 'Y. Takahashi', 'T. Hasegawa', 'H. Okamoto', 'G. Cerullo', 'A. Cavalleri']","Wall, S., Brida, D., Clark, S. et al. Quantum interference between charge excitation paths in a solid-state Mott insulator. Nature Phys7, 114–118 (2011).",494,0,97,aplusplus,10.1038/nphys1831,https://doi.org/10.1038/nphys1831,,2,nphys,nature physics,1291507200,2010-12-05,,https://www.nature.com/articles/nphys1831,7
letter,Magnetically driven superconductivity in CeCu2Si2,,,"[{'address': 'Max-Planck-Institut für Chemische Physik fester Stoffe, 01187 Dresden, Germany', 'authors': ['O. Stockert', ',\xa0J. Arndt', ',\xa0C. Geibel', ',\xa0H. S. Jeevan', ',\xa0S. Kirchner', '\xa0&\xa0F. Steglich']}, {'address': 'Institut für Festkörperphysik, Technische Universität Dresden, 01062 Dresden, Germany', 'authors': ['E. Faulhaber', '\xa0&\xa0M. Loewenhaupt']}, {'address': 'Gemeinsame Forschergruppe Helmholtz-Zentrum Berlin — TU Dresden, 85747 Garching, Germany', 'authors': ['E. Faulhaber']}, {'address': 'I. Physikalisches Institut, Universität Göttingen, 37077 Göttingen, Germany', 'authors': ['H. S. Jeevan']}, {'address': 'Max-Planck-Institut für Physik komplexer Systeme, 01187 Dresden, Germany', 'authors': ['S. Kirchner']}, {'address': 'Jülich Centre for Neutron Science, Forschungszentrum Jülich, Outstation at Institut Laue–Langevin, 38042 Grenoble, France', 'authors': ['K. Schmalzl', '\xa0&\xa0W. Schmidt']}, {'address': 'Department of Physics and Astronomy, Rice University, Houston, Texas, 77005, USA', 'authors': ['Q. Si']}]",True,"['O. Stockert', 'J. Arndt', 'E. Faulhaber', 'C. Geibel', 'H. S. Jeevan', 'S. Kirchner', 'M. Loewenhaupt', 'K. Schmalzl', 'W. Schmidt', 'Q. Si', 'F. Steglich']","Stockert, O., Arndt, J., Faulhaber, E. et al. Magnetically driven superconductivity in CeCu2Si2. Nature Phys7, 119–124 (2011).",627,0,161,aplusplus,10.1038/nphys1852,https://doi.org/10.1038/nphys1852,,2,nphys,nature physics,1292112000,2010-12-12,,https://www.nature.com/articles/nphys1852,7
letter,Charge-induced vortex lattice instability,,,"[{'address': 'Department of Physics and Astronomy, Northwestern University, Evanston, Illinois 60208, USA', 'authors': ['A. M. Mounce', ',\xa0S. Oh', ',\xa0S. Mukhopadhyay', '\xa0&\xa0W. P. Halperin']}, {'address': 'National High Magnetic Field Laboratory, Tallahassee, Florida 32310, USA', 'authors': ['A. P. Reyes', '\xa0&\xa0P. L. Kuhns']}, {'address': 'Department of Physics, University of Tokyo, Tokyo 113-8656, Japan', 'authors': ['K. Fujita', ',\xa0M. Ishikado', '\xa0&\xa0S. Uchida']}]",True,"['A. M. Mounce', 'S. Oh', 'S. Mukhopadhyay', 'W. P. Halperin', 'A. P. Reyes', 'P. L. Kuhns', 'K. Fujita', 'M. Ishikado', 'S. Uchida']","Mounce, A., Oh, S., Mukhopadhyay, S. et al. Charge-induced vortex lattice instability. Nature Phys7, 125–128 (2011).",96,0,6,aplusplus,10.1038/nphys1835,https://doi.org/10.1038/nphys1835,,2,nphys,nature physics,1290902400,2010-11-28,,https://www.nature.com/articles/nphys1835,7
letter,Single vortex–antivortex pair in an exciton-polariton condensate,,,"[{'address': 'E. L. Ginzton Laboratory, Stanford University, Stanford, California, 94305, USA', 'authors': ['Georgios Roumpos', '\xa0&\xa0Yoshihisa Yamamoto']}, {'address': 'National Institute of Informatics, Tokyo, 101-8430, Japan', 'authors': ['Michael D. Fraser', '\xa0&\xa0Yoshihisa Yamamoto']}, {'address': 'Institute for Nano Quantum Information Electronics, University of Tokyo, Tokyo, 153-8505, Japan', 'authors': ['Michael D. Fraser']}, {'address': 'Technische Physik, University of Würzburg, Physikalisches Institut and Wilhelm-Conrad-Röntgen-Research Center for Complex Material Systems, Würzburg, 97074, Germany', 'authors': ['Andreas Löffler', ',\xa0Sven Höfling', '\xa0&\xa0Alfred Forchel']}]",True,"['Georgios Roumpos', 'Michael D. Fraser', 'Andreas Löffler', 'Sven Höfling', 'Alfred Forchel', 'Yoshihisa Yamamoto']","Roumpos, G., Fraser, M., Löffler, A. et al. Single vortex–antivortex pair in an exciton-polariton condensate. Nature Phys7, 129–133 (2011).",511,0,140,aplusplus,10.1038/nphys1841,https://doi.org/10.1038/nphys1841,,2,nphys,nature physics,1290902400,2010-11-28,,https://www.nature.com/articles/nphys1841,7
letter,Quantum fluctuations can promote or inhibit glass formation,,,"[{'address': 'Department of Chemistry, Columbia University, 3000 Broadway, New York, New York 10027, USA', 'authors': ['Thomas E. Markland', ',\xa0Joseph A. Morrone', ',\xa0Bruce J. Berne', '\xa0&\xa0David R. Reichman']}, {'address': 'Institute of Physics, University of Tsukuba, Tennodai 1-1-1, Tsukuba, 305-8571, Japan', 'authors': ['Kunimasa Miyazaki']}, {'address': 'School of Chemistry, The Sackler Faculty of Exact Sciences, Tel Aviv University, Tel Aviv 69978, Israel', 'authors': ['Eran Rabani']}]",True,"['Thomas E. Markland', 'Joseph A. Morrone', 'Bruce J. Berne', 'Kunimasa Miyazaki', 'Eran Rabani', 'David R. Reichman']","Markland, T., Morrone, J., Berne, B. et al. Quantum fluctuations can promote or inhibit glass formation. Nature Phys7, 134–137 (2011).",309,10,63,aplusplus,10.1038/nphys1865,https://doi.org/10.1038/nphys1865,,2,nphys,nature physics,1294531200,2011-01-09,,https://www.nature.com/articles/nphys1865,7
letter,Observation of high-order harmonic generation in a bulk crystal,,,"[{'address': 'PULSE Institute, SLAC National Accelerator Laboratory, Menlo Park, California, 94025, USA', 'authors': ['Shambhu Ghimire', '\xa0&\xa0David A. Reis']}, {'address': 'Physics Department, Ohio State University, Columbus, Ohio, 43210, USA', 'authors': ['Anthony D. DiChiara', ',\xa0Emily Sistrunk', ',\xa0Pierre Agostini', '\xa0&\xa0Louis F. DiMauro']}, {'address': 'Departments of Photon Science and Applied Physics, Stanford University, Stanford, California, 94305, USA', 'authors': ['David A. Reis']}]",True,"['Shambhu Ghimire', 'Anthony D. DiChiara', 'Emily Sistrunk', 'Pierre Agostini', 'Louis F. DiMauro', 'David A. Reis']","Ghimire, S., DiChiara, A., Sistrunk, E. et al. Observation of high-order harmonic generation in a bulk crystal. Nature Phys7, 138–141 (2011).",3572,21,591,aplusplus,10.1038/nphys1847,https://doi.org/10.1038/nphys1847,,2,nphys,nature physics,1291507200,2010-12-05,,https://www.nature.com/articles/nphys1847,7
letter,Biomolecular imaging and electronic damage using X-ray free-electron lasers,,,"[{'address': 'ARC Centre of Excellence for Coherent X-ray Science, School of Physics, The University of Melbourne, Victoria, 3010, Australia', 'authors': ['Harry M. Quiney', '\xa0&\xa0Keith A. Nugent']}]",True,"['Harry M. Quiney', 'Keith A. Nugent']","Quiney, H., Nugent, K. Biomolecular imaging and electronic damage using X-ray free-electron lasers. Nature Phys7, 142–146 (2011).",143,1,87,aplusplus,10.1038/nphys1859,https://doi.org/10.1038/nphys1859,,2,nphys,nature physics,1292716800,2010-12-19,,https://www.nature.com/articles/nphys1859,7
article,Evidence for orbital superfluidity in the P-band of a bipartite optical square lattice,"<p>The successful emulation of the Hubbard model in optical lattices has stimulated extensive efforts to extend their scope to also capture more complex, incompletely understood scenarios of many-body physics. A promising approach is to consider higher bands, where the orbital degree of freedom gives rise to a structural diversity that is directly relevant, for example, for the physics of strongly correlated electronic matter. Here we report evidence for the formation of a superfluid in the P-band of a bipartite optical square lattice with S-orbits and P-orbits arranged in a chequerboard pattern. The observed momentum spectra feature cross-dimensional coherence with a lifetime of nearly 20&#8201;ms. Depending on the value of a small adjustable anisotropy of the lattice, our findings are explained either by real-valued striped superfluid order parameters with different orientations P<sub>x</sub>&#177;P<sub>y</sub>, or by a complex-valued P<sub>x</sub>&#177;i P<sub>y</sub> order parameter, which breaks time-reversal symmetry.</p>",,"[{'address': 'Institut für Laser-Physik, Universität Hamburg, Luruper Chaussee 149, 22761 Hamburg, Germany', 'authors': ['Georg Wirth', ',\xa0Matthias Ölschläger', '\xa0&\xa0Andreas Hemmerich']}]",False,"['Georg Wirth', 'Matthias Ölschläger', 'Andreas Hemmerich']","Wirth, G., Ölschläger, M. & Hemmerich, A. Evidence for orbital superfluidity in theP-band of a bipartite optical square lattice. Nature Phys7, 147–153 (2011).",561,7,200,aplusplus,10.1038/nphys1857,https://doi.org/10.1038/nphys1857,,2,nphys,nature physics,1292112000,2010-12-12,,https://www.nature.com/articles/nphys1857,7
article,Antibunching of microwave-frequency photons observed in correlation measurements using linear detectors,"<p>At optical frequencies the radiation produced by a source, such as a laser, a black body or a single-photon emitter, is frequently characterized by analysing the temporal correlations of emitted photons using single-photon counters. At microwave frequencies, however, there are no efficient single-photon counters yet. Instead, well-developed linear amplifiers allow for efficient measurement of the amplitude of an electromagnetic field. Here, we demonstrate first- and second-order correlation function measurements of a pulsed microwave-frequency single-photon source integrated on the same chip with a 50/50 beam splitter followed by linear amplifiers and quadrature amplitude detectors. We clearly observe single-photon coherence in first-order and photon antibunching in second-order correlation function measurements of the propagating fields.</p>",,"[{'address': 'Department of Physics, ETH Zürich, CH-8093, Zürich, Switzerland', 'authors': ['D. Bozyigit', ',\xa0C. Lang', ',\xa0L. Steffen', ',\xa0J. M. Fink', ',\xa0C. Eichler', ',\xa0M. Baur', ',\xa0R. Bianchetti', ',\xa0P. J. Leek', ',\xa0S. Filipp', '\xa0&\xa0A. Wallraff']}, {'address': 'Département de Physique, Université de Sherbrooke, Sherbrooke, Québec, J1K 2R1, Canada', 'authors': ['M. P. da Silva', '\xa0&\xa0A. Blais']}]",False,"['D. Bozyigit', 'C. Lang', 'L. Steffen', 'J. M. Fink', 'C. Eichler', 'M. Baur', 'R. Bianchetti', 'P. J. Leek', 'S. Filipp', 'M. P. da Silva', 'A. Blais', 'A. Wallraff']","Bozyigit, D., Lang, C., Steffen, L. et al. Antibunching of microwave-frequency photons observed in correlation measurements using linear detectors. Nature Phys7, 154–158 (2011).",847,1,167,aplusplus,10.1038/nphys1845,https://doi.org/10.1038/nphys1845,,2,nphys,nature physics,1291507200,2010-12-05,,https://www.nature.com/articles/nphys1845,7
article,Strong interactions of single atoms and photons near a dielectric boundary,"<p>Cavity quantum electrodynamics provides the setting for quantum control of strong interactions between a single atom and one photon. Many such atom&#8211;cavity systems interacting by coherent exchanges of single photons could be the basis for scalable quantum networks. However, moving beyond current proof-of-principle experiments involving just one or two conventional optical cavities requires the localization of individual atoms at distances &#8818;100&#8201;nm from a resonator&#8217;s surface. In this regime an atom can be strongly coupled to a single intracavity photon while at the same time experiencing significant radiative interactions with the dielectric boundaries of the resonator. Here, we report using real-time detection and high-bandwidth feedback to select and monitor single caesium atoms located &#8764;100&#8201;nm from the surface of a microtoroidal optical resonator. Strong radiative interactions of atom and cavity field probe atomic motion through the evanescent field of the resonator and reveal both the significant role of Casimir&#8211;Polder attraction and the manifestly quantum nature of the atom&#8211;cavity dynamics.</p>",,"[{'address': 'Norman Bridge Laboratory of Physics 12-33, California Institute of Technology, Pasadena, California 91125, USA', 'authors': ['D. J. Alton', ',\xa0N. P. Stern', '\xa0&\xa0H. J. Kimble']}, {'address': 'Department of Physics, Kyoto University, Kyoto 606-8502, Japan', 'authors': ['Takao Aoki']}, {'address': 'T. J. Watson Laboratory of Applied Physics 128-95, California Institute of Technology, Pasadena, California 91125, USA', 'authors': ['H. Lee', ',\xa0E. Ostby', '\xa0&\xa0K. J. Vahala']}]",False,"['D. J. Alton', 'N. P. Stern', 'Takao Aoki', 'H. Lee', 'E. Ostby', 'K. J. Vahala', 'H. J. Kimble']","Alton, D., Stern, N., Aoki, T. et al. Strong interactions of single atoms and photons near a dielectric boundary. Nature Phys7, 159–165 (2011).",303,0,79,aplusplus,10.1038/nphys1837,https://doi.org/10.1038/nphys1837,,2,nphys,nature physics,1290297600,2010-11-21,,https://www.nature.com/articles/nphys1837,7
article,A 1.8-THz quantum cascade laser operating significantly above the temperature of ℏω/kB,"<p>Several competing technologies continue to advance the field of terahertz science; of particular importance has been the development of a terahertz semiconductor quantum cascade laser (QCL), which is arguably the only solid-state terahertz source with average optical power levels of much greater than a milliwatt. Terahertz QCLs are required to be cryogenically cooled and improvement of their temperature performance is the single most important research goal in the field. Thus far, their maximum operating temperature has been empirically limited to &#8764;&#8463;&#969;/k<sub>B</sub>, a largely inexplicable trend that has bred speculation that a room-temperature terahertz QCL may not be possible in materials used at present. Here, we argue that this behaviour is an indirect consequence of the resonant-tunnelling injection mechanism employed in all previously reported terahertz QCLs. We demonstrate a new scattering-assisted injection scheme to surpass this limit for a 1.8-THz QCL that operates up to &#8764;1.9&#8463;&#969;/k<sub>B</sub> (163&#8201;K). Peak optical power in excess of 2&#8201;mW was detected from the laser at 155&#8201;K. This development should make QCL technology attractive for applications below 2&#8201;THz, and initiate new design strategies for realizing a room-temperature terahertz semiconductor laser.</p>",,"[{'address': 'Department of Electrical Engineering and Computer Science and Research Laboratory of Electronics, Massachusetts Institute of Technology, Cambridge, Massachusetts, 02139, USA', 'authors': ['Sushil Kumar', ',\xa0Chun Wang I. Chan', '\xa0&\xa0Qing Hu']}, {'address': 'Sandia National Laboratories, Center of Integrated Nanotechnologies, Albuquerque, New Mexico, 87185, USA', 'authors': ['John L. Reno']}]",False,"['Sushil Kumar', 'Chun Wang I. Chan', 'Qing Hu', 'John L. Reno']","Kumar, S., Chan, C., Hu, Q. et al.A 1.8-THz quantum cascade laser operating significantly above the temperature ofℏω/kB. Nature Phys7, 166–171 (2011).",218,3,125,aplusplus,10.1038/nphys1846,https://doi.org/10.1038/nphys1846,,2,nphys,nature physics,1292112000,2010-12-12,,https://www.nature.com/articles/nphys1846,7
article,Femtosecond coherence and quantum control of single molecules at room temperature,"<p>Quantum-mechanical phenomena, such as electronic coherence and entanglement, play a key role in several remarkably efficient natural processes including ultrafast electronic energy transfer and charge separation in photosynthetic light-harvesting. To gain insight into such dynamic processes of biomolecules it is vital to reveal relations between structural and quantum-mechanical properties. However, ensemble experiments targeting ultrafast coherences are hampered by the large intrinsic heterogeneity in these systems at physiological conditions, and single-molecule techniques have not been available until now. Here we show, by employing femtosecond pulse-shaping techniques, that quantum coherences in single organic molecules can be created, probed and manipulated at ambient conditions even in highly disordered solid environments. We find broadly distributed coherence decay times for different individual molecules giving direct insight into the structural heterogeneity of the local surroundings. Most importantly, we induce Rabi oscillations and control the coherent superposition state in a single molecule, thus carrying out a basic femtosecond single-qubit operation at room temperature.</p>",,"[{'address': 'ICFO—Institut de Ciencies Fotoniques, Mediterranean Technology Park, 08860 Castelldefels (Barcelona), Spain', 'authors': ['Richard Hildner', ',\xa0Daan Brinks', '\xa0&\xa0Niek F. van Hulst']}, {'address': 'ICREA—Institucio Catalana de Recerca i Estudis Avancats, 08015 Barcelona, Spain', 'authors': ['Niek F. van Hulst']}]",False,"['Richard Hildner', 'Daan Brinks', 'Niek F. van Hulst']","Hildner, R., Brinks, D. & van Hulst, N. Femtosecond coherence and quantum control of single molecules at room temperature. Nature Phys7, 172–177 (2011).",357,10,106,aplusplus,10.1038/nphys1858,https://doi.org/10.1038/nphys1858,,2,nphys,nature physics,1292112000,2010-12-12,,https://www.nature.com/articles/nphys1858,7
