contentType,title,abstract,affiliations,authorization,authors,citation_text,count_accesses,count_altmetric,count_citations,documentType,doi,doi_url,focus,issue,journal_pcode,journal_title,publishedAt,publishedAtString,subjects,url,volume
editorial,A problem shared is a problem halved,,[],True,[],"A problem shared is a problem halved. Nature Phys15, 107 (2019).",2510,51,1,aplusplus,10.1038/s41567-019-0434-7,https://doi.org/10.1038/s41567-019-0434-7,Viewpoints on data and code sharing,2,nphys,nature physics,1548979200,2019-02-01,numerical-data;research-data,https://www.nature.com/articles/s41567-019-0434-7,15
thesis,Searching for civilization,,[],True,"[""Mark Buchanan""]","Buchanan, M. Searching for civilization. Nature Phys15, 108 (2019).",717,8,0,aplusplus,10.1038/s41567-019-0423-x,https://doi.org/10.1038/s41567-019-0423-x,,2,nphys,nature physics,1548979200,2019-02-01,astronomy-and-planetary-science;scientific-community-and-society,https://www.nature.com/articles/s41567-019-0423-x,15
books & arts,Eye in the sky,,[],True,"[""Niccol\u00f2 Tempini""]","Tempini, N. Eye in the sky. Nature Phys15, 109 (2019).",559,3,0,aplusplus,10.1038/s41567-019-0422-y,https://doi.org/10.1038/s41567-019-0422-y,,2,nphys,nature physics,1548979200,2019-02-01,computer-science;science-in-culture,https://www.nature.com/articles/s41567-019-0422-y,15
research highlight,The long and short of it,,[],True,"[""Abigail Klopper""]","Klopper, A. The long and short of it. Nature Phys15, 110 (2019).",507,1,0,aplusplus,10.1038/s41567-019-0429-4,https://doi.org/10.1038/s41567-019-0429-4,,2,nphys,nature physics,1548979200,2019-02-01,biological-physics;biophysics;metabolism,https://www.nature.com/articles/s41567-019-0429-4,15
research highlight,Two at once,,[],True,"[""David Abergel""]","Abergel, D. Two at once. Nature Phys15, 110 (2019).",551,2,0,aplusplus,10.1038/s41567-019-0430-y,https://doi.org/10.1038/s41567-019-0430-y,,2,nphys,nature physics,1548979200,2019-02-01,ferroelectrics-and-multiferroics;magnetic-properties-and-materials;phase-transitions-and-critical-phenomena,https://www.nature.com/articles/s41567-019-0430-y,15
research highlight,Chilling motion,,[],True,"[""Federico Levi""]","Levi, F. Chilling motion. Nature Phys15, 110 (2019).",412,7,0,aplusplus,10.1038/s41567-019-0431-x,https://doi.org/10.1038/s41567-019-0431-x,,2,nphys,nature physics,1548979200,2019-02-01,quantum-information;thermodynamics,https://www.nature.com/articles/s41567-019-0431-x,15
research highlight,Common ground,,[],True,"[""Stefanie Reichert""]","Reichert, S. Common ground. Nature Phys15, 110 (2019).",486,2,1,aplusplus,10.1038/s41567-019-0432-9,https://doi.org/10.1038/s41567-019-0432-9,,2,nphys,nature physics,1548979200,2019-02-01,quantum-metrology;single-photons-and-quantum-effects;techniques-and-instrumentation,https://www.nature.com/articles/s41567-019-0432-9,15
research highlight,Explore the bad,,[],True,"[""Yun Li""]","Li, Y. Explore the bad. Nature Phys15, 110 (2019).",465,1,0,aplusplus,10.1038/s41567-019-0433-8,https://doi.org/10.1038/s41567-019-0433-8,,2,nphys,nature physics,1548979200,2019-02-01,condensed-matter-physics;ultracold-gases,https://www.nature.com/articles/s41567-019-0433-8,15
news & views,Quantum fractals,,[],True,"[""Dario Bercioux"", ""Ainhoa I\u00f1iguez""]","Bercioux, D., Iñiguez, A. Quantum fractals. Nature Phys15, 111–112 (2019).",2423,17,2,aplusplus,10.1038/s41567-018-0327-1,https://doi.org/10.1038/s41567-018-0327-1,,2,nphys,nature physics,1541980800,2018-11-12,electronic-devices;electronic-properties-and-materials,https://www.nature.com/articles/s41567-018-0327-1,15
perspective,Open is not enough,,[],True,"[""Xiaoli Chen"", ""S\u00fcnje Dallmeier-Tiessen"", ""Robin Dasler"", ""Sebastian Feger"", ""Pamfilos Fokianos"", ""Jose Benito Gonzalez"", ""Harri Hirvonsalo"", ""Dinos Kousidis"", ""Artemis Lavasa"", ""Salvatore Mele"", ""Diego Rodriguez Rodriguez"", ""Tibor \u0160imko"", ""Tim Smith"", ""Ana Trisovic"", ""Anna Trzcinska"", ""Ioannis Tsanaktsidis"", ""Markus Zimmermann"", ""Kyle Cranmer"", ""Lukas Heinrich"", ""Gordon Watts"", ""Michael Hildreth"", ""Lara Lloret Iglesias"", ""Kati Lassila-Perini"", ""Sebastian Neubert""]","Chen, X., Dallmeier-Tiessen, S., Dasler, R. et al. Open is not enough. Nature Phys15, 113–119 (2019).",15000,163,38,aplusplus,10.1038/s41567-018-0342-2,https://doi.org/10.1038/s41567-018-0342-2,Challenges in irreproducible research;Expert Recommendations in physical sciences,2,nphys,nature physics,1542240000,2018-11-15,particle-physics;publishing;research-management,https://www.nature.com/articles/s41567-018-0342-2,15
letter,Isotopic variation of parity violation in atomic ytterbium,"<p>The weak force is the only fundamental interaction known to violate the symmetry with respect to spatial inversion (parity). This parity violation can be used to isolate the effects of the weak interaction in atomic systems, providing a unique, low-energy test of the standard model (see, for example, reviews). These experiments are primarily sensitive to the weak force between the valence electrons and the nucleus, mediated by the neutral Z<sup>0</sup> boson and dependent on the weak charge of the nucleus, Q<sub>w</sub>. The standard model parameter Q<sub>w</sub> was most precisely determined in caesium and has provided a stringent test of the standard model at low energy. The standard model also predicts a variation of Q<sub>w</sub> with the number of neutrons in the nucleus, an effect whose direct observation we are reporting here. Our studies, made on a chain of ytterbium isotopes, provide a measurement of isotopic variation in atomic parity violation, confirm the predicted standard model Q<sub>w</sub> scaling and offer information about an additional Z&#8242; boson.</p>",[],False,"[""D. Antypas"", ""A. Fabricant"", ""J. E. Stalnaker"", ""K. Tsigutkin"", ""V. V. Flambaum"", ""D. Budker""]","Antypas, D., Fabricant, A., Stalnaker, J.E. et al. Isotopic variation of parity violation in atomic ytterbium. Nature Phys15, 120–123 (2019).",3830,63,15,aplusplus,10.1038/s41567-018-0312-8,https://doi.org/10.1038/s41567-018-0312-8,,2,nphys,nature physics,1540771200,2018-10-29,atomic-and-molecular-physics;nuclear-physics;particle-physics,https://www.nature.com/articles/s41567-018-0312-8,15
letter,A photon–photon quantum gate based on Rydberg interactions,"<p>The interaction between Rydberg states of neutral atoms is strong and long-range, making it appealing to put it to use in the context of quantum technologies. Recently, first applications of this idea have been reported in the fields of quantum computation and quantum simulation. Furthermore, electromagnetically induced transparency allows one to map these Rydberg interactions to light. Here we exploit this mapping and the resulting interaction between photons to realize a photon&#8211;photon quantum gate, demonstrating the potential of Rydberg systems as a platform also for quantum communication and quantum networking. We measure a controlled-NOT truth table with a fidelity of 70(8)% and an entangling-gate fidelity of 63.7(4.5)%, both post-selected upon detection of a control and a target photon. The level of control reached here is an encouraging step towards exploring novel many-body states of photons or for future applications in quantum communication and quantum networking.</p>",[],False,"[""Daniel Tiarks"", ""Steffen Schmidt-Eberle"", ""Thomas Stolz"", ""Gerhard Rempe"", ""Stephan D\u00fcrr""]","Tiarks, D., Schmidt-Eberle, S., Stolz, T. et al.A photon–photon quantum gate based on Rydberg interactions. Nature Phys15, 124–126 (2019).",6069,32,40,aplusplus,10.1038/s41567-018-0313-7,https://doi.org/10.1038/s41567-018-0313-7,,2,nphys,nature physics,1540771200,2018-10-29,atomic-and-molecular-interactions-with-photons;quantum-information;quantum-optics;qubits,https://www.nature.com/articles/s41567-018-0313-7,15
letter,Design and characterization of electrons in a fractal geometry,"<p>The dimensionality of an electronic quantum system is decisive for its properties. In one dimension, electrons form a Luttinger liquid, and in two dimensions, they exhibit the quantum Hall effect. However, very little is known about the behaviour of electrons in non-integer, or fractional dimensions. Here, we show how arrays of artificial atoms can be defined by controlled positioning of CO molecules on a Cu (111) surface, and how these sites couple to form electronic Sierpi&#324;ski fractals. We characterize the electron wavefunctions at different energies with scanning tunnelling microscopy and spectroscopy, and show that they inherit the fractional dimension. Wavefunctions delocalized over the Sierpi&#324;ski structure decompose into self-similar parts at higher energy, and this scale invariance can also be retrieved in reciprocal space. Our results show that electronic quantum fractals can be artificially created by atomic manipulation in a scanning tunnelling microscope. The same methodology will allow future studies to address fundamental questions about the effects of spin&#8211;orbit interactions and magnetic fields on electrons in non-integer dimensions. Moreover, the rational concept of artificial atoms can readily be transferred to planar semiconductor electronics, allowing for the exploration of electrons in a well-defined fractal geometry, including interactions and external fields.</p>",[],False,"[""S. N. Kempkes"", ""M. R. Slot"", ""S. E. Freeney"", ""S. J. M. Zevenhuizen"", ""D. Vanmaekelbergh"", ""I. Swart"", ""C. Morais Smith""]","Kempkes, S.N., Slot, M.R., Freeney, S.E. et al. Design and characterization of electrons in a fractal geometry. Nature Phys15, 127–131 (2019).",20000,91,52,aplusplus,10.1038/s41567-018-0328-0,https://doi.org/10.1038/s41567-018-0328-0,,2,nphys,nature physics,1541980800,2018-11-12,electronic-properties-and-materials,https://www.nature.com/articles/s41567-018-0328-0,15
letter,Plasmonic dynamics measured with frequency-comb-referenced phase spectroscopy,"<p>The strong confinement of surface plasmons&#8217; optical fields at metal surfaces makes them highly sensitive to the structural shape and refractive index change of target biological, chemical or atomic species. This has made surface plasmon resonance a widely applicable sensing technique. Plasmonic metrology is primarily based on the spectral shift of the scattering intensity spectrum. Although broadband phase spectra are known to provide richer information on target samples as opposed to intensity spectra, direct acquisition of broadband phase spectra in plasmonics has been made difficult by the lack of highly stabilized light sources. Here, we demonstrate that frequency-comb-referenced phase spectroscopy provides high speed, high resolution, and high linearity with respect to plasmonic rulers, with direct traceability to a time standard. As a demonstration, we measure the 1.94&#8201;&#197; dynamic motion of a pair of nanoholes with a resolution of 1.67&#8201;pm. The interaction through the propagation of the plasmonic field is enhanced by a factor of 155 compared to the physical sample length. Our realization of a fast and robust plasmonic ruler with picometre resolution makes it possible to obtain high-precision plasmonic phase spectroscopy for in-depth analysis of the dynamics of samples in nanoscopic volumes.</p>",[],False,"[""Nguyen Duy Anh"", ""Byung Jae Chun"", ""Sungho Choi"", ""Dong-Eon Kim"", ""Seungchul Kim"", ""Young-Jin Kim""]","Anh, N.D., Chun, B.J., Choi, S. et al. Plasmonic dynamics measured with frequency-comb-referenced phase spectroscopy. Nature Phys15, 132–137 (2019).",4383,4,3,aplusplus,10.1038/s41567-018-0330-6,https://doi.org/10.1038/s41567-018-0330-6,,2,nphys,nature physics,1541376000,2018-11-05,sub-wavelength-optics;ultrafast-photonics,https://www.nature.com/articles/s41567-018-0330-6,15
letter,Enhanced energy coupling for indirectly driven inertial confinement fusion,"<p>Recent experiments in the study of inertial confinement fusion (ICF) at the National Ignition Facility (NIF) in the United States have reached the so-called alpha-heating regime, in which the self-heating by fusion products becomes dominant, with neutron yields now exceeding 1&#8201;&#215;&#8201;10<sup>16</sup> (ref. ) However, there are still challenges on the path towards ignition, such as minimization of the drive asymmetry, suppression of laser-plasma instabilities, and mitigation of fabrication features. In addition, in the current cylindrical-hohlraum indirect drive schemes for ICF, a strong limitation is the inefficient (&#8804;10%) absorption of the laser-produced hohlraum X-rays by the capsule as set by relative capsule-to-hohlraum surface areas. Here we report an experiment demonstrating ~30% energy coupling to an aluminium capsule in a rugby-shaped, gold hohlraum. This high coupling efficiency can substantially increase the tolerance to residual imperfections and improve the prospects for ignition, both in mainline single-shell hot-spot designs and potential double-shell targets.</p>",[],False,"[""Y. Ping"", ""V. A. Smalyuk"", ""P. Amendt"", ""R. Tommasini"", ""J. E. Field"", ""S. Khan"", ""D. Bennett"", ""E. Dewald"", ""F. Graziani"", ""S. Johnson"", ""O. L. Landen"", ""A. G. MacPhee"", ""A. Nikroo"", ""J. Pino"", ""S. Prisbrey"", ""J. Ralph"", ""R. Seugling"", ""D. Strozzi"", ""R. E. Tipton"", ""Y. M. Wang"", ""E. Loomis"", ""E. Merritt"", ""D. Montgomery""]","Ping, Y., Smalyuk, V.A., Amendt, P. et al. Enhanced energy coupling for indirectly driven inertial confinement fusion. Nature Phys15, 138–141 (2019).",3058,7,12,aplusplus,10.1038/s41567-018-0331-5,https://doi.org/10.1038/s41567-018-0331-5,,2,nphys,nature physics,1540771200,2018-10-29,laser-produced-plasmas;plasma-physics,https://www.nature.com/articles/s41567-018-0331-5,15
letter,Universal T-linear resistivity and Planckian dissipation in overdoped cuprates,"<p>The perfectly linear temperature dependence of the electrical resistivity observed as T&#8201;&#8594;&#8201;0 in a variety of metals close to a quantum critical point is a major puzzle of condensed-matter physics. Here we show that T-linear resistivity as T&#8201;&#8594;&#8201;0 is a generic property of cuprates, associated with a universal scattering rate. We measured the low-temperature resistivity of the bilayer cuprate Bi<sub>2</sub>Sr<sub>2</sub>CaCu<sub>2</sub>O<sub>8+&#948;</sub> and found that it exhibits a T-linear dependence with the same slope as in the single-layer cuprates Bi<sub>2</sub>Sr<sub>2</sub>CuO<sub>6+&#948;</sub> (ref.&#8201;), La<sub>1.6&#8722;x</sub>Nd<sub>0.4</sub>Sr<sub>x</sub>CuO<sub>4</sub> (ref.&#8201;) and La<sub>2&#8722;x</sub>Sr<sub>x</sub>CuO<sub>4</sub> (ref.&#8201;), despite their very different Fermi surfaces and structural, superconducting and magnetic properties. We then show that the T-linear coefficient (per CuO<sub>2</sub> plane), A<sub>1</sub><sup>&#9633;</sup>, is given by the universal relation A<sub>1</sub><sup>&#9633;</sup>T<sub>F</sub>&#8201;=&#8201;h/2e<sup>2</sup>, where e is the electron charge, h is the Planck constant and T<sub>F</sub> is the Fermi temperature. This relation, obtained by assuming that the scattering rate 1/&#964; of charge carriers reaches the Planckian limit, whereby &#295;/&#964;&#8201;=&#8201;k<sub>B</sub>T, works not only for hole-doped cuprates but also for electron-doped cuprates, despite the different nature of their quantum critical point and strength of their electron correlations.</p>",[],False,"[""A. Legros"", ""S. Benhabib"", ""W. Tabis"", ""F. Lalibert\u00e9"", ""M. Dion"", ""M. Lizaire"", ""B. Vignolle"", ""D. Vignolles"", ""H. Raffy"", ""Z. Z. Li"", ""P. Auban-Senzier"", ""N. Doiron-Leyraud"", ""P. Fournier"", ""D. Colson"", ""L. Taillefer"", ""C. Proust""]","Legros, A., Benhabib, S., Tabis, W. et al. UniversalT-linear resistivity and Planckian dissipation in overdoped cuprates. Nature Phys15, 142–147 (2019).",13000,71,59,aplusplus,10.1038/s41567-018-0334-2,https://doi.org/10.1038/s41567-018-0334-2,,2,nphys,nature physics,1542585600,2018-11-19,electronic-properties-and-materials;superconducting-properties-and-materials,https://www.nature.com/articles/s41567-018-0334-2,15
letter,High-dimensional one-way quantum processing implemented on d-level cluster states,"<p>Taking advantage of quantum mechanics for executing computational tasks faster than classical computers or performing measurements with precision exceeding the classical limit requires the generation of specific large and complex quantum states. In this context, cluster states are particularly interesting because they can enable the realization of universal quantum computers by means of a &#8216;one-way&#8217; scheme, where processing is performed through measurements. The generation of cluster states based on sub-systems that have more than two dimensions, d-level cluster states, provides increased quantum resources while keeping the number of parties constant, and also enables novel algorithms. Here, we experimentally realize, characterize and test the noise sensitivity of three-level, four-partite cluster states formed by two photons in the time and frequency domain, confirming genuine multi-partite entanglement with higher noise robustness compared to conventional two-level cluster states. We perform proof-of-concept high-dimensional one-way quantum operations, where the cluster states are transformed into orthogonal, maximally entangled d-level two-partite states by means of projection measurements. Our scalable approach is based on integrated photonic chips and optical fibre communication components, thus achieving new and deterministic functionalities.</p>",[],False,"[""Christian Reimer"", ""Stefania Sciara"", ""Piotr Roztocki"", ""Mehedi Islam"", ""Luis Romero Cort\u00e9s"", ""Yanbing Zhang"", ""Bennet Fischer"", ""S\u00e9bastien Loranger"", ""Raman Kashyap"", ""Alfonso Cino"", ""Sai T. Chu"", ""Brent E. Little"", ""David J. Moss"", ""Lucia Caspani"", ""William J. Munro"", ""Jos\u00e9 Aza\u00f1a"", ""Michael Kues"", ""Roberto Morandotti""]","Reimer, C., Sciara, S., Roztocki, P. et al. High-dimensional one-way quantum processing implemented ond-level cluster states. Nature Phys15, 148–153 (2019).",7740,56,44,aplusplus,10.1038/s41567-018-0347-x,https://doi.org/10.1038/s41567-018-0347-x,,2,nphys,nature physics,1543795200,2018-12-03,microresonators;quantum-information;quantum-optics,https://www.nature.com/articles/s41567-018-0347-x,15
letter,Even denominator fractional quantum Hall states in higher Landau levels of graphene,"<p>An important development in the field of the fractional quantum Hall effect was the proposal that the 5/2 state observed in the Landau level with orbital index n&#8201;=&#8201;1 of two-dimensional electrons in a GaAs quantum well originates from a chiral p-wave paired state of composite fermions that are topological bound states of electrons and quantized vortices. The excitations of this state, which is theoretically described by a &#8216;Pfaffian&#8217; wavefunction or its hole partner called the anti-Pfaffian, are neither fermions nor bosons but Majorana quasiparticles obeying non-Abelian braid statistics. This has inspired ideas for fault-tolerant topological quantum computation and has also instigated a search for other states with exotic quasiparticles. Here we report experiments on monolayer graphene that show clear evidence for unexpected even denominator fractional quantum Hall physics in the n&#8201;=&#8201;3 Landau level. We numerically investigate the known candidate states for the even denominator fractional quantum Hall effect, including the Pfaffian, the particle&#8211;hole symmetric Pfaffian and the 221-parton states, and conclude that, among these, the 221-parton appears a potentially suitable candidate to describe the experimentally observed state. Like the Pfaffian, this state is believed to harbour quasi-particles with non-Abelian braid statistics.</p>",[],False,"[""Youngwook Kim"", ""Ajit C. Balram"", ""Takashi Taniguchi"", ""Kenji Watanabe"", ""Jainendra K. Jain"", ""Jurgen H. Smet""]","Kim, Y., Balram, A.C., Taniguchi, T. et al. Even denominator fractional quantum Hall states in higher Landau levels of graphene. Nature Phys15, 154–158 (2019).",5957,9,27,aplusplus,10.1038/s41567-018-0355-x,https://doi.org/10.1038/s41567-018-0355-x,,2,nphys,nature physics,1543190400,2018-11-26,quantum-hall;topological-matter,https://www.nature.com/articles/s41567-018-0355-x,15
article,On the complexity and verification of quantum random circuit sampling,"<p>A critical milestone on the path to useful quantum computers is the demonstration of a quantum computation that is prohibitively hard for classical computers&#8212;a task referred to as quantum supremacy. A leading near-term candidate is sampling from the probability distributions of randomly chosen quantum circuits, which we call random circuit sampling (RCS). RCS was defined with experimental realizations in mind, leaving its computational hardness unproven. Here we give strong complexity-theoretic evidence of classical hardness of RCS, placing it on par with the best theoretical proposals for supremacy. Specifically, we show that RCS satisfies an average-case hardness condition, which is critical to establishing computational hardness in the presence of experimental noise. In addition, it follows from known results that RCS also satisfies an anti-concentration property, namely that errors in estimating output probabilities are small with respect to the probabilities themselves. This makes RCS the first proposal for quantum supremacy with both of these properties. Finally, we also give a natural condition under which an existing statistical measure, cross-entropy, verifies RCS, as well as describe a new verification measure that in some formal sense maximizes the information gained from experimental samples.</p>",[],False,"[""Adam Bouland"", ""Bill Fefferman"", ""Chinmay Nirkhe"", ""Umesh Vazirani""]","Bouland, A., Fefferman, B., Nirkhe, C. et al. On the complexity and verification of quantum random circuit sampling. Nature Phys15, 159–163 (2019).",4218,55,32,aplusplus,10.1038/s41567-018-0318-2,https://doi.org/10.1038/s41567-018-0318-2,,2,nphys,nature physics,1540771200,2018-10-29,computational-science;quantum-information,https://www.nature.com/articles/s41567-018-0318-2,15
article,Signatures of the many-body localized regime in two dimensions,"<p>Lessons from Anderson localization highlight the importance of the dimensionality of real space for localization due to disorder. More recently, studies of many-body localization have focused on the phenomenon in one dimension using techniques of exact diagonalization and tensor networks. On the other hand, experiments in two dimensions have provided concrete results going beyond the previously numerically accessible limits while posing several challenging questions. We present the large-scale numerical examination of a disordered Bose&#8211;Hubbard model in two dimensions realized in cold atoms, which shows entanglement-based signatures of many-body localization. By generalizing a low-depth quantum circuit to two dimensions, we approximate eigenstates in the experimental parameter regimes for large systems, which is beyond the scope of exact diagonalization. A careful analysis of the eigenstate entanglement structure provides an indication of the putative phase transition marked by a peak in the fluctuations of entanglement entropy in a parameter range consistent with experiments.</p>",[],False,"[""Thorsten B. Wahl"", ""Arijeet Pal"", ""Steven H. Simon""]","Wahl, T.B., Pal, A. & Simon, S.H. Signatures of the many-body localized regime in two dimensions. Nature Phys15, 164–169 (2019).",3575,10,28,aplusplus,10.1038/s41567-018-0339-x,https://doi.org/10.1038/s41567-018-0339-x,,2,nphys,nature physics,1541980800,2018-11-12,quantum-simulation;theoretical-physics,https://www.nature.com/articles/s41567-018-0339-x,15
article,Complete reconstruction of bound and unbound electronic wavefunctions in two-photon double ionization,"<p>To be complete, the characterization of the photoionization process of atoms and molecules requires the extraction of all quantum-mechanical phases and amplitudes. So far, complete experiments have accessed only the ionization process of neutral atoms and molecules. Here we report the quantum-mechanically complete characterization of the single and double ionization of neon to yield doubly charged ions. The first ionization step by intense, polarized extreme ultraviolet light from a free-electron laser leaves the ion in a polarized state (that is, one in which the angular momentum of the ion is aligned in space). By controlling the polarization of the light, we determine the bound and continuum components of the system in the first and second ionization steps leading to the formation of doubly charged neon ions. We test the validity of our approach by characterizing the influence of autoionizing ionic states on the two-photon double-ionization mechanism. Our results are important for understanding the physics of the interaction of extreme ultraviolet radiation with ions.</p>",[],False,"[""P. A. Carpeggiani"", ""E. V. Gryzlova"", ""M. Reduzzi"", ""A. Dubrouil"", ""D. Faccial\u00e1"", ""M. Negro"", ""K. Ueda"", ""S. M. Burkov"", ""F. Frassetto"", ""F. Stienkemeier"", ""Y. Ovcharenko"", ""M. Meyer"", ""O. Plekan"", ""P. Finetti"", ""K. C. Prince"", ""C. Callegari"", ""A. N. Grum-Grzhimailo"", ""G. Sansone""]","Carpeggiani, P.A., Gryzlova, E.V., Reduzzi, M. et al. Complete reconstruction of bound and unbound electronic wavefunctions in two-photon double ionization. Nature Phys15, 170–177 (2019).",2129,35,7,aplusplus,10.1038/s41567-018-0340-4,https://doi.org/10.1038/s41567-018-0340-4,,2,nphys,nature physics,1541980800,2018-11-12,free-electron-lasers;nonlinear-optics;optical-physics,https://www.nature.com/articles/s41567-018-0340-4,15
