contentType,title,abstract,abstract_google_cn,affiliations,authorization,authors,citation_text,count_accesses,count_altmetric,count_citations,documentType,doi,doi_url,focus,issue,journal_pcode,journal_title,publishedAt,publishedAtString,subjects,url,volume
article,Direct observation of ion acceleration from a beam-driven wave in a magnetic fusion experiment,"<p>Efficiently heating a magnetically confined plasma to thermonuclear temperatures remains a central issue in fusion energy research. One well-established technique is to inject beams of neutral particles into the plasma, a process known as neutral beam injection. In the classical picture, fast ions generated from neutral beam injection predominantly heat electrons as they are slowed by friction. This electron heat is then collisionally coupled to the plasma ions, which comprise the fusion fuel. Fast ions can also drive plasma waves, which divert energy from the fuel and can degrade confinement. Here we present new observations from a field reversed configuration plasma in which a beam-driven wave in the open field line region couples directly to fuel ions, drawing a high-energy tail on subcollisional timescales that dramatically enhances the fusion rate. This mode therefore allows the beam energy to bypass the electron channel and does so without having a deleterious effect on global plasma confinement. Our results demonstrate a means of directly and non-destructively coupling energy from fast ions to plasma ions, which may pave the way for improved neutral beam injection heating efficiency or the prevention of ash accumulation with alpha channelling.</p>",,"[{'address': 'TAE Technologies, Inc., Foothill Ranch, CA, USA', 'authors': ['R. M. Magee', ',\xa0A. Necas', ',\xa0R. Clary', ',\xa0S. Korepanov', ',\xa0S. Nicks', ',\xa0T. Roche', ',\xa0M. C. Thompson', ',\xa0M. W. Binderbauer', '\xa0&\xa0T. Tajima']}]",False,"['R. M. Magee', 'A. Necas', 'R. Clary', 'S. Korepanov', 'S. Nicks', 'T. Roche', 'M. C. Thompson', 'M. W. Binderbauer', 'T. Tajima']","Magee, R.M., Necas, A., Clary, R. et al. Direct observation of ion acceleration from a beam-driven wave in a magnetic fusion experiment. Nat. Phys. 15, 281–286 (2019).",1410,14,1,aplusplus,10.1038/s41567-018-0389-0,https://doi.org/10.1038/s41567-018-0389-0,,3,nphys,nature physics,1547424000,2019-01-14,magnetically-confined-plasmas;plasma-based-accelerators,https://www.nature.com/articles/s41567-018-0389-0,15
article,The Goldstone mode and resonances in the fluid interfacial region,"<p>The development of a molecular theory of inhomogeneous fluids and, in particular, of the liquid&#8211;gas interface has received enormous interest in recent years; however, long-standing attempts to extend the concept of surface tension in mesoscopic approaches by making it scale dependent, although apparently plausible, have failed to connect with simulation and experimental studies of the interface that probe the detailed properties of density correlations. Here, we show that a fully microscopic theory of correlations in the interfacial region can be developed that overcomes many of the problems associated with simpler mesoscopic ideas. This theory originates from recognizing that the correlation function displays, in addition to a Goldstone mode, an unexpected hierarchy of resonances that constrain severely its structural properties. Indeed, this approach allows us to identify new classes of fully integrable models for which, surprisingly, the tension, density profile and correlation function can all be determined analytically, revealing the microscopic structure of correlations in all generalized van der Waals theories.</p>",,"[{'address': 'Department of Mathematics, Imperial College London, London, UK', 'authors': ['A. O. Parry']}, {'address': 'GISC, Departamento de Matemáticas, Universidad Carlos III de Madrid, Leganés, Spain', 'authors': ['C. Rascón']}]",False,"['A. O. Parry', 'C. Rascón']","Parry, A.O., Rascón, C. The Goldstone mode and resonances in the fluid interfacial region. Nat. Phys. 15, 287–292 (2019).",2016,64,3,aplusplus,10.1038/s41567-018-0361-z,https://doi.org/10.1038/s41567-018-0361-z,,3,nphys,nature physics,1544400000,2018-12-10,statistical-physics;surfaces-interfaces-and-thin-films,https://www.nature.com/articles/s41567-018-0361-z,15
article,Guiding self-organized pattern formation in cell polarity establishment,"<p>Spontaneous pattern formation in Turing systems relies on feedback. But patterns in cells and tissues seldom form spontaneously&#8212;instead they are controlled by regulatory biochemical interactions that provide molecular guiding cues. The relationship between these guiding cues and feedback in controlled biological pattern formation remains unclear. Here, we explore this relationship during cell-polarity establishment in the one-cell-stage Caenorhabditis elegans embryo. We quantify the strength of two feedback systems that operate during polarity establishment: feedback between polarity proteins and the actomyosin cortex, and mutual antagonism among polarity proteins. We characterize how these feedback systems are modulated by guiding cues from the centrosome, an organelle regulating cell cycle progression. By coupling a mass-conserved Turing-like reaction&#8211;diffusion system for polarity proteins to an active-gel description of the actomyosin cortex, we reveal a transition point beyond which feedback ensures self-organized polarization, even when cues are removed. Notably, the system switches from a guide-dominated to a feedback-dominated regime well beyond this transition point, which ensures robustness. Together, these results reveal a general criterion for controlling biological pattern-forming systems: feedback remains subcritical to avoid unstable behaviour, and molecular guiding cues drive the system beyond a transition point for pattern formation.</p>",,"[{'address': 'BIOTEC, TU Dresden, Dresden, Germany', 'authors': ['Peter Gross', '\xa0&\xa0Stephan W. Grill']}, {'address': 'Max Planck Institute of Molecular Cell Biology and Genetics, Dresden, Germany', 'authors': ['Peter Gross', ',\xa0Carsten Hoege', '\xa0&\xa0Stephan W. Grill']}, {'address': 'Max Planck Institute for the Physics of Complex Systems, Dresden, Germany', 'authors': ['Peter Gross', ',\xa0K. Vijay Kumar', ',\xa0Frank Jülicher', '\xa0&\xa0Stephan W. Grill']}, {'address': 'International Centre for Theoretical Sciences, Tata Institute of Fundamental Research, Bengaluru, India', 'authors': ['K. Vijay Kumar']}, {'address': 'The Francis Crick Institute, London, UK', 'authors': ['Nathan W. Goehring']}, {'address': 'Medical Research Council Laboratory for Molecular Cell Biology, University College London, London, UK', 'authors': ['Nathan W. Goehring']}, {'address': 'California Institute of Technology, Pasadena, CA, USA', 'authors': ['Justin S. Bois']}]",False,"['Peter Gross', 'K. Vijay Kumar', 'Nathan W. Goehring', 'Justin S. Bois', 'Carsten Hoege', 'Frank Jülicher', 'Stephan W. Grill']","Gross, P., Kumar, K.V., Goehring, N.W. et al. Guiding self-organized pattern formation in cell polarity establishment. Nat. Phys. 15, 293–300 (2019).",4785,29,13,aplusplus,10.1038/s41567-018-0358-7,https://doi.org/10.1038/s41567-018-0358-7,Active Matter,3,nphys,nature physics,1543795200,2018-12-03,biophysics;nonlinear-phenomena,https://www.nature.com/articles/s41567-018-0358-7,15
author correction,Author Correction: Portraits of physicists,,,"[{'address': 'Nature Communications', 'authors': ['Marco Bentivegna', ',\xa0Richard Brierley', '\xa0&\xa0Nina Meinzer']}]",True,"['Marco Bentivegna', 'Richard Brierley', 'Nina Meinzer']","Bentivegna, M., Brierley, R. & Meinzer, N. Author Correction: Portraits of physicists. Nat. Phys. 15, 301 (2019).",518,1,0,aplusplus,10.1038/s41567-019-0456-1,https://doi.org/10.1038/s41567-019-0456-1,,3,nphys,nature physics,1550620800,2019-02-20,,https://www.nature.com/articles/s41567-019-0456-1,15
measure for measure,"π ≈ 3.141, not only now, but forever",,,"[{'address': 'DECTRIS, Baden, Switzerland', 'authors': ['Peter Trueb']}]",True,['Peter Trueb'],"Trueb, P. π ≈ 3. 141, not only now, but forever. Nat. Phys. 15, 302 (2019).",6058,51,0,aplusplus,10.1038/s41567-019-0444-5,https://doi.org/10.1038/s41567-019-0444-5,,3,nphys,nature physics,1551398400,2019-03-01,philosophy;pure-mathematics;scientific-community-and-society;software;technology,https://www.nature.com/articles/s41567-019-0444-5,15
