contentType,title,abstract,affiliations,authorization,authors,citation_text,count_accesses,count_altmetric,count_citations,documentType,doi,doi_url,focus,issue,journal_pcode,journal_title,publishedAt,publishedAtString,subjects,url,volume
editorial,Biden time,,[],True,[],"Biden time. Nat. Phys. 17, 147 (2021).",147,3,0,aplusplus,10.1038/s41567-021-01183-6,https://doi.org/10.1038/s41567-021-01183-6,,2,nphys,nature physics,1612742400,2021-02-08,physics;scientific-community-and-society,https://www.nature.com/articles/s41567-021-01183-6,17
thesis,"Hello, school!",,[],False,"[""Mark Buchanan""]","Buchanan, M. Hello, school!. Nat. Phys. 17, 148 (2021).",57,1,0,aplusplus,10.1038/s41567-021-01173-8,https://doi.org/10.1038/s41567-021-01173-8,,2,nphys,nature physics,1612742400,2021-02-08,computer-science;protein-folding,https://www.nature.com/articles/s41567-021-01173-8,17
comment,Truth and beauty in physics and biology,,[],False,"[""Ben D. MacArthur""]","MacArthur, B.D. Truth and beauty in physics and biology. Nat. Phys. 17, 149–151 (2021).",1792,98,0,aplusplus,10.1038/s41567-020-01132-9,https://doi.org/10.1038/s41567-020-01132-9,,2,nphys,nature physics,1610323200,2021-01-11,biophysics;physics,https://www.nature.com/articles/s41567-020-01132-9,17
comment,Shifting computational boundaries for complex organic materials,,[],False,"[""R. Matthias Geilhufe"", ""Bart Olsthoorn"", ""Alexander V. Balatsky""]","Geilhufe, R.M., Olsthoorn, B. & Balatsky, A.V. Shifting computational boundaries for complex organic materials. Nat. Phys. 17, 152–154 (2021).",402,5,0,aplusplus,10.1038/s41567-020-01135-6,https://doi.org/10.1038/s41567-020-01135-6,,2,nphys,nature physics,1610409600,2021-01-12,computational-methods;electronic-properties-and-materials,https://www.nature.com/articles/s41567-020-01135-6,17
review article,Moiré heterostructures as a condensed-matter quantum simulator,"<p>Twisted van der Waals heterostructures have latterly received prominent attention for their many remarkable experimental properties and the promise that they hold for realizing elusive states of matter in the laboratory. We propose that these systems can, in fact, be used as a robust quantum simulation platform that enables the study of strongly correlated physics and topology in quantum materials. Among the features that make these materials a versatile toolbox are the tunability of their properties through readily accessible external parameters such as gating, straining, packing and twist angle; the feasibility to realize and control a large number of fundamental many-body quantum models relevant in the field of condensed-matter physics; and finally, the availability of experimental readout protocols that directly map their rich phase diagrams in and out of equilibrium. This general framework makes it possible to robustly realize and functionalize new phases of matter in a modular fashion, thus broadening the landscape of accessible physics and holding promise for future technological applications.</p>",[],False,"[""Dante M. Kennes"", ""Martin Claassen"", ""Lede Xian"", ""Antoine Georges"", ""Andrew J. Millis"", ""James Hone"", ""Cory R. Dean"", ""D. N. Basov"", ""Abhay N. Pasupathy"", ""Angel Rubio""]","Kennes, D.M., Claassen, M., Xian, L. et al. Moiré heterostructures as a condensed-matter quantum simulator. Nat. Phys. 17, 155–163 (2021).",2252,45,0,aplusplus,10.1038/s41567-020-01154-3,https://doi.org/10.1038/s41567-020-01154-3,,2,nphys,nature physics,1612137600,2021-02-01,electronic-properties-and-materials;theory-and-computation;topological-matter;two-dimensional-materials,https://www.nature.com/articles/s41567-020-01154-3,17
news & views,Clock comparison using black holes,,[],True,"[""R\u00fcdiger Haas""]","Haas, R. Clock comparison using black holes. Nat. Phys. 17, 164–165 (2021).",391,1,0,aplusplus,10.1038/s41567-020-01071-5,https://doi.org/10.1038/s41567-020-01071-5,,2,nphys,nature physics,1603929600,2020-10-29,astronomy-and-astrophysics;atomic-and-molecular-physics;fibre-optics-and-optical-communications;optical-metrology,https://www.nature.com/articles/s41567-020-01071-5,17
news & views,Gently stirred not shaken,,[],True,"[""Daniel Rolles""]","Rolles, D. Gently stirred not shaken. Nat. Phys. 17, 165–166 (2021).",725,3,0,aplusplus,10.1038/s41567-020-01119-6,https://doi.org/10.1038/s41567-020-01119-6,,2,nphys,nature physics,1608508800,2020-12-21,atomic-and-molecular-interactions-with-photons;atomic-and-molecular-physics;quantum-physics,https://www.nature.com/articles/s41567-020-01119-6,17
news & views,An odd couple,,[],True,"[""Brian D\u2019Urso"", ""James Millen""]","D’Urso, B., Millen, J. An odd couple. Nat. Phys. 17, 167–168 (2021).",839,11,0,aplusplus,10.1038/s41567-020-1020-8,https://doi.org/10.1038/s41567-020-1020-8,,2,nphys,nature physics,1600646400,2020-09-21,quantum-mechanics;quantum-optics,https://www.nature.com/articles/s41567-020-1020-8,17
news & views,Light captured in flight,,[],True,"[""Nina Meinzer""]","Meinzer, N. Light captured in flight. Nat. Phys. 17, 168 (2021).",202,1,0,aplusplus,10.1038/s41567-021-01179-2,https://doi.org/10.1038/s41567-021-01179-2,,2,nphys,nature physics,1612742400,2021-02-08,imaging-and-sensing;imaging-techniques,https://www.nature.com/articles/s41567-021-01179-2,17
news & views,The symmetry of superconducting Sr2RuO4,,[],True,"[""Daniel F. Agterberg""]","Agterberg, D.F. The symmetry of superconducting Sr2RuO4. Nat. Phys. 17, 169–170 (2021).",1555,10,0,aplusplus,10.1038/s41567-020-1034-2,https://doi.org/10.1038/s41567-020-1034-2,,2,nphys,nature physics,1600646400,2020-09-21,superconducting-properties-and-materials,https://www.nature.com/articles/s41567-020-1034-2,17
news & views,Chaotic worms,,[],True,"[""Jane Loveless"", ""Barbara Webb""]","Loveless, J., Webb, B. Chaotic worms. Nat. Phys.(2020).",647,8,0,aplusplus,10.1038/s41567-020-01058-2,https://doi.org/10.1038/s41567-020-01058-2,,2,nphys,nature physics,1601856000,2020-10-05,biological-physics;biophysics;nonlinear-phenomena,https://www.nature.com/articles/s41567-020-01058-2,17
news & views,Living proof of effective defects,,[],True,"[""M.-A. Fardin"", ""B. Ladoux""]","Fardin, MA., Ladoux, B. Living proof of effective defects. Nat. Phys. 17, 172–173 (2021).",1459,62,0,aplusplus,10.1038/s41567-020-01084-0,https://doi.org/10.1038/s41567-020-01084-0,,2,nphys,nature physics,1606089600,2020-11-23,biophysics;motility,https://www.nature.com/articles/s41567-020-01084-0,17
letter,Ultrafast manipulation of the weakly bound helium dimer,"<p>Controlling the interactions between atoms with external fields opened up new branches in physics ranging from strongly correlated atomic systems to ideal Bose and Fermi gases and Efimov physics. Such control usually prepares samples that are stationary or evolve adiabatically in time. In contrast, in molecular physics, external ultrashort laser fields are used to create anisotropic potentials that launch ultrafast rotational wave packets and align molecules in free space. Here we combine these two regimes of ultrafast times and low energies. We apply a short laser pulse to the helium dimer, a weakly bound and highly delocalized single bound state quantum system. The laser field locally tunes the interaction between two helium atoms, imparting an angular momentum of 2&#8463; and evoking an initially confined dissociative wave packet. We record a video of the density and phase of this wave packet as it propagates from small to large internuclear distances. At large internuclear distances, where the interaction between atoms is negligible, the wave packet is essentially free. This work paves the way for future tomography of wave-packet dynamics and provides the technique for studying exotic and otherwise hardly accessible quantum systems, such as halo and Efimov states.</p>",[],False,"[""Maksim Kunitski"", ""Qingze Guan"", ""Holger Maschkiwitz"", ""J\u00f6rg Hahnenbruch"", ""Sebastian Eckart"", ""Stefan Zeller"", ""Anton Kalinin"", ""Markus Sch\u00f6ffler"", ""Lothar Ph. H. Schmidt"", ""Till Jahnke"", ""D\u00f6rte Blume"", ""Reinhard D\u00f6rner""]","Kunitski, M., Guan, Q., Maschkiwitz, H. et al. Ultrafast manipulation of the weakly bound helium dimer. Nat. Phys. 17, 174–178 (2021).",1175,111,1,aplusplus,10.1038/s41567-020-01081-3,https://doi.org/10.1038/s41567-020-01081-3,,2,nphys,nature physics,1608508800,2020-12-21,exotic-atoms-and-molecules;macromolecules-and-clusters,https://www.nature.com/articles/s41567-020-01081-3,17
letter,The Heisenberg limit for laser coherence,"<p>Quantum optical coherence can be quantified only by accounting for both the particle- and wave-nature of light. For an ideal laser beam, the coherence can be thought of roughly as the number of photons emitted consecutively into the beam with the same phase. This number, \({\mathfrak{C}}\), can be much larger than the number of photons in the laser itself, &#956;. The limit for an ideal laser was thought to be of order &#956;<sup>2</sup> (refs. ). Here, assuming only that a laser produces a beam with properties close to those of an ideal laser beam and that it has no external sources of coherence, we derive an upper bound on \({\mathfrak{C}}\), which is of order &#956;<sup>4</sup>. Moreover, using the matrix product states method, we find a model that achieves this scaling and show that it could, in principle, be realized using circuit quantum electrodynamics. Thus, \({\mathfrak{C}}\) of order &#956;<sup>2</sup> is only a standard quantum limit; the ultimate quantum limit&#8212;or Heisenberg limit&#8212;is quadratically better.</p>",[],False,"[""Travis J. Baker"", ""Seyed N. Saadatmand"", ""Dominic W. Berry"", ""Howard M. Wiseman""]","Baker, T.J., Saadatmand, S.N., Berry, D.W. et al. The Heisenberg limit for laser coherence. Nat. Phys. 17, 179–183 (2021).",3795,165,0,aplusplus,10.1038/s41567-020-01049-3,https://doi.org/10.1038/s41567-020-01049-3,,2,nphys,nature physics,1603670400,2020-10-26,lasers-leds-and-light-sources;quantum-information;single-photons-and-quantum-effects,https://www.nature.com/articles/s41567-020-01049-3,17
letter,Visualization of the flat electronic band in twisted bilayer graphene near the magic angle twist,"<p>Bilayer graphene has been predicted to host a moir&#233; miniband with flat dispersion if the layers are stacked at specific twist angles known as the &#8217;magic angles&#8217;. Recently, twisted bilayer graphene (tBLG) with a magic angle twist was reported to exhibit a correlated insulating state and superconductivity, where the presence of the flat miniband in the system is thought to be essential for the emergence of these ordered phases in the transport measurements. Although tunnelling spectroscopy and electronic compressibility measurements in tBLG have found a van Hove singularity that is consistent with the presence of the flat miniband, a direct observation of the flat dispersion in the momentum space of such a moir&#233; miniband in tBLG is still lacking. Here, we report the visualization of this flat moir&#233; miniband by using angle-resolved photoemission spectroscopy with nanoscale resolution. The high spatial resolution of this technique enabled the measurement of the local electronic structure of the tBLG. The measurements demonstrate the existence of the flat moir&#233; band near the charge neutrality for tBLG close to the magic angle at room temperature.</p>",[],False,"[""M. Iqbal Bakti Utama"", ""Roland J. Koch"", ""Kyunghoon Lee"", ""Nicolas Leconte"", ""Hongyuan Li"", ""Sihan Zhao"", ""Lili Jiang"", ""Jiayi Zhu"", ""Kenji Watanabe"", ""Takashi Taniguchi"", ""Paul D. Ashby"", ""Alexander Weber-Bargioni"", ""Alex Zettl"", ""Chris Jozwiak"", ""Jeil Jung"", ""Eli Rotenberg"", ""Aaron Bostwick"", ""Feng Wang""]","Utama, M.I.B., Koch, R.J., Lee, K. et al. Visualization of the flat electronic band in twisted bilayer graphene near the magic angle twist. Nat. Phys.(2020).",5758,18,10,aplusplus,10.1038/s41567-020-0974-x,https://doi.org/10.1038/s41567-020-0974-x,,2,nphys,nature physics,1595808000,2020-07-27,condensed-matter-physics;electronic-properties-and-devices;two-dimensional-materials,https://www.nature.com/articles/s41567-020-0974-x,17
letter,Observation of flat bands in twisted bilayer graphene,"<p>Transport experiments in twisted bilayer graphene have revealed multiple superconducting domes separated by correlated insulating states. These properties are generally associated with strongly correlated states in a flat mini-band of the hexagonal moir&#233; superlattice as was predicted by band structure calculations. Evidence for the existence of a flat band comes from local tunnelling spectroscopy and electronic compressibility measurements, which report two or more sharp peaks in the density of states that may be associated with closely spaced Van Hove singularities. However, direct momentum-resolved measurements have proved to be challenging. Here, we combine different imaging techniques and angle-resolved photoemission with simultaneous real- and momentum-space resolution (nano-ARPES) to directly map the band dispersion in twisted bilayer graphene devices near charge neutrality. Our experiments reveal large areas with a homogeneous twist angle that support a flat band with a spectral weight that is highly localized in momentum space. The flat band is separated from the dispersive Dirac bands, which show multiple moir&#233; hybridization gaps. These data establish the salient features of the twisted bilayer graphene band structure.</p>",[],False,"[""Simone Lisi"", ""Xiaobo Lu"", ""Tjerk Benschop"", ""Tobias A. de Jong"", ""Petr Stepanov"", ""Jose R. Duran"", ""Florian Margot"", ""Ir\u00e8ne Cucchi"", ""Edoardo Cappelli"", ""Andrew Hunter"", ""Anna Tamai"", ""Viktor Kandyba"", ""Alessio Giampietri"", ""Alexei Barinov"", ""Johannes Jobst"", ""Vincent Stalman"", ""Maarten Leeuwenhoek"", ""Kenji Watanabe"", ""Takashi Taniguchi"", ""Louk Rademaker"", ""Sense Jan van der Molen"", ""Milan P. Allan"", ""Dmitri K. Efetov"", ""Felix Baumberger""]","Lisi, S., Lu, X., Benschop, T. et al. Observation of flat bands in twisted bilayer graphene. Nat. Phys. 17, 189–193 (2021).",5625,47,4,aplusplus,10.1038/s41567-020-01041-x,https://doi.org/10.1038/s41567-020-01041-x,,2,nphys,nature physics,1601251200,2020-09-28,electronic-properties-and-materials;materials-for-devices,https://www.nature.com/articles/s41567-020-01041-x,17
letter,Ultrasound evidence for a two-component superconducting order parameter in Sr2RuO4,"<p>The quasi-two-dimensional metal Sr<sub>2</sub>RuO<sub>4</sub> is one of the best characterized unconventional superconductors, yet the nature of its superconducting order parameter is still under debate. This information is crucial to determine the pairing mechanism of Cooper pairs. Here we use ultrasound velocity to probe the superconducting state of Sr<sub>2</sub>RuO<sub>4</sub>. This thermodynamic probe is sensitive to the symmetry of the material, and therefore, it can help in identifying the symmetry of the superconducting order parameter. Indeed, we observe a sharp jump in the shear elastic constant c<sub>66</sub> as the temperature is increased across the superconducting transition. This directly implies that the superconducting order parameter is of a two-component nature. On the basis of symmetry arguments and given the other known properties of Sr<sub>2</sub>RuO<sub>4</sub> (refs. ), we discuss which states are compatible with this requirement and propose that the two-component order parameter {d<sub>xz</sub>; d<sub>yz</sub>} is the most likely candidate.</p>",[],False,"[""S. Benhabib"", ""C. Lupien"", ""I. Paul"", ""L. Berges"", ""M. Dion"", ""M. Nardone"", ""A. Zitouni"", ""Z. Q. Mao"", ""Y. Maeno"", ""A. Georges"", ""L. Taillefer"", ""C. Proust""]","Benhabib, S., Lupien, C., Paul, I. et al. Ultrasound evidence for a two-component superconducting order parameter in Sr2RuO4. Nat. Phys.(2020).",2082,7,4,aplusplus,10.1038/s41567-020-1033-3,https://doi.org/10.1038/s41567-020-1033-3,,2,nphys,nature physics,1600646400,2020-09-21,condensed-matter-physics;physics;superconducting-properties-and-materials,https://www.nature.com/articles/s41567-020-1033-3,17
letter,Thermodynamic evidence for a two-component superconducting order parameter in Sr2RuO4,"<p>Sr<sub>2</sub>RuO<sub>4</sub> has stood as the leading candidate for a spin-triplet superconductor for 26 years. However, recent NMR experiments have cast doubt on this candidacy and it is difficult to find a theory of superconductivity that is consistent with all experiments. The order parameter symmetry for this material therefore remains an open question. Symmetry-based experiments are needed that can rule out broad classes of possible superconducting order parameters. Here, we use resonant ultrasound spectroscopy to measure the entire symmetry-resolved elastic tensor of Sr<sub>2</sub>RuO<sub>4</sub> through the superconducting transition. We observe a thermodynamic discontinuity in the shear elastic modulus c<sub>66</sub>, which implies that the superconducting order parameter has two components. A two-component p-wave order parameter, such as p<sub>x</sub>&#8201;+&#8201;ip<sub>y</sub>, naturally satisfies this requirement. As this order parameter appears to have been precluded by recent NMR experiments, we suggest that two other two-component order parameters, namely \(\{{d}_{xz},{d}_{yz}\}\) and \(\{{d}_{{x}^{2}-{y}^{2}},{g}_{xy({x}^{2}-{y}^{2})}\}\), are now the prime candidates for the order parameter of Sr<sub>2</sub>RuO<sub>4</sub>.</p>",[],False,"[""Sayak Ghosh"", ""Arkady Shekhter"", ""F. Jerzembeck"", ""N. Kikugawa"", ""Dmitry A. Sokolov"", ""Manuel Brando"", ""A. P. Mackenzie"", ""Clifford W. Hicks"", ""B. J. Ramshaw""]","Ghosh, S., Shekhter, A., Jerzembeck, F. et al. Thermodynamic evidence for a two-component superconducting order parameter in Sr2RuO4. Nat. Phys. 17, 199–204 (2021).",4224,207,10,aplusplus,10.1038/s41567-020-1032-4,https://doi.org/10.1038/s41567-020-1032-4,,2,nphys,nature physics,1600646400,2020-09-21,electronic-properties-and-materials;superconducting-properties-and-materials,https://www.nature.com/articles/s41567-020-1032-4,17
letter,Bacteria solve the problem of crowding by moving slowly,"<p>Bacteria commonly live attached to surfaces in dense collectives containing billions of cells. While it is known that motility allows these groups to expand en masse into new territory, how bacteria collectively move across surfaces under such tightly packed conditions remains poorly understood. Here we combine experiments, cell tracking and individual-based modelling to study the pathogen Pseudomonas aeruginosa as it collectively migrates across surfaces using grappling-hook-like pili. We show that the fast-moving cells of a hyperpilated mutant are overtaken and outcompeted by the slower-moving wild type at high cell densities. Using theory developed to study liquid crystals, we demonstrate that this effect is mediated by the physics of topological defects, points where cells with different orientations meet one another. Our analyses reveal that when defects with topological charge +1/2 collide with one another, the fast-moving mutant cells rotate to point vertically and become trapped. By moving more slowly, wild-type cells avoid this trapping mechanism and generate collective behaviour that results in faster migration. In this way, the physics of liquid crystals explains how slow bacteria can outcompete faster cells in the race for new territory.</p>",[],False,"[""O. J. Meacock"", ""A. Doostmohammadi"", ""K. R. Foster"", ""J. M. Yeomans"", ""W. M. Durham""]","Meacock, O.J., Doostmohammadi, A., Foster, K.R. et al. Bacteria solve the problem of crowding by moving slowly. Nat. Phys. 17, 205–210 (2021).",3147,99,1,aplusplus,10.1038/s41567-020-01070-6,https://doi.org/10.1038/s41567-020-01070-6,,2,nphys,nature physics,1606089600,2020-11-23,biological-physics;cellular-motility;microbiology,https://www.nature.com/articles/s41567-020-01070-6,17
letter,Topological defects promote layer formation in Myxococcus xanthus colonies,"<p>The soil bacterium Myxococcus xanthus lives in densely packed groups that form dynamic three-dimensional patterns in response to environmental changes, such as droplet-like fruiting bodies during starvation. The development of these multicellular structures begins with the sequential formation of cell layers in a process that is poorly understood. Here, using confocal three-dimensional imaging, we find that motile, rod-shaped M. xanthus cells are densely packed and aligned in each layer, forming an active nematic liquid crystal. Cell alignment is nearly perfect throughout the population except at point defects that carry half-integer topological charge. We observe that new cell layers preferentially form at the position of +1/2&#8201;defects, whereas holes preferentially open at &#8722;1/2&#8201;defects. To explain these findings, we model the bacterial colony as an extensile active nematic fluid with anisotropic friction. In agreement with our experimental measurements, this model predicts an influx of cells towards the +1/2&#8201;defects and an outflux of cells from the &#8722;1/2&#8201;defects. Our results suggest that cell motility and mechanical cell&#8211;cell interactions are sufficient to promote the formation of cell layers at topological defects, thereby seeding fruiting bodies in colonies of M. xanthus.</p>",[],False,"[""Katherine Copenhagen"", ""Ricard Alert"", ""Ned S. Wingreen"", ""Joshua W. Shaevitz""]","Copenhagen, K., Alert, R., Wingreen, N.S. et al. Topological defects promote layer formation inMyxococcus xanthuscolonies. Nat. Phys.(2020).",2112,119,3,aplusplus,10.1038/s41567-020-01056-4,https://doi.org/10.1038/s41567-020-01056-4,,2,nphys,nature physics,1606089600,2020-11-23,biological-physics;cellular-motility;statistical-physics,https://www.nature.com/articles/s41567-020-01056-4,17
letter,Isotopy and energy of physical networks,"<p>While the structural characteristics of a network are uniquely determined by its adjacency matrix, in physical networks, such as the brain or the vascular system, the network&#8217;s three-dimensional layout also affects the system&#8217;s structure and function. We lack, however, the tools to distinguish physical networks with identical wiring but different geometrical layouts. To address this need, here we introduce the concept of network isotopy, representing different network layouts that can be transformed into one another without link crossings, and show that a single quantity, the graph linking number, captures the entangledness of a layout, defining distinct isotopy classes. We find that a network&#8217;s elastic energy depends linearly on the graph linking number, indicating that each local tangle offers an independent contribution to the total energy. This finding allows us to formulate a statistical model for the formation of tangles in physical networks. We apply the developed framework to a diverse set of real physical networks, finding that the mouse connectome is more entangled than expected based on optimal wiring.</p>",[],False,"[""Yanchen Liu"", ""Nima Dehmamy"", ""Albert-L\u00e1szl\u00f3 Barab\u00e1si""]","Liu, Y., Dehmamy, N. & Barabási, AL. Isotopy and energy of physical networks. Nat. Phys. 17, 216–222 (2021).",2100,30,0,aplusplus,10.1038/s41567-020-1029-z,https://doi.org/10.1038/s41567-020-1029-z,,2,nphys,nature physics,1603065600,2020-10-19,complex-networks;statistical-physics,https://www.nature.com/articles/s41567-020-1029-z,17
article,Intercontinental comparison of optical atomic clocks through very long baseline interferometry,"<p>The comparison of distant atomic clocks is foundational to international timekeeping, global positioning and tests of fundamental physics. Optical-fibre links allow the most precise optical clocks to be compared, without degradation, over intracontinental distances up to thousands of kilometres, but intercontinental comparisons remain limited by the performance of satellite transfer techniques. Here we show that very long baseline interferometry (VLBI), although originally developed for radio astronomy and geodesy, can overcome this limit and compare remote clocks through the observation of extragalactic radio sources. We developed dedicated transportable VLBI stations that use broadband detection and demonstrate the comparison of two optical clocks located in Italy and Japan separated by 9,000&#8201;km. This system demonstrates performance beyond satellite techniques and can pave the way for future long-term stable international clock comparisons.</p>",[],False,"[""Marco Pizzocaro"", ""Mamoru Sekido"", ""Kazuhiro Takefuji"", ""Hideki Ujihara"", ""Hidekazu Hachisu"", ""Nils Nemitz"", ""Masanori Tsutsumi"", ""Tetsuro Kondo"", ""Eiji Kawai"", ""Ryuichi Ichikawa"", ""Kunitaka Namba"", ""Yoshihiro Okamoto"", ""Rumi Takahashi"", ""Junichi Komuro"", ""Cecilia Clivati"", ""Filippo Bregolin"", ""Piero Barbieri"", ""Alberto Mura"", ""Elena Cantoni"", ""Giancarlo Cerretto"", ""Filippo Levi"", ""Giuseppe Maccaferri"", ""Mauro Roma"", ""Claudio Bortolotti"", ""Monia Negusini"", ""Roberto Ricci"", ""Giampaolo Zacchiroli"", ""Juri Roda"", ""Julia Leute"", ""G\u00e9rard Petit"", ""Federico Perini"", ""Davide Calonico"", ""Tetsuya Ido""]","Pizzocaro, M., Sekido, M., Takefuji, K. et al. Intercontinental comparison of optical atomic clocks through very long baseline interferometry. Nat. Phys. 17, 223–227 (2021).",1843,212,3,aplusplus,10.1038/s41567-020-01038-6,https://doi.org/10.1038/s41567-020-01038-6,,2,nphys,nature physics,1601856000,2020-10-05,astronomy-and-astrophysics;atomic-and-molecular-physics;fibre-optics-and-optical-communications;optical-metrology,https://www.nature.com/articles/s41567-020-01038-6,17
