doi,title,title_cn,abstract,abstract_cn,affiliations,affiliations_cn
10.1038/lsa.2016.17,Energy transfer in plasmonic photocatalytic composites,等离子体光催化复合材料中的能量转移 ,"<p>Among the many novel photocatalytic systems developed in very recent years, plasmonic photocatalytic composites possess great potential for use in applications and are one of the most intensively investigated photocatalytic systems owing to their high solar energy utilization efficiency. In these composites, the plasmonic nanoparticles (PNPs) efficiently absorb solar light through localized surface plasmon resonance and convert it into energetic electrons and holes in the nearby semiconductor. This energy transfer from PNPs to semiconductors plays a decisive role in the overall photocatalytic performance. Thus, the underlying physical mechanism is of great scientific and technological importance and is one of the hottest topics in the area of plasmonic photocatalysts. In this review, we examine the very recent advances in understanding the energy transfer process in plasmonic photocatalytic composites, describing both the theoretical basis of this process and experimental demonstrations. The factors that affect the energy transfer efficiencies and how to improve the efficiencies to yield better photocatalytic performance are also discussed. Furthermore, comparisons are made between the various energy transfer processes, emphasizing their limitations/benefits for efficient operation of plasmonic photocatalysts.</p>",在最近几年开发的许多新型光催化系统中，等离激元光催化复合材料具有广阔的应用前景，由于其高的太阳能利用效率，它是研究最深入的光催化系统之一。在这些复合材料中，等离子体纳米颗粒（PNP）通过局部表面等离子体激元共振有效吸收太阳光，并将其转换为附近半导体中的高能电子和空穴。从PNP到半导体的这种能量转移在总体光催化性能中起着决定性的作用。因此，潜在的物理机制具有重大的科学技术意义，并且是等离子光催化剂领域中最热门的主题之一。在这篇综述中，我们研究了在理解等离激元光催化复合材料中能量转移过程方面的最新进展，描述了该过程的理论基础和实验论证。还讨论了影响能量转移效率的因素以及如何提高效率以产生更好的光催化性能。此外，还对各种能量转移过程进行了比较，强调了它们在等离子光催化剂有效运行方面的局限性/优点。</ p> ,"[{'address': 'School of Physics, State Key Laboratory of Crystal Materials, Shandong University, Jinan, 250100, China', 'authors': ['Xiang-Chao Ma', ',\xa0Ying Dai', ',\xa0Lin Yu', '\xa0&\xa0Bai-Biao Huang']}]","[{'address': 'School of Physics, State Key Laboratory of Crystal Materials, Shandong University, Jinan, 250100, China', 'authors': ['Xiang-Chao Ma', ',\xa0Ying Dai', ',\xa0Lin Yu', '\xa0&\xa0Bai-Biao Huang']}] "
10.1038/lsa.2016.24,A single Eu2+-activated high-color-rendering oxychloride white-light phosphor for white-light-emitting diodes,用于发光二极管的单个Eu2 +活化的高显色性氯氧化物白光荧光粉 ,"<p>Single-phased, high-color-rendering index (CRI) white-light phosphors are emerging as potential phosphor-converted white-light-emitting diodes (WLEDs) and as an alternative to blends of tricolor phosphors. However, it is a challenge to create a high CRI white light from a single-doped activator. Here, we present a high CRI (Ra = 91) white-light phosphor, Sr<sub>5</sub>(PO<sub>4</sub>)<sub>3-x</sub>(BO<sub>3</sub>)<sub>x</sub>Cl:Eu<sup>2+</sup>, composed of Sr<sub>5</sub>(PO<sub>4</sub>)<sub>3</sub>Cl as the beginning member and Sr<sub>5</sub>(BO<sub>3</sub>)<sub>3</sub>Cl as the end member. This work utilized the solid-solution method, and tunable Eu<sup>2+</sup> emission was achieved. Color-tunable Eu<sup>2+</sup> emissions in response to structural variation were observed in Sr<sub>5</sub>(PO<sub>4</sub>)<sub>3-x</sub>(BO<sub>3</sub>)<sub>x</sub>Cl solid solutions. This was further confirmed using X-ray Rietveld refinement, electron paramagnetic resonance spectroscopy, and in the photoluminescence spectra. The color-tunable emissions included the white light that originated from the combination of the blue emission of Sr<sub>5</sub>(PO<sub>4</sub>)<sub>3</sub>Cl:Eu<sup>2+</sup> and an induced Eu<sup>2+</sup> yellow emission at approximately 550 nm in the solid solution. Importantly, the white-light phosphors showed a greater R9 = 90.2 under excitation at 365 nm. This result has rarely been reported in the literature and is greater than that of (R9 = 14.3) commercial Y<sub>3</sub>A<sub>l5</sub>O<sub>12</sub>:Ce<sup>3+</sup>-based WLEDs. These findings demonstrate the great potential of Sr<sub>5</sub>(PO<sub>4</sub>)<sub>3-x</sub>(BO<sub>3</sub>)<sub>x</sub>Cl:0.04Eu<sup>2+</sup> as a white-light phosphor for near-UV phosphor-converted WLEDs. These results also provide a shortcut for developing a high CRI white-light phosphor from a single Eu<sup>2+</sup>-doped compound.</p>",<p>单相，高显色指数（CRI）的白光磷光体作为潜在的磷光体转换的白光发光二极管（WLED）以及替代三色磷光体的替代品而出现。然而，从单掺杂活化剂产生高CRI白光是一个挑战。在这里，我们提出了一种高CRI（Ra = 91）白光荧光粉Sr <sub> 5 </ sub>（PO <sub> 4 </ sub>）<sub> 3-x </ sub>（BO < sub> 3 </ sub>）<sub> x </ sub> Cl：Eu <sup> 2 + </ sup>，由Sr <sub> 5 </ sub>（PO <sub> 4 </ sub> ）<sub> 3 </ sub> Cl作为开始成员，Sr <sub> 5 </ sub>（BO <sub> 3 </ sub>）<sub> 3 </ sub> Cl作为结束成员。利用固溶法，实现了可调的Eu <sup> 2 + </ sup>发射。在Sr <sub> 5 </ sub>（PO <sub> 4 </ sub>）<sub> 3-x </ s </ sub>中观察到响应于结构变化的Eu <sup> 2 + </ sup>可调色发射。 sub>（BO <sub> 3 </ sub>）<sub> x </ sub> Cl固溶体。使用X射线Rietveld精修，电子顺磁共振光谱以及光致发光光谱进一步证实了这一点。颜色可调发射包括源自Sr <sub> 5 </ sub>（PO <sub> 4 </ sub>）<sub> 3 </ sub> Cl：Eu蓝色发射的白光固溶体中约550 nm处的<sup> 2 + </ sup>和诱导的Eu <sup> 2 + </ sup>黄色发射。重要的是，在365 nm激发下，白光磷光体显示出更大的R9 = 90.2。该结果在文献中鲜为人知，并且比（R9 = 14.3）商业Y <sub> 3 </ sub> A <sub> 15 </ sub> O <sub> 12 </ sub>：Ce大基于<sup> 3 + </ sup>的WLED。这些发现证明了Sr <sub> 5 </ sub>（PO <sub> 4 </ sub>）<sub> 3-x </ sub>（BO <sub> 3 </ sub>）<sub > x </ sub> Cl：0.04Eu <sup> 2 + </ sup>作为近紫外荧光粉转换的WLED的白光荧光粉。这些结果也为从单一的Eu <sup> 2 + </ sup>掺杂的化合物制备高CRI白光荧光粉提供了捷径。</ p> ,"[{'address': 'Center for Advanced Optoelectronic Functional Materials Research, and Key Laboratory for UV-Emitting Materials and Technology of Ministry of Education, Northeast Normal University, 5268 Renmin Street, Changchun, 130024, China', 'authors': ['Peng-Peng Dai', ',\xa0Cong Li', ',\xa0Xin-Tong Zhang', ',\xa0Xi Chen', ',\xa0Yan Jia', ',\xa0Xiaojun Wang', '\xa0&\xa0Yi-Chun Liu']}, {'address': 'Department of Chemistry, University of Zurich, , The X-ray Crystallography Facility and The Linden Research Group, Winterthurerstrasse, 190 CH-8057 Zurich, Switzerland', 'authors': ['Jun Xu']}, {'address': 'School of Life Sciences, Northeast Normal University, 5268 Renmin Street, Changchun, 130024, China', 'authors': ['Xiu-Li Wang']}, {'address': 'Department of Physics, Georgia Southern University, Statesboro, 30460, GA, USA', 'authors': ['Xiaojun Wang']}]",[{'地址'：'东北光电大学先进光电子功能材料研究中心和紫外线发射材料与技术教育部重点实验室，长春人民街5268，130024，'作者'：[ '戴鹏鹏'，'，\ xa0Cong Li'，'，\ xa0Xin-Tong Zhang'，'，\ xa0Xi Chen'，'，\ xa0Yan Jia'，'，\ xa0Xiaojun Wang'，'\ xa0＆\ xa0Yi- Chun Liu']}，{'地址'：'苏黎世大学化学系，X射线晶体学设施和Linden研究小组，Winterthurerstrasse，瑞士CH-8057，苏黎世'，'作者'：[' 徐军，]}，{'地址'：'东北师范大学生命科学学院，长春人民街5268，130024'，'作者'：['Xiu-Li Wang']}，{'地址' ：“佐治亚州南部大学物理系，美国佐治亚州Statesboro，30460”，“作者”：['Xiaojun Wang']}] 
10.1038/lsa.2016.26,An ultra-narrow linewidth solution-processed organic laser,超窄线宽溶液处理的有机激光器 ,"<p>Optically pumped lasers based on solution-processed thin-film gain media have recently emerged as low-cost, broadly tunable, and versatile active photonics components that can fit any substrate and are useful for, e.g., chemo- or biosensing or visible spectroscopy. Although single-mode operation has been demonstrated in various resonator architectures with a large variety of gain media&#8212;including dye-doped polymers, organic semiconductors, and, more recently, hybrid perovskites&#8212;the reported linewidths are typically on the order of a fraction of a nanometer or broader, i.e., the coherence lengths are no longer than a few millimeters, which does not enable high-resolution spectroscopy or coherent sensing. The linewidth is fundamentally constrained by the short photon cavity lifetime in the standard resonator geometries. We demonstrate here a novel structure for an organic thin-film solid-state laser that is based on a vertical external cavity, wherein a holographic volume Bragg grating ensures both spectral selection and output coupling in an otherwise very compact (&#8764;cm<sup>3</sup>) design. Under short-pulse (0.4 ns) pumping, Fourier-transform-limited laser pulses are obtained, with a full width at half-maximum linewidth of 900 MHz (1.25 pm). Using 20-ns-long pump pulses, the linewidth can be further reduced to 200 MHz (0.26 pm), which is four times above the Fourier limit and corresponds to an unprecedented coherence length of 1 m. The concept is potentially transferrable to any type of thin-film laser and can be ultimately made tunable; it also represents a very compact alternative to bulky grating systems in dye lasers.</p>",<p>基于溶液处理的薄膜增益介质的光泵浦激光器最近已成为低成本，广泛可调且用途广泛的有源光子组件，它们可以适合任何基板，并适用于例如化学或生物传感或可见光光谱学。尽管已经在具有多种增益介质的各种谐振器体系结构中证明了单模工作，其中包括染料掺杂的聚合物，有机半导体以及最近的混合钙钛矿，但报告的线宽通常约为小于或等于纳米的几分之一，即相干长度不超过几毫米，这无法实现高分辨率光谱或相干感测。在标准谐振器几何结构中，线宽从根本上受光子腔寿命短的限制。我们在这里展示了一种基于垂直外腔的有机薄膜固态激光器的新颖结构，其中，全息体积布拉格光栅可确保光谱选择和输出耦合，而这种结构非常紧凑（＆＃8764; cm < sup> 3 </ sup>）设计。在短脉冲（0.4 ns）泵浦下，获得了傅里叶变换限制的激光脉冲，其半峰最大线宽的全宽度为900 MHz（1.25 pm）。使用20 ns长的泵浦脉冲，可以将线宽进一步减小到200 MHz（0.26 pm），这是傅立叶极限的四倍，并且对应于1 m的前所未有的相干长度。该概念可能会转移到任何类型的薄膜激光器，并且最终可以调整。它也是染料激光器中体积庞大的光栅系统的非常紧凑的替代品。</ p> ,"[{'address': 'Université Paris 13, Sorbonne Paris Cité, Laboratoire de Physique des Lasers, F-93430 Villetaneuse, France', 'authors': ['Oussama Mhibik', ',\xa0Sebastien Forget', '\xa0&\xa0Sebastien Chénais']}, {'address': 'CNRS, UMR 7538, LPL, F-93430 Villetaneuse, France', 'authors': ['Oussama Mhibik', ',\xa0Sebastien Forget', '\xa0&\xa0Sebastien Chénais']}, {'address': 'CREOL, College of Optics and Photonics, University of Central Florida, Orlando, P.O. Box 162700, FL 32816-2700, USA', 'authors': ['Dan Ott', ',\xa0George Venus', ',\xa0Ivan Divliansky', '\xa0&\xa0Leonid Glebov']}]",[{'地址'：'巴黎大学第13大学，索邦大学城，激光实验室，法国Filletaneuse F-93430，'作者'：['Oussama Mhibik'，'，\ xa0Sebastien Forget'，'\ xa0＆ \ xa0SebastienChénais']}，{'address'：'CNRS，UMR 7538，LPL，F-93430 Villetaneuse，France'，'作者'：['Oussama Mhibik'，'，\ xa0Sebastien Forget'，'\ xa0＆\ xa0SebastienChénais']}，{'地址'：'CREOL，奥兰多中佛罗里达大学，光学与光子学院，邮政信箱162700，FL 32816-2700，美国'，'作者'：['Dan Ott'，' ，\ xa0George Venus'，'，\ xa0Ivan Divliansky'，'\ xa0＆\ xa0Leonid Glebov']}]] 
10.1038/lsa.2016.28,A sensing mechanism for the detection of carbon nanotubes using selective photoluminescent probes based on ionic complexes with organic dyes,使用基于有机染料离子配合物的选择性光致发光探针检测碳纳米管的传感机制 ,"<p>The multifunctional properties of carbon nanotubes (CNTs) make them a powerful platform for unprecedented innovations in a variety of practical applications. As a result of the surging growth of nanotechnology, nanotubes present a potential problem as an environmental pollutant, and as such, an efficient method for their rapid detection must be established. Here, we propose a novel type of ionic sensor complex for detecting CNTs &#8211; an organic dye that responds sensitively and selectively to CNTs with a photoluminescent signal. The complexes are formed through Coulomb attractions between dye molecules with uncompensated charges and CNTs covered with an ionic surfactant in water. We demonstrate that the photoluminescent excitation of the dye can be transferred to the nanotubes, resulting in selective and strong amplification (up to a factor of 6) of the light emission from the excitonic levels of CNTs in the near-infrared spectral range, as experimentally observed via excitation-emission photoluminescence (PL) mapping. The chirality of the nanotubes and the type of ionic surfactant used to disperse the nanotubes both strongly affect the amplification; thus, the complexation provides sensing selectivity towards specific CNTs. Additionally, neither similar uncharged dyes nor CNTs covered with neutral surfactant form such complexes. As model organic molecules, we use a family of polymethine dyes with an easily tailorable molecular structure and, consequently, tunable absorbance and PL characteristics. This provides us with a versatile tool for the controllable photonic and electronic engineering of an efficient probe for CNT detection.</p>",<p>碳纳米管（CNT）的多功能特性使其成为在各种实际应用中进行空前创新的强大平台。由于纳米技术的迅猛发展，纳米管作为环境污染物存在潜在的问题，因此，必须建立一种快速检测纳米管的有效方法。在这里，我们提出了一种新型的用于检测CNT的离子传感器配合物。一种有机染料，可通过光致发光信号对碳纳米管敏感且选择性地做出反应。络合物是通过具有未补偿电荷的染料分子与被离子表面活性剂覆盖的CNT之间的库仑吸引力形成的。我们证明了染料的光致发光激发可以转移到纳米管，从而导致碳纳米管在近红外光谱范围内的激子能级选择性强地放大（最高达6倍）。通过激发-发射光致发光（PL）映射观察到。纳米管的手性和用于分散纳米管的离子表面活性剂的类型都强烈影响扩增。因此，该络合物提供了对特定CNT的感测选择性。此外，类似的不带电染料或被中性表面活性剂覆盖的CNT都不形成这种络合物。作为模型有机分子，我们使用了具有易于定制的分子结构并因此具有可调的吸光度和PL特性的聚次甲基染料家族。这为我们提供了一种用于可控光子和电子工程的高效检测CNT的多功能工具。</ p> ,"[{'address': 'Institute of Physics, National Academy of Sciences of Ukraine, 46, prospekt Nauky, 03680, Kyiv, Ukraine', 'authors': ['Petro Lutsyk', ',\xa0Anatolii Bukivskyi', ',\xa0Yuri Piryatinski', '\xa0&\xa0Anatoli Verbitsky']}, {'address': 'School of Engineering & Applied Science, Aston University, Aston Triangle, B47ET, Birmingham, UK', 'authors': ['Petro Lutsyk', ',\xa0Raz Arif', ',\xa0Jan Hruby', '\xa0&\xa0Aleksey Rozhin']}, {'address': 'Physics Department, Faculty of Science, University of Sulaimani, P.O. Box 334, Sulaimani, Iraq-Kurdistan Region', 'authors': ['Raz Arif']}, {'address': 'Brno University of Technology, CEITEC BUT, Technická 3058/10, 616 00 Brno, Czech Republic', 'authors': ['Jan Hruby']}, {'address': 'Institute of Organic Chemistry, National Academy of Sciences of Ukraine, 5 Murmanska str., Kyiv, 02660, Ukraine', 'authors': ['Olexander Vinijchuk', ',\xa0Mykola Shandura', ',\xa0Viktor Yakubovskyi', ',\xa0Yuri Kovtun', '\xa0&\xa0Oleksiy Kachkovsky']}, {'address': 'School of Chemistry, University of Nottingham, University Park, Nottingham, NG7 2RD, UK', 'authors': ['Graham A Rance']}, {'address': 'Nottingham Nanotechnology and Nanoscience Centre, University of Nottingham, University Park, Nottingham, NG7 2RD, UK', 'authors': ['Michael Fay']}]",[{'address'：“乌克兰国家科学院物理研究所，46，prospekt Nauky，03680，乌克兰基辅，”，“作者”：['Petro Lutsyk'，'，\ xa0Anatolii Bukivskyi'，'，\ xa0Yuri Piryatinski'，'\ xa0＆\ xa0Anatoli Verbitsky']}，{'地址'：'阿斯顿大学工程与应用科学学院，阿斯顿三角，B47ET，伯明翰，英国'，'作者'：['Petro Lutsyk'， '，\ xa0Raz Arif'，'，\ xa0Jan Hruby'，'\ xa0＆\ xa0Aleksey Rozhin']}，{'地址'：'苏拉马尼大学理学院物理系邮箱334，伊拉克-库尔德地区苏莱马尼，'作者'：['Raz Arif']}，{'地址'：'布尔诺工业大学，CEITEC BUT，Technická3058 / 10，616 00布尔诺，捷克共和国'， 'authors'：['Jan Hruby']}，{'address'：'乌克兰国家科学院有机化学研究所，乌克兰，基辅5 Murmanska str。，02660，'，'authors'：['Olexander Vinijchuk '，'，\ xa0Mykola Shandura'，'，\ xa0Viktor Yakubovskyi'，'，\ xa0Yuri Kovtun'，'\ xa0＆\ xa0Oleksiy Kachkovsky']}，{'address'：'诺丁汉大学化学学院，大学公园， NG7 2RD，英国诺丁汉”，“作者”：['Graham A Rance']}，{'地址'：“英国诺丁汉大学，诺丁汉大学，诺丁汉，NG7 2RD，英国诺丁汉大学纳米技术与纳米科学中心”，“作者” '：['Michael Fay']}] 
10.1038/lsa.2016.30,"Electrically driven, phosphor-free, white light-emitting diodes using gallium nitride-based double concentric truncated pyramid structures",电驱动的无磷白色发光二极管，使用基于氮化镓的双同心截头金字塔结构 ,"<p>White light-emitting diodes (LEDs) are becoming an alternative general light source, with huge energy savings compared to conventional lighting. However, white LEDs using phosphor(s) suffer from unavoidable Stokes energy converting losses, higher manufacturing cost, and reduced thermal stability. Here, we demonstrate electrically driven, phosphor-free, white LEDs based on three-dimensional gallium nitride structures with double concentric truncated hexagonal pyramids. The electroluminescence spectra are stable with varying current. The origin of the emission wavelength is studied by cathodoluminescence and high-angle annular dark field scanning transmission electron microscopy experiments. Spatial variation of the carrier injection efficiency is also investigated by a comparative analysis between spatially resolved photoluminescence and electroluminescence.</p>",<p>白光发光二极管（LED）成为替代常规光源，与传统照明相比节省了大量能源。 然而，使用磷光体的白光LED不可避免地遭受了斯托克斯能量转换损失，较高的制造成本以及降低的热稳定性。 在这里，我们演示了基于电驱动的无磷白光LED，该LED基于具有双同心圆头截断的六棱锥的三维氮化镓结构。 电致发光光谱在变化的电流下是稳定的。 通过阴极发光和高角度环形暗场扫描透射电子显微镜实验研究了发射波长的起源。 通过空间分辨光致发光和电致发光的比较分析，研究了载流子注入效率的空间变化。</ p> ,"[{'address': 'Department of Physics and KI for the NanoCentury, Korea Advanced Institute of Science and Technology, 291 Daehak-ro, Yuseong-gu, 34141, Daejeon, Korea', 'authors': ['Seung-Hyuk Lim', ',\xa0Young-Ho Ko', ',\xa0Christophe Rodriguez', ',\xa0Su-Hyun Gong', '\xa0&\xa0Yong-Hoon Cho']}]",[{'address'：'纳米世纪物理学与KI系，韩国科学技术高等研究院，韩国大田市九城区大发路291号，韩国大田市34141，'作者'：['Seung-Hyuk Lim '，'，\ xa0Young-Ho Ko'，'，\ xa0Christophe Rodriguez'，'，\ xa0Su-Hyun Gong'，'\ xa0＆\ xa0Yong-Hoon Cho']}]] 
10.1038/lsa.2016.32,Efficient photon coupling from a diamond nitrogen vacancy center by integration with silica fiber,通过与二氧化硅纤维集成，从金刚石氮空位中心进行有效的光子耦合 ,"<p>A central goal in quantum information science is to efficiently interface photons with single optical modes for quantum networking and distributed quantum computing. Here, we introduce and experimentally demonstrate a compact and efficient method for the low-loss coupling of a solid-state qubit, the nitrogen vacancy (NV) center in diamond, with a single-mode optical fiber. In this approach, single-mode tapered diamond waveguides containing exactly one high quality NV memory are selected and integrated on tapered silica fibers. Numerical optimization of an adiabatic coupler indicates that near-unity-efficiency photon transfer is possible between the two modes. Experimentally, we find an overall collection efficiency between 16% and 37% and estimate a single photon count rate at saturation above 700 kHz. This integrated system enables robust, alignment-free, and efficient interfacing of single-mode optical fibers with single photon emitters and quantum memories in solids.</p>",量子信息科学的中心目标是有效地将光子与单一光学模式相接口，以实现量子网络和分布式量子计算。 在这里，我们介绍并通过实验证明了一种紧凑高效的方法，可用于将单模光纤与固态量子位（金刚石中的氮空位（NV）中心）进行低损耗耦合。 通过这种方法，选择了仅包含一个高质量NV存储的单模锥形金刚石波导，并将其集成在锥形石英纤维上。 绝热耦合器的数值优化表明，两种模式之间可能实现近统一的光子传输。 通过实验，我们发现整体收集效率在16％到37％之间，并估计了700 kHz以上饱和时的单个光子计数率。 该集成系统可实现单模光纤与固体中的单个光子发射器和量子存储器的鲁棒，无对准，高效连接。</ p> ,"[{'address': 'Department of Electrical Engineering and Computer Science, Massachusetts Institute of Technology, 77 Massachusetts Ave, Cambridge, 02139, MA, USA', 'authors': ['Rishi N Patel', ',\xa0Tim Schröder', ',\xa0Noel Wan', ',\xa0Luozhou Li', ',\xa0Sara L Mouradian', ',\xa0Edward H Chen', '\xa0&\xa0Dirk R Englund']}, {'address': 'Department of Applied Physics, Stanford University, 348 Via Pueblo Mall, Stanford, 94305, CA, USA', 'authors': ['Rishi N Patel']}]",[{'address'：'麻省理工学院电气工程与计算机科学系，美国马萨诸塞州剑桥市麻萨诸塞州大街79号，美国马萨诸塞州02139，'作者'：['Rishi N Patel'，'，\ xa0TimSchröder' ，'，\ xa0Noel Wan'，'，\ xa0Luozhou Li'，'，\ xa0Sara L Mouradian'，'，\ xa0Edward H Chen'，'\ xa0＆\ xa0Dirk R Englund']}，{'address'：'Department of 斯坦福大学应用物理学院，地址：348 Via Pueblo Mall，美国，斯坦福，94305，美国，“作者”：['Rishi N Patel']}] 
