doi,title,title_cn,abstract,abstract_cn,affiliations,affiliations_cn
10.1038/lsa.2016.186,Optical imaging of post-embryonic zebrafish using multi orientation raster scan optoacoustic mesoscopy,胚胎后斑马鱼的光学成像使用多方向光栅扫描光声显微术 ,"<p>Whole-body optical imaging of post-embryonic stage model organisms is a challenging and long sought-after goal. It requires a combination of high-resolution performance and high-penetration depth. Optoacoustic (photoacoustic) mesoscopy holds great promise, as it penetrates deeper than optical and optoacoustic microscopy while providing high-spatial resolution. However, optoacoustic mesoscopic techniques only offer partial visibility of oriented structures, such as blood vessels, due to a limited angular detection aperture or the use of ultrasound frequencies that yield insufficient resolution. We introduce 360&#176; multi orientation (multi-projection) raster scan optoacoustic mesoscopy (MORSOM) based on detecting an ultra-wide frequency bandwidth (up to 160&#8201;MHz) and weighted deconvolution to synthetically enlarge the angular aperture. We report unprecedented isotropic in-plane resolution at the 9&#8211;17&#8201;&#956;m range and improved signal to noise ratio in phantoms and opaque 21-day-old Zebrafish. We find that MORSOM performance defines a new operational specification for optoacoustic mesoscopy of adult organisms, with possible applications in the developmental biology of adulthood and aging.</p>",<p>胚胎后阶段模型生物的全身光学成像是一个具有挑战性和长期追求的目标。它需要兼具高分辨率性能和高穿透深度。光声（光声）介电镜具有广阔的前景，因为它比光学和光声显微镜更深入，同时提供高空间分辨率。然而，由于有限的角度检测孔径或使用产生不足分辨率的超声频率，光声介观技术仅提供定向结构例如血管的部分可见性。我们介绍360＆＃176;多方向（多投影）光栅扫描光声显微术（MORSOM），其基于检测超宽频率带宽（高达160＆＃8201MHz）和加权解卷积以合成地扩大角孔径。我们报告了在9＆＃8211; 17＆＃8201;＆＃956; m范围内前所未有的各向同性面内分辨率，并改善了幻影和不透明的21天龄斑马鱼的信噪比。我们发现MORSOM的性能为成年生物的光声膜镜检查定义了新的操作规范，并可能在成年和衰老的发育生物学中应用。</ p> ,"[{'address': 'Chair for Biological Imaging, Technische Universität München, München, D-81675, Germany', 'authors': ['Murad Omar', ',\xa0Johannes Rebling', ',\xa0Mathias Schwarz', '\xa0&\xa0Vasilis Ntziachristos']}, {'address': 'Institute for Biological and Medical Imaging, Helmholtz Zentrum München, Neuherberg, D-85764, Germany', 'authors': ['Murad Omar', ',\xa0Johannes Rebling', ',\xa0Mathias Schwarz', '\xa0&\xa0Vasilis Ntziachristos']}, {'address': 'Carl Zeiss AG, Corporate Research and Technology, Jena, D-07745, Germany', 'authors': ['Kai Wicker', '\xa0&\xa0Tobias Schmitt-Manderbach']}, {'address': 'ESPCI Paris, PSL Research University, CNRS, INSERM, Institut Langevin, Paris, F-75005, France', 'authors': ['Jérôme Gateau']}, {'address': 'Research Unit Sensory Biology and Organogenesis, Helmholtz Zentrum München, Neuherberg, D-85764, Germany', 'authors': ['Hérnan López-Schier']}, {'address': 'Carl Zeiss Vision International GmbH, Technology & Innovation, Aalen, D-73430, Germany', 'authors': ['Timo Mappes']}]",[{'地址'：'慕尼黑工业大学生物成像主席，慕尼黑，D-81675，德国'，'作者'：['Murad Omar'，'，\ xa0Johannes Rebling'，'，\ xa0Mathias Schwarz'，' \ xa0＆\ xa0Vasilis Ntziachristos']}，{'address'：“生物医学影像研究所，Helmholtz ZentrumMünchen，诺伊尔贝格，D-85764，德国”，“作者”：['Murad Omar'，'，\ xa0Johannes Rebling '，'，\ xa0Mathias Schwarz'，'\ xa0＆\ xa0Vasilis Ntziachristos']}，{'address'：'Carl Zeiss AG，​​Corporate Research and Technology，Jena，D-07745，Germany'，'authors'：['Kai Wicker”，“ \ xa0＆\ xa0Tobias Schmitt-Manderbach”]}，{'地址'：“ ESPCI巴黎，PSL研究大学，CNRS，INSERM，兰格文研究所，巴黎F-75005，法国”，“作者”：[' JérômeGateau']}，{'地址'：'感官生物学和器官发生研究单位，Helmholtz ZentrumMünchen，诺伊尔贝格，D-85764，德国'，'作者'：['HérnanLópez-Schier']}，{'地址' ：“卡尔蔡司视觉国际有限公司，技术与创新，阿伦，D-73430，德国”，“ hors'：['Timo Mappes']}] 
10.1038/lsa.2016.187,Attosecond precision multi-kilometer laser-microwave network,阿秒精度的多公里激光微波网络 ,"<p>Synchronous laser-microwave networks delivering attosecond timing precision are highly desirable in many advanced applications, such as geodesy, very-long-baseline interferometry, high-precision navigation and multi-telescope arrays. In particular, rapidly expanding photon-science facilities like X-ray free-electron lasers and intense laser beamlines require system-wide attosecond-level synchronization of dozens of optical and microwave signals up to kilometer distances. Once equipped with such precision, these facilities will initiate radically new science by shedding light on molecular and atomic processes happening on the attosecond timescale, such as intramolecular charge transfer, Auger processes and their impacts on X-ray imaging. Here we present for the first time a complete synchronous laser-microwave network with attosecond precision, which is achieved through new metrological devices and careful balancing of fiber nonlinearities and fundamental noise contributions. We demonstrate timing stabilization of a 4.7-km fiber network and remote optical&#8211;optical synchronization across a 3.5-km fiber link with an overall timing jitter of 580 and 680 attoseconds root-mean-square, respectively, for over 40&#8201;h. Ultimately, we realize a complete laser-microwave network with 950-attosecond timing jitter for 18&#8201;h. This work can enable next-generation attosecond photon-science facilities to revolutionize many research fields from structural biology to material science and chemistry to fundamental physics.</p>",在许多先进的应用中，例如大地测量学，超长基线干涉测量法，高精度导航和多望远镜阵列，都非常需要能够提供亚秒级定时精度的同步激光微波网络。尤其是，诸如X射线自由电子激光器和强激光束线之类的迅速发展的光子科学设施，需要在整个系统范围内对数十公里以内的光和微波信号进行亚秒级同步。一旦具备了如此精确的精度，这些设施将通过揭示在十亿分之一秒尺度上发生的分子和原子过程（例如分子内电荷转移，俄歇过程及其对X射线成像的影响）开创根本的新科学。在这里，我们首次展示了具有亚秒级精度的完整同步激光-微波网络，这是通过新的计量设备以及对光纤非线性和基本噪声贡献的仔细平衡而实现的。我们演示了一个4.7公里光纤网络和3.5公里光纤链路上的远程光同步的时序稳定性，其总时序抖动分别为580和680阿秒均方根，超过40均方根。 H。最终，我们实现了一个完整的激光微波网络，具有950阿秒的定时抖动，可持续18小时。这项工作可以使下一代的亚秒级光子科学设备彻底改变从结构生物学到材料科学，化学到基础物理学的许多研究领域。</ p> ,"[{'address': 'Center for Free-Electron Laser Science, Deutsches Elektronen-Synchrotron, Hamburg, 22607, Germany', 'authors': ['Ming Xin', ',\xa0Kemal Şafak', ',\xa0Aram Kalaydzhyan', ',\xa0Wen-Ting Wang', ',\xa0Oliver D Mücke', '\xa0&\xa0Franz X Kärtner']}, {'address': 'Department of Physics, University of Hamburg and the Hamburg Center for Ultrafast Imaging, Hamburg, 22761, Germany', 'authors': ['Kemal Şafak', ',\xa0Oliver D Mücke', '\xa0&\xa0Franz X Kärtner']}, {'address': 'Research Laboratory of Electronics, Massachusetts Institute of Technology, Cambridge, 02139, MA, USA', 'authors': ['Michael Y Peng', '\xa0&\xa0Franz X Kärtner']}]",[{'地址'：'自由电子激光科学中心，德意志电子同步加速器，汉堡，德国22607'，'作者'：['Ming Xin'，'，\ xa0KemalŞafak'，'，\ xa0Aram Kalaydzhyan' ，'，\ xa0Wen-Ting Wang'，'，\ xa0Oliver DMücke'，'\ xa0＆\ xa0Franz XKärtner']}，{'address'：'汉堡大学物理系和汉堡超快成像中心， 汉堡，22761，德国”，“作者”：['KemalŞafak'，'，\ xa0Oliver DMücke'，'\ xa0＆\ xa0Franz XKärtner']}，{'address'：'麻省理工学院电子研究实验室 科技，剑桥，美国马萨诸塞州02139”，“作者”：['Michael Y Peng'，'\ xa0＆\ xa0Franz XKärtner']}] 
10.1038/lsa.2016.190,High-finesse Fabry–Perot cavities with bidimensional Si3N4 photonic-crystal slabs,具有二维Si3N4光子晶体平板的高级Fabry-Perot腔 ,"<p>Light scattering by a two-dimensional photonic-crystal slab (PCS) can result in marked interference effects associated with Fano resonances. Such devices offer appealing alternatives to distributed Bragg reflectors and filters for various applications, such as optical wavelength and polarization filters, reflectors, semiconductor lasers, photodetectors, bio-sensors and non-linear optical components. Suspended PCS also have natural applications in the field of optomechanics, where the mechanical modes of a suspended slab interact via radiation pressure with the optical field of a high-finesse cavity. The reflectivity and transmission properties of a defect-free suspended PCS around normal incidence can be used to couple out-of-plane mechanical modes to an optical field by integrating it in a free-space cavity. Here we demonstrate the successful implementation of a PCS reflector on a high-tensile stress Si<sub>3</sub>N<sub>4</sub> nanomembrane. We illustrate the physical process underlying the high reflectivity by measuring the photonic-crystal band diagram. Moreover, we introduce a clear theoretical description of the membrane scattering properties in the presence of optical losses. By embedding the PCS inside a high-finesse cavity, we fully characterize its optical properties. The spectrally, angular- and polarization-resolved measurements demonstrate the wide tunability of the membrane&#8217;s reflectivity, from nearly 0 to 99.9470&#177;0.0025%, and show that material absorption is not the main source of optical loss. Moreover, the cavity storage time demonstrated in this work exceeds the mechanical period of low-order mechanical drum modes. This so-called resolved-sideband condition is a prerequisite to achieve quantum control of the mechanical resonator with light.</p>",二维光子晶体平板（PCS）的光散射会导致与Fano共振相关的明显干涉效应。这样的设备为各种应用提供了分布式布拉格反射器和滤光片的吸引人的替代产品，例如光学波长和偏振滤光片，反射器，半导体激光器，光电探测器，生物传感器和非线性光学组件。悬浮的PCS在光力学领域也有自然的应用，其中悬浮平板的机械模式通过辐射压力与高精细腔体的光场相互作用。通过将法向入射角附近的无缺陷悬浮PCS集成在自由空间腔中，可以将其反射率和透射特性用于将平面外机械模式耦合到光场。在这里，我们展示了PCS反射器在高应力应力Si <sub> 3 </ sub> N <sub> 4 </ sub>纳米膜上的成功实现。我们通过测量光子晶体能带图来说明高反射率背后的物理过程。此外，我们介绍了在存在光损耗的情况下膜散射特性的清晰理论描述。通过将PCS嵌入高精细的腔体内，我们可以充分表征其光学特性。光谱，角度和偏振分辨的测量结果表明，膜的反射率具有很宽的可调谐性，从几乎0到99.9470＆＃177; 0.0025％，并且表明材料吸收不是光学损耗的主要来源。此外，这项工作中展示的腔体存储时间超过了低阶机械鼓模式的机械时间。这种所谓的解析边带条件是用光实现机械共振器的量子控制的前提。</ p> ,"[{'address': 'Laboratoire Kastler Brossel, UPMC-Sorbonne Universités, CNRS, ENS-PSL Research University, Collège de France, 4 place Jussieu, Case 74, Paris, F75252, France', 'authors': ['Xu Chen', ',\xa0Clément Chardin', ',\xa0Kevin Makles', ',\xa0Charles Caër', ',\xa0Sheon Chua', ',\xa0Tristan Briant', ',\xa0Pierre-François Cohadon', ',\xa0Antoine Heidmann', ',\xa0Thibaut Jacqmin', '\xa0&\xa0Samuel Deléglise']}, {'address': 'Laboratoire de Photonique et de Nanostructures LPN-CNRS/CNRS, Route de Nozay, Marcoussis, 91460, France', 'authors': ['Rémy Braive', '\xa0&\xa0Isabelle Robert-Philip']}, {'address': 'Université Paris Diderot, Sorbonne Paris Cité, Paris, 75207, France', 'authors': ['Rémy Braive']}]",[{'address'：'Laboratoire Kastler Brossel，UPMC-Sorbonne大学，CNRS，ENS-PSL研究大学，法国Collège，4位，Jussieu，Case 74，巴黎，F75252，法国'，'作者'：['Xu Chen '，'，\xa0ClémentChardin'，'，\ xa0Kevin Makles'，'，\ xa0CharlesCaër'，'，\ xa0Sheon Chua'，'，\ xa0Tristan Briant'，'，\xa0Pierre-FrançoisCohadon'，'，\ xa0Antoine Heidmann'，'，\ xa0Thibaut Jacqmin'，'\ xa0＆\ xa0SamuelDeléglise']}，{'地址'：'光子学和纳米结构实验室LPN-CNRS / CNRS，马科斯西斯路线Nozay，91460，法国'，'作者'：['RémyBraive'，'\ xa0＆\ xa0Isabelle Robert-Philip']}，{'address'：'UniversitéParis Diderot，Sorbonne ParisCité，巴黎，75207，法国'，'authors'：['Rémy Braive']}] 
10.1038/lsa.2016.192,Bragg-mirror-like circular dichroism in bio-inspired quadruple-gyroid 4srs nanostructures,受生物启发的四螺旋体4srs纳米结构中的布拉格镜状圆二色性 ,"<p>The smooth and tailorable spectral response of Bragg mirrors has driven their pervasive use in optical systems requiring customizable spectral control of beam propagation. However, the simple nature of Bragg mirror reflection prevents their application to the control of important polarization states such as circular polarization. While helical and gyroid-based nanostructures exhibiting circular dichroism have been developed extensively to address this limitation, they are often restricted by the spectral inconsistency of their optical response. Here we present the fabrication and characterization of quadruple-gyroid 4srs nanostructures exhibiting bio-inspired Bragg-mirror-like circular dichroism: a smooth and uniform band of circular dichroism reminiscent of the spectrum of a simple multilayer Bragg-mirror. Furthermore, we demonstrate that the circular dichroism produced by 4srs nanostructures are robust to changes in incident angle and beam collimation, providing a new platform to create and engineer circular dichroism for functional circular polarization manipulation.</p>",<p>布拉格反射镜的平滑和可定制的光谱响应促使其在需要可定制的光束传播光谱控制的光学系统中得到广泛应用。但是，布拉格镜面反射的简单性质阻止了它们应用于重要的偏振态（例如圆偏振）的控制。虽然已经广泛地开发了显示圆形二色性的基于螺旋和基于螺旋的纳米结构来解决该限制，但是它们经常受到其光学响应的​​光谱不一致的限制。在这里，我们介绍四股螺旋4srs纳米结构的制备和表征，这些纳米结构表现出生物启发的类似布拉格镜的圆二色性：光滑而均匀的圆二色性色带，让人联想到简单的多层布拉格镜的光谱。此外，我们证明了4srs纳米结构产生的圆二色性对入射角和光束准直的变化具有鲁棒性，为创建和设计用于功能圆极化操纵的圆二色性提供了新平台。</ p> ,"[{'address': 'Laboratory of Artificial-Intelligence Nanophotonics and CUDOS, School of Science, RMIT University, Melbourne, 3001, Victoria, Australia', 'authors': ['Benjamin P Cumming', '\xa0&\xa0Min Gu']}, {'address': 'Centre for Micro-Photonics, Faculty of Science, Engineering and Technology, Swinburne University of Technology, Hawthorn, 3122, Victoria, Australia', 'authors': ['Benjamin P Cumming', '\xa0&\xa0Min Gu']}, {'address': 'School of Engineering and Information Technology, Mathematics and Statistics, Murdoch University, Murdoch, Western Australia 6150, Australia', 'authors': ['Gerd E Schröder-Turk']}, {'address': 'Laser Physics Centre and CUDOS, Research School of Physical Sciences and Engineering, Australian National University, Canberra, Australian Capital Territory 2601, Australia', 'authors': ['Sukanta Debbarma']}]",[{'地址'：'人工智慧纳米光子学和CUDOS实验室，墨尔本皇家墨尔本理工大学，墨尔本，3001，澳大利亚维多利亚，'作者'：['Benjamin P Cumming'，'\ xa0＆\ xa0Min Gu' ]}，{'地址'：'斯威本科技大学科学技术与工程学院微光子学中心，霍桑，3122，澳大利亚维多利亚'，'作者'：['Benjamin P Cumming'，'\ xa0＆\ xa0Min Gu']}，{'地址'：'澳大利亚西澳大利亚州默多克市默多克大学工程与信息技术学院，数学和统计学院，澳大利亚6150'，'作者'：['Gerd ESchröder-Turk'] }，{“地址”：“激光物理中心和CUDOS，澳大利亚国立大学物理科学与工程研究学院，堪培拉，澳大利亚首都特区2601，澳大利亚”，“作者”：['Sukanta Debbarma']}] 
10.1038/lsa.2016.194,Control over emissivity of zero-static-power thermal emitters based on phase-changing material GST,基于相变材料GST的零静态功率热辐射器的发射率控制 ,"<p>Controlling the emissivity of a thermal emitter has attracted growing interest, with a view toward a new generation of thermal emission devices. To date, all demonstrations have involved using sustained external electric or thermal consumption to maintain a desired emissivity. In the present study, we demonstrated control over the emissivity of a thermal emitter consisting of a film of phase-changing material Ge<sub>2</sub>Sb<sub>2</sub>Te<sub>5</sub> (GST) on top of a metal film. This thermal emitter achieves broad wavelength-selective spectral emissivity in the mid-infrared. The peak emissivity approaches the ideal blackbody maximum, and a maximum extinction ratio of &gt;10&#8201;dB is attainable by switching the GST between the crystalline and amorphous phases. By controlling the intermediate phases, the emissivity can be continuously tuned. This switchable, tunable, wavelength-selective and thermally stable thermal emitter will pave the way toward the ultimate control of thermal emissivity in the field of fundamental science as well as for energy harvesting and thermal control applications, including thermophotovoltaics, light sources, infrared imaging and radiative coolers.</p>",<p>控制热辐射器的发射率引起了人们的兴趣，以期开发新一代的热辐射设备。迄今为止，所有演示都涉及使用持续的外部电力或热量消耗来维持所需的发射率。在本研究中，我们展示了对由相变材料Ge <sub> 2 </ sub> Sb <sub> 2 </ sub> Te <sub> 5 </ sub>薄膜组成的热辐射器的发射率的控制>（GST）在金属膜的顶部。该热发射器在中红外波段实现了宽广的波长选择光谱发射率。峰值发射率接近理想的黑体最大值，并且通过在晶相和非晶相之间切换GST可获得最大消光比＞ 10＆＃8201; dB。通过控制中间相位，可以连续调整发射率。这种可切换，可调，波长选择和热稳定的热辐射器将为基础科学领域以及能量收集和热控制应用（包括热光电，光源，红外成像和热成像）的最终热辐射控制铺平道路。辐射冷却器。</ p> ,"[{'address': 'State Key Laboratory of Modern Optical Instrumentation, College of Optical Science and Engineering, Zhejiang University, Hangzhou, 310027, China', 'authors': ['Kai-Kai Du', ',\xa0Qiang Li', ',\xa0Ji-Chao Ding', ',\xa0Yue Lu', '\xa0&\xa0Min Qiu']}, {'address': 'College of Information Science & Electronic Engineering, Zhejiang University, Hangzhou, 310027, China', 'authors': ['Yan-Biao Lyu', '\xa0&\xa0Zhi-Yuan Cheng']}]","[{'address': 'State Key Laboratory of Modern Optical Instrumentation, College of Optical Science and Engineering, Zhejiang University, Hangzhou, 310027, China', 'authors': ['Kai-Kai Du', ',\xa0Qiang Li', ',\xa0Ji-Chao Ding', ',\xa0Yue Lu', '\xa0&\xa0Min Qiu']}, {'address': 'College of Information Science & Electronic Engineering, Zhejiang University, Hangzhou, 310027, China', 'authors': ['Yan-Biao Lyu', '\xa0&\xa0Zhi-Yuan Cheng']}] "
10.1038/lsa.2016.196,Ultrafast laser-scanning time-stretch imaging at visible wavelengths,可见波长的超快激光扫描时间拉伸成像 ,"<p>Optical time-stretch imaging enables the continuous capture of non-repetitive events in real time at a line-scan rate of tens of MHz&#8212;a distinct advantage for the ultrafast dynamics monitoring and high-throughput screening that are widely needed in biological microscopy. However, its potential is limited by the technical challenge of achieving significant pulse stretching (that is, high temporal dispersion) and low optical loss, which are the critical factors influencing imaging quality, in the visible spectrum demanded in many of these applications. We present a new pulse-stretching technique, termed free-space angular-chirp-enhanced delay (FACED), with three distinguishing features absent in the prevailing dispersive-fiber-based implementations: (1) it generates substantial, reconfigurable temporal dispersion in free space (&gt;1&#8201;ns&#8201;nm<sup>&#8722;1</sup>) with low intrinsic loss (&lt;6&#8201;dB) at visible wavelengths; (2) its wavelength-invariant pulse-stretching operation introduces a new paradigm in time-stretch imaging, which can now be implemented both with and without spectral encoding; and (3) pulse stretching in FACED inherently provides an ultrafast all-optical laser-beam scanning mechanism at a line-scan rate of tens of MHz. Using FACED, we demonstrate not only ultrafast laser-scanning time-stretch imaging with superior bright-field image quality compared with previous work but also, for the first time, MHz fluorescence and colorized time-stretch microscopy. Our results show that this technique could enable a wider scope of applications in high-speed and high-throughput biological microscopy that were once out of reach.</p>",<p>光学时间拉伸成像技术能够以数十兆赫兹的线扫描速率实时连续捕获非重复事件，这是广泛需要的超快速动态监测和高通量筛选的显着优势在生物显微镜下。然而，在许多这些应用所需的可见光谱中，其潜力受到实现显着脉冲展宽（即高时间色散）和低光损耗的技术挑战的限制，这是影响成像质量的关键因素。我们提出了一种新的脉冲拉伸技术，称为自由空间角-增强延迟（FACED），它具有主要的基于色散光纤的实现中不具备的三个显着特征：（1）它在自由中产生大量可重构的时间色散在可见波长处具有低本征损耗（＆lt; 6＆＃8201; dB）的空间（＆gt; 1＆＃8201; ns＆＃8201; nm <sup>＆＃8722; 1 </ sup>）； （2）其波长不变的脉冲拉伸操作在时间拉伸成像中引入了新的范例，现在可以在有光谱编码和无光谱编码的情况下实现； （3）FACED中的脉冲拉伸固有地以几十MHz的线扫描速率提供了超快的全光学激光束扫描机制。使用FACED，我们不仅展示了与以前的工作相比具有超高亮场图像质量的超快激光扫描时间拉伸成像，而且还首次展示了MHz荧光和彩色时间拉伸显微镜。我们的结果表明，该技术可以为曾经无法企及的高速，高通量生物显微镜提供更广泛的应用。</ p> ,"[{'address': 'Department of Electrical and Electronic Engineering, The University of Hong Kong, Pokfulam Road, Hong Kong 999077, China', 'authors': ['Jiang-Lai Wu', ',\xa0Yi-Qing Xu', ',\xa0Xiao-Ming Wei', ',\xa0Antony CS Chan', ',\xa0Anson HL Tang', ',\xa0Andy KS Lau', ',\xa0Edmund Y Lam', ',\xa0Kenneth KY Wong', '\xa0&\xa0Kevin K Tsia']}, {'address': 'Department of Bioengineering, University of Washington, Seattle, 98195, Washington, USA', 'authors': ['Jing-Jiang Xu']}, {'address': 'Department of Mechanical Engineering, The University of Hong Kong, Pokfulam Road, Hong Kong, 999077, China', 'authors': ['Bob MF Chung', '\xa0&\xa0Ho Cheung Shum']}]",[{'地址'：'香港大学电气及电子工程系，香港薄扶林道，香港999077'，'作者'：['江江来'，'，\ xa0Yi-Qing Qing' ，'，\ xa0Wei-Ming Ming'，'，\ xa0Antony CS Chan'，'，\ xa0Anson HL Tang'，'，\ xa0Andy KS Lau'，'，\ xa0Edmund Y Lam'，'，\ xa0Kenneth KY Wong'， '\ xa0＆\ xa0Kevin K Tsia']}，{'address'：'华盛顿大学生物工程系，西雅图，98195，美国华盛顿'，'作者'：['Jing-Jiang Xu']}，{' 地址”：“香港大学，薄扶林道，香港大学机械工程系，中国999077”，“作者”：['Bob MF Chung'，'\ xa0＆\ xa0Ho Cheung Shum']}]] 
