doi,title,title_cn,abstract,abstract_cn,affiliations,affiliations_cn
10.1038/lsa.2017.4,"High beam quality 5 J, 200 Hz Nd:YAG laser system",高光束质量5 J，200 Hz Nd：YAG激光系统 ,,,"[{'address': 'Academy of Opto-Electronics, Chinese Academy of Sciences, Beijing, 100094, China', 'authors': ['Zhong-Wei Fan', ',\xa0Ji-Si Qiu', ',\xa0Zhi-Jun Kang', ',\xa0Yan-Zhong Chen', ',\xa0Wen-Qi Ge', '\xa0&\xa0Xiong-Xin Tang']}, {'address': 'National Engineering Research Center for DPSSL, Beijing, 100094, China', 'authors': ['Zhong-Wei Fan', ',\xa0Ji-Si Qiu', ',\xa0Zhi-Jun Kang', ',\xa0Yan-Zhong Chen', ',\xa0Wen-Qi Ge', '\xa0&\xa0Xiong-Xin Tang']}, {'address': 'University of Chinese Academy of Sciences, Beijing, 100049, China', 'authors': ['Zhong-Wei Fan']}, {'address': 'Sino-HG Applied Laser Technology Institute Company, Ltd., Tianjin, 300304, China', 'authors': ['Ji-Si Qiu', ',\xa0Zhi-Jun Kang', ',\xa0Yan-Zhong Chen', ',\xa0Wen-Qi Ge', '\xa0&\xa0Xiong-Xin Tang']}]","[{'address': 'Academy of Opto-Electronics, Chinese Academy of Sciences, Beijing, 100094, China', 'authors': ['Zhong-Wei Fan', ',\xa0Ji-Si Qiu', ',\xa0Zhi-Jun Kang', ',\xa0Yan-Zhong Chen', ',\xa0Wen-Qi Ge', '\xa0&\xa0Xiong-Xin Tang']}, {'address': 'National Engineering Research Center for DPSSL, Beijing, 100094, China', 'authors': ['Zhong-Wei Fan', ',\xa0Ji-Si Qiu', ',\xa0Zhi-Jun Kang', ',\xa0Yan-Zhong Chen', ',\xa0Wen-Qi Ge', '\xa0&\xa0Xiong-Xin Tang']}, {'address': 'University of Chinese Academy of Sciences, Beijing, 100049, China', 'authors': ['Zhong-Wei Fan']}, {'address': 'Sino-HG Applied Laser Technology Institute Company, Ltd., Tianjin, 300304, China', 'authors': ['Ji-Si Qiu', ',\xa0Zhi-Jun Kang', ',\xa0Yan-Zhong Chen', ',\xa0Wen-Qi Ge', '\xa0&\xa0Xiong-Xin Tang']}] "
10.1038/lsa.2016.224,Photonic molecules with a tunable inter-cavity gap,具有可调腔隙的光子分子 ,"<p>Optical micro-resonators have broad applications. They are used, for example, to enhance light&#8211;matter interactions in optical sensors or as model systems for investigating fundamental physical mechanisms in cavity quantum electrodynamics. Coupling two or more micro-cavities is particularly interesting as it enlarges the design freedom and the field of application. In this context, achieving tunability of the coupling strength and hence the inter-cavity gap is of utmost importance for adjusting the properties of the coupled micro-resonator system. In this paper, we report on a novel coupling approach that allows highly precise tuning of the coupling gap of polymeric micro-resonators that are fabricated side by side on a common substrate. We structure goblet-shaped whispering-gallery-mode resonators on an elastic silicone-based polymer substrate by direct laser writing. The silicone substrate is mechanically stretched in order to exploit the lateral shrinkage to reduce the coupling gap. Incorporating a laser dye into the micro-resonators transforms the cavities into micro-lasers that can be pumped optically. We have investigated the lasing emission by micro-photoluminescence spectroscopy, focusing on the spatial localization of the modes. Our results demonstrate the formation of photonic molecules consisting of two or even three resonators, for which the coupling strengths and hence the lasing performance can be precisely tuned. Flexibility and tunability are key elements in future photonics, making our approach interesting for various photonic applications. For instance, as our coupling approach can also be extended to larger cavity arrays, it might serve as a platform for tunable coupled-resonator optical waveguide devices.</p>",<p>光学微谐振器具有广泛的应用。它们例如用于增强光学传感器中的光与物质的相互作用，或用作研究腔量子电动力学中基本物理机制的模型系统。耦合两个或多个微腔特别有趣，因为它扩大了设计的自由度和应用领域。在这种情况下，对于调节耦合的微谐振器系统的性能而言，实现耦合强度的可调谐性以及因此使腔之间的间隙至关重要。在本文中，我们报告了一种新颖的耦合方法，该方法可以高度精确地调整在共同基板上并排制造的聚合物微谐振器的耦合间隙。我们通过直接激光写入在弹性有机硅基聚合物基板上构造高脚杯状的耳语画廊模式谐振器。机械拉伸有机硅基材，以利用横向收缩来减小连接间隙。将激光染料掺入到微谐振器中，可以将空腔转换成可以光学泵浦的微激光器。我们已经研究了通过微光致发光光谱的激光发射，重点是模式的空间定位。我们的结果证明了由两个或什至三个谐振器组成的光子分子的形成，可以精确地调节其耦合强度和激射性能。灵活性和可调性是未来光子学中的关键要素，这使我们的方法对于各种光子学应用很有趣。例如，由于我们的耦合方法还可以扩展到更大的腔阵列，因此它可以作为可调谐耦合谐振器光波导器件的平台。</ p> ,"[{'address': 'Institute of Applied Physics, Karlsruhe Institute of Technology (KIT), Karlsruhe, 76128, Germany', 'authors': ['Tobias Siegle', ',\xa0Stefan Schierle', ',\xa0Sarah Kraemmer', '\xa0&\xa0Heinz Kalt']}, {'address': 'Zoological Institute, Karlsruhe Institute of Technology (KIT), Karlsruhe, 76128, Germany', 'authors': ['Benjamin Richter']}, {'address': 'Institute of Microstructure Technology, Karlsruhe Institute of Technology (KIT), Karlsruhe, 76128, Germany', 'authors': ['Sentayehu F Wondimu', ',\xa0Peter Schuch', '\xa0&\xa0Christian Koos']}, {'address': 'Institute of Photonics and Quantum Electronics, Karlsruhe Institute of Technology (KIT), Karlsruhe, 76128, Germany', 'authors': ['Sentayehu F Wondimu', '\xa0&\xa0Christian Koos']}]",[{'地址'：'卡尔斯鲁厄理工学院（KIT）应用物理研究所，德国76128，'作者'：['Tobias Siegle'，'，\ xa0Stefan Schierle'，'，\ xa0Sarah Kraemmer' ，'\ xa0＆\ xa0Heinz Kalt']}，{'address'：'卡尔斯鲁厄技术学院（KIT）动物学研究所，德国卡尔斯鲁厄，76128'，'作者'：['Benjamin Richter']}，{'地址 '：“卡尔斯鲁厄技术学院微结构技术研究所，卡尔斯鲁厄，76128，德国”，“作者”：['Sentayehu F Wondimu'，'，\ xa0Peter Schuch'，'\ xa0＆\ xa0Christian Koos']} ，{'地址'：'卡尔斯鲁厄理工学院（KIT）的光子学和量子电子研究所，德国卡尔斯鲁厄，76128'，'作者'：['Sentayehu F Wondimu'，'\ xa0＆\ xa0Christian Koos']}]] 
10.1038/lsa.2016.226,Optical fiber meta-tips,光纤元提示 ,"<p>We report on the first demonstration of a proof-of-principle optical fiber &#8216;meta-tip&#8217;, which integrates a phase-gradient plasmonic metasurface on the fiber tip. For illustration and validation purposes, we present numerical and experimental results pertaining to various prototypes implementing generalized forms of the Snell&#8217;s transmission/reflection laws at near-infrared wavelengths. In particular, we demonstrate several examples of beam steering and coupling with surface waves, in fairly good agreement with theory. Our results constitute a first step toward the integration of unprecedented (metasurface-enabled) light-manipulation capabilities in optical-fiber technology. By further enriching the emergent &#8216;lab-on-fiber&#8217; framework, this may pave the way for the widespread diffusion of optical metasurfaces in real-world applications to communications, signal processing, imaging and sensing.</p>",<p>我们报告了原理证明光纤＆＃8216; meta-tip＆＃8217;的首次演示，该光纤在光纤尖端上集成了相梯度等离子体超表面。 为了说明和验证目的，我们提供了与各种原型相关的数值和实验结果，这些原型实现了Snell透射/反射定律在近红外波长的广义形式。 特别是，我们展示了光束转向和与表面波耦合的几个示例，与理论相当吻合。 我们的结果构成了将前所未有的（启用元表面的）光处理功能集成到光纤技术中的第一步。 通过进一步丰富出现的＆＃8216;光纤实验室＆＃8217; 框架，这可能为光学超表面在现实世界中广泛应用于通信，信号处理，成像和传感的应用铺平道路。</ p> ,"[{'address': 'Optoelectronic Division, Department of Engineering, University of Sannio, Benevento, I-82100, Italy', 'authors': ['Maria Principe', ',\xa0Marco Consales', ',\xa0Alberto Micco', ',\xa0Antonello Cutolo', '\xa0&\xa0Andrea Cusano']}, {'address': 'Department of Engineering, Waves Group, University of Sannio, Benevento, I-82100, Italy', 'authors': ['Maria Principe', ',\xa0Giuseppe Castaldi', '\xa0&\xa0Vincenzo Galdi']}, {'address': 'Institute for Microelectronics and Microsystems, National Research Council, Napoli, I-80131, Italy', 'authors': ['Alessio Crescitelli', '\xa0&\xa0Emanuela Esposito']}, {'address': 'UTTP-MDB, Materials and Devices, ENEA—Portici Research Center, Portici, Napoli, I-80055, Italy', 'authors': ['Vera La Ferrara']}]",[{'地址'：'圣尼奥大学工程系光电系，意大利I-82100，贝内文托'，'作者'：['Maria Principe'，'，\ xa0Marco Consales'，'，\ xa0Alberto Micco' ，'，\ xa0Antonello Cutolo'，'\ xa0＆\ xa0Andrea Cusano']}，{'地址'：'圣尼奥大学工程学院工程系，贝内文托，I-82100，意大利'，'作者'：[' Maria Principe'，'，\，xa0Giuseppe Castaldi'，'\ xa0＆\ xa0Vincenzo Galdi']}，{'address'：'国家研究委员会微电子学和微系统研究所，那不勒斯，I-80131，意大利'，'作者'： ['Alessio Crescitelli'，'\ xa0＆\ xa0Emanuela Esposito']}，{'address'：'UTTP-MDB，材料和设备，ENEA-Portici研究中心，Portici，那不勒斯，I-80055，意大利'，'作者' ：['Vera La Ferrara']} 
10.1038/lsa.2016.232,Direct observation of Anderson localization in plasmonic terahertz devices,直接观察等离子太赫兹设备中的安德森定位 ,"<p>We present the first experimental observation of Anderson localization in the terahertz frequency range using plasmonic structures. To accomplish this goal, we designed THz waveguides consisting of a one-dimensional array of rectangular apertures that were fabricated in a freestanding metal foil. Disorder is introduced into the waveguide by offsetting the position of each aperture by a random distance within a prescribed range. For example, for a waveguide with apertures spaced by 250&#8201;&#956;m in a periodic waveguide, 10% disorder would correspond to the apertures being shifted by a random value between &#177;25&#8201;&#956;m along the waveguide axis. We find that for disorder levels below 25%, there is only an increase in the propagation loss along the device. However, for two specific waveguides with 25% disorder, we observe a spatially localized mode that lies just within the stop band of the device and exhibits a double-sided exponential spatial decay away from the maximum.</p>",<p>我们提出了使用等离子体结构在太赫兹频率范围内进行安德森定位的首次实验观察。为了实现此目标，我们设计了太赫兹波导，该波导由一维矩形孔阵列组成，这些矩形孔是在独立的金属箔中制造的。通过将每个孔的位置偏移规定范围内的随机距离，将无序引入波导。例如，对于在周期波导中孔径间隔为250的波导，10％的无序性将对应于孔径在25到25之间的随机值偏移。沿波导轴我们发现，对于低于25％的无序水平，沿着设备的传播损耗只会增加。然而，对于具有25％无序性的两个特定波导，我们观察到一个空间局部模式，该模式恰好位于设备的阻带内，并且呈现出远离最大值的双面指数空间衰减。</ p> ,"[{'address': 'Department of Electrical and Computer Engineering, University of Utah, Salt Lake City, 84112, UT, USA', 'authors': ['Shashank Pandey', ',\xa0Barun Gupta', '\xa0&\xa0Ajay Nahata']}, {'address': 'Tata Institute for Fundamental Research, Mumbai, 400005, India', 'authors': ['Sushil Mujumdar']}]",[{'地址'：'犹他大学盐湖城电气与计算机工程系，美国犹他州84112'，'作者'：['Shashank Pandey'，'，\ xa0Barun Gupta'，'\ xa0＆\ xa0Ajay Nahata']}，{'地址'：'塔塔基础研究学院，印度孟买，400005'，'作者'：['Sushil Mujumdar']}] 
10.1038/lsa.2016.239,Rapid and robust control of single quantum dots,快速可靠地控制单个量子点 ,"<p>The combination of single particle detection and ultrafast laser pulses is an instrumental method to track dynamics at the femtosecond time scale in single molecules, quantum dots and plasmonic nanoparticles. Optimal control of the extremely short-lived coherences of these individual systems has so far remained elusive, yet its successful implementation would enable arbitrary external manipulation of otherwise inaccessible nanoscale dynamics. In ensemble measurements, such control is often achieved by resorting to a closed-loop optimization strategy, where the spectral phase of a broadband laser field is iteratively optimized. This scheme needs long measurement times and strong signals to converge to the optimal solution. This requirement is in conflict with the nature of single emitters whose signals are weak and unstable. Here we demonstrate an effective closed-loop optimization strategy capable of addressing single quantum dots at room temperature, using as feedback observable the two-photon photoluminescence induced by a phase-controlled broadband femtosecond laser. Crucial to the optimization loop is the use of a deterministic and robust-against-noise search algorithm converging to the theoretically predicted solution in a reduced amount of steps, even when operating at the few-photon level. Full optimization of the single dot luminescence is obtained within ~100 trials, with a typical integration time of 100&#8201;ms per trial. These times are faster than the typical photobleaching times in single molecules at room temperature. Our results show the suitability of the novel approach to perform closed-loop optimizations on single molecules, thus extending the available experimental toolbox to the active control of nanoscale coherences.</p>",<p>单粒子检测和超快激光脉冲的组合是一种在飞秒时间尺度上跟踪单分子，量子点和等离激元纳米粒子动力学的仪器方法。迄今为止，对这些单个系统极其短暂的相干性的最佳控制仍然遥遥无期，但其成功实施将能够对外部无法实现的纳米级动力学进行任意外部操纵。在集成测量中，通常通过采用闭环优化策略来实现这种控制，在该策略中，迭代地优化了宽带激光场的光谱相位。该方案需要较长的测量时间和较强的信号才能收敛到最佳解决方案。该要求与信号微弱且不稳定的单个发射器的性质相冲突。在这里，我们展示了一种有效的闭环优化策略，该策略能够在室温下解决单个量子点的问题，并使用可控的宽带飞秒激光诱导的双光子光致发光作为反馈。优化循环的关键是使用确定性和鲁棒性的抗噪搜索算法，即使在几个光子级上运行，也可以减少步数，收敛到理论预测的解决方案。在约100个试验中获得了单点发光的完全优化，每个试验的典型积分时间为100＆＃8201; ms。这些时间比室温下单个分子的典型光漂白时间快。我们的结果表明，该新方法适用于对单个分子进行闭环优化，从而将可用的实验工具箱扩展到了对纳米级相干性的主动控制。</ p> ,"[{'address': 'ICFO - Institut de Ciencies Fotoniques, The Barcelona Institute of Science and Technology, Castelldefels (Barcelona), 08860, Spain', 'authors': ['Nicolò Accanto', ',\xa0Pablo M de Roque', '\xa0&\xa0Niek F van Hulst']}, {'address': 'Instituto de Óptica-CSIC, Madrid, 28006, Spain', 'authors': ['Marcial Galvan-Sosa']}, {'address': 'Istituto Italiano di Tecnologia, Genova, 16163, Italy', 'authors': ['Sotirios Christodoulou', '\xa0&\xa0Iwan Moreels']}, {'address': 'Department of Physics, University of Genova, Genova, 16146, Italy', 'authors': ['Sotirios Christodoulou']}, {'address': 'ICREA - Institució Catalana de Recerca i Estudis Avançats, Barcelona, 08010, Spain', 'authors': ['Niek F van Hulst']}]",[{'address'：'ICFO-Fotons研究所，巴塞罗那科学技术学院，卡斯特尔德费尔斯（巴塞罗那），西班牙08860，'作者'：['NicolòAccanto'，'，\ xa0Pablo M de Roque' ，'\ xa0＆\ xa0Niek F van Hulst']}，{'address'：'Instituto deÓptica-CSIC，Madrid，28006，Spain'，'authors'：['Marcial Galvan-Sosa']}，{'address ”：“意大利热那亚理工学院（Istituto Italiano di Tecnologia，热那亚，16163，意大利”），“作者”：['Sotirios Christodoulou'，'\ xa0和\ xa0Iwan Moreels']}，{'地址'：'热那亚大学物理系，热那亚，16146，意大利'，'作者'：['Sotirios Christodoulou']}，{'地址'：'ICREA-西班牙加泰罗尼亚加泰罗纳德埃斯特迪斯阿文萨斯学院，巴塞罗那，08010，西班牙'，'作者'：'[ Niek F van Hulst']}] 
10.1038/lsa.2016.256,Direct visualization of the complete evolution of femtosecond laser-induced surface structural dynamics of metals,飞秒激光诱导的金属表面结构动力学的完整演化的直接可视化 ,"<p>Despite extensive studies of femtosecond laser-material interactions, even the simplest morphological responses following femtosecond pulse irradiation have not been fully resolved. Past studies have revealed only partial dynamics. Here we develop a zero-background and high-contrast scattered-light-based optical imaging technique through which we capture, for the first time, the complete temporal and spatial evolution of the femtosecond laser-induced morphological surface structural dynamics of metals from start to finish, that is, from the initial transient surface fluctuations, through melting and ablation, to the end of resolidification. We find that transient surface structures first appear at a delay time on the order of 100&#8201;ps, which is attributed to ablation driven by pressure relaxation in the surface layer. The formation dynamics of the surface structures at different length scales are individually resolved, and the sequence of their appearance changes with laser fluence is found. Cooling and complete resolidification, observed here for the first time, are shown to occur more slowly than previously predicted by two orders of magnitude. We examine and identify the mechanisms driving each of these dynamic steps. The visualization and control of morphological surface structural dynamics not only are of fundamental importance for understanding femtosecond laser-induced material responses but also pave the way for the design of new material functionalities through surface structuring.</p>",<p>尽管对飞秒激光与材料的相互作用进行了广泛的研究，但飞秒脉冲辐照后最简单的形态反应仍未完全解决。过去的研究仅揭示了部分动态。在这里，我们开发了一种基于零背景和高对比度的基于散射光的光学成像技术，通过该技术，我们首次捕获了飞秒激光诱导的金属形态表面结构动力学从头到尾的完整时空演变。即从最初的瞬时表面波动，熔化和烧蚀直至再凝固结束。我们发现瞬态表面结构首先出现在100ps数量级的延迟时间，这归因于表面层压力松弛所驱动的烧蚀。分别解决了不同长度尺度的表面结构的形成动力学，并发现了其外观随激光能量密度变化的顺序。首次在这里观察到的冷却和完全再凝固显示出比先前预计的慢两个数量级。我们研究并确定了驱动这些动态步骤中每一个的机制。形态学表面结构动力学的可视化和控制，不仅对于理解飞秒激光诱导的材料响应至关重要，而且为通过表面结构设计新材料功能性铺平了道路。</ p> ,"[{'address': 'The Institute of Optics, University of Rochester, Rochester, 14627, NY, USA', 'authors': ['Ranran Fang', ',\xa0Anatoliy Vorobyev', '\xa0&\xa0Chunlei Guo']}, {'address': 'The Guo China-US Photonics Laboratory, Changchun Institute of Optics, Fine Mechanics and Physics, Chinese Academy of Sciences, Changchun, China', 'authors': ['Chunlei Guo']}]",[{'address'：“美国纽约州罗彻斯特市罗彻斯特大学光学研究所，美国纽约州14627”，“作者”：['Ranran Fang'，'，\ xa0Anatoliy Vorobyev'，'\ xa0＆\ xa0Chunlei Guo'] }，{“地址”：“中国科学院长春光学精密机械与物理研究所郭中美光子实验室，中国长春”，“作者”：['Chunlei Guo']}]] 
