doi,title,title_cn,abstract,abstract_cn,affiliations,affiliations_cn
10.1038/lsa.2018.5,Ultrahigh-resolution nonlinear optical imaging of the armchair orientation in 2D transition metal dichalcogenides,二维过渡金属二卤化物中扶手椅取向的超高分辨率非线性光学成像 ,"<p>We used nonlinear laser scanning optical microscopy to study atomically thin transition metal dichalcogenides (TMDs) and revealed, with unprecedented resolution, the orientational distribution of armchair directions and their degree of organization in the two-dimensional (2D) crystal lattice. In particular, we carried out polarization-resolved second-harmonic generation (PSHG) imaging for monolayer WS<sub>2</sub> and obtained, with high-precision, the orientation of the main crystallographic axis (armchair orientation) for each individual 120 &#215; 120&#8201;nm<sup>2</sup> pixel of the 2D crystal area. Such nanoscale resolution was realized by fitting the experimental PSHG images, obtained with sub-micron precision, to a new generalized theoretical model that accounts for the nonlinear optical properties of TMDs. This enabled us to distinguish between different crystallographic domains, locate boundaries and reveal fine structure. As a consequence, we can calculate the mean orientational average of armchair angle distributions in specific regions of interest and define the corresponding standard deviation as a figure-of-merit for the 2D crystal quality.</p>",<p>我们使用非线性激光扫描光学显微镜研究了原子稀薄的过渡金属二硫化二氢（TMD），并以前所未有的分辨率揭示了扶手椅方向的方向分布及其在二维（2D）晶格中的组织度。特别是，我们对单层WS <sub> 2 </ sub>进行了偏振分辨二次谐波生成（PSHG）成像，并以高精度获得了每个个体的主结晶轴方向（扶手椅方向） 120＆＃215;二维晶体区域的120＆＃8201; nm <sup> 2 </ sup>像素。通过将亚微米精度获得的实验PSHG图像拟合到考虑了TMDs非线性光学特性的新型广义理论模型中，可以实现这种纳米级分辨率。这使我们能够区分不同的晶体学区域，定位边界并揭示精细的结构。因此，我们可以计算出特定目标区域中扶手椅角分布的平均取向平均值，并将相应的标准偏差定义为二维晶体质量的品质因数。</ p> ,"[{'address': 'Institute of Electronic Structure and Laser, Foundation for Research and Technology-Hellas, Heraklion Crete, 71110, Greece', 'authors': ['Sotiris Psilodimitrakopoulos', ',\xa0Leonidas Mouchliadis', ',\xa0Ioannis Paradisanos', ',\xa0Andreas Lemonis', ',\xa0George Kioseoglou', '\xa0&\xa0Emmanuel Stratakis']}, {'address': 'Department of Physics, University of Crete, Heraklion Crete, 71003, Greece', 'authors': ['Ioannis Paradisanos']}, {'address': 'Department of Materials Science and Technology, University of Crete, Heraklion Crete, 71003, Greece', 'authors': ['George Kioseoglou', '\xa0&\xa0Emmanuel Stratakis']}]",[{'地址'：'电子结构与激光研究所，研究技术基金会-Hellas，伊拉克利翁克里特岛，希腊，71110'，'作者'：['Sotiris Psilodimitrakopoulos'，'，\ xa0Leonidas Mouchliadis'，'，\ xa0Ioannis Paradisanos'，'，\ xa0Andreas Lemonis'，'，\ xa0George Kioseoglou'，'\ xa0 \ xa0Emmanuel Stratakis']}，{'address'：'物理系，克里特大学，伊拉克利翁克里特岛，71003，希腊'， 'authors'：['Ioannis Paradisanos']}，{'address'：'克里特大学材料科学与技术系，伊拉克利翁克里特岛，希腊71003'，'authors'：['George Kioseoglou'，'\ xa0＆ \ xa0Emmanuel Stratakis']}] 
10.1038/lsa.2018.6,A real-time detection and positioning method for small and weak targets using a 1D morphology-based approach in 2D images,使用基于1D形态学的方法在2D图像中实时检测小目标和弱目标的方法 ,"<p>A small and weak target detection method is proposed in this work that outperforms all other methods in terms of real-time capability. It is the first time that two-dimensional (2D) images are processed using only one-dimensional1D structuring elements in a morphology-based approach, enabling the real-time hardware implementation of the whole image processing method. A parallel image readout and processing structure is introduced to achieve an ultra-low latency time on the order of nanoseconds, and a hyper-frame resolution in the time domain can be achieved by combining the row-by-row structure and the electrical rolling shutter technique. Experimental results suggest that the expected target can be successfully detected under various interferences with an accuracy of 0.1 pixels (1&#963;) under the worst sky night test condition and that a centroiding precision of better than 0.03 pixels (1&#963;) can be reached for static tests. The real-time detection method with high robustness and accuracy is attractive for application to all types of real-time small target detection systems, such as medical imaging, infrared surveillance, and target measurement and tracking, where an ultra-high processing speed is required.</p>",<p>在这项工作中，提出了一种小而弱的目标检测方法，该方法在实时能力方面优于所有其他方法。这是首次以基于形态学的方法仅使用一维1D结构元素处理二维（2D）图像，从而实现了整个图像处理方法的实时硬件实现。引入了并行图像读取和处理结构，以实现纳秒级的超低延迟时间，并且通过将逐行结构和电子滚动快门相结合，可以在时域中实现超帧分辨率技术。实验结果表明，在最坏的夜空测试条件下，可以在各种干扰下以0.1像素（1 ##）的精度成功检测到预期目标，并且质心精度优于0.03像素（1 ## 963;）。达到静态测试。具有高鲁棒性和准确性的实时检测方法非常适合应用于需要超高处理速度的所有类型的实时小型目标检测系统，例如医学成像，红外监视以及目标测量和跟踪</ p> ,"[{'address': 'Department of Precision Instrument, Tsinghua University, Beijing, 100084, China', 'authors': ['Min-Song Wei', ',\xa0Fei Xing', '\xa0&\xa0Zheng You']}, {'address': 'State Key Laboratory of Precision Measurement Technology and Instruments, Tsinghua University, Beijing, 100084, China', 'authors': ['Min-Song Wei', ',\xa0Fei Xing', '\xa0&\xa0Zheng You']}, {'address': 'Department of Mechanical Engineering, University of California, Berkeley, 94720, CA, USA', 'authors': ['Min-Song Wei']}]",[{'地址'：'清华大学精密仪器系，北京，100084'，'作者'：['Min-Song Wei'，'，\ xa0Fei X''，'\ xa0＆\ xa0Zheng You']} ，{“地址”：“清华大学精密测量技术与仪器国家重点实验室，北京，100084”，“作者”：['Min-Song Wei'，'，\ xa0Fei Xing'，'\ xa0＆\ xa0Zheng You']}，{'地址'：'加利福尼亚大学伯克利分校机械工程系，美国，加利福尼亚州94720'，'作者'：['Min-Song Wei']}] 
10.1038/lsa.2018.8,Negative reflection and negative surface wave conversion from obliquely incident electromagnetic waves,倾斜入射电磁波的负反射和负表面波转换 ,"<p>Complete control of spatially propagating waves (PWs) and surface waves (SWs) is an ultimate goal that scientists and engineers seek for, in which negative reflection of PW and negative surface wave are two exotic phenomena. Here, we experimentally demonstrate an anisotropic digital coding metasurface capable of controlling both PWs and SWs with a single coding pattern. On the basis of the digital description of coding metasurfaces, a simple coding method is proposed to allow dual functionalities (either PW or SW manipulations) under two orthogonal polarizations at arbitrarily oblique incidences, thus improving the adaptability of digital coding metasurfaces in more practical circumstances. With elaborately designed ellipse-shaped coding particles, we experimentally demonstrate various functions under oblique incidences, including the negative reflection of PW, negative SW, anomalous reflection and their arbitrary combinations, all having good agreements with theoretical and numerical predictions. We believe that the proposed method may enable the digital coding metasurfaces to have broad applications in radar detections, wireless communications and imaging.</p>",<p>完全控制空间传播波（PW）和表面波（SW）是科学家和工程师追求的最终目标，其中PW的负反射和负表面波是两个奇特的现象。在这里，我们实验证明了一种各向异性的数字编码超表面，它能够用一个编码模式控制PW和SW。基于对编码超表面的数字描述，提出了一种简单的编码方法，该方法允许在任意倾斜入射角的两个正交极化下实现双重功能（PW或SW操作），从而提高了数字编码超表面在实际环境中的适应性。通过精心设计的椭圆形编码粒子，我们通过实验证明了斜入射下的各种功能，包括PW的负反射，SW的负反射，反常反射及其任意组合，所有这些都与理论和数值预测相吻合。我们相信，该方法可以使数字编码超表面在雷达探测，无线通信和成像中具有广泛的应用。</ p> ,"[{'address': 'State Key Laboratory of Millimeter Waves, Southeast University, Nanjing, 210096, China', 'authors': ['Shuo Liu', ',\xa0Tie Jun Cui', ',\xa0Ahsan Noor', ',\xa0Zui Tao', ',\xa0Hao Chi Zhang', ',\xa0Guo Dong Bai', ',\xa0Yan Yang', '\xa0&\xa0Xiao Yang Zhou']}, {'address': 'Synergetic Innovation Center of Wireless Communication Technology, Southeast University, Nanjing, 210096, China', 'authors': ['Shuo Liu', ',\xa0Tie Jun Cui', ',\xa0Ahsan Noor', ',\xa0Zui Tao', ',\xa0Hao Chi Zhang', '\xa0&\xa0Guo Dong Bai']}, {'address': 'Centre of Intelligent Acoustics and Immersive Communications and School of Marine Science and Technology, Northwestern Polytechnical University, Xian, 710072, China', 'authors': ['Yan Yang']}, {'address': 'Jiangsu Xuantu Technology Co., Ltd., 12 Mozhou East Road, Nanjing, 211111, China', 'authors': ['Xiao Yang Zhou']}]",[{'地址'：'东南大学毫米波国家重点实验室，南京，210096'，'作者'：['刘硕'，'，\ xa0Tie Jun Cui'，'，'xa0Ahsan Noor'，' ，\ xa0Zui Tao'，'，\ xa0Hao Chi Zhang'，'，\ xa0Guo Dong Bai'，'，\ xa0Yan Yang'，'\ xa0＆\ xa0XiaoYang Zhou']}，{'address'：'协同创新中心 东南大学无线通信技术，南京，210096”，“作者”：['Shuo Liu'，'，\ xa0Tie Jun Cui'，'，\ xa0Ahsan Noor'，'，\ xa0Zui Tao'，'，\ xa0Hao 张池，'\ xa0＆\ xa0Guo Dong Bai']}，{'address'：“西北工业大学智能声学与沉浸式通信技术中心和海洋科学技术学院，西安710072”，“作者” ：['Yan Yang']}，{'address'：'江苏玄图科技有限公司，南京市墨州东路12号，211111'，'authors'：['Xiao Yang Zhou']}]] 
10.1038/lsa.2018.9,Entanglement beating in free space through spin–orbit coupling,通过自旋轨道耦合在自由空间中纠缠跳动 ,"<p>It is well known that the entanglement of a quantum state is invariant under local unitary transformations. This rule dictates, for example, that the entanglement of internal degrees of freedom of a photon remains invariant during free-space propagation. Here, we outline a scenario in which this paradigm does not hold. Using local Bell states engineered from classical vector vortex beams with non-separable degrees of freedom, the so-called classically entangled states, we demonstrate that the entanglement evolves during propagation, oscillating between maximally entangled (purely vector) and product states (purely scalar). We outline the spin&#8211;orbit interaction behind these novel propagation dynamics and confirm the results experimentally, demonstrating spin&#8211;orbit coupling in paraxial beams. This demonstration highlights a hitherto unnoticed property of classical entanglement and simultaneously offers a device for the on-demand delivery of vector states to targets, for example, for dynamic laser materials processing, switchable resolution within stimulated emission depletion (STED) systems, and a tractor beam for entanglement.</p>",<p>众所周知，量子态的纠缠在局部unit变换下是不变的。例如，该规则指示光子内部自由度的纠缠在自由空间传播期间保持不变。在这里，我们概述了这种范例不成立的情况。使用具有不可分自由度的经典矢量涡旋光束设计的局部贝尔状态，即所谓的经典纠缠状态，我们证明了纠缠在传播过程中演化，在最大纠缠（纯粹矢量）和乘积状态（纯粹标量）之间振荡。我们概述了这些新颖的传播动力学背后的自旋轨道相互作用，并通过实验证实了这一结果，论证了近轴光束中的自旋轨道耦合。该演示突出显示了迄今为止经典的纠缠特性，同时还提供了一种将矢量状态按需传递到目标的设备，例如，用于动态激光材料处理，受激发射损耗（STED）系统内可切换的分辨率以及拖拉机纠缠光束。</ p> ,"[{'address': 'Institute of Applied Physics, University of Muenster, Muenster, D-48149, Germany', 'authors': ['Eileen Otte', '\xa0&\xa0Cornelia Denz']}, {'address': 'School of Physics, University of the Witwatersrand, Wits, 2050, South Africa', 'authors': ['Carmelo Rosales-Guzmán', ',\xa0Bienvenu Ndagano', '\xa0&\xa0Andrew Forbes']}]",[{'地址'：'德国明斯特大学应用物理研究所，D-48149，德国'，'作者'：['Eileen Otte'，'\ xa0＆\ xa0Cornelia Denz']}，{'地址：： '威特沃特斯兰德大学物理学院，维特，2050年，南非'，'作者'：['CarmeloRosales-Guzmán'，'，\ xa0Bienvenu Ndagano'，'\ xa0＆\ xa0Andrew Forbes']}]] 
10.1038/lsa.2017.179,Spectroscopic stimulated Raman scattering imaging of highly dynamic specimens through matrix completion,通过基质完成对高动态标本的光谱激发拉曼散射成像 ,"<p>Spectroscopic stimulated Raman scattering (SRS) imaging generates chemical maps of intrinsic molecules, with no need for prior knowledge. Despite great advances in instrumentation, the acquisition speed for a spectroscopic SRS image stack is fundamentally bounded by the pixel integration time. In this work, we report three-dimensional sparsely sampled spectroscopic SRS imaging that measures ~20% of pixels throughout the stack. In conjunction with related work in low-rank matrix completion (e.g., the Netflix Prize), we develop a regularized non-negative matrix factorization algorithm to decompose the sub-sampled image stack into spectral signatures and concentration maps. This design enables an acquisition speed of 0.8&#8201;s per image stack, with 50 frames in the spectral domain and 40,000 pixels in the spatial domain, which is faster than the conventional raster laser-scanning scheme by one order of magnitude. Such speed allows real-time metabolic imaging of living fungi suspended in a growth medium while effectively maintaining the spatial and spectral resolutions. This work is expected to promote broad application of matrix completion in spectroscopic laser-scanning imaging.</p>","<p>光谱激发拉曼散射（SRS）成像无需固有知识即可生成内在分子的化学图。尽管仪器方面取得了很大的进步，但光谱SRS图像堆栈的采集速度从根本上受像素积分时间的限制。在这项工作中，我们报告了三维稀疏采样光谱SRS成像，可测量整个堆栈中约20％的像素。结合低秩矩阵完成的相关工作（例如Netflix奖），我们开发了一种正则化的非负矩阵分解算法，以将子采样图像堆栈分解为光谱特征和浓度图。该设计使每个图像堆栈的采集速度为0.8 s，在光谱域中具有50帧，在空间域中具有40,000像素，这比常规光栅激光扫描方案快一个数量级。这样的速度允许对悬浮在生长培养基中的活真菌进行实时代谢成像，同时有效地保持空间和光谱分辨率。预期这项工作将促进矩阵完成在光谱激光扫描成像中的广泛应用。</ p> ","[{'address': 'Department of Biomedical Engineering, Boston University, Boston, 02215, MA, USA', 'authors': ['Haonan Lin', '\xa0&\xa0Ji-Xin Cheng']}, {'address': 'Department of Electrical & Computer Engineering, Boston University, Boston, 02215, MA, USA', 'authors': ['Chien-Sheng Liao', '\xa0&\xa0Ji-Xin Cheng']}, {'address': 'Vibronix, Inc., West Lafayette, 47907, IN, USA', 'authors': ['Pu Wang']}, {'address': 'Weldon School of Biomedical Engineering, Purdue University, West Lafayette, 47907, IN, USA', 'authors': ['Nan Kong']}]",[{'地址'：'波士顿大学生物医学工程系，波士顿，美国马萨诸塞州02215'，'作者'：['Haonan Lin'，'\ xa0＆\ xa0Ji-XinCheng Xin']}，{'地址 ：“波士顿大学电机与计算机工程系，波士顿，美国马萨诸塞州02215”，“作者”：['廖建生，'\ xa0＆\ xa0Ji-Xin Cheng']，}，{'地址'： 'Vibronix，Inc.，West Lafayette，47907，IN，USA'，'authors'：['Pu Wang']}，{'address'：'Purdue UniversityWeldon Biomedical Engineering School，Purdue University，West Lafayette，47907，IN， 美国”，“作者”：['Nan Kong']}] 
