doi,title,title_cn,abstract,abstract_cn,affiliations,affiliations_cn
10.1038/lsa.2015.121,Graphene-doped polymer nanofibers for low-threshold nonlinear optical waveguiding,石墨烯掺杂的聚合物纳米纤维用于低阈值非线性光波导 ,"<p>Graphene-doped polymer nanofibers are fabricated by taper drawing of solvated polyvinyl alcohol doped with liquid-phase exfoliated graphene flakes. Nanofibers drawn this way typically have diameters measured in hundreds of nanometers and lengths in tens of millimeters; they show excellent uniformity and surface smoothness for optical waveguiding. Owing to their tightly confined waveguiding behavior, light&#8211;matter interaction in these subwavelength-diameter nanofibers is significantly enhanced. Using approximately 1350-nm-wavelength femto-second pulses, we demonstrate saturable absorption behavior in these nanofibers with a saturation threshold down to 0.25 pJ pulse<sup>&#8722;1</sup> (peak power &#8764;1.3 W). Additionally, using 1064-nm-wavelength nanosecond pulses as switching light, we show all-optical modulation of a 1550-nm-wavelength signal light guided along a single nanofiber with a switching peak power of &#8764;3.2 W.</p>",掺杂石墨烯的聚合物纳米纤维是通过将液相剥落的石墨烯薄片掺入的溶剂化聚乙烯醇的锥度拉伸法制成的。 用这种方法拉制的纳米纤维通常具有几百纳米的直径和数十毫米的长度。 它们对于光波导显示出优异的均匀性和表面光滑度。 由于它们严格的波导行为，这些亚波长直径纳米纤维中的光物质相互作用得到显着增强。 使用大约1350 nm波长的飞秒脉冲，我们证明了在这些纳米纤维中的饱和吸收行为，其饱和阈值低至0.25 pJ脉冲<sup>＆＃8722; 1 </ sup>（峰值功率＆＃8764; 1.3 W ）。 此外，使用1064 nm波长的纳秒脉冲作为开关光，我们展示了沿单根纳米光纤引导的1550 nm波长的信号光的全光调制，开关峰值功率为＆＃8764; 3.2 W。</ p > ,"[{'address': 'State Key Laboratory of Modern Optical Instrumentation, College of Optical Science and Engineering, Zhejiang University, Hangzhou, 310027, China', 'authors': ['Chao Meng', ',\xa0Shao-Liang Yu', '\xa0&\xa0Li-Min Tong']}, {'address': 'Department of Physics, State Key Laboratory of Surface Physics, Laboratory of Advanced Materials and Key Laboratory of Micro and Nano Photonic Structures (Ministry of Education), Fudan University, Shanghai, 200433, China', 'authors': ['Hong-Qing Wang', ',\xa0Yue Cao', '\xa0&\xa0Wei-Tao Liu']}, {'address': 'Department of Physics, University of California, Berkeley, 94720, CA, USA', 'authors': ['Yuen-Ron Shen']}]",[{'地址'：'浙江大学光学科学与工程学院，现代光学仪器国家重点实验室，杭州，杭州310027'，'作者'：['Chao Meng'，'，\ xa0Shao-Liang Yu' ，'\ xa0＆\ xa0Li-Min Tong']}，{'address'：'物理系，表面物理国家重点实验室，先进材料实验室和微纳纳米光子结构教育部重点实验室（复旦大学） 上海大学，200433，中国，'作者'：['Hong-Qing Wang'，'，\ xa0Yue Cao'，'\ xa0＆\ xa0Wei-Tao Liu']}，{'address'：'Physical Department， 加利福尼亚大学伯克利分校，94720，美国，加利福尼亚”，“作者”：['Yuen-Ron Shen']}] 
10.1038/lsa.2015.123,Polarization shaping of Poincaré beams by polariton oscillations,通过极化子振荡对庞加莱光束进行极化整形 ,"<p>We propose theoretically and demonstrate experimentally the generation of light pulses whose polarization varies temporally to cover selected areas of the Poincar&#233; sphere with both tunable swirling speed and total duration (1 ps and 10 ps, respectively, in our implementation). The effect relies on the Rabi oscillations of two polariton polarized fields excited by two counter-polarized and delayed pulses. The superposition of the oscillating fields result in the precession of the Stokes vector of the emitted light while polariton lifetime imbalance results in its drift from a circle of controllable radius on the Poincar&#233; sphere to a single point at long times. The positioning of the initial circle and final point allows to engineer the type of polarization spanning, including a full sweeping of the Poincar&#233; sphere. The universality and simplicity of the scheme should allow for the deployment of time-varying full-Poincar&#233; polarization fields in a variety of platforms, timescales, and regimes.</p>",<p>我们在理论上提出并在实验上证明了光脉冲的产生，该光脉冲的偏振随时间发生变化以覆盖庞加莱汽车的选定区域。具有可调旋流速度和总持续时间（在我们的实施中分别为1 ps和10 ps）的球体。该效应依赖于由两个反极化和延迟脉冲激发的两个极化子极化场的拉比振荡。振荡场的叠加导致所发射光的斯托克斯矢量进动，而极化子寿命的不平衡导致其从Poincar＆＃233;上可控半径的圆上漂移。长时间内将球体扩展到单个点。初始圆和最终点的位置允许设计极化范围的类型，包括对Poincar＆＃233;的完全扫描。领域。该方案的普遍性和简单性应允许部署随时间变化的全Poincar＆＃233;各种平台，时标和体制中的极化场。</ p> ,"[{'address': 'Departamento de Física Teórica de la Materia Condensada and Condensed Matter Physics Center (IFIMAC), Universidad Autónoma de Madrid, E-28049, Spain', 'authors': ['David Colas', ',\xa0Elena del Valle', '\xa0&\xa0Fabrice P Laussy']}, {'address': 'NANOTEC, Istituto di Nanotecnologia-CNR, Via Arnesano, Lecce, 73100, Italy', 'authors': ['Lorenzo Dominici', ',\xa0Stefano Donati', ',\xa0Dario Ballarini', ',\xa0Milena de Giorgi', ',\xa0Giuseppe Gigli', '\xa0&\xa0Daniele Sanvitto']}, {'address': 'Istituto Italiano di Tecnologia, IIT-Lecce, Via Barsanti, Lecce, 73010, Italy', 'authors': ['Lorenzo Dominici', '\xa0&\xa0Stefano Donati']}, {'address': 'Universitá del Salento, Via Arnesano, Lecce, 73100, Italy', 'authors': ['Stefano Donati', '\xa0&\xa0Giuseppe Gigli']}, {'address': 'Division of Physics and Applied Physics, Nanyang Technological University, Singapore, 637371, Singapore', 'authors': ['Anastasiia A Pervishko', ',\xa0Timothy CH Liew', '\xa0&\xa0Ivan A Shelykh']}, {'address': 'Science Institute, University of Iceland, Dunhagi 3, Reykjavik, IS-107, Iceland', 'authors': ['Ivan A Shelykh']}, {'address': 'Laboratory of Light-Matter Coupling in Nanostructures, ITMO University, St. Petersburg, 197101, Russia', 'authors': ['Ivan A Shelykh']}, {'address': 'Laboratoire Kastler Brossel, UPMC-Paris 6, ENS et CNRS, Paris, 75005, France', 'authors': ['Alberto Bramati']}, {'address': 'Russian Quantum Center, Novaya 100, Skolkovo, 143025, Moscow Region, Russia', 'authors': ['Fabrice P Laussy', '\xa0&\xa0Alexey V Kavokin']}, {'address': 'CNR-SPIN, Tor Vergata, viale del Politechnico 1, Rome, I-00133, Italy', 'authors': ['Alexey V Kavokin']}]",[{'address'：'马德里自治大学和密聚物理学中心（IFIMAC），费西卡·德·费里卡·德·马里亚斯分校，西班牙E-28049，'作者'：['David Colas'，'，\ xa0Elena del Valle'，'\ xa0＆\ xa0Fabrice P Laussy']}，{'地址'：'NANOTEC，纳米技术研究所，意大利，莱昂市Arnesano大街，邮编73100，'作者'：[[Lorenzo Dominici'， '，\ xa0Stefano Donati'，'，\ xa0Dario Ballarini'，'，\ xa0Milena de Giorgi'，'，\ xa0Giuseppe Gigli'，'\ xa0＆\ xa0Daniele Sanvitto']}，{'address'：'Istituto Italiano di Tecnologia ，IIT -Lecce，Via Barsanti，莱切，73010，意大利'，'作者'：[[Lorenzo Dominici'，'\ xa0＆\ xa0Stefano Donati']}，{'地址'：'Salento大学，Via Arnesano，莱切，73100，Italy'，'authors'：['Stefano Donati'，'\ xa0＆\ xa0Giuseppe Gigli']}，{'address'：''南洋理工大学物理与应用物理系，新加坡，637371，新加坡' ，'authors'：['Anastasiia A Pervishko'，'，\ xa0Timothy CH Liew'，'\ xa0＆\ xa0Ivan A Shelykh']}，{'地址'：'，'冰岛大学科学研究所，Dunhagi 3，雷克雅未克，IS-107，冰岛'，'作者'：[[Ivan A Shelykh']}，{'address'：'纳米结构中的光耦合实验室， ITMO大学，圣彼得堡，197101，俄罗斯'，'作者'：['Ivan A Shelykh']}，{'address'：'Laboratoire Kastler Brossel，UPMC-Paris 6，ENS et CNRS，巴黎，75005，法国' ，'作者'：['Alberto Bramati']}，{'地址'：'俄罗斯量子中心，Novaya 100，Skolkovo，143025，俄罗斯莫斯科地区'，'作者'：['Fabrice P Laussy'，'\ xa0 ＆\ xa0Alexey V Kavokin']}，{'address'：'CNR-SPIN，Tor Vergata，viale del Politechnico 1，Rome，I-00133，Italy'，'authors'：['Alexey V Kavokin']}]] 
10.1038/lsa.2015.125,Optical delivery of multiple opsin-encoding genes leads to targeted expression and white-light activation,多种视蛋白编码基因的光学传递导致靶向表达和白光激活 ,"<p>In photodegenerative diseases such as retinitis pigmentosa (RP) and age-related macular degeneration (AMD), progressive loss of vision occurs as a result of degeneration of the periphery of the retina and the macula, respectively. Current optogenetic stimulation-based approaches to vision restoration offer the advantages of cellular specificity, high resolution, and minimal invasiveness over electrode arrays; however, the clinical translation of optogenetic activation suffers from the lack of a method for the delivery of opsins into spatially targeted regions of a retina that has degenerated. Non-targeted opsin delivery through viral or non-viral methods to non-photodegenerated retinal areas will perturb these already functioning retinal regions. Furthermore, viral methods are subject to limitations on the delivery of large plasmids, such as fusion constructs of multiple spectrally separated opsins (e.g., channelrhodopsin-2 (ChR2), chimeric opsin variants (C1V1), ReaChR), which can provide higher photo-excitability than can a single narrow-band opsin under ambient light conditions. Here, we report the ultrafast near-infrared laser-based spatially targeted transfection of single and multiple opsins and present a comparison with the opsin expression distribution achieved using another non-viral, but non-targeted, transfection method, lipofection. Functional evaluation of cells transfected with multiple opsins using the laser method revealed a significantly higher white-light-induced photocurrent than in cells expressing a single opsin (ChR2). The laser-assisted targeted delivery of multiple opsin-encoding genes to the peripheral retina/macula is ideal for sensitizing retinal areas that have degenerated, thus paving the way toward the restoration of lost vision in RP/AMD patients.</p>",<p>在光变性疾病中，例如色素性视网膜炎（RP）和与年龄相关的黄斑变性（AMD），视力的逐渐丧失分别是视网膜和黄斑周围变性引起的。当前基于光遗传刺激的视力恢复方法比电极阵列具有细胞特异性，高分辨率和最小侵入性的优势。然而，光遗传激活的临床翻译遭受缺乏将视蛋白递送到退化的视网膜的空间靶区域的方法的困扰。通过病毒或非病毒方法将非靶向视蛋白递送至非光变性视网膜区域将干扰这些已经起作用的视网膜区域。此外，病毒方法受大型质粒递送的限制，例如多种光谱分离的视蛋白的融合构建体（例如Channelrhodopsin-2（ChR2），嵌合视蛋白变体（C1V1），ReaChR），它们可以提供更高的光与单个窄带视蛋白在环境光条件下相比，具有更高的兴奋性。在这里，我们报告单个和多个视蛋白的超快速近红外激光基于空间目标的转染，并与使用另一种非病毒但非靶向的转染方法lipofection实现的视蛋白表达分布进行比较。使用激光方法转染了多种视蛋白的细胞的功能评估表明，白光诱导的光电流明显高于表达单一视蛋白（ChR2）的细胞。多种视蛋白编码基因的激光辅助靶向递送至周围视网膜/黄斑非常适用于敏化已退化的视网膜区域，从而为恢复RP / AMD患者视力丧失铺平了道路。</ p> ,"[{'address': 'Biophysics and Physiology Lab, The University of Texas at Arlington, Arlington, TX, USA', 'authors': ['Kamal Dhakal', ',\xa0Subrata Batabyal', '\xa0&\xa0Samarendra Mohanty']}, {'address': 'NanoScope Technologies, LLC, Arlington, TX, USA', 'authors': ['Weldon Wright', '\xa0&\xa0Samarendra Mohanty']}, {'address': 'Department of Bioengineering, The University of Texas at Arlington, Arlington, TX, USA', 'authors': ['Young-tae Kim']}]",[{'地址'：'德克萨斯大学阿灵顿分校，美国德克萨斯州阿灵顿市生物物理与生理实验室'，'作者'：['Kamal Dhakal'，'，\ xa0Subrata Batabyal'，'\ xa0＆\ xa0Samarendra Mohanty' ]}，{'地址'：'NanoScope Technologies，LLC，美国德克萨斯州阿灵顿'，'作者'：['Weldon Wright'，'\ xa0＆\ xa0Samarendra Mohanty']}，{'地址'：'生物工程学系 ，德克萨斯大学阿灵顿分校，美国德克萨斯州阿灵顿”，“作者”：['Young-tae Kim']}] 
10.1038/lsa.2015.127,Thermally reconfigurable quantum photonic circuits at telecom wavelength by femtosecond laser micromachining,飞秒激光微加工在电信波长下可热重构的量子光子电路 ,"<p>The importance of integrated quantum photonics in the telecom band is based on the possibility of interfacing with the optical network infrastructure that was developed for classical communications. In this framework, femtosecond laser-written integrated photonic circuits, which have already been assessed for use in quantum information experiments in the 800-nm wavelength range, have great potential. In fact, these circuits, being written in glass, can be perfectly mode-matched at telecom wavelength to the in/out coupling fibers, which is a key requirement for a low-loss processing node in future quantum optical networks. In addition, for several applications, quantum photonic devices must be dynamically reconfigurable. Here, we experimentally demonstrate the high performance of femtosecond laser-written photonic circuits for use in quantum experiments in the telecom band, and we demonstrate the use of thermal shifters, which were also fabricated using the same femtosecond laser, to accurately tune such circuits. State-of-the-art manipulation of single- and two-photon states is demonstrated, with fringe visibilities greater than 95%. The results of this work open the way to the realization of reconfigurable quantum photonic circuits based on this technological platform.</p>",<p>在电信频段中集成量子光子学的重要性是基于与为经典通信开发的光网络基础设施接口的可能性。在这种框架下，飞秒激光写入的集成光子电路（已经被评估用于800纳米波长范围的量子信息实验）具有巨大的潜力。实际上，用玻璃编写的这些电路可以在电信波长下与输入/输出耦合光纤进行完美模式匹配，这是未来量子光学网络中低损耗处理节点的关键要求。另外，对于几种应用，量子光子器件必须是可动态重新配置的。在这里，我们通过实验演示了飞秒激光写入的光子电路在电信频段量子实验中的高性能，并且演示了使用同样使用飞秒激光器制造的热转换器来精确调谐此类电路。展示了单光子和双光子状态的最新技术，其条纹可见度大于95％。这项工作的结果为基于该技术平台的可重构量子光子电路的实现开辟了道路。</ p> ,"[{'address': 'Dipartimento di Fisica - Sapienza Università di Roma, P.le Aldo Moro 5, Roma, I-00185, Italy', 'authors': ['Fulvio Flamini', ',\xa0Lorenzo Magrini', ',\xa0Adil S Rab', ',\xa0Nicolò Spagnolo', "",\xa0Vincenzo D'Ambrosio"", ',\xa0Paolo Mataloni', '\xa0&\xa0Fabio Sciarrino']}, {'address': 'Istituto di Fotonica e Nanotecnologie - Consiglio Nazionale delle Ricerche (IFN-CNR), P.za Leonardo da Vinci, 32, Milano, I-20133, Italy', 'authors': ['Tommaso Zandrini', ',\xa0Andrea Crespi', ',\xa0Roberta Ramponi', '\xa0&\xa0Roberto Osellame']}, {'address': 'Dipartimento di Fisica - Politecnico di Milano, P.za Leonardo da Vinci, 32, Milano, I-20133, Italy', 'authors': ['Tommaso Zandrini', ',\xa0Andrea Crespi', ',\xa0Roberta Ramponi', '\xa0&\xa0Roberto Osellame']}]",[{'address'：'物理系-罗马Sapienza大学，P.le Aldo Moro 5，罗马，I-00185，意大利'，'作者'：['Fulvio Flamini'，'，\ xa0Lorenzo Magrini'，' ，\ xa0Adil S Rab'，'，\xa0NicolòSpagnolo'，“，\ xa0Vincenzo D'Ambrosio”，'，\ xa0Paolo Mataloni'，'\ xa0＆\ xa0Fabio Sciarrino']}，{'地址'：'光子学研究所和纳米技术-国家研究委员会（IFN-CNR），P.za Leonardo da Vinci，32岁，米兰，I-20133，意大利，“作者”：['Tommaso Zandrini'，'，\ xa0Andrea Crespi'，'，\ xa0Roberta Ramponi'，'\ \ xa0＆\ xa0Roberto Osellame']}，{'address'：'物理系-米兰理工大学，P.za Leonardo da Vinci，32，米兰，I-20133，意大利'，'作者' ：[[Tommaso Zandrini'，'，\ xa0Andrea Crespi'，'，\ xa0Roberta Ramponi'，'\ xa0和\ xa0Roberto Osellame']}]] 
10.1038/lsa.2015.129,Mechanism of mechanical quenching and mechanoluminescence in phosphorescent CaZnOS:Cu,磷光CaZnOS：Cu的机械淬灭和机械发光机理 ,"<p>This article reports a new phosphorescent material, CaZnOS:Cu, that exhibits two types of mechano-optical conversion: mechanical quenching and mechanoluminescence. An intense mechanical quenching of phosphorescence corresponding to mechanical stimuli can be achieved in CaZnOS:Cu within a short decay time period. Over time, it gradually changes to mechanoluminescence when a mechanical load is applied. We propose that the mechanical quenching and mechanoluminescence arise from the different roles of shallow and deep traps in CaZnOS:Cu. CaZnOS:Cu has promising applications in monitoring mechanical stress in industrial plants, structures, and living bodies.</p>",<p>本文报道了一种新型的磷光材料CaZnOS：Cu，它表现出两种类型的机械-光学转换：机械淬灭和机械发光。 可以在较短的衰减时间内在CaZnOS：Cu中实现与机械刺激相对应的强烈磷光机械淬灭。 随着时间的流逝，当施加机械负载时，它逐渐变为机械发光。 我们提出机械淬火和机械发光是由于CaZnOS：Cu中浅层陷阱和深层陷阱的不同作用引起的。 CaZnOS：Cu在监测工厂，建筑物和生物体内的机械应力方面具有广阔的应用前景。</ p> ,"[{'address': 'National Institute of Advanced Industrial Science and Technology (AIST), Saga, 841-0052, Japan', 'authors': ['Dong Tu', ',\xa0Chao-Nan Xu', ',\xa0Yuki Fujio', '\xa0&\xa0Akihito Yoshida']}, {'address': 'Interdisciplinary Graduate School of Engineering Sciences, Kyushu University, Fukuoka, 816-8580, Japan', 'authors': ['Dong Tu', '\xa0&\xa0Chao-Nan Xu']}, {'address': 'International Institute for Carbon-Neutral Energy Research (WPI-I2CNER), Kyushu University, Fukuoka, 819-0395, Japan', 'authors': ['Chao-Nan Xu']}]",[{'地址'：'国家先进工业科学技术研究院（AIST），日本佐贺，841-0052'，'作者'：['东土'，'，\ xa0Chao-Nan Xu'，'，\ xa0Yuki Fujio'，'\ xa0＆\ xa0Akihito Yoshida']}，{'地址'：'日本九州大学，福冈九州大学工学跨学科研究生院，816-8580，'，'作者'：['东土'，' \ xa0＆\ xa0Chao-Nan Xu']}，{'地址'：'九州大学国际碳中性能源研究所（WPI-I2CNER），日本福冈，819-0395，'作者'：['Chao -南Xu']}] 
10.1038/lsa.2015.131,On-chip light sources for silicon photonics,硅光子的片上光源 ,"<p>Serving as the electrical to optical converter, the on-chip silicon light source is an indispensable component of silicon photonic technologies and has long been pursued. Here, we briefly review the history and recent progress of a few promising contenders for on-chip light sources in terms of operating wavelength, pump condition, power consumption, and fabrication process. Additionally, the performance of each contender is also assessed with respect to thermal stability, which is a crucial parameter to consider in complex optoelectronic integrated circuits (OEICs) and optical interconnections. Currently, III-V-based silicon (Si) lasers formed via bonding techniques demonstrate the best performance and display the best opportunity for commercial usage in the near future. However, in the long term, direct hetero-epitaxial growth of III&#8211;V materials on Si seems more promising for low-cost, high-yield fabrication. The demonstration of high-performance quantum dot (QD) lasers monolithically grown on Si strongly forecasts its feasibility and enormous potential for on-chip lasers. The superior temperature-insensitive characteristics of the QD laser promote this design in large-scale high-density OEICs. The Germanium (Ge)-on-Si laser is also competitive for large-scale monolithic integration in the future. Compared with a III-V-based Si laser, the biggest potential advantage of a Ge-on-Si laser lies in its material and processing compatibility with Si technology. Additionally, the versatility of Ge facilitates photon emission, modulation, and detection simultaneously with a simple process complexity and low cost.</p>",<p>片上硅光源用作电光转换器，是硅光子技术必不可少的组成部分，并一直受到人们的追捧。在这里，我们从工作波长，泵浦条件，功耗和制造工艺方面简要回顾了一些有前途的片上光源竞争者的历史和最新进展。此外，还针对热稳定性来评估每个竞争者的性能，这是在复杂的光电集成电路（OEIC）和光学互连中要考虑的关键参数。当前，通过键合技术形成的基于III-V的硅（Si）激光器展示出最佳性能，并在不久的将来展示出最佳的商业应用机会。但是，从长远来看，对于低成本，高产量的制造而言，III和V材料在Si上的直接异质外延生长似乎更有希望。单片生长在Si上的高性能量子点（QD）激光器的演示强烈预测了其可行性和片上激光器的巨大潜力。 QD激光器出色的温度不敏感特性在大规模高密度OEIC中促进了这种设计。将来，锗（Ge）-on-Si激光器在大规模单片集成方面也具有竞争力。与基于III-V的Si激光器相比，Ge-on-Si激光器的最大潜在优势在于其材料和与Si技术的工艺兼容性。此外，Ge的多功能性可同时促进光子的发射，调制和检测，且工艺简单，成本低。</ p> ,"[{'address': 'State Key Laboratory of Advanced Optical Communication Systems and Networks, School of Electronics Engineering and Computer Science, Peking University, Beijing, 100871, China', 'authors': ['Zhiping Zhou', '\xa0&\xa0Bing Yin']}, {'address': 'Department of Materials Science and Engineering, Massachusetts Institute of Technology, Cambridge, 02139, MA, USA', 'authors': ['Jurgen Michel']}]",[{'地址'：'北京大学电子工程与计算机科学学院，先进的光通信系统和网络国家重点实验室，北京，100871，'作者'：['Zhiping Zhou'，'\ xa0＆\ xa0Bing Yin']}，{'地址'：'麻省理工学院材料科学与工程系，剑桥，美国马萨诸塞州02139'，'作者'：['Jurgen Michel']}] 
