doi,title,title_cn,abstract,abstract_cn
10.1038/nphoton.2008.132,Enhanced light out-coupling of organic light-emitting devices using embedded low-index grids,使用嵌入式低折射率栅格增强有机发光器件的光输出耦合 ,"<p>The application of organic light-emitting devices to reduce the energy consumption of interior lighting, which now costs more than $230 billion annually, is attracting interest due to the high efficiency of these devices. Indeed, electrophosphorescent organic light-emitting devices with an internal quantum efficiency &#951;<sub>IQE</sub> of 100% (refs&#160;) already approach the efficiency of fluorescent lamps. However, because of the high refractive index of organic materials and the optical confinement and internal reflection that results, the light out-coupling efficiency &#951;<sub>out</sub> for conventional organic light-emitting devices is limited to &#8764;20% (refs). Here we demonstrate that embedding a low-index grid in the organic layers can enhance the out-coupling of the waveguided light without spectral distortion. When combined with microlenses that out-couple the glass modes, the external quantum efficiency &#951;<sub>EQE</sub> and power efficiency of a white organic light-emitting device are improved to 34&#160;&#177;&#160;2% and 68&#160;&#177;&#160;4&#160;lm&#160;W<sup>&#8211;1</sup>. The resulting &#951;<sub>out</sub> is 2.3&#160;&#177;&#160;0.2 times that of a conventional organic light-emitting device used as a comparison, and simulations indicate that the enhancement can be further increased to 3.4&#160;&#177;&#160;0.2.</p>",<p>有机发光装置的应用减少室内照明的能耗，由于这些装置的高效率，现在每年花费超过2300亿美元，引起了人们的兴趣。实际上，内部量子效率为100％（refs＆＃160;）的电致磷光有机发光器件已经接近荧光灯的效率。但是，由于有机材料的高折射率以及由此产生的光学限制和内部反射，常规有机发光器件的光输出耦合效率＆＃951; <sub> out </ sub>限于＃8764; 20％（参考）。在这里，我们证明了在有机层中嵌入低折射率网格可以增强波导光的输出耦合，而不会产生光谱失真。当与将玻璃模耦合的微透镜组合使用时，白色有机发光器件的外部量子效率＆quot; EQE＆quot;功率效率提高到34＆＃160;＆＃177;。 ＆＃160; 2％和68＆＃160;＆＃160; 4＆＃160; lm＆＃160; W <sup>＆＃8211; 1 </ sup>。所得的结果是传统有机发光器件的2.3倍，是比较结果，而仿真表明该增强可以进一步提高到3.4＆＃160;＆＃177;＆＃160; 0.2。</ p> 
10.1038/nphoton.2008.130,Robust photonic entanglement distribution by state-independent encoding onto decoherence-free subspace,通过与状态无关的编码到无退相干子空间上的鲁棒光子纠缠分布 ,"<p>Efficient and faithful implementation of quantum information tasks, such as quantum computing, quantum communication and quantum metrology, requires robust and state-independent decoherence-suppressing measures to protect the quantum information carriers. Here we present an experimental demonstration of a robust distribution scheme in which one photon of an entangled photon pair is successfully encoded into and decoded from a decoherence-free subspace by a state-independent scheme. We achieved a high-fidelity distribution of the entangled state over a fibre communication channel, and also demonstrated that the scheme is robust against fragility of the reference frame. The scheme, thanks to its state-independence, is also applicable to the multipartite case where the photon to be distributed is entangled with many other photons. Such a robust and universal scheme for distributing quantum information in an indeterministic but conclusive manner will constitute an important building block of quantum communication and computing networks.</p>",<p>有效，忠实地执行量子信息任务，例如量子计算，量子通信和量子计量学，需要鲁棒且独立于状态的去相干抑制措施来保护量子信息载体。在这里，我们介绍了一种鲁棒的分配方案的实验演示，其中纠缠光子对中的一个光子通过独立于状态的方案成功地编码到了无退相干子空间中，并从中被解码。我们在光纤通信信道上实现了纠缠态的高保真度分布，并且还证明了该方案对参考帧的脆弱性具有鲁棒性。由于其状态独立性，该方案也适用于多部分情况，其中要分布的光子与许多其他光子纠缠在一起。这种以不确定性但决定性的方式分配量子信息的强大而通用的方案将构成量子通信和计算网络的重要组成部分。</ p> 
10.1038/nphoton.2008.133,A high-efficiency display based on a telescopic pixel design,基于伸缩像素设计的高效显示器 ,"<p>Several transmissive display technologies have been invented as an alternative to the liquid crystal display, which typically transmits only 5&#8211;10% of the backlight. Most are based on microelectromechanical shutters that block light or let it pass through transparent windows in an opaque substrate; however, their overall backlight transmission efficiency is still less than 10%. Here, we propose a new pixel-based technology that involves a telescopic pixel design and can transmit 36% of the backlight. Each pixel consists of two micromirrors, one of which is stationary, whereas the other can be deformed by application of an electrostatic force. Depending on the applied voltage, the deformable mirror can either stop light or focus it on the stationary mirror and let it pass through the pixel. This display technology offers a fast response time (less than 1.5&#160;ms), high image resolution, can be made from relatively cheap materials, and is compatible with liquid crystal display production processes.</p>",<p>已经发明了几种透射显示技术来替代液晶显示器，该液晶显示器通常仅透射5％到10％的背光。大多数是基于微机电百叶窗，它们可以挡住光线或让光线穿过不透明基材中的透明窗口。但是，它们的整体背光传输效率仍不到10％。在这里，我们提出了一种新的基于像素的技术，该技术涉及可伸缩像素设计，并且可以透射36％的背光。每个像素由两个微镜组成，其中一个是固定的，而另一个可以通过施加静电力而变形。根据所施加的电压，可变形反射镜可以停止光线或将其聚焦在固定反射镜上，并使其通过像素。该显示技术提供了快速的响应时间（小于1.5毫秒），高图像分辨率，可以由相对便宜的材料制成，并且与液晶显示器的生产过程兼容。</ p> 
10.1038/nphoton.2008.131,A hybrid plasmonic waveguide for subwavelength confinement and long-range propagation,用于子波长限制和远距离传播的混合等离子体波导 ,"<p>The emerging field of nanophotonics addresses the critical challenge of manipulating light on scales much smaller than the wavelength. However, very few feasible practical approaches exist at present. Surface plasmon polaritons are among the most promising candidates for subwavelength optical confinement. However, studies of long-range surface plasmon polaritons have only demonstrated optical confinement comparable to that of conventional dielectric waveguides, because of practical issues including optical losses and stringent fabrication demands. Here, we propose a new approach that integrates dielectric waveguiding with plasmonics. The hybrid optical waveguide consists of a dielectric nanowire separated from a metal surface by a nanoscale dielectric gap. The coupling between the plasmonic and waveguide modes across the gap enables &#8216;capacitor-like&#8217; energy storage that allows effective subwavelength transmission in non-metallic regions. In this way, surface plasmon polaritons can travel over large distances (40&#8211;150&#160;&#181;m) with strong mode confinement (ranging from &#955;<sup>2</sup>/400 to &#955;<sup>2</sup>/40). This approach is fully compatible with semiconductor fabrication techniques and could lead to truly nanoscale semiconductor-based plasmonics and photonics.</p>",<p>纳米光子学的新兴领域解决了在远小于波长的尺度上操纵光的重大挑战。但是，目前几乎没有可行的实用方法。表面等离子体激元极化子是亚波长光学限制最有希望的候选者之一。但是，由于包括光损耗和严格的制造要求在内的实际问题，对长距离表面等离激元极化子的研究仅证明了其光学限制可与常规介质波导相比。在这里，我们提出了一种新的方法，该方法将电介质波导与等离子体激元集成在一起。混合光波导由通过纳米级电介质间隙与金属表面隔开的电介质纳米线组成。跨越间隙的等离激元和波导模式之间的耦合使“类似电容器”成为可能。能量存储，可在非金属区域有效传输亚波长。这样，表面等离激元极化子可以在很强的模式限制（范围从＆＃955; <sup> 2 </ sup> / 400到＆ ＃955; <sup> 2 </ sup> / 40）。这种方法与半导体制造技术完全兼容，并且可能导致真正的基于纳米级的半导体等离激元和光子学。</ p> 
10.1038/nphoton.2008.127,Creation of a needle of longitudinally polarized light in vacuum using binary optics,使用二元光学系统在真空中创建纵向偏振光针 ,"<p>Recently many ideas have been proposed for the use of a longitudinal field for particle acceleration, fluorescent imaging, second-harmonic generation and Raman spectroscopy. A few methods to enhance the longitudinal field component have been suggested, but all have insufficient optical efficiency and non-uniform axial field strength. Here we report a new method that permits the combination of very unusual properties of light in the focal region, permitting the creation of a &#8216;pure&#8217; longitudinal light beam with subdiffraction beam size (0.43&#955;). This beam is non-diffracting; that is, it propagates without divergence over a long distance (of about 4&#955;) in free space. This is achieved by focusing a radially polarized Bessel&#8211;Gaussian beam with a combination of a binary-phase optical element and a high-numerical-aperture lens. This binary optics works as a special polarization filter enhancing the longitudinal component.</p>",最近，已经提出了许多关于使用纵向场进行粒子加速，荧光成像，二次谐波产生和拉曼光谱学的想法。 已经提出了几种增强纵向场分量的方法，但是所有方法都没有足够的光学效率和不均匀的轴向场强。 在这里，我们报告了一种新方法，该方法可以将焦点区域中非常不寻常的光特性组合在一起，从而可以创建“ pure” 具有亚衍射光束尺寸（0.43＆＃955;）的纵向光束。 这束光是无衍射的。 也就是说，它在自由空间中的较长距离（大约4英寸）内传播而没有发散。 这是通过将径向偏振的Bessel高斯光束与二相光学元件和高数值孔径透镜组合在一起来实现的。 这种二元光学器件用作特殊的偏振滤光片，可增强纵向分量。</ p> 
