doi,title,title_cn,abstract,abstract_cn
10.1038/nphoton.2016.175,The philanthropist scholar,慈善学者 ,,
10.1038/nphoton.2016.164,Revisiting photocarrier lifetimes in photovoltaics,回顾光伏中的光电载流子寿命 ,,
10.1038/nphoton.2016.165,Reply to 'Revisiting photocarrier lifetimes in photovoltaics',回复“重新审视光伏中的光电载流子寿命” ,,
10.1038/nphoton.2016.173,New titles at a glance,新标题一览 ,,
10.1038/nphoton.2016.167,Randomness from vacuum,真空产生的随机性 ,,
10.1038/nphoton.2016.168,Resonance fluorescence,共振荧光 ,,
10.1038/nphoton.2016.169,Cell oscillators,单元振荡器 ,,
10.1038/nphoton.2016.170,True silver,真银 ,,
10.1038/nphoton.2016.176,Photon sorter,光子品种 ,,
10.1038/nphoton.2016.142,Raman cooling in a semiconductor,半导体中的拉曼冷却 ,,
10.1038/nphoton.2016.160,Bright future for upconversion,上转换的光明前景 ,,
10.1038/nphoton.2016.172,Dealing with diffraction data,处理衍射数据 ,,
10.1038/nphoton.2016.171,Momentum multiplexing,动量复用 ,,
10.1038/nphoton.2016.138,Guiding light via geometric phases,通过几何相位引导光 ,,
10.1038/nphoton.2016.129,Hologram of a single photon,单光子的全息图 ,,
10.1038/nphoton.2016.141,In vivo cellular-resolution retinal imaging in infants and children using an ultracompact handheld probe,使用超紧凑型手持式探针对婴儿和儿童进行体内细胞分辨率视网膜成像 ,,
10.1038/nphoton.2016.139,Detection of gamma photons using solution-grown single crystals of hybrid lead halide perovskites,使用溶液生长的混合卤化钙钛矿形成的单晶检测γ光子 ,,
10.1038/nphoton.2016.137,Multicolour localization microscopy by point-spread-function engineering,通过点扩散功能工程进行多色定位显微镜 ,,
10.1038/nphoton.2016.158,Room-temperature continuous-wave electrically injected InGaN-based laser directly grown on Si,直接在Si上生长的室温连续波电注入InGaN基激光器 ,,
10.1038/nphoton.2016.122,Resolved-sideband Raman cooling of an optical phonon in semiconductor materials,半导体材料中光子的解析边带拉曼冷却 ,"<p>The radiation pressure of light has been widely used to cool trapped atoms or the mechanical vibrational modes of optomechanical systems. Recently, by using the electrostrictive forces of light, spontaneous Brillouin cooling and stimulated Brillouin excitation of acoustic modes of the whispering-gallery-type resonator have been demonstrated. The laser cooling of specific lattice vibrations in solids (that is, phonons) proposed by Dykman in the late 1970s, however, still remains sparsely investigated. Here, we demonstrate the first strong spontaneous Raman cooling and heating of a longitudinal optical phonon (LOP) with a 6.23&#8197;THz frequency in polar semiconductor zinc telluride nanobelts. We use the exciton to resonate and assist photoelastic Raman scattering from the LOPs caused by a strong exciton&#8211;LOP coupling. By detuning the laser pump to a lower (higher) energy-resolved sideband to make a spontaneous scattering photon resonate with an exciton at an anti-Stokes (Stokes) frequency, the dipole oscillation of the LOPs is photoelastically attenuated (enhanced) to a colder (hotter) state.</p>",<p>光的辐射压力已被广泛用于冷却捕获的原子或光机械系统的机械振动模式。近来，已经证明了通过利用光的电致伸缩力，耳语画廊型谐振器的自发性布里渊冷却和受激布里渊激发了声模。 Dykman在1970年代后期提出的对固体（即声子）中的特定晶格振动进行激光冷却的研究仍然很少。在这里，我们展示了极性半导体碲化锌纳米带中具有6.23＆＃8197; THz频率的纵向光学声子（LOP）的首次强自发拉曼冷却和加热。我们使用激子来共振并辅助由强激子LOP耦合引起的LOP产生的光弹性拉曼散射。通过将激光泵失谐至较低（较高）的能量分辨边带，使自发散射光子与激子以反斯托克斯（Stokes）频率共振，LOP的偶极子振荡被光弹性衰减（增强）到更冷。 （较热）状态。</ p> 
10.1038/nphoton.2016.136,High-resolution adaptive imaging of a single atom,单个原子的高分辨率自适应成像 ,"<p>Optical imaging systems are used extensively in the life and physical sciences because of their ability to non-invasively capture details on the microscopic and nanoscopic scales. Such systems are often limited by source or detector noise, image distortions and human operator misjudgement. Here, we report a general, quantitative method to analyse and correct these errors. We use this method to identify and correct optical aberrations in an imaging system for single atoms and realize an atomic position sensitivity of &#8764;0.5&#8197;nm&#8197;Hz<sup>&#8722;1/2</sup> with a minimum uncertainty of 1.7&#8197;nm, allowing the direct imaging of atomic motion. This is the highest position sensitivity ever measured for an isolated atom and opens up the possibility of performing out-of-focus three-dimensional particle tracking, imaging of atoms in three-dimensional optical lattices or sensing forces at the yoctonewton (10<sup>&#8722;24</sup>&#8197;N) scale.</p>",<p>由于光学成像系统能够无创地捕获微观和纳米尺度的细节，因此在生命科学和物理科学中得到了广泛的应用。 此类系统通常受到源或检测器噪声，图像失真和操作人员错误判断的限制。 在这里，我们报告了一种通用的定量方法来分析和纠正这些错误。 我们使用这种方法来识别和校正成像系统中单个原子的光学像差，并实现＆＃8764; 0.5＆＃8197; nm＆＃8197; Hz <sup>＆＃8722; 1/2 </ sup>的最小不确定度为1.7＆＃8197; nm，允许原子运动的直接成像。 这是有史以来针对孤立原子测得的最高位置灵敏度，并开启了进行离焦的三维粒子跟踪，对三维光学晶格中的原子进行成像或在圆球上的感应力的可能性（10 <sup> ＆＃8722; 24 </ sup>＆＃8197; N）比例。</ p> 
10.1038/nphoton.2016.143,Power conversion efficiency exceeding the Shockley–Queisser limit in a ferroelectric insulator,铁电绝缘子的功率转换效率超过了Shockley-Queisser极限 ,"<p>Ferroelectric absorbers, which promote carrier separation and exhibit above-gap photovoltages, are attractive candidates for constructing efficient solar cells. Using the ferroelectric insulator BaTiO<sub>3</sub> we show how photogeneration and the collection of hot, non-equilibrium electrons through the bulk photovoltaic effect (BPVE) yields a greater-than-unity quantum efficiency. Despite absorbing less than a tenth of the solar spectrum, the power conversion efficiency of the BPVE device under 1 sun illumination exceeds the Shockley&#8211;Queisser limit for a material of this bandgap. We present data for devices that feature a single-tip electrode contact and an array with 24 tips (total planar area of 1&#8197;&#215;&#8197;1&#8197;&#956;m<sup>2</sup>) capable of generating a current density of 17&#8197;mA&#8197;cm<sup>&#8211;2</sup> under illumination of AM1.5&#8197;G. In summary, the BPVE at the nanoscale provides an exciting new route for obtaining high-efficiency photovoltaic solar energy conversion.</p>",促进载流子分离并显示出高于间隙的光电压的铁电吸收剂是构建高效太阳能电池的有吸引力的候选材料。我们使用铁电绝缘体BaTiO <sub> 3 </ sub>展示了如何通过本体光伏效应（BPVE）进行光生和收集热的非平衡电子，从而产生大于一的量子效率。尽管吸收不到太阳光谱的十分之一，但在1个太阳光照射下BPVE器件的功率转换效率超过了该带隙材料的Shockley Queisser极限。我们提供具有单尖端电极触点和具有24个尖端的阵列（总平面面积为1＆＃8197;＆＃215;＆＃8197; 1＆＃8197;＆＃956; m <sup> 2 < / sup>）能够在AM1.5＆＃8197; G的照明下产生17＆＃8197; mA＆＃8197; cm <sup>＆＃8211; 2 </ sup>的电流密度。综上所述，纳米级BPVE为获得高效的光伏太阳能转化提供了令人兴奋的新途径。</ p> 
