doi,title,title_cn,abstract,abstract_cn
10.1038/nphoton.2008.84,It's good to get out,出去很好 ,,
10.1038/nphoton.2008.85,Spasers explained,抽筋解释 ,,
10.1038/nphoton.2008.86,"Squeezed light, spin flips, chirality checks, tweezers with floating electrodes, and more",挤压光，自旋翻转，手性检查，带浮动电极的镊子等等 ,,
10.1038/nphoton.2008.88,Finer optical tweezers,细镊子 ,,
10.1038/nphoton.2008.89,Self-trapping of speckled light beams,斑点光束的自陷 ,,
10.1038/nphoton.2008.90,Grating games,光栅游戏 ,,
10.1038/nphoton.2008.92,To the quantum level,达到量子水平 ,,
10.1038/nphoton.2008.91,Beyond the limit,超越极限 ,,
10.1038/nphoton.2008.87,Observing quantum interference,观察量子干扰 ,,
10.1038/nphoton.2008.104,Erratum: Ceramic future,勘误表：陶瓷的未来 ,,
10.1038/nphoton.2008.93,Erratum: Antenna-enhanced detectors,勘误：天线增强型探测器 ,,
10.1038/nphoton.2008.94,Carbon-nanotube photonics and optoelectronics,碳纳米管光子学和光电子学 ,,
10.1038/nphoton.2008.82,Lasing spaser,激光打spa ,"<p>In 2003 Bergman and Stockman introduced the spaser, a quantum amplifier of surface plasmons by stimulated emission of radiation. They argued that by exploiting a metal/dielectric composite medium it should be possible to construct a nanodevice, where a strong coherent field is built up in a spatial region much smaller than the wavelength. V-shaped metallic structures, combined with semiconductor quantum dots, were discussed as a possible realization of the spaser. Here we introduce a further development of the spaser concept. We show that by combining the metamaterial and spaser ideas one can create a narrow-diversion coherent source of electromagnetic radiation that is fuelled by plasmonic oscillations. We argue that a two-dimensional array of a certain class of plasmonic resonators supporting coherent current excitations with high quality factor can act as a planar source of spatially and temporally coherent radiation, which we term a &#8216;lasing spaser.&#8217;</p>",<p> 2003年，Bergman和Stockman推出了spaser，它是一种通过激发辐射而产生的表面等离子体激元的量子放大器。 他们认为，通过利用金属/电介质复合介质，应该有可能构建一种纳米器件，其中在比波长小得多的空间区域中建立了一个强相干场。 讨论了将V形金属结构与半导体量子点结合起来作为Spaser的可能实现方式。 在这里，我们介绍了spaser概念的进一步发展。 我们表明，通过结合超材料和SPASER的思想，可以创建由等离子激元激发的电磁辐射的狭窄转移相干源。 我们认为，以高品质因数支持相干电流激励的特定类别的等离子激元谐振器的二维阵列可以充当时空相干辐射的平面源，我们称其为“激光激射器”。 ; </ p> 
10.1038/nphoton.2008.79,Optical frequency comb with submillihertz linewidth and more than 10 W average power,光频率梳，亚兆赫线宽，平均功率超过10 W ,"<p>Growing demands for high average and peak powers in extreme nonlinear optics, attosecond-pulse and extreme ultraviolet comb generation experiments can find a powerful solution in fibre-based mode-locked lasers. Using passive enhancement cavities, fibre lasers have produced high-repetition-rate femtosecond pulse trains with multikilowatt average powers and peak powers reaching hundreds of megawatts. One major challenge for novel high-resolution spectroscopy and precision measurement in suboptical wavelength regions is to transfer the state-of-the-art optical phase coherence into the extreme ultraviolet domain through the extreme nonlinear optics enabled by these high-power systems. We demonstrate here that optical frequency combs produced by high-power fibre lasers reach unprecedented levels of performance in both precision and average power. We achieve a record low relative linewidth of &lt;1&#160;mHz between a traditional Ti:sapphire frequency comb and a novel 10&#160;W average power fibre comb, at the same time demonstrating all the necessary elements for power scaling precision comb technology to beyond 10&#160;kW.</p>",<p>在极端非线性光学器件，阿秒脉冲和极端紫外梳产生实验中，对高平均功率和峰值功率的需求不断增长，可以在基于光纤的锁模激光器中找到强大的解决方案。通过使用无源增强腔，光纤激光器产生了高重复频率的飞秒脉冲序列，其平均功率为几千瓦，峰值功率达到数百兆瓦。在亚光学波长范围内进行新型高分辨率光谱学和精密测量的一项主要挑战是，通过这些高功率系统支持的极端非线性光学，将最新的光学相位相干传递至极端紫外域。我们在这里演示了由高功率光纤激光器产生的光频率梳在精度和平均功率方面都达到了前所未有的性能水平。我们在传统的Ti：蓝宝石频率梳和新型10＆＃W平均功率光纤梳之间实现了创纪录的低相对线宽（＆lt; 1＆＃160; mHz），同时展示了功率定标精密梳的所有必要元素技术达到10＆＃160; kW以上。</ p> 
10.1038/nphoton.2008.80,Grating formation by metal-nanoparticle-mediated coupling of light into waveguided modes,通过金属-纳米粒子介导的光耦合进入波导模式而形成光栅 ,"<p>The trapping, manipulation and conversion of light by nanostructures are of great interest at present, both scientifically and for applications. An important part of this is the interaction of light with optical waveguides, mediated by plasmon-active metal-nanoparticle arrangements. Strong coupling of incident light to waveguide-plasmon polaritons has been demonstrated by means of nanoparticle lattices, as well as by disordered metal-island film distributions, and it has further been used to enhance the efficiency of solar cells and LED (ref.&#160;). Here, we show that a disordered metal-nanoparticle layer, supported by a 40-nm-thick Si<sub>3</sub>N<sub>4</sub> membrane, enables coupling of a single laser pulse to the waveguided modes of the membrane, and that, under certain conditions, this leads to reorganization of the nanoparticle ensemble into ordered one- and two-dimensional grating patterns. Such self-patterning has not been observed before, and could lead to useful methods for the fabrication of complex nanostructures and advanced photonic devices.</p>",<p>目前，无论是科学上还是应用上，纳米结构对光的捕获，操纵和转换都引起了人们的极大兴趣。其中一个重要部分是光与光波导之间的相互作用，由等离激元活性金属-纳米粒子排列介导。已经通过纳米粒子晶格以及无序的金属岛膜分布证明了入射光与波导-等离激元的强耦合，并且它还被用于提高太阳能电池和LED的效率（参见160;）。在这里，我们表明，由40nm厚的Si <sub> 3 </ sub> N <sub> 4 </ sub>膜支撑的无序金属纳米颗粒层能够将单个激光脉冲耦合到波导在一定条件下，这导致纳米粒子集合重组为有序的一维和二维光栅图案。这种自构图从未见过，可能会为制造复杂的纳米结构和先进的光子器件提供有用的方法。</ p> 
10.1038/nphoton.2008.78,Nanometric optical tweezers based on nanostructured substrates,基于纳米结构基底的纳米光镊 ,"<p>The ability to control the position of a mesoscopic object with nanometric precision is important for the rapid progress of nanoscience. One of the most promising tools to achieve such control is optical tweezers, which trap objects near the focus of a laser beam. However, the drawbacks of conventional tweezers include a trapping volume that is diffraction-limited and significant brownian motion of trapped nanoobjects. Here, we report the first experimental realization of three-dimensional nanometric optical tweezers that are based on nanostructured substrates. Using electromagnetically coupled pairs of gold nanodots in a standard optical tweezers set-up, we create an array of subwavelength plasmonic optical traps that offer a significant increase in trapping efficiency. The nanodot optical near-fields reduce the trapping volume beyond the diffraction limit and quench brownian motion of the trapped nanoparticles by almost an order of magnitude as compared to conventional tweezers operating under the same trapping conditions. Our tweezers achieve nanoscale control of entities at significantly smaller laser powers and open new avenues for nanomanipulation of fragile biological objects.</p>",<p>以纳米精度控制介观物体位置的能力对于纳米科学的快速发展很重要。实现这种控制的最有前途的工具之一是光镊，该光镊将物体捕获在激光束的焦点附近。然而，常规镊子的缺点包括被衍射限制的捕获体积和被捕获的纳米物体的明显的布朗运动。在这里，我们报告基于纳米结构的基板的三维纳米光镊子的第一个实验实现。在标准的光镊设置中使用电磁耦合的金纳米点对，我们创建了亚波长等离激元光阱阵列，可大大提高捕获效率。与在相同捕获条件下操作的常规镊子相比，纳米点光学近场将捕获体积减小到超过衍射极限，并使捕获的纳米颗粒的布朗运动猝灭了近一个数量级。我们的镊子可以以较小的激光功率实现对实体的纳米级控制，并为脆弱生物物体的纳米处理开辟了新途径。</ p> 
10.1038/nphoton.2008.81,Incoherent spatial solitons in effectively instantaneous nonlinear media,有效瞬时非线性介质中的非相干空间孤子 ,"<p>Incoherent optical spatial solitons are self-trapped beams with a multimodal structure that varies randomly in time. They form when their diffraction-broadening, which is governed by their spatial correlations, is balanced by nonlinear interaction between the waves and the medium, resulting in the stationary propagation of the time-averaged intensity structure of the beam. The experimental observation of incoherent solitons has opened up exciting new avenues in soliton science. However, all incoherent spatial solitons observed to date have been supported by nonlinearities with a slow response time, &#964;, that is much longer than the characteristic fluctuation time of the beam, t<sub>c</sub> &#8810; &#964;. Here, we demonstrate incoherent solitons in effectively instantaneous nonlocal nonlinear media where &#964; &#8810; t<sub>c</sub>. These solitons exhibit fundamentally new features (for example, propagation at random trajectories), and can be created in various optically nonlinear media, as well as in other fields where the nonlinearity is nonlocal and very fast.</p>",<p>非相干光学空间孤子是具有多模态结构的自陷束，其随时间随机变化。当它们的衍射扩展（由它们的空间相关性决定）被波与介质之间的非线性相互作用所平衡时，它们就形成了，从而导致了光束的时均强度结构的平稳传播。非相干孤子的实验观察为孤子科学开辟了令人兴奋的新途径。但是，迄今为止观察到的所有非相干空间孤子都得到了非线性的支持，响应时间很慢，这比光束的特征波动时间t <sub> c </ sub>＆＃8810长得多。 ; ＆＃964;。在这里，我们证明了有效瞬时非局部非线性介质中的非相干孤子，其中＆＃8810; t <sub> c </ sub>。这些孤子从根本上表现出新特征（例如，在随机轨道上传播），并且可以在各种光学非线性介质中以及在非线性非局部且非常快的其他领域中创建。</ p> 
10.1038/nphoton.2008.95,Erratum: Superconducting nanowire photon-number-resolving detector at telecommunication wavelengths,勘误：电信波长下的超导纳米线光子数解析探测器 ,,
10.1038/nphoton.2008.96,A round-up of recent papers in the field of photonics published by the physical sciences division of the Nature Publishing Group,自然出版集团的物理科学部门在光子学领域的最新论文综述 ,,
10.1038/nphoton.2008.97,Nonlinear crystals,非线性晶体 ,,
10.1038/nphoton.2008.98,Mind the trap,注意陷阱 ,,
10.1038/nphoton.2008.83,This issue,这个问题 ,,
