doi,title,title_cn,abstract,abstract_cn
10.1038/nphoton.2015.227,Extraction of a single photon from an optical pulse,从光脉冲中提取单个光子 ,,
10.1038/nphoton.2015.234,Detection and tracking of moving objects hidden from view,检测和跟踪隐藏在视野之外的移动物体 ,,
10.1038/nphoton.2015.250,Frequency-agile dual-comb spectroscopy,频率捷变双梳谱 ,,
10.1038/nphoton.2015.226,Solid-state infrared-to-visible upconversion sensitized by colloidal nanocrystals,胶态纳米晶体敏化固态红外到可见光的上转换 ,,
10.1038/nphoton.2015.248,Imaging nanophotonic modes of microresonators using a focused ion beam,使用聚焦离子束成像微谐振器的纳米光子模式 ,,
10.1038/nphoton.2015.205,Modified optical absorption of molecules on metallic nanoparticles at sub-monolayer coverage,亚单层覆盖下金属纳米粒子上分子的改良光吸收 ,"<p>Enhanced optical absorption of molecules in the vicinity of metallic nanostructures is key to a number of surface-enhanced spectroscopies and of great general interest to the fields of plasmonics and nano-optics. However, experimental access to this absorbance has long proven elusive. Here, we present direct measurements of the surface absorbance of dye molecules adsorbed onto silver nanospheres and, crucially, at sub-monolayer concentrations where dye&#8211;dye interactions become negligible. With a large detuning from the plasmon resonance, distinct shifts and broadening of the molecular resonances reveal the intrinsic properties of the dye in contact with the metal colloid, in contrast to the often studied strong-coupling regime where the optical properties of the dye molecules cannot be isolated. The observation of these shifts together with the ability to routinely measure them has broad implications in the interpretation of experiments involving resonant molecules on metallic surfaces, such as surface-enhanced spectroscopies and many aspects of molecular plasmonics.</p>",<p>增强金属在纳米结构附近的分子的光吸收是许多表面增强光谱学的关键，并且对于等离激元学和纳米光学领域具有广泛的兴趣。但是，长期以来一直无法获得这种吸光度的实验方法。在这里，我们提出了直接测量吸附到银纳米球上的染料分子的表面吸收率的方法，并且至关重要的是，在亚单层浓度下，染料与染料的相互作用可忽略不计。与等离振子共振有很大的失谐，分子共振的明显位移和展宽揭示了染料与金属胶体接触的内在特性，这与经常研究的强耦合机制相反，在后者中染料分子的光学特性无法被隔离。这些位移的观察以及常规测量的能力，对解释涉及金属表面共振分子的实验具有广泛的意义，例如表面增强光谱学和分子等离子体的许多方面。</ p> 
10.1038/nphoton.2015.223,Towards graphene plasmon-based free-electron infrared to X-ray sources,迈向基于石墨烯等离子体激元的自由电子红外到X射线源 ,"<p>Rapid progress in nanofabrication methods has fuelled a quest for ultra-compact photonic integrated systems and nanoscale light sources. The prospect of small-footprint, high-quality emitters of short-wavelength radiation is especially exciting due to the importance of extreme-ultraviolet and X-ray radiation as research and diagnostic tools in medicine, engineering and the natural sciences. Here, we propose a highly directional, tunable and monochromatic radiation source based on electrons interacting with graphene plasmons. Our complementary analytical theory and ab initio simulations demonstrate that the high momentum of the strongly confined graphene plasmons enables the generation of high-frequency radiation from relatively low-energy electrons, bypassing the need for lengthy electron acceleration stages or extreme laser intensities. For instance, highly directional 20&#8197;keV photons could be generated in a table-top design using electrons from conventional radiofrequency electron guns. The conductive nature and high damage threshold of graphene make it especially suitable for this application. Our electron&#8211;plasmon scattering theory is readily extended to other systems in which free electrons interact with surface waves.</p>",<p>纳米制造方法的迅速发展推动了对超紧凑光子集成系统和纳米级光源的追求。由于极紫外和X射线辐射作为医学，工程学和自然科学的研究和诊断工具的重要性，因此小尺寸，高质量的短波辐射发射器的前景尤其令人兴奋。在此，我们基于电子与石墨烯等离子体激元相互作用，提出了一种高度定向，可调谐和单色的辐射源。我们的互补分析理论和从头算模拟表明，严格约束的石墨烯等离子体激元的高动量可从能量较低的电子产生高频辐射，而无需冗长的电子加速阶段或极端的激光强度。例如，可以使用来自常规射频电子枪的电子，在台式设计中生成高度定向的20keV光子。石墨烯的导电性质和高损伤阈值使其特别适合此应用。我们的电子等离激元散射理论很容易扩展到自由电子与表面波相互作用的其他系统。</ p> 
10.1038/nphoton.2015.213,Observation of a hot-phonon bottleneck in lead-iodide perovskites,碘化钙钛矿中热声子瓶颈的观察 ,"<p>We study the carrier dynamics in planar methyl ammonium lead iodide perovskite films using broadband transient absorption spectroscopy. We show that the sharp optical absorption onset is due to an exciton transition that is inhomogeneously broadened with a binding energy of 9&#8197;meV. We fully characterize the transient absorption spectrum by free-carrier-induced bleaching of the exciton transition, quasi-Fermi energy, carrier temperature and bandgap renormalization constant. The photo-induced carrier temperature is extracted from the transient absorption spectra and monitored as a function of delay time for different excitation wavelengths and photon fluences. We find an efficient hot-phonon bottleneck that slows down cooling of hot carriers by three to four orders of magnitude in time above a critical injection carrier density of &#8764;5&#8201;&#215;&#8201;10<sup>17</sup>&#8197;cm<sup>&#8722;3</sup>. Compared with molecular beam epitaxially grown GaAs, the critical density is an order of magnitude lower and the relaxation time is approximately three orders of magnitude longer.</p>",<p>我们使用宽带瞬态吸收光谱研究平面甲基铵碘化铅钙钛矿薄膜中的载流子动力学。我们表明，急剧的光吸收开始是由于激子跃迁，该激子跃迁不均匀地加宽了9＆＃8197; meV的结合能。我们通过激子跃迁，准费米能量，载流子温度和带隙重归一化常数的自由载流子引起的漂白来充分表征瞬态吸收光谱。从瞬态吸收光谱中提取出光诱导的载流子温度，并根据延迟时间对不同的激发波长和光子通量进行监测。我们发现了一个有效的热声子瓶颈，可将热载流子的冷却速度在高于临界注入载流子密度＆＃8764; 5＆＃8201;＆＃215;＆＃8201; 10 <sup > 17 </ sup>＆＃8197; cm <sup>＆＃8722; 3 </ sup>。与分子束外延生长的砷化镓相比，临界密度低一个数量级，弛豫时间长约三个数量级。</ p> 
10.1038/nphoton.2015.247,Optically reconfigurable metasurfaces and photonic devices based on phase change materials,基于相变材料的光学可重构超颖表面和光子设备 ,"<p>Photonic components with adjustable parameters, such as variable-focal-length lenses or spectral filters, which can change functionality upon optical stimulation, could offer numerous useful applications. Tuning of such components is conventionally achieved by either micro- or nanomechanical actuation of their constituent parts, by stretching or by heating. Here, we report a novel approach for making reconfigurable optical components that are created with light in a non-volatile and reversible fashion. Such components are written, erased and rewritten as two-dimensional binary or greyscale patterns into a nanoscale film of phase-change material by inducing a refractive-index-changing phase transition with tailored trains of femtosecond pulses. We combine germanium&#8211;antimony&#8211;tellurium-based films with a diffraction-limited resolution optical writing process to demonstrate a variety of devices: visible-range reconfigurable bichromatic and multi-focus Fresnel zone plates, a super-oscillatory lens with subwavelength focus, a greyscale hologram, and a dielectric metamaterial with on-demand reflection and transmission resonances.</p>",具有可调整参数的光子组件（例如可变焦距透镜或光谱滤光片）可以在光刺激后改变功能，可以提供许多有用的应用。通常通过微机械或纳米机械致动其组成部分，通过拉伸或加热来实现对这些组件的调节。在这里，我们报告了一种新颖的方法，用于制造可重构的光学组件，这些组件可以以非易失性和可逆的方式通过光来创建。通过使用定制的飞秒脉冲序列诱导折射率变化的相变，将此类组件作为二维二进制或灰度图案写入，擦除和重写为相变材料的纳米级薄膜。我们将锗，锑和碲基薄膜与衍射极限分辨率光学写入工艺相结合，以演示各种设备：可见光范围可重配置的双色和多焦点菲涅耳波带片，具有亚波长的超振荡透镜焦点，灰度全息图和具有按需反射和透射共振的介电超材料。</ p> 
