doi,title,title_cn,abstract,abstract_cn
10.1038/s41567-020-0971-0,Tunnelling dynamics between superconducting bound states at the atomic limit,超导束缚态在原子极限之间的隧穿动力学 ,"<p>There is a limit to the miniaturization of every process, and for charge transport this is realized by the coupling of two single discrete energy levels at the atomic scale. In superconductors, Yu&#8211;Shiba&#8211;Rusinov (YSR) states are such levels. Here, we place a magnetic impurity on the tip of a scanning tunnelling microscope (YSR-STM) and use it to demonstrate sequential tunnelling of electrons between parity-protected YSR states on the tip and in the sample. Using this Shiba&#8211;Shiba tunnelling technique we probe the YSR lifetime, which we can enhance by reducing the relaxation of the excited YSR state to the intrinsic channel. Our work offers a way to characterize and manipulate coupled superconducting bound states, such as Andreev levels, YSR states or Majorana bound states at the atomic limit.</p>",<p>每个过程的微型化都有一个极限，对于电荷传输，这是通过在原子尺度上耦合两个单个离散能级实现的。 在超导体中，Yu Shiba Rusinov（YSR）状态就是这样的水平。 在这里，我们将磁性杂质放在扫描隧道显微镜（YSR-STM）的尖端上，并用它来证明电子在尖端和样品中受奇偶保护的YSR状态之间的顺序隧穿。 使用这种Shiba＆＃8211; Shiba隧道技术，我们可以探究YSR寿命，可以通过减少激发YSR态对本征通道的弛豫来提高YSR寿命。 我们的工作为表征和操纵耦合的超导束缚态提供了一种方法，例如原子极限处的安德列夫能级，YSR态或马约拉纳束缚态。</ p> 
10.1038/s41567-020-0978-6,Universal scaling laws rule explosive growth in human cancers,普遍缩放法则统治着人类癌症的爆炸性增长 ,"<p>Most physical and other natural systems are complex entities that are composed of a large number of interacting individual elements. It is a surprising fact that they often obey the so-called scaling laws that relate an observable quantity to a measure of the size of the system. Here, we describe the discovery of universal superlinear metabolic scaling laws in human cancers. This dependence underpins increasing tumour aggressiveness, owing to evolutionary dynamics, that leads to an explosive growth as the disease progresses. We validated this dynamic using longitudinal volumetric data of different histologies from large cohorts of patients with cancer. To explain our observations we tested complex, biologically inspired mathematical models that describe the key processes that govern tumour growth. Our models predict that the emergence of superlinear allometric scaling laws is an inherently three-dimensional phenomenon. Moreover, the scaling laws that we identified allowed us to define a set of metabolic metrics with prognostic value, which adds clinical utility to our findings.</p>",<p>大多数物理系统和其他自然系统都是复杂的实体，由大量相互作用的单个元素组成。令人惊讶的事实是，它们经常遵守所谓的缩放定律，该定律将可观察的量与系统大小的度量联系起来。在这里，我们描述了人类癌症中普遍的超线性代谢比例定律的发现。由于进化动力学，这种依赖性增强了肿瘤的侵略性，导致随着疾病的发展爆发性增长。我们使用来自大量癌症患者的不同组织学的纵向体积数据验证了这一动态。为了解释我们的观察结果，我们测试了受生物学启发的复杂数学模型，这些模型描述了控制肿瘤生长的关键过程。我们的模型预测超线性异形比例定律的出现是固有的三维现象。此外，我们确定的比例定律使我们能够定义一组具有预后价值的代谢指标，这为我们的发现增加了临床实用性。</ p> 
10.1038/s41567-020-0966-x,Author Correction: A brief history of nuclear fusion,作者更正：核聚变简史 ,,
10.1038/s41567-020-0977-7,Author Correction: Polarizing an antiferromagnet by optical engineering of the crystal field,作者更正：通过晶体场的光学工程使反铁磁体极化 ,,
10.1038/s41567-020-0985-7,Author Correction: Human information processing in complex networks,作者更正：复杂网络中的人类信息处理 ,,
10.1038/s41567-020-0996-4,Publisher Correction: Universal elastic mechanism for stinger design,出版商更正：毒刺设计的通用弹性机制 ,,
10.1038/s41567-020-01095-x,Simplify your life,简化生活 ,,
