doi,title,title_cn,abstract,abstract_cn
10.1038/nphys2238,Five minutes from disaster,灾难五分钟 ,,
10.1038/nphys2242,Out of the darkness,走出黑暗 ,,
10.1038/nphys2224,Can't get no diffraction?,无法得到衍射？ ,,
10.1038/nphys2225,Just like that,就这样 ,,
10.1038/nphys2229,Behind the screen,屏幕后面 ,,
10.1038/nphys2233,Upholding the law,遵守法律 ,,
10.1038/nphys2234,Millikan recharged,密立根充值 ,,
10.1038/nphys2235,Quantum chemistry cut short,量子化学缩短了 ,,
10.1038/nphys2236,Quantum speed limit,量子速度极限 ,,
10.1038/nphys2237,How the galaxy got its field,银河系如何发展 ,,
10.1038/nphys2209,The Sleeping Beauty approach,睡美人方法 ,,
10.1038/nphys2184,A Stirling effort,斯特林的努力 ,,
10.1038/nphys2215,Hot electrons but cool vibrations,电子热但振动小 ,,
10.1038/nphys2223,Carbon's superconducting footprint,碳的超导足迹 ,,
10.1038/nphys2230,Unearthly beauty,超自然之美 ,,
10.1038/nphys2222,Through the quantum chicane,通过量子锥 ,,
10.1038/nphys2227,Dense bytes from antiferromagnetic bits,反铁磁位的密集字节 ,,
10.1038/nphys2187,Doppler speed gun for spins,多普勒测速仪旋转 ,,
10.1038/nphys2228,Sleight of handedness,轻率 ,,
10.1038/nphys2178,Protecting entanglement from decoherence using weak measurement and quantum measurement reversal,使用弱测量和量子测量逆转保护缠结免受退相干 ,,
10.1038/nphys2161,Magnetoelectric resonance with electromagnons in a perovskite helimagnet,钙钛矿直升机磁铁中的电磁子与磁电共振 ,,
10.1038/nphys2155,Phase separation and magnetic order in K-doped iron selenide superconductor,掺钾硒化铁超导体的相分离和磁序 ,,
10.1038/nphys2181,Phonon-mediated superconductivity in graphene by lithium deposition,锂沉积中声子介导的石墨烯超导 ,,
10.1038/nphys2159,Imaging molecular potentials using ultrahigh-resolution resonant photoemission,使用超高分辨率共振光发射成像分子电位 ,,
10.1038/nphys2153,Focusing of short-pulse high-intensity laser-accelerated proton beams,短脉冲高强度激光加速质子束的聚焦 ,,
10.1038/nphys2163,Realization of a micrometre-sized stochastic heat engine,微米级随机热机的实现 ,,
10.1038/nphys2170,High-fidelity quantum driving,高保真量子驱动 ,"<p>Accurately controlling a quantum system is a fundamental requirement in quantum information processing and the coherent manipulation of molecular systems. The ultimate goal in quantum control is to prepare a desired state with the highest fidelity allowed by the available resources and the experimental constraints. Here we experimentally implement two optimal high-fidelity control protocols using a two-level quantum system comprising Bose&#8211;Einstein condensates in optical lattices. The first is a short-cut protocol that reaches the maximum quantum-transformation speed compatible with the Heisenberg uncertainty principle. In the opposite limit, we realize the recently proposed transitionless superadiabatic protocols in which the system follows the instantaneous adiabatic ground state nearly perfectly. We demonstrate that superadiabatic protocols are extremely robust against control parameter variations, making them useful for practical applications.</p>",<p>精确控制量子系统是量子信息处理和分子系统相干操纵的基本要求。 量子控制的最终目标是准备一种具有可用资源和实验约束所允许的最高保真度的期望状态。 在这里，我们使用两级量子系统实验性地实现了两个最佳的高保真控制协议，该两级量子系统包括光学晶格中的玻色和爱因斯坦凝聚。 第一个是捷径协议，可以达到与海森堡不确定性原理兼容的最大量子转化速度。 在相反的范围内，我们实现了最近提出的无过渡超级绝热协议，其中系统几乎完全遵循瞬时绝热基态。 我们证明超级绝热协议对控制参数的变化具有极强的鲁棒性，使其对实际应用非常有用。</ p> 
10.1038/nphys2157,Doppler velocimetry of spin propagation in a two-dimensional electron gas,二维电子气中自旋传播的多普勒测速 ,"<p>Controlling the flow of electrons by manipulating their spin is a key to the development of spin-based electronics. Recent demonstrations of electrical-gate control in spin-transistor configurations have shown great promise, but operation at room temperature remains elusive. Further progress requires a deeper understanding of the propagation of spin polarization, particularly in the high-mobility semiconductors used for devices. Here we report the application of Doppler velocimetry to resolve the motion of spin-polarized electrons in GaAs quantum wells driven by a drifting Fermi sea. We find that the spin mobility tracks the high electron mobility precisely as a function of temperature. However, we also observe that the coherent precession of spins driven by spin&#8211;orbit interaction, which is essential for the operation of a broad class of spin logic devices, breaks down at temperatures above 150&#8201;K, for reasons that are not yet understood theoretically.</p>",<p>通过控制电子的自旋来控制电子流是自旋电子学发展的关键。 自旋晶体管配置中的电子门控制的最新演示显示出了巨大的希望，但是在室温下运行仍然遥遥无期。 进一步的进步需要对自旋极化的传播有更深入的了解，尤其是在用于设备的高迁移率半导体中。 在这里，我们报告了多普勒测速仪的应用，以解决由费米海漂移驱动的GaAs量子阱中自旋极化电子的运动。 我们发现自旋迁移率随温度精确地跟踪高电子迁移率。 但是，我们还观察到，自旋-轨道相互作用驱动的自旋的相干进动（对于多种自旋逻辑设备的运行至关重要）在温度高于150°K时会分解，原因如下： 从理论上尚未理解。</ p> 
10.1038/nphys2208,Chiral superconductivity from repulsive interactions in doped graphene,掺杂石墨烯排斥相互作用的手性超导性 ,"<p>Chiral superconductivity, which breaks time-reversal symmetry, can exhibit a wealth of fascinating properties that are highly sought after for nanoscience applications. We identify doped graphene monolayer as a system where chiral superconductivity can be realized. In this material, a unique situation arises at a doping where the Fermi surface is nested and the density of states is singular. In this regime, d-wave superconductivity can emerge from repulsive electron&#8211;electron interactions. Using a renormalization group method, we argue that superconductivity dominates over all competing orders for generic weak repulsive interactions. Superconductivity develops simultaneously in two degenerate d-wave pairing channels. We argue that the resulting superconducting state is of chiral type, with the phase of the superconducting order parameter winding by 4&#960; around the Fermi surface. Realization of this state in doped graphene will prove that superconductivity can emerge from electron&#8211;electron repulsion, and will open the door to applications of chiral superconductivity.</p>",<p>手性超导电性打破了时间反转的对称性，可以展现出令人着迷的特性，这是纳米科学应用所极力追求的。我们将掺杂的石墨烯单层确定为可以实现手性超导的系统。在这种材料中，在掺杂处出现了独特的情况，其中费米表面是嵌套的，并且态密度是奇异的。在这种情况下，d波超导性可以从排斥电子和电子相互作用中出现。使用重归一化组方法，我们认为对于一般的弱排斥相互作用，超导性在所有竞争顺序中均占主导地位。超导性在两个简并的d波配对通道中同时发展。我们认为，所得到的超导状态是手性类型，超导阶数参数的相位缠绕4＆＃960;。在费米表面附近。在掺杂石墨烯中实现该状态将证明，超导电性可以从电子排斥中产生，并为手性超导电性的应用打开了大门。</ p> 
10.1038/nphys2133,Non-monotonic temperature evolution of dynamic correlations in glass-forming liquids,玻璃形成液中动态相关性的非单调温度演化 ,"<p>The viscosity of glass-forming liquids increases by many orders of magnitude if their temperature is lowered by a mere factor of 2&#8211;3. Recent studies suggest that this widespread phenomenon is accompanied by spatially heterogeneous dynamics, and a growing dynamic correlation length quantifying the extent of correlated particle motion. Here we use a novel numerical method to detect and quantify spatial correlations that reveal a surprising non-monotonic temperature evolution of spatial dynamical correlations, accompanied by a second length scale that grows monotonically and has a very different nature. Our results directly unveil a dramatic qualitative change in atomic motions near the mode-coupling crossover temperature, which involves no fitting or indirect theoretical interpretation. These findings impose severe new constraints on the theoretical description of the glass transition, and open several research perspectives, in particular for experiments, to confirm and quantify our observations in real materials.</p>",<p>如果形成玻璃的液体的温度仅降低2到3倍，其粘度就会增加许多数量级。最近的研究表明，这种普遍现象伴随着空间上的异质动力学，并且不断增长的动态相关长度量化了相关粒子运动的程度。在这里，我们使用一种新颖的数值方法来检测和量化空间相关性，从而揭示出令人惊讶的空间动态相关性的非单调温度演变，并伴随着第二个长度尺度，该长度尺度单调增长并且具有非常不同的性质。我们的结果直接揭示了模式耦合交叉温度附近原子运动的剧烈质变，这不涉及拟合或间接理论解释。这些发现对玻璃化转变的理论描述施加了严峻的新限制，并打开了一些研究视角，尤其是在实验方面，以确认和量化我们在真实材料中的观察结果。</ p> 
10.1038/nphys2196,Optical cavity cooling of mechanical modes of a semiconductor nanomembrane,半导体纳米膜机械模的光腔冷却 ,"<p>Mechanical oscillators can be optically cooled using a technique known as optical-cavity back-action. Cooling of composite metal&#8211;semiconductor mirrors, dielectric mirrors and dielectric membranes has been demonstrated. Here we report cavity cooling of mechanical modes in a high-quality-factor and optically active semiconductor nanomembrane. The cooling is a result of electron&#8211;hole generation by cavity photons. Consequently, the cooling factor depends on the optical wavelength, varies drastically in the vicinity of the semiconductor bandgap, and follows the excitonic absorption behaviour. The resultant photo-induced rigidity is large and a mode temperature cooled from room temperature down to 4&#8201;K is realized with 50&#8201;&#956;W of light and a cavity finesse of just 10. Thermal stress due to non-radiative relaxation of the electron&#8211;hole pairs is the primary cause of the cooling. We also analyse an alternative cooling mechanism that is a result of electronic stress via the deformation potential, and outline future directions for cavity optomechanics with optically active semiconductors.</p>",<p>可以使用称为光腔反向作用的技术对机械振荡器进行光学冷却。已经证明了复合金属半导体镜，介电镜和介电膜的冷却。在这里，我们报告高品质因数和光学活性半导体纳米膜中的机械模腔冷却。冷却是由空腔光子产生电子空穴的结果。因此，冷却因子取决于光波长，在半导体带隙附近急剧变化，并遵循激子吸收行为。所产生的光致刚度大，并且在50W的光线和仅10的腔隙的情况下，可以实现从室温冷却至4K的模温，并且腔体的细度仅为10。电子-空穴对的辐射弛豫是冷却的主要原因。我们还分析了通过形变电势产生的电子应力所导致的另一种冷却机制，并概述了具有光学活性半导体的腔体光力学的未来发展方向。</ p> 
10.1038/nphys2213,Erratum: Dirac cones reshaped by interaction effects in suspended graphene,勘误：悬浮石墨烯中的相互作用效应重塑了狄拉克锥 ,,
10.1038/nphys2218,Erratum: Long-range Kondo signature of a single magnetic impurity,勘误表：单个磁性杂质的近距离近藤签名 ,,
