doi,title,title_cn,abstract,abstract_cn
10.1038/nphys2295,Mismeasure for measure,措施不当 ,,
10.1038/nphys2284,Grain of truth,真相 ,,
10.1038/nphys2289,Strange goings-on,奇怪的事 ,,
10.1038/nphys2290,Frozen light switch,冷冻灯开关 ,,
10.1038/nphys2291,Optics for a better memory,光学效果更好 ,,
10.1038/nphys2292,Bacteria get around,细菌四处走动 ,,
10.1038/nphys2293,Liquids in no man's land,无人区中的液体 ,,
10.1038/nphys2246,Order in disorder,秩序混乱 ,,
10.1038/nphys2260,State secrets squeezed,国家机密受到挤压 ,,
10.1038/nphys2288,Suspended memory,暂停的记忆 ,,
10.1038/nphys2243,To see a SAW,看SAW ,,
10.1038/nphys2283,Photonic neural networks,光子神经网络 ,,
10.1038/nphys2285,Forced to branch out,被迫分支 ,,
10.1038/nphys2258,Quantum simulation,量子模拟 ,,
10.1038/nphys2275,Goals and opportunities in quantum simulation,量子模拟的目标和机会 ,,
10.1038/nphys2259,Quantum simulations with ultracold quantum gases,超冷量子气体的量子模拟 ,"<p>Ultracold quantum gases offer a unique setting for quantum simulation of interacting many-body systems. The high degree of controllability, the novel detection possibilities and the extreme physical parameter regimes that can be reached in these &#8216;artificial solids&#8217; provide an exciting complementary set-up compared with natural condensed-matter systems, much in the spirit of Feynman&#8217;s vision of a quantum simulator. Here we review recent advances in technology and discuss progress in a number of areas where experimental results have already been obtained.</p>",<p>超OLDOLD量子气体为相互作用的多体系统的量子模拟提供了独特的设置。 在这些“人造固体”中可以达到的高度可控性，新颖的检测可能性和极端的物理参数范围。 与自然凝聚态系统相比，它提供了令人兴奋的互补设置，这很符合费曼量子模拟器的构想。 在这里，我们回顾技术的最新进展，并讨论在已经获得实验结果的许多领域中的进展。</ p> 
10.1038/nphys2252,Quantum simulations with trapped ions,捕获离子的量子模拟 ,"<p>In the field of quantum simulation, methods and tools are explored for simulating the dynamics of a quantum system of interest with another system that is easier to control and measure. Systems of trapped atomic ions can be accurately controlled and manipulated, a large variety of interactions can be engineered with high precision and measurements of relevant observables can be obtained with nearly 100% efficiency. Here, we discuss prospects for quantum simulations using systems of trapped ions, and review the available set of quantum operations and first proof-of-principle experiments for both analog and digital quantum simulations with trapped ions.</p>",<p>在量子仿真领域，人们探索了一些方法和工具来用其他易于控制和测量的系统来模拟感兴趣的量子系统的动力学。 被捕集的原子离子系统可以被精确地控制和操纵，可以高精度地设计各种各样的相互作用，并且可以以接近100％的效率获得相关可观察物的测量值。 在这里，我们讨论了使用俘获离子系统进行量子模拟的前景，并回顾了利用俘获离子进行模拟和数字量子模拟的可用量子操作集和首次原理证明实验。</ p> 
10.1038/nphys2253,Photonic quantum simulators,光子量子模拟器 ,"<p>Quantum simulators are controllable quantum systems that can be used to mimic other quantum systems. They have the potential to enable the tackling of problems that are intractable on conventional computers. The photonic quantum technology available today is reaching the stage where significant advantages arise for the simulation of interesting problems in quantum chemistry, quantum biology and solid-state physics. In addition, photonic quantum systems also offer the unique benefit of being mobile over free space and in waveguide structures, which opens new perspectives to the field by enabling the natural investigation of quantum transport phenomena. Here, we review recent progress in the field of photonic quantum simulation, which should break the ground towards the realization of versatile quantum simulators.</p>",<p>量子模拟器是可控制的量子系统，可用于模拟其他量子系统。 它们具有解决常规计算机上难以解决的问题的潜力。 当今可用的光子量子技术已经到达了阶段，在此阶段，模拟量子化学，量子生物学和固态物理学中有趣的问题将产生明显的优势。 此外，光子量子系统还具有在自由空间和波导结构中移动的独特优势，通过对量子传输现象的自然研究，为该领域打开了新的视野。 在这里，我们回顾了光子量子仿真领域的最新进展，这应该为实现通用量子仿真器开辟道路。</ p> 
10.1038/nphys2251,On-chip quantum simulation with superconducting circuits,超导电路的片上量子仿真 ,"<p>Using a well-controlled quantum system to simulate complex quantum matter is an idea that has been around for 30 years and put into practice in systems of ultracold atoms for more than a decade. Much recent excitement has focused on a new implementation of quantum simulators using superconducting circuits, where conventional microchip fabrication can be used to take design concepts to experimental reality, quickly and flexibly. Because the quantum &#8216;particles&#8217; in these simulators are circuit excitations rather than physical particles subject to conservation laws, superconducting simulators provide a complement to ultracold atoms by naturally accessing non-equilibrium physics. Here, we review the recent wealth of theoretical explorations and experimental prospects of realizing these new devices.</p>",<p>使用一个控制良好的量子系统来模拟复杂的量子物质是一个已经存在了30年的想法，并且在超冷原子系统中投入了十多年的实践。 最近的许多激动都集中在使用超导电路的量子仿真器的新实现上，其中传统的微芯片制造可用于将设计概念快速灵活地带入实验现实。 因为量子＆＃8216;粒子＆＃8217; 在这些模拟器中，电路激励不是服从守恒律的物理粒子，超导模拟器通过自然地进入非平衡物理学，为超冷原子提供了补充。 在这里，我们回顾了实现这些新设备的最新理论探索和实验前景。</ p> 
10.1038/nphys2231,Emergent electrodynamics of skyrmions in a chiral magnet,天性离子在手性磁体中的新兴电动力学 ,,
10.1038/nphys2245,Spin-nematic squeezed vacuum in a quantum gas,量子气体中自旋向列压缩真空 ,,
10.1038/nphys2216,Shallow pockets and very strong coupling superconductivity in FeSexTe1−x,FeSexTe1-x中的浅孔和非常强的耦合超导性 ,,
10.1038/nphys2219,Nonlinear detection of spin currents in graphene with non-magnetic electrodes,用非磁性电极非线性检测石墨烯中的自旋电流 ,,
10.1038/nphys2220,New chiral phases of superfluid 3He stabilized by anisotropic silica aerogel,各向异性二氧化硅气凝胶稳定的超流体3He的新手性相 ,,
10.1038/nphys2249,Large-scale electron acceleration by parallel electric fields during magnetic reconnection,磁重连接期间通过平行电场进行的大规模电子加速 ,,
10.1038/nphys2232,Probing the relaxation towards equilibrium in an isolated strongly correlated one-dimensional Bose gas,在孤立的强相关一维Bose气体中探索向平衡的弛豫 ,"<p>The problem of how complex quantum systems eventually come to rest lies at the heart of statistical mechanics. The maximum-entropy principle describes which quantum states can be expected in equilibrium, but not how closed quantum many-body systems dynamically equilibrate. Here, we report the experimental observation of the non-equilibrium dynamics of a density wave of ultracold bosonic atoms in an optical lattice in the regime of strong correlations. Using an optical superlattice, we follow its dynamics in terms of quasi-local densities, currents and coherences&#8212;all showing a fast relaxation towards equilibrium values. Numerical calculations based on matrix-product states are in an excellent quantitative agreement with the experimental data. The system fulfills the promise of being a dynamical quantum simulator, in that the controlled dynamics runs for longer times than present classical algorithms can keep track of.</p>",<p>复杂的量子系统最终如何静止的问题是统计力学的核心。 最大熵原理描述了在平衡状态下可以预期的量子态，但没有描述封闭的量子多体系统如何动态平衡。 在这里，我们报告了在强相关状态下光学晶格中超冷硼原子密度波的非平衡动力学实验观察。 使用光学超晶格，我们在准局部密度，电流和相干方面遵循其动力学，所有这些都显示出向平衡值的快速松弛。 基于基质-产物状态的数值计算与实验数据具有极好的定量一致性。 该系统实现了成为动态量子模拟器的希望，因为受控动力学的运行时间比当前经典算法无法跟踪的时间更长。</ p> 
10.1038/nphys2250,Satellites and large doping and temperature dependence of electronic properties in hole-doped BaFe2As2,卫星和空穴掺杂BaFe2As2中电子性质的大掺杂和温度依赖性 ,"<p>Superconductivity has recently been discovered in several families of iron-based compounds, but despite intense research even such basic electronic properties of these materials as Fermi surfaces, effective electron masses and orbital characters are still subject to debate. Here, we address an issue that has not been considered before, namely the consequences of dynamical screening of the Coulomb interactions between Fe d&#160;electrons. We demonstrate that dynamical screening effects are important not only for higher-energy spectral features, such as correlation satellites seen in photoemission spectroscopy, but also for the low-energy electronic structure. Our analysis indicates that BaFe<sub>2</sub>As<sub>2</sub> is a strongly correlated compound with strongly doping- and temperature-dependent properties. In the hole-overdoped regime an incoherent metal is found, whereas Fermi-liquid behaviour is recovered in the undoped compound. At optimal doping, the self-energy exhibits an unusual square-root energy dependence, which leads to strong band renormalizations near the Fermi level.</p>",<p>最近已经在几个铁基化合物家族中发现了超导性，但是尽管进行了深入研究，但这些材料的基本电子特性（如费米表面，有效电子质量和轨道特性）仍存在争议。在这里，我们解决了一个以前未曾考虑过的问题，即动态筛选Fe d＆＃160电子之间的库仑相互作用的结果。我们证明动态筛选效果不仅对于高能谱特征（例如在光发射光谱中看到的相关卫星）很重要，而且对于低能电子结构也很重要。我们的分析表明，BaFe <sub> 2 </ sub> As <sub> 2 </ sub>是高度相关的化合物，具有强烈的掺杂和温度依赖性。在空穴掺杂态中，发现了非相干金属，而费米-液相行为在未掺杂的化合物中得以恢复。在最佳掺杂下，自能量表现出不同寻常的平方根能量依赖性，从而导致在费米能级附近出现强的带正态化。</ p> 
10.1038/nphys2217,Local probing of propagating acoustic waves in a gigahertz echo chamber,千兆赫回波室内传播声波的局部探测 ,"<p>In the same way that micro-mechanical resonators resemble guitar strings and drums, surface acoustic waves resemble the sound these instruments produce, but moving over a solid surface rather than through air. In contrast with oscillations in suspended resonators, such propagating mechanical waves have not before been studied near the quantum mechanical limits. Here, we demonstrate local probing of surface acoustic waves with a displacement sensitivity of 30&#8201;am<sub>RMS</sub>&#8201;Hz<sup>&#8722;1/2</sup> and detection sensitivity on the single-phonon level after averaging, at a frequency of 932&#8201;MHz. Our probe is a piezoelectrically coupled single-electron transistor, which is sufficiently fast, non-destructive and localized to enable us to track pulses echoing back and forth in a long acoustic cavity, self-interfering and ringing the cavity up and down. We project that strong coupling to quantum circuits will enable new experiments, and hybrids using the unique features of surface acoustic waves. Prospects include quantum investigations of phonon&#8211;phonon interactions, and acoustic coupling to superconducting qubits for which we present favourable estimates.</p>",<p>与微机械谐振器类似吉他弦和鼓一样，表面声波类似于这些乐器产生的声音，但在固体表面而不是通过空气移动。与悬挂式谐振器中的振荡相反，这种传播的机械波在量子力学极限附近尚未得到研究。在这里，我们演示了表面声波的局部探测，其位移灵敏度为30＆＃8201; am <sub> RMS </ sub>＆＃8201; Hz <sup>＆＃8722; 1/2 </ sup>在平均后的单声子级上，频率为932＆MHz。我们的探头是压电耦合的单电子晶体管，其速度足够快，无损且不受干扰，可以使我们跟踪在长声腔中来回回波的脉冲，自干扰并上下振荡腔。我们预计，与量子电路的强耦合将使新的实验成为可能，并利用表面声波的独特功能进行混合。前景包括声子相互作用的量子研究，以及与超导量子位的声耦合，对此我们提供了有利的估计。</ p> 
10.1038/nphys2239,Multistep redirection by cross-beam power transfer of ultrahigh-power lasers in a plasma,等离子体中超高功率激光器的跨光束功率转移进行多步重定向 ,<p>Laser redirection by cross-beam power transfer in a plasma is an important example of a nonlinear optics process which uses laser&#8211;plasma instabilities to one&#8217;s advantage. We have demonstrated this in a hohlraum plasma at the National Ignition Facility (NIF) at Lawrence Livermore National Laboratory. A four-wave mixing process causes laser power in multiple beams to change direction and add to the laser power of a selected beam. The process is controlled by setting the wavelength separation of the interacting laser beams. This technique provides a method to remotely re-point or combine high-powered laser beams without the need of local optical apparatus.</p>,通过等离子体中的跨束功率传输进行激光重定向是非线性光学过程的重要示例，该过程利用激光等离子体的不稳定性来发挥其优势。 我们已经在劳伦斯·利弗莫尔国家实验室的国家点火设施（NIF）的大气压等离子体中证明了这一点。 四波混合过程使多个光束的激光功率改变方向，并增加所选光束的激光功率。 通过设置相互作用的激光束的波长间隔来控制该过程。 该技术提供了一种无需本地光学设备即可远程重新指向或组合大功率激光束的方法。</ p> 
10.1038/nphys2281,Erratum: Experimental demonstration of a universally valid error–disturbance uncertainty relation in spin measurements,勘误：自旋测量中普遍有效的误差干扰不确定性关系的实验证明 ,,
