doi,title,title_cn,abstract,abstract_cn
10.1038/nphys4221,Magnetic pseudo-fields in a rotating electron–nuclear spin system,旋转电子-核自旋系统中的伪磁场 ,,
10.1038/nphys4205,Thermodynamic evidence for a nematic phase transition at the onset of the pseudogap in YBa2Cu3Oy,YBa2Cu3Oy假间隙开始时向列相变的热力学证据 ,,
10.1038/nphys4264,Majorana fermions in the Kitaev quantum spin system α-RuCl3,Kitaev量子自旋系统α-RuCl3中的马约拉纳费米子 ,,
10.1038/nphys4181,Large anomalous Nernst effect at room temperature in a chiral antiferromagnet,手性反铁磁体在室温下的大能斯特能斯特效应 ,,
10.1038/nphys4193,Topological sound in active-liquid metamaterials,活性液体超材料中的拓扑声音 ,,
10.1038/nphys4194,Coupling the Leidenfrost effect and elastic deformations to power sustained bouncing,耦合莱顿弗罗斯特效应和弹性变形来增强持续弹跳 ,,
10.1038/nphys4184,Geometrical frustration yields fibre formation in self-assembly,几何挫折会在自组装中产生纤维形成 ,,
10.1038/nphys4214,Solutal Marangoni flows of miscible liquids drive transport without surface contamination,互溶性液体的Solutal Marangoni流动驱动运输而没有表面污染 ,,
10.1038/nphys4257,Coherent control of an opsin in living brain tissue,活脑组织中视蛋白的相干控制 ,,
10.1038/nphys4204,Observation of topological edge states in parity–time-symmetric quantum walks,奇偶时间对称量子游动中拓扑边缘状态的观察 ,"<p>The study of non-Hermitian systems with parity&#8211;time (PT) symmetry is a rapidly developing frontier. Realized in recent experiments, PT-symmetric classical optical systems with balanced gain and loss hold great promise for future applications. Here we report the experimental realization of passive PT-symmetric quantum dynamics for single photons by temporally alternating photon losses in the quantum walk interferometers. The ability to impose PT symmetry allows us to realize and investigate Floquet topological phases driven by PT-symmetric quantum walks. We observe topological edge states between regions with different bulk topological properties and confirm the robustness of these edge states with respect to PT-symmetry-preserving perturbations and PT-symmetry-breaking static disorder. Our results contribute towards the realization of quantum mechanical PT-synthetic devices and suggest exciting possibilities for the exploration of the topological properties of non-Hermitian systems using discrete-time quantum walks.</p>",<p>具有奇偶性时间（PT）对称性的非Hermitian系统的研究是一个发展迅速的领域。在最近的实验中实现的，具有对称增益和损耗的PT对称经典光学系统在未来的应用中具有广阔的前景。在这里，我们通过量子步态干涉仪中的时间交替光子损耗，报告了单个光子的无源PT对称量子动力学的实验实现。强加PT对称性的能力使我们能够实现和研究由PT对称量子行走驱动的Floquet拓扑相位。我们观察到具有不同整体拓扑性质的区域之间的拓扑边缘状态，并确认这些边缘状态相对于PT对称性保持扰动和PT对称性破坏静态无序的鲁棒性。我们的研究结果为实现量子力学PT合成装置做出了贡献，并为使用离散时间量子行走探索非赫米特系统的拓扑性质提供了令人兴奋的可能性。</ p> 
10.1038/nphys4213,Negative permittivity in bubble and stripe phases,气泡和条纹相的介电常数为负 ,"<p>The physics of itinerant electrons in condensed matter is by and large governed by repulsive Coulomb forces. However, attractive interactions may emerge and prevail in determining the ground state despite the pervasive Coulomb repulsion. A notable example is electron pairing and superconductivity. The interplay of attractive and repulsive interactions may also instigate spontaneous symmetry lowering and clustering of charges in geometric patterns even without net attraction. Both types of attractive interaction triggered physics&#8212;pairing and charge ordering&#8212;are at play in two-dimensional electron systems exposed to a quantizing magnetic field. The charge ordering has been concluded indirectly from transport behaviour. Here we report the observation of negative permittivity present solely when bubble and stripe phases form. In conjunction with a theoretical model, the negative permittivity provides evidence for the underlying attractive exchange-correlation energy which sufficiently countervails Coulomb repulsion at small distances to enable and mediate charge clustering.</p>",<p>在凝聚态中，流动电子的物理很大程度上受排斥的库仑力控制。然而，尽管普遍存在库仑排斥，但在确定基态时可能会出现吸引人的相互作用，并占主导地位。一个显着的例子是电子对和超导性。吸引和排斥相互作用的相互作用也可能导致自发的对称性降低和几何图案中电荷的聚集，即使没有净吸引也是如此。两种类型的有吸引力的相互作用触发了物理配对和电荷排序，它们都在暴露于量化磁场的二维电子系统中发挥作用。收费命令是根据运输行为间接得出的。在这里，我们报告仅在气泡和条纹相形成时才出现负介电常数的现象。负介电常数与理论模型相结合，为潜在的有吸引力的交换相关能量提供了证据，该能量足以抵消小距离处的库仑排斥，从而实现并调节电荷簇。</ p> 
10.1038/nphys4212,A high-temperature quantum spin liquid with polaron spins,极化子自旋的高温量子自旋液体 ,"<p>The existence of a quantum spin liquid (QSL) in which quantum fluctuations of spins are sufficiently strong to preclude spin ordering down to zero temperature was originally proposed theoretically more than 40 years ago, but its experimental realization turned out to be very elusive. Here we report on an almost ideal spin liquid state that appears to be realized by atomic-cluster spins on the triangular lattice of a charge-density wave state of 1T-TaS<sub>2</sub>. In this system, the charge excitations have a well-defined gap of &#8764;0.3&#8201;eV, while nuclear quadrupole resonance and muon-spin-relaxation experiments reveal that the spins show gapless QSL dynamics and no long-range magnetic order at least down to 70&#8201;mK. Canonical T<sup>2</sup> power-law temperature dependence of the spin relaxation dynamics characteristic of a QSL is observed from 200&#8201;K to T<sub>f</sub> = 55&#8201;K. Below this temperature, we observe a new gapless state with reduced density of spin excitations and high degree of local disorder signifying new quantum spin order emerging from the QSL.</p>",<p>理论上已经提出了量子自旋液体（QSL），其中自旋的量子涨落足够强以阻止自旋降到零温度，但理论上却是在40多年前提出的，但事实证明，它的实验性实现非常难以捉摸。在这里，我们报告了一种几乎理想的自旋液体状态，该状态似乎是通过在1T-TaS <sub> 2 </ sub>的电荷密度波状态的三角晶格上的原子簇自旋实现的。在该系统中，电荷激发的间隙明确定义为＆＃8764; 0.3＆＃8201; eV，而核四极共振和μ自旋弛豫实验表明自旋显示出无间隙的QSL动力学并且没有长距离的磁场至少要降到70＆＃8201; mK。 QSL自旋弛豫动力学特性的典型T <sup> 2 </ sup>幂律温度相关性在200＆＃8201; K到T <sub> f </ sub> = 55＆＃8201; K处观察到。在此温度以下，我们观察到一种新的无间隙状态，其自旋激发的密度降低，并且局部无序度很高，这表明从QSL出现了新的量子自旋顺序。</ p> 
10.1038/nphys4227,Forward and inverse kinetic energy cascades in Jupiter's turbulent weather layer,木星湍流天气层中的正反动能级联 ,"<p>Jupiter&#8217;s turbulent weather layer contains phenomena of many different sizes, from local storms up to the Great Red Spot and banded jets. The global circulation is driven by complex interactions with (as yet uncertain) small-scale processes. We have calculated structure functions and kinetic energy spectral fluxes from Cassini observations over a wide range of length scales in Jupiter&#8217;s atmosphere. We found evidence for an inverse cascade of kinetic energy from length scales comparable to the first baroclinic Rossby deformation radius up to the global jet scale, but also a forward cascade of kinetic energy from the deformation radius to smaller scales. This second result disagrees with the traditional picture of Jupiter&#8217;s atmospheric dynamics, but has some similarities with mesoscale phenomena in the Earth&#8217;s atmosphere and oceans. We conclude that the inverse cascade driving Jupiter&#8217;s jets may have a dominant energy source at scales close to the deformation radius, such as baroclinic instability.</p>",<p>木星的湍急天气层包含许多不同大小的现象，从局部风暴到大红色斑点和带状喷射。全球循环是由与（尚不确定）小规模过程的复杂相互作用驱动的。我们已经从木星观测到的木星大气中各种长度尺度上的结构函数和动能谱通量进行了计算。我们发现证据表明，与第一斜斜Rossby变形半径直至全球射流尺度相比，长度尺度的动能呈反级联，但从变形半径到较小尺度的动能呈正级联。第二个结果与木星的大气动力学的传统图景不同，但与地球大气和海洋的中尺度现象有一些相似之处。我们得出结论，逆级联驱动木星射流在接近变形半径的尺度上可能具有主要的能源，例如斜压不稳定。</ p> 
