doi,title,title_cn,abstract,abstract_cn
10.1038/nphys1955,"Use, not abuse, of science",使用而非滥用科学 ,,
10.1038/nphys1956,Let's share,让我们分享 ,,
10.1038/nphys1943,The irregularity of reality,现实的不规律性 ,,
10.1038/nphys1947,A family affair,家庭事务 ,,
10.1038/nphys1951,Our choice from the recent literature,我们从最近的文献中选择 ,,
10.1038/nphys1938,A twist on relativistic astrophysics,相对论天体物理学的一个转折 ,,
10.1038/nphys1949,It doesn't work,没用 ,,
10.1038/nphys1931,Feeling the heat,感觉热 ,,
10.1038/nphys1930,Genetics and g-factors,遗传学和g因子 ,,
10.1038/nphys1935,A plasma of magnetic monopoles,磁单极子的等离子体 ,,
10.1038/nphys1950,X-ray crystallography goes viral,X射线晶体学病毒化 ,,
10.1038/nphys1907,Twisting of light around rotating black holes,旋转的黑洞周围的光线扭曲 ,,
10.1038/nphys1879,Observation of a ubiquitous three-dimensional superconducting gap function in optimally doped Ba0.6K0.4Fe2As2,最佳掺杂Ba0.6K0.4Fe2As2中普遍存在的三维超导能隙函数的观察 ,,
10.1038/nphys1876,Long-range Kondo signature of a single magnetic impurity,单个磁性杂质的近距离近距离签名 ,,
10.1038/nphys1868,Ferromagnetic quantum critical point induced by dimer-breaking in SrCo2(Ge1−xPx)2,SrCo2（Ge1-xPx）2中二聚体断裂引起的铁磁量子临界点 ,,
10.1038/nphys1864,Cold melting and solid structures of dense lithium,致密锂的冷熔和固态结构 ,,
10.1038/nphys1870,Strongly modified plasmon–matter interaction with mesoscopic quantum emitters,与介观量子发射体的强烈修饰的等离子体激元相互作用 ,,
10.1038/nphys1872,"Few femtosecond, few kiloampere electron bunch produced by a laser–plasma accelerator",飞秒，激光等离子体加速器产生的几千安培电子束 ,,
10.1038/nphys1863,Ultrafast optical control of entanglement between two quantum-dot spins,超快速光学控制两个量子点自旋之间的纠缠 ,"<p>The interaction between two quantum bits enables the creation of entanglement, the two-particle correlations that are at the heart of quantum information science. In semiconductor quantum dots, much work has focused on demonstrating control over single spin qubits using optical techniques. However, optical control of two spin qubits remains a major challenge for scaling to a fully fledged quantum-information platform. Here, we combine advances in vertically stacked quantum dots with ultrafast laser techniques to achieve optical control of the entangled state of two electron spins. Each electron is in a separate InAs quantum dot, and the spins interact through tunnelling, where the tunnelling rate determines how rapidly entangling operations can be carried out. We achieve two-qubit gates with an interaction rate of 30&#8201;GHz, more than an order of magnitude faster than demonstrated in any other system so far. These results demonstrate the viability and advantages of optically controlled quantum-dot spins for multi-qubit systems.</p>",<p>两个量子位之间的相互作用使得纠缠的创建成为了量子信息科学的核心，即两个粒子之间的相互关系。在半导体量子点中，许多工作集中于证明使用光学技术控制单个自旋量子位。然而，对两个自旋量子位的光学控制仍然是将比例缩放到完整的量子信息平台的主要挑战。在这里，我们将垂直堆叠的量子点的先进技术与超快激光技术相结合，以实现对两个电子自旋的纠缠态的光学控制。每个电子都在一个单独的InAs量子点中，自旋通过隧穿相互作用，其中隧穿速率决定了纠缠操作的执行速度。我们实现了具有30＆＃8201; GHz的交互速率的两个量子比特的门，比迄今为止在任何其他系统中展示的速度快一个数量级。这些结果证明了光控制量子点自旋在多量子位系统中的可行性和优势。</ p> 
10.1038/nphys1909,Observation of the thermal Casimir force,卡西米尔热力的观察 ,"<p>Quantum theory predicts the existence of the Casimir force between macroscopic bodies, a force arising from the zero-point energy of electromagnetic field modes around them. A thermal Casimir force, due to thermal rather than quantum fluctuations of the electromagnetic field at finite temperature, was theoretically predicted long ago. Here we report the experimental observation of the thermal Casimir force between two gold plates. We measured the attractive force between a flat and a spherical plate for separations between 0.7&#8201;&#956;m and 7&#8201;&#956;m. An electrostatic force caused by potential patches on the plates&#8217; surfaces is included in the analysis. Previous measurements of the quantum-fluctuation-induced force have been unable to clearly settle the question of whether the correct low-frequency form of the dielectric constant dispersion for calculating Casimir forces is the Drude model or the plasma model. Our experimental results are in excellent agreement (reduced &#967;<sup>2</sup> of 1.04) with the Casimir force calculated using the Drude model, including the T=300&#8201;K thermal force, which dominates over the quantum fluctuation-induced force at separations greater than 3&#8201;&#956;m. The plasma model result is excluded in the measured separation range.</p>",<p>量子理论预测宏观物体之间存在卡西米尔力，该力是由它们周围电磁场模式的零点能量产生的。从理论上讲，由于在有限温度下电磁场的热波动而不是量子波动，会产生卡西米尔热力。在这里，我们报告两个金板之间的卡西米尔热力的实验观察。我们测量了平板和球形板之间的吸引力，以使间距在0.7和7之间。由板上的潜在斑块引起的静电力＆＃8217;分析中包括曲面。先前对量子涨落引起的力的测量无法清楚地解决用于计算卡西米尔力的介电常数色散的正确低频形式是德鲁德模型还是等离子体模型的问题。我们的实验结果与使用Drude模型计算出的卡西米尔力（包括T = 300＆＃8201; K热力）吻合很好（降低了1.04的＆＃967; <sup> 2 </ sup>）。间距大于3的量子涨落引起的力。血浆模型结果不在测量的分离范围内。</ p> 
10.1038/nphys1873,Angle dependence of quantum oscillations in YBa2Cu3O6.59 shows free-spin behaviour of quasiparticles,YBa2Cu3O6.59中量子振荡的角度依赖性表明准粒子的自旋行为 ,"<p>Measurements of quantum oscillations in the cuprate superconductors afford an opportunity to assess the extent to which their electronic properties yield to a description rooted in Fermi-liquid theory. However, such an analysis is hampered by the small number of oscillatory periods observed in the accessible magnetic field range. Here we employ a genetic algorithm to globally model the field, angular and temperature dependence of the quantum oscillations observed in the resistivity of YBa<sub>2</sub>Cu<sub>3</sub>O<sub>6.59</sub>. This approach successfully fits an entire data set to a Fermi surface consisting of two small, quasi-two-dimensional cylinders, rather than the large Fermi surface predicted by conventional electronic-structure calculations. A key result is the first identification of the effects of Zeeman splitting, indicating that the quasiparticles behave as nearly free spins, constraining the source of the Fermi-surface reconstruction to something other than a spin-density wave with moments perpendicular to the magnetic field.</p>",<p>对铜酸盐超导体中量子振动的测量提供了一个机会，可以评估其电子性质在多大程度上产生于费米液体理论的描述。但是，这种分析受到在可访问磁场范围内观察到的少量振荡周期的阻碍。在这里，我们采用遗传算法对YBa <sub> 2 </ sub> Cu <sub> 3 </ sub> O <sub> 6.59电阻率中观察到的量子振荡的场，角和温度依赖性进行全局建模。子>。这种方法成功地将整个数据集拟合到由两个小的准二维圆柱体组成的费米曲面，而不是常规电子结构计算所预测的大费米曲面。一个关键结果是首次确定了塞曼分裂的影响，表明准粒子的行为接近于自由自旋，从而将费米表面重建的源限制为自旋密度波以外的东西，其磁矩垂直于磁场。 </ p> 
10.1038/nphys1892,Localization of preformed Cooper pairs in disordered superconductors,预制库珀对在无序超导体中的定位 ,"<p>The most profound effect of disorder on electronic systems is the localization of the electrons transforming an otherwise metallic system into an insulator. If the metal is also a superconductor then, at low temperatures, disorder can induce a pronounced transition from a superconducting into an insulating state. An outstanding question is whether the route to insulating behaviour proceeds through the direct localization of Cooper pairs or, alternatively, by a two-step process in which the Cooper pairing is first destroyed followed by the standard localization of single electrons. Here we address this question by studying the local superconducting gap of a highly disordered amorphous superconductor by means of scanning tunnelling spectroscopy. Our measurements reveal that, in the vicinity of the superconductor&#8211;insulator transition, the coherence peaks in the one-particle density of states disappear whereas the superconducting gap remains intact, indicating the presence of localized Cooper pairs. Our results provide the first direct evidence that the superconductor&#8211;insulator transition in some homogeneously disordered materials is driven by Cooper-pair localization.</p>",<p>无序对电子系统的最深远影响是电子的定位，将原本是金属的系统转变为绝缘体。如果金属也是超导体，那么在低温下，无序会引起从超导到绝缘态的明显过渡。一个悬而未决的问题是，绝缘行为的途径是通过库珀对的直接定位还是通过两步过程进行的，在该过程中首先破坏库珀对，然后破坏单个电子的标准定位。在这里，我们通过扫描隧道光谱研究高度无序的非晶态超导体的局部超导间隙来解决这个问题。我们的测量结果表明，在超导体绝缘体跃迁附近，单粒子态密度的相干峰消失，而超导间隙保持完整，表明存在局部库珀对。我们的结果提供了第一个直接证据，表明某些均匀无序材料中的超导体绝缘体转变是由库珀对定位驱动的。</ p> 
10.1038/nphys1866,Evolution of microscopic localization in graphene in a magnetic field from scattering resonances to quantum dots,从散射共振到量子点，磁场中石墨烯微观定位的演变 ,"<p>Graphene exhibits rich new physics and great promise for applications in electronics. The half-integer quantum Hall effect and high carrier mobility are critically dependent on interactions with impurities/substrates and localization of Dirac fermions in realistic devices. We microscopically study these interactions using scanning tunnelling spectroscopy (STS) of exfoliated graphene on a SiO<sub>2</sub> substrate in an applied magnetic field. The magnetic field strongly affects the electronic behaviour of the graphene; the states condense into well-defined Landau levels with a dramatic change in the character of localization. In zero magnetic field, weakly localized states are created by the substrate induced disorder potential. In strong magnetic fields, the two-dimensional electron gas breaks into a network of interacting quantum dots formed at the potential hills and valleys of the disorder potential. Our results demonstrate how graphene properties are perturbed by the disorder potential; a finding essential for the physics and applications of graphene.</p>",<p>石墨烯展现出丰富的新物理原理，并在电子领域具有广阔的应用前景。半整数量子霍耳效应和高载流子迁移率主要取决于与杂质/底物的相互作用以及狄拉克费米子在实际器件中的定位。我们在施加磁场的情况下，使用剥落石墨烯在SiO <sub> 2 </ sub>衬底上的扫描隧道光谱（STS），从微观上研究了这些相互作用。磁场会强烈影响石墨烯的电子行为。各州凝结为定义明确的Landau级别，其本地化特征发生了巨大变化。在零磁场中，基板诱导的无序电势会产生弱局部状态。在强磁场中，二维电子气分裂成由相互作用的量子点组成的网络，这些量子点形成在无序电势的电势峰和谷处。我们的结果表明，石墨烯的性能如何受到无序电位的干扰。对石墨烯的物理和应用至关重要的发现。</ p> 
10.1038/nphys1896,Creation and measurement of long-lived magnetic monopole currents in spin ice,旋转冰中长寿命磁单极电流的产生和测量 ,"<p>The recent discovery of &#8216;magnetricity&#8217; in spin ice raises the question of whether long-lived currents of magnetic &#8216;monopoles&#8217; can be created and manipulated by applying magnetic fields. Here we show that they can. By applying a magnetic-field pulse to a Dy<sub>2</sub>Ti<sub>2</sub>O<sub>7</sub> spin-ice crystal at 0.36&#8201;K, we create a relaxing magnetic current that lasts for several minutes. We measure the current by means of the electromotive force it induces in a solenoid coupled to a sensitive amplifier, and quantitatively describe it using a chemical kinetic model of point-like charges obeying the Onsager&#8211;Wien mechanism of carrier dissociation and recombination. We thus derive the microscopic parameters of monopole motion in spin ice and identify the distinct roles of free and bound magnetic charges. Our results illustrate a basic capacitor effect for magnetic charge and should pave the way for the design and realization of &#8216;magnetronic&#8217; circuitry.</p>",<p>＆＃8216;磁性＆＃8217;的最新发现在自旋冰中提出了一个问题，即磁单极的长寿命电流是否可以通过施加磁场来创建和操纵。在这里，我们证明他们可以。通过在0.36＆＃8201; K处的Dy <sub> 2 </ sub> Ti <sub> 2 </ sub> O <sub> 7 </ sub>自旋冰晶体上施加磁场脉冲，我们创建了持续数分钟的松弛电流。我们利用电流在耦合到灵敏放大器的螺线管中感应的电动势来测量电流，并使用点状电荷的化学动力学模型遵循载流子解离和重组的Onsager＆＃8211; Wien机理定量地描述电流。因此，我们得出了自旋冰中单极运动的微观参数，并确定了自由和束缚电荷的独特作用。我们的结果说明了基本的电容器电荷对磁性的影响，并应为＆＃8216; magnetronic＆＃8217;的设计和实现铺平道路。电路。</ p> 
10.1038/nphys1862,Excitable particles in an optical torque wrench,光学扭矩扳手中的可激发颗粒 ,"<p>The optical torque wrench is a laser trapping technique capable of applying and directly measuring torque on microscopic birefringent particles using spin momentum transfer, and has found application in the measurement of static torsional properties of biological molecules such as single DNAs. Motivated by the potential of the optical torque wrench to access the fast rotational dynamics of biological systems, a result of its all-optical manipulation and detection, we focus on the angular dynamics of the trapped birefringent particle, demonstrating its excitability in the vicinity of a critical point. This links the optical torque wrench to nonlinear dynamical systems such as neuronal and cardiovascular tissues, nonlinear optics and chemical reactions, all of which display an excitable binary (&#8216;all-or-none&#8217;) response to input perturbations. On the basis of this dynamical feature, we devise and implement a conceptually new sensing technique capable of detecting single perturbation events with high signal-to-noise ratio and continuously adjustable sensitivity.</p>",<p>光学扭矩扳手是一种激光捕获技术，能够利用自旋动量传递对微型双折射粒子施加和直接测量扭矩，并且已发现可用于测量生物分子（如单个DNA）的静态扭转特性。受光学扭矩扳手访问生物系统快速旋转动力学的潜力的推动，这是其全光学操作和检测的结果，我们将重点放在捕获的双折射粒子的角动力学上，展示了其在近红外区域的兴奋性。临界点。这将光学扭矩扳手链接到非线性动力学系统，例如神经元和心血管组织，非线性光学和化学反应，所有这些系统均显示出对输入扰动的兴奋性二元（“全有或无”）响应。基于这种动态特性，我们设计并实现了一种概念上新的传感技术，该技术能够检测具有高信噪比和连续可调灵敏度的单个扰动事件。</ p> 
10.1038/nphys1860,Impact of single links in competitive percolation,单一链接对竞争渗透的影响 ,"<p>How a complex network is connected crucially impacts its dynamics and function. Percolation, the transition to extensive connectedness on gradual addition of links, was long believed to be continuous, but recent numerical evidence of &#8216;explosive percolation&#8217; suggests that it might also be discontinuous if links compete for addition. Here we analyse the microscopic mechanisms underlying discontinuous percolation processes and reveal a strong impact of single-link additions. We show that in generic competitive percolation processes, including those showing explosive percolation, single links do not induce a discontinuous gap in the largest cluster size in the thermodynamic limit. Nevertheless, our results highlight that for large finite systems single links may still induce substantial gaps, because gap sizes scale weakly algebraically with system size. Several essentially macroscopic clusters coexist immediately before the transition, announcing discontinuous percolation. These results explain how single links may drastically change macroscopic connectivity in networks where links add competitively.</p>",<p>复杂网络的连接方式严重影响其动态和功能。长期以来，人们一直认为渗流是在逐渐增加链接的基础上过渡到广泛连接的过渡，但是最近的数值证据证明了爆炸性渗流。建议如果链接竞争添加，它也可能是不连续的。在这里，我们分析了不连续渗流过程的微观机制，并揭示了单链添加的强大影响。我们表明，在包括竞争性渗滤在内的一般竞争渗滤过程中，单链不会在热力学极限内引起最大簇尺寸的不连续间隙。然而，我们的结果强调指出，对于大型有限系统，单个链接仍可能会引发大量的间隙，因为间隙大小随系统大小的代数呈弱比例缩放。在过渡之前，几个本质上是宏观的簇共存，宣布不连续渗流。这些结果解释了单个链接如何在链接竞争激烈的网络中极大地改变宏观连通性。</ p> 
10.1038/nphys1937,Erratum: High-sensitivity diamond magnetometer with nanoscale resolution,勘误：具有纳米级分辨率的高灵敏度金刚石磁力计 ,,
