contentType,title,abstract,abstract_google_cn,affiliations,authorization,authors,citation_text,count_accesses,count_altmetric,count_citations,documentType,doi,doi_url,focus,issue,journal_pcode,journal_title,publishedAt,publishedAtString,subjects,url,volume
editorial,Students are our future,,,[],True,[],"Students are our future. Nature Photon8, 341 (2014).",1267,12,1,aplusplus,10.1038/nphoton.2014.106,https://doi.org/10.1038/nphoton.2014.106,,5,nphoton,nature photonics,1398384000,2014-04-25,optics-and-photonics;scientific-community-and-society,https://www.nature.com/articles/nphoton.2014.106,8
commentary,Resolving a misconception about structured illumination,,,"[{""address"": ""Kai Wicker wrote this commentary while at the Institute of Physical Chemistry, Abbe Center of Photonics, Friedrich-Schiller-University Jena, Helmholtzweg 4, 07743 Jena, Germany, Leibniz Institute of Photonic Technology (IPHT), Albert-Einstein Strasse 9, 07745 Jena, Germany; his present affiliation is Carl Zeiss AG, Corporate Research and Technology, Carl-Zeiss-Promenade 10, 07745 Jena, Germany"", ""authors"": [""Kai Wicker""]}, {""address"": ""his present affiliation is Carl Zeiss AG, Corporate Research and Technology, Carl-Zeiss-Promenade 10, 07745 Jena, Germany"", ""authors"": [""Kai Wicker""]}, {""address"": ""and Randall Division of Cell and Molecular Biophysics, Rainer Heintzmann is at the Institute of Physical Chemistry, Abbe Center of Photonics, Friedrich-Schiller-University Jena, Helmholtzweg 4, 07743 Jena, Germany, Leibniz Institute of Photonic Technology (IPHT), Albert-Einstein Strasse 9, 07745 Jena, Germany, King's College London, NHH, Guy's Campus, London SE1 1UL, UK"", ""authors"": [""Rainer Heintzmann""]}]",False,"[""Kai Wicker"", ""Rainer Heintzmann""]","Wicker, K., Heintzmann, R. Resolving a misconception about structured illumination. Nature Photon8, 342–344 (2014).",674,6,38,aplusplus,10.1038/nphoton.2014.88,https://doi.org/10.1038/nphoton.2014.88,,5,nphoton,nature photonics,1398384000,2014-04-25,imaging-and-sensing;super-resolution-microscopy,https://www.nature.com/articles/nphoton.2014.88,8
commentary,Making spatial multiplexing a reality,,,"[{""address"": ""Peter J. Winzer is at Bell Laboratories, Alcatel-Lucent, 791 Holmdel-Keyport Road, Holmdel, New Jersey 07733, USA"", ""authors"": [""Peter J. Winzer""]}]",False,"[""Peter J. Winzer""]","Winzer, P. Making spatial multiplexing a reality. Nature Photon8, 345–348 (2014).",649,3,177,aplusplus,10.1038/nphoton.2014.58,https://doi.org/10.1038/nphoton.2014.58,,5,nphoton,nature photonics,1398384000,2014-04-25,fibre-optics-and-optical-communications,https://www.nature.com/articles/nphoton.2014.58,8
books & arts,New titles at a glance,,,[],True,[],"New titles at a glance. Nature Photon8, 349 (2014).",10,0,0,aplusplus,10.1038/nphoton.2014.87,https://doi.org/10.1038/nphoton.2014.87,,5,nphoton,nature photonics,1398384000,2014-04-25,optics-and-photonics,https://www.nature.com/articles/nphoton.2014.87,8
research highlights,Damaging laser illumination,,,[],True,"[""Noriaki Horiuchi""]","Horiuchi, N. Damaging laser illumination. Nature Photon8, 350 (2014).",14,0,0,aplusplus,10.1038/nphoton.2014.100,https://doi.org/10.1038/nphoton.2014.100,,5,nphoton,nature photonics,1398384000,2014-04-25,diode-lasers;fibre-optics-and-optical-communications;optoelectronic-devices-and-components,https://www.nature.com/articles/nphoton.2014.100,8
research highlights,Chaotic polarization attractor,,,[],True,"[""Rachel Won""]","Won, R. Chaotic polarization attractor. Nature Photon8, 350 (2014).",18,0,0,aplusplus,10.1038/nphoton.2014.97,https://doi.org/10.1038/nphoton.2014.97,,5,nphoton,nature photonics,1398384000,2014-04-25,mode-locked-lasers;nonlinear-optics;solitons,https://www.nature.com/articles/nphoton.2014.97,8
research highlights,Implantation innovation,,,[],True,"[""Oliver Graydon""]","Graydon, O. Implantation innovation. Nature Photon8, 350 (2014).",16,1,0,aplusplus,10.1038/nphoton.2014.98,https://doi.org/10.1038/nphoton.2014.98,,5,nphoton,nature photonics,1398384000,2014-04-25,diamond;quantum-optics,https://www.nature.com/articles/nphoton.2014.98,8
research highlights,Probing molecular hydrogen,,,[],True,"[""Oliver Graydon""]","Graydon, O. Probing molecular hydrogen. Nature Photon8, 350 (2014).",5,0,0,aplusplus,10.1038/nphoton.2014.99,https://doi.org/10.1038/nphoton.2014.99,,5,nphoton,nature photonics,1398384000,2014-04-25,ultrafast-photonics,https://www.nature.com/articles/nphoton.2014.99,8
research highlights,Exciting channels,,,[],False,"[""David Pile""]","Pile, D. Exciting channels. Nature Photon8, 350–351 (2014).",2,0,0,aplusplus,10.1038/nphoton.2014.101,https://doi.org/10.1038/nphoton.2014.101,,5,nphoton,nature photonics,1398384000,2014-04-25,nanophotonics-and-plasmonics;sub-wavelength-optics,https://www.nature.com/articles/nphoton.2014.101,8
research highlights,Silicon alternative,,,[],True,"[""David Pile""]","Pile, D. Silicon alternative. Nature Photon8, 351 (2014).",14,0,0,aplusplus,10.1038/nphoton.2014.102,https://doi.org/10.1038/nphoton.2014.102,,5,nphoton,nature photonics,1398384000,2014-04-25,integrated-optics;sub-wavelength-optics,https://www.nature.com/articles/nphoton.2014.102,8
research highlights,Mobile high-Q nanoresonators,,,[],True,"[""Rachel Won""]","Won, R. Mobile high-Qnanoresonators. Nature Photon8, 351 (2014).",31,3,0,aplusplus,10.1038/nphoton.2014.103,https://doi.org/10.1038/nphoton.2014.103,,5,nphoton,nature photonics,1398384000,2014-04-25,nanowires;photonic-crystals;semiconductors;silicon-photonics,https://www.nature.com/articles/nphoton.2014.103,8
research highlights,Veselago lensing by atoms,,,[],True,"[""Simon Pleasants""]","Pleasants, S. Veselago lensing by atoms. Nature Photon8, 351 (2014).",24,0,1,aplusplus,10.1038/nphoton.2014.104,https://doi.org/10.1038/nphoton.2014.104,,5,nphoton,nature photonics,1398384000,2014-04-25,atom-optics,https://www.nature.com/articles/nphoton.2014.104,8
research highlights,Exploiting the infrared,,,[],True,"[""Simon Pleasants""]","Pleasants, S. Exploiting the infrared. Nature Photon8, 351 (2014).",29,0,1,aplusplus,10.1038/nphoton.2014.105,https://doi.org/10.1038/nphoton.2014.105,,5,nphoton,nature photonics,1398384000,2014-04-25,imaging-and-sensing;near-infrared-spectroscopy,https://www.nature.com/articles/nphoton.2014.105,8
news & views,Chalcogenide promise,,,[],True,"[""Simon Pleasants""]","Pleasants, S. Chalcogenide promise. Nature Photon8, 352 (2014).",33,0,7,aplusplus,10.1038/nphoton.2014.92,https://doi.org/10.1038/nphoton.2014.92,,5,nphoton,nature photonics,1398384000,2014-04-25,laser-material-processing;lithography,https://www.nature.com/articles/nphoton.2014.92,8
news & views,X-ray laser plasma amplifiers,,,"[{""address"": ""Masaharu Nishikino and Tetsuya Kawachi are at the Quantum Beam Science Directorate, Japan Atomic Energy Agency, 8-1-7 Umemidai, Kizugawa, Kyoto 619-0215, Japan"", ""authors"": [""Masaharu Nishikino"", ""\u00a0&\u00a0Tetsuya Kawachi""]}]",False,"[""Masaharu Nishikino"", ""Tetsuya Kawachi""]","Nishikino, M., Kawachi, T. X-ray laser plasma amplifiers. Nature Photon8, 352–354 (2014).",86,0,5,aplusplus,10.1038/nphoton.2014.86,https://doi.org/10.1038/nphoton.2014.86,,5,nphoton,nature photonics,1398384000,2014-04-25,laser-produced-plasmas;x-rays,https://www.nature.com/articles/nphoton.2014.86,8
news & views,"10,000 tiny lasers",,,[],True,"[""David Pile""]","Pile, D. 10, 000 tiny lasers. Nature Photon8, 354 (2014).",9,3,0,aplusplus,10.1038/nphoton.2014.89,https://doi.org/10.1038/nphoton.2014.89,,5,nphoton,nature photonics,1398384000,2014-04-25,photonic-crystals;solid-state-lasers,https://www.nature.com/articles/nphoton.2014.89,8
review article,Quantum information transfer using photons,,,"[{""address"": ""Institut f\u00fcr Experimentalphysik, Universit\u00e4t Innsbruck, Technikerstra\u00dfe 25, Innsbruck, 6020, Austria"", ""authors"": [""T. E. Northup"", ""\u00a0&\u00a0R. Blatt""]}, {""address"": ""Institut f\u00fcr Quantenoptik und Quanteninformation der \u00d6sterreichischen Akademie der Wissenschaften, Technikerstra\u00dfe 21a, Innsbruck, 6020, Austria"", ""authors"": [""R. Blatt""]}]",False,"[""T. E. Northup"", ""R. Blatt""]","Northup, T., Blatt, R. Quantum information transfer using photons. Nature Photon8, 356–363 (2014).",1409,11,154,aplusplus,10.1038/nphoton.2014.53,https://doi.org/10.1038/nphoton.2014.53,,5,nphoton,nature photonics,1398384000,2014-04-25,quantum-information,https://www.nature.com/articles/nphoton.2014.53,8
letter,Experimental realization of a concatenated Greenberger–Horne–Zeilinger state for macroscopic quantum superpositions,,,"[{""address"": ""Hefei National Laboratory for Physical Sciences at Microscale and Department of Modern Physics, University of Science and Technology of China, Hefei, 230026, Anhui, China"", ""authors"": [""He Lu"", "",\u00a0Luo-Kan Chen"", "",\u00a0Chang Liu"", "",\u00a0Ping Xu"", "",\u00a0Xing-Can Yao"", "",\u00a0Li Li"", "",\u00a0Nai-Le Liu"", "",\u00a0Bo Zhao"", "",\u00a0Yu-Ao Chen"", ""\u00a0&\u00a0Jian-Wei Pan""]}, {""address"": ""Shanghai Branch, CAS Center for Excellence and Synergetic Innovation Center in Quantum Information and Quantum Physics, University of Science and Technology of China, Shanghai, 201315, China"", ""authors"": [""He Lu"", "",\u00a0Luo-Kan Chen"", "",\u00a0Chang Liu"", "",\u00a0Ping Xu"", "",\u00a0Xing-Can Yao"", "",\u00a0Li Li"", "",\u00a0Nai-Le Liu"", "",\u00a0Bo Zhao"", "",\u00a0Yu-Ao Chen"", ""\u00a0&\u00a0Jian-Wei Pan""]}]",False,"[""He Lu"", ""Luo-Kan Chen"", ""Chang Liu"", ""Ping Xu"", ""Xing-Can Yao"", ""Li Li"", ""Nai-Le Liu"", ""Bo Zhao"", ""Yu-Ao Chen"", ""Jian-Wei Pan""]","Lu, H., Chen, L., Liu, C. et al. Experimental realization of a concatenated Greenberger–Horne–Zeilinger state for macroscopic quantum superpositions. Nature Photon8, 364–368 (2014).",186,0,28,aplusplus,10.1038/nphoton.2014.81,https://doi.org/10.1038/nphoton.2014.81,,5,nphoton,nature photonics,1397952000,2014-04-20,optical-metrology;quantum-information;quantum-metrology;quantum-optics,https://www.nature.com/articles/nphoton.2014.81,8
letter,Diamond nonlinear photonics,,,"[{""address"": ""Harvard University, School of Engineering and Applied Sciences, Cambridge, 02138, Massachusetts, USA"", ""authors"": [""B. J. M. Hausmann"", "",\u00a0I. Bulu"", "",\u00a0V. Venkataraman"", "",\u00a0P. Deotare"", ""\u00a0&\u00a0M. Lon\u010dar""]}]",False,"[""B. J. M. Hausmann"", ""I. Bulu"", ""V. Venkataraman"", ""P. Deotare"", ""M. Lon\u010dar""]","Hausmann, B., Bulu, I., Venkataraman, V. et al. Diamond nonlinear photonics. Nature Photon8, 369–374 (2014).",1310,34,187,aplusplus,10.1038/nphoton.2014.72,https://doi.org/10.1038/nphoton.2014.72,,5,nphoton,nature photonics,1397952000,2014-04-20,diamond;lasers-leds-and-light-sources;nonlinear-optics,https://www.nature.com/articles/nphoton.2014.72,8
letter,Coherent terabit communications with microresonator Kerr frequency combs,,,"[{""address"": ""Institute of Photonics and Quantum Electronics (IPQ) and Institute of Microstructure Technology (IMT), Karlsruhe Institute of Technology (KIT), Karlsruhe, 76131, Germany"", ""authors"": [""Joerg Pfeifle"", "",\u00a0Matthias Lauermann"", "",\u00a0Yimin Yu"", "",\u00a0Daniel Wegner"", "",\u00a0Philipp Schindler"", "",\u00a0Jingshi Li"", "",\u00a0David Hillerkuss"", "",\u00a0Rene Schmogrow"", "",\u00a0Claudius Weimann"", "",\u00a0Wolfgang Freude"", "",\u00a0Juerg Leuthold"", ""\u00a0&\u00a0Christian Koos""]}, {""address"": ""\u00c9cole Polytechnique F\u00e9d\u00e9rale de Lausanne (EPFL), Lausanne, 1015, Switzerland"", ""authors"": [""Victor Brasch"", "",\u00a0Tobias Herr"", ""\u00a0&\u00a0Tobias J. Kippenberg""]}, {""address"": ""Menlo Systems GmbH, Martinsried, 82152, Germany"", ""authors"": [""Klaus Hartinger"", ""\u00a0&\u00a0Ronald Holzwarth""]}]",False,"[""Joerg Pfeifle"", ""Victor Brasch"", ""Matthias Lauermann"", ""Yimin Yu"", ""Daniel Wegner"", ""Tobias Herr"", ""Klaus Hartinger"", ""Philipp Schindler"", ""Jingshi Li"", ""David Hillerkuss"", ""Rene Schmogrow"", ""Claudius Weimann"", ""Ronald Holzwarth"", ""Wolfgang Freude"", ""Juerg Leuthold"", ""Tobias J. Kippenberg"", ""Christian Koos""]","Pfeifle, J., Brasch, V., Lauermann, M. et al. Coherent terabit communications with microresonator Kerr frequency combs. Nature Photon8, 375–380 (2014).",1541,97,322,aplusplus,10.1038/nphoton.2014.57,https://doi.org/10.1038/nphoton.2014.57,,5,nphoton,nature photonics,1397347200,2014-04-13,fibre-optics-and-optical-communications;frequency-combs;lasers-leds-and-light-sources;nonlinear-optics,https://www.nature.com/articles/nphoton.2014.57,8
letter,Gain dynamics in a soft-X-ray laser amplifier perturbed by a strong injected X-ray field,,,"[{""address"": ""National Science Foundation Engineering Research Center for Extreme Ultraviolet Science and Technology, Colorado State University, Fort Collins, 80523, Colorado, USA"", ""authors"": [""Y. Wang"", "",\u00a0S. Wang"", "",\u00a0L. Yin"", "",\u00a0J. Nejdl"", "",\u00a0B. M. Luther"", ""\u00a0&\u00a0J. J. Rocca""]}, {""address"": ""Laboratoire de Physique des Gaz et des Plasmas, Bat. 210, UMR 8578 CNRS, Universit\u00e9 Paris-Sud, Orsay, 91405, France"", ""authors"": [""E. Oliva"", "",\u00a0T. T. T. Le"", ""\u00a0&\u00a0D. Ros""]}, {""address"": ""Laboratoire d'Optique Appliqu\u00e9e, ENSTA, CNRS, Ecole Polytechnique, UMR 7639, 828 boulevard des Mar\u00e9chaux, Palaiseau, 91128, France"", ""authors"": [""L. Li"", "",\u00a0C. Proux"", ""\u00a0&\u00a0Ph. Zeitoun""]}, {""address"": ""School of Nuclear Science and Technology, Lanzhou University, Lanzhou, 730000, China"", ""authors"": [""L. Li""]}, {""address"": ""Oak Ridge National Laboratory, PO Box 2008, Oak Ridge, 37831, Tennessee, USA"", ""authors"": [""M. Berrill""]}, {""address"": ""Lawrence Livermore National Laboratory, PO Box 808, Livermore, 94551-0808, California, USA"", ""authors"": [""J. Dunn""]}]",False,"[""Y. Wang"", ""S. Wang"", ""E. Oliva"", ""L. Li"", ""M. Berrill"", ""L. Yin"", ""J. Nejdl"", ""B. M. Luther"", ""C. Proux"", ""T. T. T. Le"", ""J. Dunn"", ""D. Ros"", ""Ph. Zeitoun"", ""J. J. Rocca""]","Wang, Y., Wang, S., Oliva, E. et al. Gain dynamics in a soft-X-ray laser amplifier perturbed by a strong injected X-ray field. Nature Photon8, 381–384 (2014).",97,0,21,aplusplus,10.1038/nphoton.2014.79,https://doi.org/10.1038/nphoton.2014.79,,5,nphoton,nature photonics,1397952000,2014-04-20,laser-produced-plasmas;x-rays,https://www.nature.com/articles/nphoton.2014.79,8
article,The influence of molecular orientation on organic bulk heterojunction solar cells,"<p>In bulk heterojunction organic photovoltaics, electron-donating and electron-accepting materials form a distributed network of heterointerfaces in the photoactive layer, where critical photo-physical processes occur. However, little is known about the structural properties of these interfaces due to their complex three-dimensional arrangement and the lack of techniques to measure local order. Here, we report that molecular orientation relative to donor/acceptor heterojunctions is an important parameter in realizing high-performance fullerene-based, bulk heterojunction solar cells. Using resonant soft X-ray scattering, we characterize the degree of molecular orientation, an order parameter that describes face-on (+1) or edge-on (&#8722;1) orientations relative to these heterointerfaces. By manipulating the degree of molecular orientation through the choice of molecular chemistry and the characteristics of the processing solvent, we are able to show the importance of this structural parameter on the performance of bulk heterojunction organic photovoltaic devices featuring the electron-donating polymers PNDT&#8211;DTBT, PBnDT&#8211;DTBT or PBnDT&#8211;TAZ.</p>",,"[{""address"": ""Department of Physics, North Carolina State University, Raleigh, 27695, North Carolina, USA"", ""authors"": [""John R. Tumbleston"", "",\u00a0Brian A. Collins"", "",\u00a0Eliot Gann"", "",\u00a0Wei Ma"", ""\u00a0&\u00a0Harald Ade""]}, {""address"": ""Department of Chemistry, University of North Carolina at Chapel Hill, Chapel Hill, 27599, North Carolina, USA"", ""authors"": [""Liqiang Yang"", "",\u00a0Andrew C. Stuart"", ""\u00a0&\u00a0Wei You""]}]",False,"[""John R. Tumbleston"", ""Brian A. Collins"", ""Liqiang Yang"", ""Andrew C. Stuart"", ""Eliot Gann"", ""Wei Ma"", ""Wei You"", ""Harald Ade""]","Tumbleston, J., Collins, B., Yang, L. et al. The influence of molecular orientation on organic bulk heterojunction solar cells. Nature Photon8, 385–391 (2014).",1118,70,318,aplusplus,10.1038/nphoton.2014.55,https://doi.org/10.1038/nphoton.2014.55,,5,nphoton,nature photonics,1396742400,2014-04-06,solar-cells,https://www.nature.com/articles/nphoton.2014.55,8
article,Large-area luminescent solar concentrators based on 'Stokes-shift-engineered' nanocrystals in a mass-polymerized PMMA matrix,"<p>Luminescent solar concentrators are cost-effective complements to semiconductor photovoltaics that can boost the output of solar cells and allow for the integration of photovoltaic-active architectural elements into buildings (for example, photovoltaic windows). Colloidal quantum dots are attractive for use in luminescent solar concentrators, but their small Stokes shift results in reabsorption losses that hinder the realization of large-area devices. Here, we use &#8216;Stokes-shift-engineered&#8217; CdSe/CdS quantum dots with giant shells (giant quantum dots) to realize luminescent solar concentrators without reabsorption losses for device dimensions up to tens of centimetres. Monte-Carlo simulations show a 100-fold increase in efficiency using giant quantum dots compared with core-only nanocrystals. We demonstrate the feasibility of this approach by using high-optical-quality quantum dot&#8211;polymethylmethacrylate nanocomposites fabricated using a modified industrial method that preserves the light-emitting properties of giant quantum dots upon incorporation into the polymer. Study of these luminescent solar concentrators yields optical efficiencies &gt;10% and an effective concentration factor of 4.4. These results demonstrate the significant promise of Stokes-shift-engineered quantum dots for large-area luminescent solar concentrators.</p>",,"[{""address"": ""Dipartimento di Scienza dei Materiali, Universit\u00e0 degli Studi di Milano-Bicocca, via Cozzi 55, Milano, I-20125, Italy"", ""authors"": [""Francesco Meinardi"", "",\u00a0Annalisa Colombo"", "",\u00a0Roberto Simonutti"", "",\u00a0Monica Lorenzon"", "",\u00a0Luca Beverina"", ""\u00a0&\u00a0Sergio Brovelli""]}, {""address"": ""Theoretical Division, Los Alamos National Laboratory, New Mexico, 87545, USA"", ""authors"": [""Kirill A. Velizhanin""]}, {""address"": ""Center for Advanced Solar Photophysics, Los Alamos National Laboratory, New Mexico, 87545, USA"", ""authors"": [""Kirill A. Velizhanin"", ""\u00a0&\u00a0Victor I. Klimov""]}, {""address"": ""New Chemistry Unit and International Centre for Materials Science, Jawaharlal Nehru Centre for Advanced Scientific Research, Jakkur, P.O., Jakkur, Bangalore, 560064, India"", ""authors"": [""Ranjani Viswanatha""]}, {""address"": ""Chemistry Division, Los Alamos National Laboratory, New Mexico, 87545, USA"", ""authors"": [""Ranjani Viswanatha"", ""\u00a0&\u00a0Victor I. Klimov""]}]",False,"[""Francesco Meinardi"", ""Annalisa Colombo"", ""Kirill A. Velizhanin"", ""Roberto Simonutti"", ""Monica Lorenzon"", ""Luca Beverina"", ""Ranjani Viswanatha"", ""Victor I. Klimov"", ""Sergio Brovelli""]","Meinardi, F., Colombo, A., Velizhanin, K. et al. Large-area luminescent solar concentrators based on ‘Stokes-shift-engineered’ nanocrystals in a mass-polymerized PMMA matrix. Nature Photon8, 392–399 (2014).",2016,150,344,aplusplus,10.1038/nphoton.2014.54,https://doi.org/10.1038/nphoton.2014.54,,5,nphoton,nature photonics,1397347200,2014-04-13,nanophotonics-and-plasmonics;optical-materials-and-structures,https://www.nature.com/articles/nphoton.2014.54,8
article,Shape-induced force fields in optical trapping,"<p>Advances in optical tweezers, coupled with the proliferation of two-photon polymerization systems, mean that it is now becoming routine to fabricate and trap non-spherical particles. The shaping of both light beams and particles allows fine control over the flow of momentum from the optical to mechanical regimes. However, understanding and predicting the behaviour of such systems is highly complex in comparison with the traditional optically trapped microsphere. In this Article, we present a conceptually new and simple approach based on the nature of the optical force density. We illustrate the method through the design and fabrication of a shaped particle capable of acting as a passive force clamp, and we demonstrate its use as an optically trapped probe for imaging surface topography. Further applications of the design rules highlighted here may lead to new sensors for probing biomolecule mechanics, as well as to the development of optically actuated micromachines.</p>",,"[{""address"": ""H.H. Wills Physics Laboratory, University of Bristol, Tyndall Avenue, Bristol, BS8 1TL, UK"", ""authors"": [""D. B. Phillips"", "",\u00a0S. Hanna"", "",\u00a0D. M. Carberry"", "",\u00a0M. J. Miles"", ""\u00a0&\u00a0S. H. Simpson""]}, {""address"": ""Department of Physics and Astronomy, SUPA, University of Glasgow, Glasgow, G12 8QQ, UK"", ""authors"": [""D. B. Phillips"", ""\u00a0&\u00a0M. J. Padgett""]}, {""address"": ""Department of Electrical and Electronic Engineering, University of Bristol, Bristol, BS8 1UB, UK"", ""authors"": [""Y.-L. D. Ho""]}, {""address"": ""School of Mathematics and Physics, The University of Queensland, St Lucia, 4072, Brisbane, Australia"", ""authors"": [""D. M. Carberry""]}]",False,"[""D. B. Phillips"", ""M. J. Padgett"", ""S. Hanna"", ""Y.-L. D. Ho"", ""D. M. Carberry"", ""M. J. Miles"", ""S. H. Simpson""]","Phillips, D., Padgett, M., Hanna, S. et al. Shape-induced force fields in optical trapping. Nature Photon8, 400–405 (2014).",686,24,81,aplusplus,10.1038/nphoton.2014.74,https://doi.org/10.1038/nphoton.2014.74,Nobel Prize in Physics 2018,5,nphoton,nature photonics,1397347200,2014-04-13,imaging-techniques;laser-material-processing;optical-manipulation-and-tweezers,https://www.nature.com/articles/nphoton.2014.74,8
article,"Watt-class high-power, high-beam-quality photonic-crystal lasers","<p>The applications of surface-emitting lasers, in particular vertical-cavity surface-emitting lasers (VCSELs), are currently being extended to various low-power fields including communications and interconnections. However, the fundamental difficulties in increasing their output power by more than several milliwatts while maintaining single-mode operation prevent their application in high-power fields such as material processing, laser medicine and nonlinear optics, despite their advantageous properties of circular beams, the absence of catastrophic optical damage, and their suitability for two-dimensional integration. Here, we demonstrate watt-class high-power, single-mode operation by a two-dimensional photonic-crystal surface-emitting laser under room-temperature, continuous-wave conditions. The two-dimensional band-edge resonant effect of a photonic crystal formed by metal&#8211;organic chemical vapour deposition enables a 1,000 times broader coherent-oscillation area, which results in a high beam quality of M<sup>2</sup>&#160;&#8804;&#160;1.1, narrowing the focus spot by two orders of magnitude compared to VCSELs. Our demonstration promises to realize innovative high-power applications for surface-emitting lasers.</p>",,"[{""address"": ""Material Research Group, Central Research Laboratory, Hamamatsu Photonics K.K., Shizuoka, 434-8601, Japan"", ""authors"": [""Kazuyoshi Hirose"", "",\u00a0Yoshitaka Kurosaka"", "",\u00a0Akiyoshi Watanabe"", ""\u00a0&\u00a0Takahiro Sugiyama""]}, {""address"": ""Department of Electronic Science and Engineering, Kyoto University, Kyoto, 615-8510, Japan"", ""authors"": [""Kazuyoshi Hirose"", "",\u00a0Yong Liang"", "",\u00a0Yoshitaka Kurosaka"", ""\u00a0&\u00a0Susumu Noda""]}, {""address"": ""JST ACCEL, Kyoto University, Kyoto, 615-8510, Japan"", ""authors"": [""Susumu Noda""]}]",False,"[""Kazuyoshi Hirose"", ""Yong Liang"", ""Yoshitaka Kurosaka"", ""Akiyoshi Watanabe"", ""Takahiro Sugiyama"", ""Susumu Noda""]","Hirose, K., Liang, Y., Kurosaka, Y. et al. Watt-class high-power, high-beam-quality photonic-crystal lasers. Nature Photon8, 406–411 (2014).",2053,23,185,aplusplus,10.1038/nphoton.2014.75,https://doi.org/10.1038/nphoton.2014.75,,5,nphoton,nature photonics,1397347200,2014-04-13,nanophotonics-and-plasmonics;semiconductor-lasers,https://www.nature.com/articles/nphoton.2014.75,8
