contentType,title,abstract,abstract_google_cn,affiliations,authorization,authors,citation_text,count_accesses,count_altmetric,count_citations,documentType,doi,doi_url,focus,issue,journal_pcode,journal_title,publishedAt,publishedAtString,subjects,url,volume
editorial,Breaking down barriers,,,[],True,[],"Breaking down barriers. Nature Photon6, 567 (2012).",61,3,0,aplusplus,10.1038/nphoton.2012.230,https://doi.org/10.1038/nphoton.2012.230,,9,nphoton,nature photonics,1346630400,2012-09-03,biophotonics;scientific-community-and-society,https://www.nature.com/articles/nphoton.2012.230,6
commentary,Laserlab Europe expands in third phase,,,"[{""address"": ""David Pile is at Nature Photonics, 225 Bush Street, Suite 1453, San Francisco, California 94104, USA"", ""authors"": [""David Pile""]}]",False,"[""David Pile""]","Pile, D. Laserlab Europe expands in third phase. Nature Photon6, 568–570 (2012).",11,2,0,aplusplus,10.1038/nphoton.2012.219,https://doi.org/10.1038/nphoton.2012.219,,9,nphoton,nature photonics,1346630400,2012-09-03,lasers-leds-and-light-sources,https://www.nature.com/articles/nphoton.2012.219,6
books & arts,New titles at a glance,,,[],True,[],"New titles at a glance. Nature Photon6, 571 (2012).",6,0,0,aplusplus,10.1038/nphoton.2012.208,https://doi.org/10.1038/nphoton.2012.208,,9,nphoton,nature photonics,1346630400,2012-09-03,optics-and-photonics,https://www.nature.com/articles/nphoton.2012.208,6
research highlights,Negative-frequency mode,,,[],True,"[""Noriaki Horiuchi""]","Horiuchi, N. Negative-frequency mode. Nature Photon6, 572 (2012).",28,1,0,aplusplus,10.1038/nphoton.2012.215,https://doi.org/10.1038/nphoton.2012.215,,9,nphoton,nature photonics,1346630400,2012-09-03,nonlinear-optics;optical-physics,https://www.nature.com/articles/nphoton.2012.215,6
research highlights,Reconfigurable cavities,,,[],True,"[""Noriaki Horiuchi""]","Horiuchi, N. Reconfigurable cavities. Nature Photon6, 572 (2012).",5,0,0,aplusplus,10.1038/nphoton.2012.216,https://doi.org/10.1038/nphoton.2012.216,,9,nphoton,nature photonics,1346630400,2012-09-03,optofluidics;photonic-crystals,https://www.nature.com/articles/nphoton.2012.216,6
research highlights,Quasi-reflectography,,,[],True,"[""James Baxter""]","Baxter, J. Quasi-reflectography. Nature Photon6, 572 (2012).",5,0,1,aplusplus,10.1038/nphoton.2012.222,https://doi.org/10.1038/nphoton.2012.222,,9,nphoton,nature photonics,1346630400,2012-09-03,arts;imaging-and-sensing;mid-infrared-photonics,https://www.nature.com/articles/nphoton.2012.222,6
research highlights,A steady sweep,,,[],True,"[""Rachel Won""]","Won, R. A steady sweep. Nature Photon6, 572 (2012).",10,1,0,aplusplus,10.1038/nphoton.2012.223,https://doi.org/10.1038/nphoton.2012.223,,9,nphoton,nature photonics,1346630400,2012-09-03,semiconductor-lasers,https://www.nature.com/articles/nphoton.2012.223,6
research highlights,Photorefractive control,,,[],True,"[""Rachel Won""]","Won, R. Photorefractive control. Nature Photon6, 572 (2012).",11,1,0,aplusplus,10.1038/nphoton.2012.224,https://doi.org/10.1038/nphoton.2012.224,,9,nphoton,nature photonics,1346630400,2012-09-03,nanophotonics-and-plasmonics,https://www.nature.com/articles/nphoton.2012.224,6
research highlights,No moving parts,,,[],True,"[""Seiji Armstrong""]","Armstrong, S. No moving parts. Nature Photon6, 573 (2012).",4,0,0,aplusplus,10.1038/nphoton.2012.225,https://doi.org/10.1038/nphoton.2012.225,,9,nphoton,nature photonics,1346630400,2012-09-03,imaging-and-sensing,https://www.nature.com/articles/nphoton.2012.225,6
research highlights,Mimicking the brain,,,[],True,"[""Seiji Armstrong""]","Armstrong, S. Mimicking the brain. Nature Photon6, 573 (2012).",23,1,0,aplusplus,10.1038/nphoton.2012.226,https://doi.org/10.1038/nphoton.2012.226,,9,nphoton,nature photonics,1346630400,2012-09-03,biophotonics;optoelectronic-devices-and-components,https://www.nature.com/articles/nphoton.2012.226,6
research highlights,Sun-powered lasers,,,[],True,"[""David Pile""]","Pile, D. Sun-powered lasers. Nature Photon6, 573 (2012).",9,0,0,aplusplus,10.1038/nphoton.2012.227,https://doi.org/10.1038/nphoton.2012.227,,9,nphoton,nature photonics,1346630400,2012-09-03,lasers-leds-and-light-sources;solar-energy-and-photovoltaic-technology,https://www.nature.com/articles/nphoton.2012.227,6
research highlights,Polychromatic metalens,,,[],True,"[""David Pile""]","Pile, D. Polychromatic metalens. Nature Photon6, 573 (2012).",34,0,0,aplusplus,10.1038/nphoton.2012.228,https://doi.org/10.1038/nphoton.2012.228,,9,nphoton,nature photonics,1346630400,2012-09-03,imaging-and-sensing,https://www.nature.com/articles/nphoton.2012.228,6
research highlights,Low-power nanosurgery,,,[],True,"[""James Baxter""]","Baxter, J. Low-power nanosurgery. Nature Photon6, 573 (2012).",8,1,1,aplusplus,10.1038/nphoton.2012.229,https://doi.org/10.1038/nphoton.2012.229,,9,nphoton,nature photonics,1346630400,2012-09-03,biophotonics;lasers-leds-and-light-sources,https://www.nature.com/articles/nphoton.2012.229,6
news & views,High-resolution surface structures,,,"[{""address"": ""Adrian P. Mancuso is the leading scientist for the Single Particles, Clusters and Biomolecules Instrument of the European X-ray Free Electron Laser, 22607 Hamburg, Germany"", ""authors"": [""Adrian P. Mancuso""]}, {""address"": ""Garth J. Williams is a staff scientist at the CXI instrument of the Linac Coherent Light Source located at SLAC National Accelerator Laboratory, Menlo Park, California, USA"", ""authors"": [""Garth J. Williams""]}]",False,"[""Adrian P. Mancuso"", ""Garth J. Williams""]","Mancuso, A., Williams, G. High-resolution surface structures. Nature Photon6, 574–575 (2012).",40,0,2,aplusplus,10.1038/nphoton.2012.209,https://doi.org/10.1038/nphoton.2012.209,,9,nphoton,nature photonics,1346630400,2012-09-03,imaging-and-sensing;x-rays,https://www.nature.com/articles/nphoton.2012.209,6
news & views,Photonic crystals aid fish's night vision,,,[],True,"[""Seiji Armstrong""]","Armstrong, S. Photonic crystals aid fish's night vision. Nature Photon6, 575 (2012).",24,0,3,aplusplus,10.1038/nphoton.2012.213,https://doi.org/10.1038/nphoton.2012.213,,9,nphoton,nature photonics,1346630400,2012-09-03,biophotonics;photonic-crystals,https://www.nature.com/articles/nphoton.2012.213,6
news & views,Dye lasers with a difference,,,"[{""address"": ""Jos\u00e9 M. G. Martinho is at Centro de Qu\u00edmica-F\u00edsica Molecular and IN \u2014 Institute of Nanoscience and Nanotechnology, Instituto Superior T\u00e9cnico, Universidade T\u00e9cnica de Lisboa, Av. Rovisco Pais 1, 1049-001 Lisboa, Portugal"", ""authors"": [""Jos\u00e9 M. G. Martinho""]}]",False,"[""Jos\u00e9 M. G. Martinho""]","Martinho, J. Dye lasers with a difference. Nature Photon6, 576–577 (2012).",34,0,0,aplusplus,10.1038/nphoton.2012.210,https://doi.org/10.1038/nphoton.2012.210,,9,nphoton,nature photonics,1346630400,2012-09-03,fluorescence-resonance-energy-transfer;lasers-leds-and-light-sources;photochemistry,https://www.nature.com/articles/nphoton.2012.210,6
news & views,Rubber stamp for silicon photonics,,,"[{""address"": ""Robert W. Kelsall is at the School of Electronic and Electrical Engineering, University of Leeds, Leeds LS2 9JT, UK"", ""authors"": [""Robert W. Kelsall""]}]",False,"[""Robert W. Kelsall""]","Kelsall, R. Rubber stamp for silicon photonics. Nature Photon6, 577–579 (2012).",65,0,9,aplusplus,10.1038/nphoton.2012.211,https://doi.org/10.1038/nphoton.2012.211,,9,nphoton,nature photonics,1346630400,2012-09-03,integrated-optics;lasers-leds-and-light-sources;optoelectronic-devices-and-components;silicon-photonics,https://www.nature.com/articles/nphoton.2012.211,6
news & views,Wave–particle superposition,,,"[{""address"": ""Gerardo Adesso and Davide Girolami are at the School of Mathematical Sciences, The University of Nottingham, University Park, Nottingham NG7 2RD, UK"", ""authors"": [""Gerardo Adesso"", ""\u00a0&\u00a0Davide Girolami""]}]",False,"[""Gerardo Adesso"", ""Davide Girolami""]","Adesso, G., Girolami, D. Wave–particle superposition. Nature Photon6, 579–580 (2012).",137,1,6,aplusplus,10.1038/nphoton.2012.214,https://doi.org/10.1038/nphoton.2012.214,,9,nphoton,nature photonics,1346630400,2012-09-03,quantum-optics,https://www.nature.com/articles/nphoton.2012.214,6
letter,Maximal energy transport through disordered media with the implementation of transmission eigenchannels,"<p>Complex media such as random nanostructures and biological tissues induce multiple wave scattering, which interrupts the propagation of waves and attenuates energy transmission. Even for a highly disordered medium, however, it is possible in principle to enhance the delivery of energy to the far side of the medium. Similar to the resonator modes in linear optical cavities, specific modes called eigenchannels exist in a disordered medium and have extraordinarily high transmission. In this Letter, we report the first experimental realization of transmission eigenchannels in a disordered medium and show that an eigenchannel transports 3.99 times more energy than uncontrolled waves, which is the best experimental record reported to date. Our study will open up new avenues for enhancing light energy delivery to biological tissues for medical purposes and for controlling the lasing threshold in random lasers.</p>",,"[{""address"": ""Department of Physics, Korea University, Seoul, 136-701, Korea"", ""authors"": [""Moonseok Kim"", "",\u00a0Youngwoon Choi"", "",\u00a0Changhyeong Yoon"", "",\u00a0Wonjun Choi"", "",\u00a0Q-Han Park"", ""\u00a0&\u00a0Wonshik Choi""]}, {""address"": ""Department of Physics, Myongji University, Yongin, 449-728, Korea"", ""authors"": [""Jaisoon Kim""]}]",False,"[""Moonseok Kim"", ""Youngwoon Choi"", ""Changhyeong Yoon"", ""Wonjun Choi"", ""Jaisoon Kim"", ""Q-Han Park"", ""Wonshik Choi""]","Kim, M., Choi, Y., Yoon, C. et al. Maximal energy transport through disordered media with the implementation of transmission eigenchannels. Nature Photon6, 581–585 (2012).",765,11,147,aplusplus,10.1038/nphoton.2012.159,https://doi.org/10.1038/nphoton.2012.159,,9,nphoton,nature photonics,1342915200,2012-07-22,optical-physics;quantum-optics,https://www.nature.com/articles/nphoton.2012.159,6
letter,Three-dimensional coherent X-ray surface scattering imaging near total external reflection,"<p>Lensless X-ray coherent diffraction imaging (CDI) has emerged as a thriving field promising applications in materials and biological sciences with a theoretical imaging resolution only limited by the X-ray wavelength. Most CDI methods use transmission geometry, which is not suitable for nanostructures grown on opaque substrates or for objects of interest comprising only surfaces or interfaces. Attempts have been made to perform CDI experiments in reflection geometry, both optically and with X-rays, but the reconstruction resulted in mostly planar images, with less success in the third dimension. Here, we discuss the development of coherent surface scattering imaging in grazing-incidence geometry that takes advantage of enhanced X-ray surface scattering and interference near total external reflection. We demonstrate the successful reconstruction of substrate-supported non-periodic surface patterns in three dimensions with nanometre resolution in the direction normal to the substrate, promising wide applications in elucidating structures in substrate-supported and buried nanoelectronics and photonics.</p>",,"[{""address"": ""X-ray Science Division, Advanced Photon Source, Argonne National Laboratory, Argonne, 60439, Illinois, USA"", ""authors"": [""Tao Sun"", "",\u00a0Zhang Jiang"", "",\u00a0Joseph Strzalka"", ""\u00a0&\u00a0Jin Wang""]}, {""address"": ""Center for Nanoscale Materials, Argonne National Laboratory, Argonne, 60439, Illinois, USA"", ""authors"": [""Leonidas Ocola""]}]",False,"[""Tao Sun"", ""Zhang Jiang"", ""Joseph Strzalka"", ""Leonidas Ocola"", ""Jin Wang""]","Sun, T., Jiang, Z., Strzalka, J. et al. Three-dimensional coherent X-ray surface scattering imaging near total external reflection. Nature Photon6, 586–590 (2012).",391,29,35,aplusplus,10.1038/nphoton.2012.178,https://doi.org/10.1038/nphoton.2012.178,,9,nphoton,nature photonics,1344729600,2012-08-12,imaging-and-sensing;nanophotonics-and-plasmonics;x-rays,https://www.nature.com/articles/nphoton.2012.178,6
letter,Enhanced power-conversion efficiency in polymer solar cells using an inverted device structure,"<p>Polymer-fullerene bulk heterojunction solar cells (PSCs) are currently attracting a great deal of attention and gaining increasing importance, having already shown great promise as renewable, lightweight and low-cost energy sources. Recently, the power-conversion efficiency of state-of-the-art PSCs has exceeded 8% in the scientific literature. However, to find viable applications for this emerging photovoltaic technology, further enhancements in the efficiency towards 10% (the threshold for commercial applications) are urgently required. Here, we demonstrate highly efficient PSCs with a certified efficiency of 9.2% using an inverted structure, which simultaneously offers ohmic contact for photogenerated charge-carrier collection and allows optimum photon harvest in the device. Because of the ease of use and drastic boost in efficiency provided by this device structure, this discovery could find use in fully exploiting the potential of various material systems, and also open up new opportunities to improve PSCs with a view to achieving an efficiency of 10%.</p>",,"[{""address"": ""Institute of Polymer Optoelectronic Materials and Devices, State Key Laboratory of Luminescent Materials and Devices, South China University of Technology, Guangzhou, 510640, PR China"", ""authors"": [""Zhicai He"", "",\u00a0Chengmei Zhong"", "",\u00a0Shijian Su"", "",\u00a0Miao Xu"", "",\u00a0Hongbin Wu"", ""\u00a0&\u00a0Yong Cao""]}]",False,"[""Zhicai He"", ""Chengmei Zhong"", ""Shijian Su"", ""Miao Xu"", ""Hongbin Wu"", ""Yong Cao""]","He, Z., Zhong, C., Su, S. et al. Enhanced power-conversion efficiency in polymer solar cells using an inverted device structure. Nature Photon6, 591–595 (2012).",3740,4,3263,aplusplus,10.1038/nphoton.2012.190,https://doi.org/10.1038/nphoton.2012.190,,9,nphoton,nature photonics,1345334400,2012-08-19,solar-energy-and-photovoltaic-technology,https://www.nature.com/articles/nphoton.2012.190,6
letter,Observation of one-way Einstein–Podolsky–Rosen steering,"<p>The distinctive non-classical features of quantum physics were first discussed in the seminal paper by A. Einstein, B. Podolsky and N. Rosen (EPR) in 1935. In his immediate response, E. Schr&#246;dinger introduced the notion of entanglement, now seen as the essential resource in quantum information as well as in quantum metrology. Furthermore, he showed that at the core of the EPR argument is a phenomenon that he called steering. In contrast to entanglement and violations of Bell's inequalities, steering implies a direction between the parties involved. Recent theoretical works have precisely defined this property, but the question arose as to whether there are bipartite states showing steering only in one direction. Here, we present an experimental realization of two entangled Gaussian modes of light that in fact shows the steering effect in one direction but not in the other. The generated one-way steering gives a new insight into quantum physics and may open a new field of applications in quantum information.</p>",,"[{""address"": ""Centre for Quantum Engineering and Space-Time Research\u2014QUEST, Leibniz Universit\u00e4t Hannover, Welfengarten 1, Hannover, 30167, Germany"", ""authors"": [""Vitus H\u00e4ndchen"", "",\u00a0Tobias Eberle"", "",\u00a0Sebastian Steinlechner"", "",\u00a0Aiko Samblowski"", "",\u00a0Torsten Franz"", "",\u00a0Reinhard F. Werner"", ""\u00a0&\u00a0Roman Schnabel""]}, {""address"": ""Max-Planck-Institut f\u00fcr Gravitationsphysik (Albert-Einstein-Institut) and Institut f\u00fcr Gravitationsphysik der Leibniz Universit\u00e4t Hannover, Callinstra\u00dfe 38, Hannover, 30167, Germany"", ""authors"": [""Vitus H\u00e4ndchen"", "",\u00a0Tobias Eberle"", "",\u00a0Sebastian Steinlechner"", "",\u00a0Aiko Samblowski"", ""\u00a0&\u00a0Roman Schnabel""]}, {""address"": ""Institut f\u00fcr Theoretische Physik der Leibniz Universit\u00e4t Hannover, Appelstra\u00dfe 2, Hannover, 30167, Germany"", ""authors"": [""Torsten Franz"", ""\u00a0&\u00a0Reinhard F. Werner""]}]",False,"[""Vitus H\u00e4ndchen"", ""Tobias Eberle"", ""Sebastian Steinlechner"", ""Aiko Samblowski"", ""Torsten Franz"", ""Reinhard F. Werner"", ""Roman Schnabel""]","Händchen, V., Eberle, T., Steinlechner, S. et al. Observation of one-way Einstein–Podolsky–Rosen steering. Nature Photon6, 596–599 (2012).",368,30,189,aplusplus,10.1038/nphoton.2012.202,https://doi.org/10.1038/nphoton.2012.202,,9,nphoton,nature photonics,1345334400,2012-08-19,quantum-optics,https://www.nature.com/articles/nphoton.2012.202,6
letter,Realization of quantum Wheeler's delayed-choice experiment,"<p>Light is believed to exhibit wave&#8211;particle duality depending on the detecting devices, according to Bohr's complementarity principle, as has been demonstrated by the &#8216;delayed-choice experiment&#8217; with classical detecting devices. A recent proposal suggests that the detecting device can also occupy a quantum state, and a quantum version of the delayed-choice experiment can be performed. Here, we experimentally realize the quantum delayed-choice experiment and observe the wave&#8211;particle morphing phenomenon of a single photon. We also illustrate, for the first time, the behaviour of the quantum wave&#8211;particle superposition state of a single photon. We find that the quantum wave&#8211;particle superposition state is distinct from the classical mixture state because of quantum interference between the wave and particle states. Our work reveals the deep relationship between the complementarity principle and the superposition principle, and it may be helpful in furthering understanding of the behaviour of light.</p>",,"[{""address"": ""Key Laboratory of Quantum Information, University of Science and Technology of China, CAS, Hefei, 230026, China"", ""authors"": [""Jian-Shun Tang"", "",\u00a0Yu-Long Li"", "",\u00a0Xiao-Ye Xu"", "",\u00a0Guo-Yong Xiang"", "",\u00a0Chuan-Feng Li"", ""\u00a0&\u00a0Guang-Can Guo""]}]",False,"[""Jian-Shun Tang"", ""Yu-Long Li"", ""Xiao-Ye Xu"", ""Guo-Yong Xiang"", ""Chuan-Feng Li"", ""Guang-Can Guo""]","Tang, J., Li, Y., Xu, X. et al. Realization of quantum Wheeler's delayed-choice experiment. Nature Photon6, 600–604 (2012).",777,72,71,aplusplus,10.1038/nphoton.2012.179,https://doi.org/10.1038/nphoton.2012.179,,9,nphoton,nature photonics,1345334400,2012-08-19,optical-physics;quantum-optics,https://www.nature.com/articles/nphoton.2012.179,6
letter,Ultrafast all-optical switching by single photons,"<p>An as yet outstanding goal in quantum optics is the realization of fast optical nonlinearities at the single-photon level. This would allow for the implementation of optical devices with new functionalities such as single-photon switches/transistors or controlled-phase gates. Although nonlinear optics effects at the single-emitter level have been demonstrated in a number of systems, none of these experiments showed single-photon switching on ultrafast timescales. Here, we perform pulsed two-colour spectroscopy and demonstrate that, in a strongly coupled quantum dot&#8211;cavity system, the presence of a single photon on one of the fundamental polariton transitions can turn on light scattering on a transition from the first to the second Jaynes&#8211;Cummings manifold. The overall switching time of this single-photon all-optical switch is &#8764;50 ps. In addition, we use the single-photon nonlinearity to implement a pulse correlator. Our quantum dot&#8211;cavity system could form the building block of future high-bandwidth photonic networks operating in the quantum regime.</p>",,"[{""address"": ""Institute of Quantum Electronics, ETH Zurich, Zurich, 8093, Switzerland"", ""authors"": [""Thomas Volz"", "",\u00a0Andreas Reinhard"", "",\u00a0Martin Winger"", "",\u00a0Kevin J. Hennessy"", ""\u00a0&\u00a0Ata\u00e7 Imamo\u011flu""]}, {""address"": ""Department of Physics and Astronomy, University of Rochester, Rochester, 14627, New York, USA"", ""authors"": [""Antonio Badolato""]}, {""address"": ""School of Engineering and Applied Physics, Harvard University, Cambridge, 02138, Massachusetts, USA"", ""authors"": [""Evelyn L. Hu""]}]",False,"[""Thomas Volz"", ""Andreas Reinhard"", ""Martin Winger"", ""Antonio Badolato"", ""Kevin J. Hennessy"", ""Evelyn L. Hu"", ""Ata\u00e7 Imamo\u011flu""]","Volz, T., Reinhard, A., Winger, M. et al. Ultrafast all-optical switching by single photons. Nature Photon6, 605–609 (2012).",977,3,229,aplusplus,10.1038/nphoton.2012.181,https://doi.org/10.1038/nphoton.2012.181,,9,nphoton,nature photonics,1344729600,2012-08-12,nonlinear-optics;optical-materials-and-structures;quantum-optics;ultrafast-photonics,https://www.nature.com/articles/nphoton.2012.181,6
letter,Wafer-scale integration of group III–V lasers on silicon using transfer printing of epitaxial layers,"<p>The hard-drive and electronic industries can benefit by using the properties of light for power transfer and signalling. However, the integration of silicon electronics with lasers remains a challenge, because practical monolithic silicon lasers are not currently available. Here, we demonstrate a strategy for this integration, using an elastomeric stamp to selectively release and transfer epitaxial coupons of GaAs to realize III&#8211;V lasers on a silicon substrate by means of a wafer-scale printing process. Low-threshold continuous-wave lasing at a wavelength of 824&#160;nm is achieved from Fabry&#8211;P&#233;rot ridge waveguide lasers operating at temperatures up to 100&#160;&#176;C. Single and multi-transverse mode devices emit total optical powers of &gt;60&#160;mW and support modulation bandwidths of &gt;3&#160;GHz. This fabrication strategy opens a route to the low-cost integration of III&#8211;V photonic devices and circuits on silicon and other substrates.</p>",,"[{""address"": ""Tyndall National Institute, University College Cork, Lee Maltings, Cork, Ireland"", ""authors"": [""John Justice"", ""\u00a0&\u00a0Brian Corbett""]}, {""address"": ""Semprius Inc., 4915 Prospectus Drive, Suite C, Durham, 27713, North Carolina, USA"", ""authors"": [""Chris Bower"", ""\u00a0&\u00a0Matthew Meitl""]}, {""address"": ""Seagate Technology, 1 Disc Drive, Springtown Industrial Estate, Londonderry, BT48 OBF, Northern Ireland"", ""authors"": [""Marcus B. Mooney"", ""\u00a0&\u00a0Mark A. Gubbins""]}]",False,"[""John Justice"", ""Chris Bower"", ""Matthew Meitl"", ""Marcus B. Mooney"", ""Mark A. Gubbins"", ""Brian Corbett""]","Justice, J., Bower, C., Meitl, M. et al. Wafer-scale integration of groupIII–Vlasers on silicon using transfer printing of epitaxial layers. Nature Photon6, 610–614 (2012).",960,3,127,aplusplus,10.1038/nphoton.2012.204,https://doi.org/10.1038/nphoton.2012.204,,9,nphoton,nature photonics,1345334400,2012-08-19,integrated-optics;lasers-leds-and-light-sources;silicon-photonics,https://www.nature.com/articles/nphoton.2012.204,6
article,Transfer-printed stacked nanomembrane lasers on silicon,"<p>The realization of silicon-based light sources has been the subject of a major research and development effort worldwide. Such sources may help make integrated photonic and electronic circuitry more cost-effective, with higher performance and greater energy efficiency. The hybrid approach, in which silicon is integrated with a III&#8211;V gain medium, is an attractive route in the development of silicon lasers because of its potential for high efficiency. Hybrid lasers with good performance have been reported that are fabricated by direct growth or direct wafer-bonding of the gain medium to silicon. Here, we report a membrane reflector surface-emitting laser on silicon that is based on multilayer semiconductor nanomembrane stacking and a stamp-assisted transfer-printing process. The optically pumped laser consists of a transferred III&#8211;V InGaAsP quantum-well heterostructure as the gain medium, which is sandwiched between two thin, single-layer silicon photonic-crystal Fano resonance membrane reflectors. We also demonstrate high-finesse single- or multiwavelength vertical laser cavities.</p>",,"[{""address"": ""Department of Electrical Engineering, NanoFAB Center, University of Texas at Arlington, 76019, Texas, USA"", ""authors"": [""Hongjun Yang"", "",\u00a0Deyin Zhao"", "",\u00a0Santhad Chuwongin"", "",\u00a0Weiquan Yang"", "",\u00a0Yichen Shuai"", ""\u00a0&\u00a0Weidong Zhou""]}, {""address"": ""Department of Electrical and Computer Engineering, University of Wisconsin-Madison, Wisconsin, 53706, USA"", ""authors"": [""Jung-Hun Seo"", ""\u00a0&\u00a0Zhenqiang Ma""]}, {""address"": ""Semerane, Inc, 202 East Border Street, Suite 149, Arlington, 76010, Texas, USA"", ""authors"": [""Hongjun Yang""]}, {""address"": ""KTH-Royal Institute of Technology, School of Information and Communication Technology, Electrum 229, Kista, 164 40, Sweden"", ""authors"": [""Jesper Berggren"", ""\u00a0&\u00a0Mattias Hammar""]}]",False,"[""Hongjun Yang"", ""Deyin Zhao"", ""Santhad Chuwongin"", ""Jung-Hun Seo"", ""Weiquan Yang"", ""Yichen Shuai"", ""Jesper Berggren"", ""Mattias Hammar"", ""Zhenqiang Ma"", ""Weidong Zhou""]","Yang, H., Zhao, D., Chuwongin, S. et al. Transfer-printed stacked nanomembrane lasers on silicon. Nature Photon6, 615–620 (2012).",745,24,138,aplusplus,10.1038/nphoton.2012.160,https://doi.org/10.1038/nphoton.2012.160,,9,nphoton,nature photonics,1342915200,2012-07-22,integrated-optics;lasers-leds-and-light-sources;silicon-photonics,https://www.nature.com/articles/nphoton.2012.160,6
