contentType,title,abstract,abstract_google_cn,affiliations,authorization,authors,citation_text,count_accesses,count_altmetric,count_citations,documentType,doi,doi_url,focus,issue,journal_pcode,journal_title,publishedAt,publishedAtString,subjects,url,volume
books & arts,On our bookshelf,,,"[{""address"": ""Nature Photonics"", ""authors"": [""Rachel Won""]}]",True,"[""Rachel Won""]","Won, R. On our bookshelf. Nat. Photonics13, 437 (2019).",282,0,0,aplusplus,10.1038/s41566-019-0469-4,https://doi.org/10.1038/s41566-019-0469-4,,7,nphoton,nature photonics,1561075200,2019-06-21,,https://www.nature.com/articles/s41566-019-0469-4,13
research highlight,Reconstruction simplified,,,"[{""address"": ""Nature Photonics"", ""authors"": [""David F. P. Pile""]}]",True,"[""David F. P. Pile""]","Pile, D.F.P. Reconstruction simplified. Nat. Photonics13, 438 (2019).",541,0,0,aplusplus,10.1038/s41566-019-0480-9,https://doi.org/10.1038/s41566-019-0480-9,,7,nphoton,nature photonics,1561075200,2019-06-21,imaging-and-sensing;optical-sensors;optical-techniques,https://www.nature.com/articles/s41566-019-0480-9,13
research highlight,Super oscillation beams,,,"[{""address"": ""Nature Photonics"", ""authors"": [""Noriaki Horiuchi""]}]",True,"[""Noriaki Horiuchi""]","Horiuchi, N. Super oscillation beams. Nat. Photonics13, 438 (2019).",578,1,0,aplusplus,10.1038/s41566-019-0481-8,https://doi.org/10.1038/s41566-019-0481-8,,7,nphoton,nature photonics,1561075200,2019-06-21,confocal-microscopy;nanoparticles;optical-manipulation-and-tweezers;sub-wavelength-optics,https://www.nature.com/articles/s41566-019-0481-8,13
research highlight,Sensitive nanodiamonds,,,"[{""address"": ""Nature Photonics"", ""authors"": [""Oliver Graydon""]}]",True,"[""Oliver Graydon""]","Graydon, O. Sensitive nanodiamonds. Nat. Photonics13, 438 (2019).",666,0,0,aplusplus,10.1038/s41566-019-0482-7,https://doi.org/10.1038/s41566-019-0482-7,,7,nphoton,nature photonics,1561075200,2019-06-21,diamond;optical-sensors,https://www.nature.com/articles/s41566-019-0482-7,13
research highlight,Flexible coating,,,"[{""address"": ""Nature Photonics"", ""authors"": [""Oliver Graydon""]}]",True,"[""Oliver Graydon""]","Graydon, O. Flexible coating. Nat. Photonics13, 438 (2019).",478,2,1,aplusplus,10.1038/s41566-019-0483-6,https://doi.org/10.1038/s41566-019-0483-6,,7,nphoton,nature photonics,1561075200,2019-06-21,metamaterials,https://www.nature.com/articles/s41566-019-0483-6,13
research highlight,Room-temperature comb,,,"[{""address"": ""Nature Photonics"", ""authors"": [""Oliver Graydon""]}]",True,"[""Oliver Graydon""]","Graydon, O. Room-temperature comb. Nat. Photonics13, 438 (2019).",598,0,0,aplusplus,10.1038/s41566-019-0484-5,https://doi.org/10.1038/s41566-019-0484-5,,7,nphoton,nature photonics,1561075200,2019-06-21,frequency-combs;terahertz-optics,https://www.nature.com/articles/s41566-019-0484-5,13
news & views,Attoclock and tunnelling time,,,"[{""address"": ""Max Planck Institute for the Physics of Complex Systems, Dresden, Germany"", ""authors"": [""Jan M. Rost"", ""\u00a0&\u00a0Ulf Saalmann""]}]",False,"[""Jan M. Rost"", ""Ulf Saalmann""]","Rost, J.M., Saalmann, U. Attoclock and tunnelling time. Nat. Photonics13, 439–440 (2019).",873,0,1,aplusplus,10.1038/s41566-019-0472-9,https://doi.org/10.1038/s41566-019-0472-9,,7,nphoton,nature photonics,1561075200,2019-06-21,imaging-and-sensing;quantum-physics,https://www.nature.com/articles/s41566-019-0472-9,13
news & views,Tunable plasmonic pixels,,,"[{""address"": ""Nature Photonics"", ""authors"": [""David F. P. Pile""]}]",True,"[""David F. P. Pile""]","Pile, D.F.P. Tunable plasmonic pixels. Nat. Photonics13, 440 (2019).",1176,1,0,aplusplus,10.1038/s41566-019-0478-3,https://doi.org/10.1038/s41566-019-0478-3,,7,nphoton,nature photonics,1561075200,2019-06-21,displays;nanophotonics-and-plasmonics;optical-materials-and-structures,https://www.nature.com/articles/s41566-019-0478-3,13
news & views,Where two quantum fluids meet,,,"[{""address"": ""Institute for Quantum Computing, University of Waterloo, Waterloo, Ontario, Canada"", ""authors"": [""Taehyun Yoon"", ""\u00a0&\u00a0Na Young Kim""]}, {""address"": ""Department of Electrical and Computer Engineering, University of Waterloo, Waterloo, Ontario, Canada"", ""authors"": [""Taehyun Yoon"", ""\u00a0&\u00a0Na Young Kim""]}]",False,"[""Taehyun Yoon"", ""Na Young Kim""]","Yoon, T., Kim, N.Y. Where two quantum fluids meet. Nat. Photonics13, 441–442 (2019).",633,1,0,aplusplus,10.1038/s41566-019-0473-8,https://doi.org/10.1038/s41566-019-0473-8,,7,nphoton,nature photonics,1561075200,2019-06-21,optical-manipulation-and-tweezers;polaritons;quantum-optics,https://www.nature.com/articles/s41566-019-0473-8,13
news & views,Photonic amyloids,,,"[{""address"": ""Department of Physics, Chemistry, and Biology, Link\u00f6ping University, Link\u00f6ping, Sweden"", ""authors"": [""Per Hammarstr\u00f6m""]}]",False,"[""Per Hammarstr\u00f6m""]","Hammarström, P. Photonic amyloids. Nat. Photonics13, 442–444 (2019).",569,0,0,aplusplus,10.1038/s41566-019-0471-x,https://doi.org/10.1038/s41566-019-0471-x,,7,nphoton,nature photonics,1561075200,2019-06-21,bioluminescence-imaging;biophysics;imaging-and-sensing;optical-imaging,https://www.nature.com/articles/s41566-019-0471-x,13
letter,Taming of random lasers,"<p>Random lasers are fascinating devices due to the absence of a conventional cavity structure and their counterintuitive lasing mechanism. However, they are also notorious for their unpredictability. Despite their many unusual properties, random lasers are unlikely to achieve the ubiquitous acceptance of conventional lasers unless the underlying lasing mechanisms that govern their operation are thoroughly understood and their exotic properties are appropriately regulated. Recent demonstrations of localized random lasers are considered a breakthrough in the field because structural disorders were engineered in a top-down manner. Nevertheless, the origin of the lasing phenomenon and the controllability of these devices have not been adequately addressed. Lately, we have experimentally proven that photonic band-tail eigenstates&#8212;manifestations of photonic Anderson localizations&#8212;are responsible for random lasing in a compositionally disordered photonic crystal platform. Herein, we demonstrate that the process of governing the band-tail states offers a unique opportunity to finally regulate random lasers.</p>",,"[{""address"": ""Department of Physics and Astronomy, Seoul National University, Seoul, Republic of Korea"", ""authors"": [""Myungjae Lee"", ""\u00a0&\u00a0Heonsu Jeon""]}, {""address"": ""Inter-university Semiconductor Research Center, Seoul National University, Seoul, Republic of Korea"", ""authors"": [""Myungjae Lee"", ""\u00a0&\u00a0Heonsu Jeon""]}, {""address"": ""Universit\u00e9 de Lyon, Institut des Nanotechnologies de Lyon-INL, UMR CNRS 5270, CNRS, Ecole Centrale de Lyon, Ecully, France"", ""authors"": [""S\u00e9gol\u00e8ne Callard"", ""\u00a0&\u00a0Christian Seassal""]}, {""address"": ""Institute of Applied Physics, Seoul National University, Seoul, Republic of Korea"", ""authors"": [""Heonsu Jeon""]}]",False,"[""Myungjae Lee"", ""S\u00e9gol\u00e8ne Callard"", ""Christian Seassal"", ""Heonsu Jeon""]","Lee, M., Callard, S., Seassal, C. et al. Taming of random lasers. Nat. Photonics13, 445–448 (2019).",6506,0,4,aplusplus,10.1038/s41566-019-0407-5,https://doi.org/10.1038/s41566-019-0407-5,,7,nphoton,nature photonics,1554681600,2019-04-08,nanophotonics-and-plasmonics;semiconductor-lasers,https://www.nature.com/articles/s41566-019-0407-5,13
article,Computed stereo lensless X-ray imaging,"<p>Recovering the three-dimensional (3D) properties of artificial or biological systems using low X-ray doses is challenging as most techniques are based on computing hundreds of two-dimensional (2D) projections. The requirement for a low X-ray dose also prevents single-shot 3D imaging using ultrafast X-ray sources. Here we show that computed stereo vision concepts can be applied to X-rays. Stereo vision is important in the field of machine vision and robotics. We reconstruct two X-ray stereo views from coherent diffraction patterns and compute a nanoscale 3D representation of the sample from disparity maps. Similarly to brain perception, computed stereo vision algorithms use constraints. We demonstrate that phase-contrast images relax the disparity constraints, allowing occulted features to be revealed. We also show that by using nanoparticles as labels we can extend the applicability of the technique to complex samples. Computed stereo X-ray imaging will find application at X-ray free-electron lasers, synchrotrons and laser-based sources, and in industrial and medical 3D diagnosis methods.</p>",,"[{""address"": ""LIDYL, CEA, CNRS, Universit\u00e9 Paris-Saclay, CEA Saclay, Gif-sur-Yvette, France"", ""authors"": [""J. Duarte"", "",\u00a0R. Cassin"", "",\u00a0J. Huijts"", "",\u00a0B. Iwan"", "",\u00a0W. Boutu"", ""\u00a0&\u00a0H. Merdji""]}, {""address"": ""Leibniz Universit\u00e4t Hannover, Institut f\u00fcr Quantenoptik, Hannover, Germany"", ""authors"": [""B. Iwan"", ""\u00a0&\u00a0M. Kovacev""]}, {""address"": ""CSNSM, CNRS/IN2P3, Universit\u00e9 Paris-Saclay, Orsay, France"", ""authors"": [""F. Fortuna"", ""\u00a0&\u00a0L. Delbecq""]}, {""address"": ""Center for Free-Electron Laser Science, DESY, Hamburg, Germany"", ""authors"": [""H. Chapman""]}, {""address"": ""Instituto de Plasmas e Fus\u00e3o Nuclear, IST Lisboa, Lisbon, Portugal"", ""authors"": [""M. Fajardo""]}]",False,"[""J. Duarte"", ""R. Cassin"", ""J. Huijts"", ""B. Iwan"", ""F. Fortuna"", ""L. Delbecq"", ""H. Chapman"", ""M. Fajardo"", ""M. Kovacev"", ""W. Boutu"", ""H. Merdji""]","Duarte, J., Cassin, R., Huijts, J. et al. Computed stereo lensless X-ray imaging. Nat. Photonics13, 449–453 (2019).",2768,89,1,aplusplus,10.1038/s41566-019-0419-1,https://doi.org/10.1038/s41566-019-0419-1,,7,nphoton,nature photonics,1555286400,2019-04-15,high-harmonic-generation;ultrafast-photonics;x-rays,https://www.nature.com/articles/s41566-019-0419-1,13
article,Femtofarad optoelectronic integration demonstrating energy-saving signal conversion and nonlinear functions,"<p>The introduction of photonic technologies into mature electronic circuits is in high demand to accelerate on-chip information networking and even computing. Great difficulty lies in the fact that the optoelectronic coupling at their interfaces requires a substantial charging energy determined by their capacitance. Optoelectronic devices have been too large to reduce the integrated capacitance down to the femtofarad scale. Here we use a photonic-crystal platform to demonstrate the first experimental proof of optoelectronic integration at only 2&#8201;fF. This allows us to realize a record-low attojoule-energy electro-optic modulator (an electrical-to-optical or E&#8211;O converter) and an amplifier-free photoreceiver (an optical-to-electrical, or O&#8211;E converter), which leads to ultralow-energy signal conversion. By integrating these O&#8211;E/E&#8211;O devices, we demonstrate femtofarad &#8216;O&#8211;E&#8211;O transistors&#8217; with optical signal gain that show various optical nonlinear functions, including as all-optical switches, wavelength converters and cascadable optical repeaters with a femtojoule-per-bit energy consumption. These femtofarad-scale O&#8211;E/E&#8211;O/O&#8211;E&#8211;O devices promise tightly coupled photonic&#8211;electronic integration for new fields of energy-saving information processing.</p>",,"[{""address"": ""Nanophotonics Center, NTT Corporation, Atsugi, Japan"", ""authors"": [""Kengo Nozaki"", "",\u00a0Shinji Matsuo"", "",\u00a0Takuro Fujii"", "",\u00a0Koji Takeda"", "",\u00a0Akihiko Shinya"", "",\u00a0Eiichi Kuramochi"", ""\u00a0&\u00a0Masaya Notomi""]}, {""address"": ""NTT Basic Research Laboratories, NTT Corporation, Atsugi, Japan"", ""authors"": [""Kengo Nozaki"", "",\u00a0Akihiko Shinya"", "",\u00a0Eiichi Kuramochi"", ""\u00a0&\u00a0Masaya Notomi""]}, {""address"": ""NTT Device Technology Laboratories, NTT Corporation, Atsugi, Japan"", ""authors"": [""Shinji Matsuo"", "",\u00a0Takuro Fujii"", ""\u00a0&\u00a0Koji Takeda""]}]",False,"[""Kengo Nozaki"", ""Shinji Matsuo"", ""Takuro Fujii"", ""Koji Takeda"", ""Akihiko Shinya"", ""Eiichi Kuramochi"", ""Masaya Notomi""]","Nozaki, K., Matsuo, S., Fujii, T. et al. Femtofarad optoelectronic integration demonstrating energy-saving signal conversion and nonlinear functions. Nat. Photonics13, 454–459 (2019).",4163,38,7,aplusplus,10.1038/s41566-019-0397-3,https://doi.org/10.1038/s41566-019-0397-3,,7,nphoton,nature photonics,1555286400,2019-04-15,optoelectronic-devices-and-components;photonic-crystals,https://www.nature.com/articles/s41566-019-0397-3,13
article,Surface passivation of perovskite film for efficient solar cells,"<p>In recent years, the power conversion efficiency of perovskite solar cells has increased to reach over 20%. Finding an effective means of defect passivation is thought to be a promising route for bringing further increases in the power conversion efficiency and the open-circuit voltage (V<sub>OC</sub>) of perovskite solar cells. Here, we report the use of an organic halide salt phenethylammonium iodide (PEAI) on HC(NH<sub>2</sub>)<sub>2</sub>&#8211;CH<sub>3</sub>NH<sub>3</sub> mixed perovskite films for surface defect passivation. We find that PEAI can form on the perovskite surface and results in higher-efficiency cells by reducing the defects and suppressing non-radiative recombination. As a result, planar perovskite solar cells with a certificated efficiency of 23.32% (quasi-steady state) are obtained. In addition, a V<sub>OC</sub> as high as 1.18&#8201;V is achieved at the absorption threshold of 1.53&#8201;eV, which is 94.4% of the Shockley&#8211;Queisser limit V<sub>OC</sub> (1.25&#8201;V).</p>",,"[{""address"": ""Key Laboratory of Semiconductor Materials Science, Institute of Semiconductors, Chinese Academy of Sciences, Beijing, China"", ""authors"": [""Qi Jiang"", "",\u00a0Yang Zhao"", "",\u00a0Xingwang Zhang"", "",\u00a0Xiaolei Yang"", "",\u00a0Yong Chen"", "",\u00a0Zema Chu"", "",\u00a0Qiufeng Ye"", "",\u00a0Xingxing Li"", "",\u00a0Zhigang Yin"", ""\u00a0&\u00a0Jingbi You""]}, {""address"": ""Center of Materials Science and Optoelectronics Engineering, University of Chinese Academy of Sciences, Beijing, China"", ""authors"": [""Qi Jiang"", "",\u00a0Yang Zhao"", "",\u00a0Xingwang Zhang"", "",\u00a0Yong Chen"", "",\u00a0Zema Chu"", "",\u00a0Qiufeng Ye"", "",\u00a0Xingxing Li"", "",\u00a0Zhigang Yin"", ""\u00a0&\u00a0Jingbi You""]}]",False,"[""Qi Jiang"", ""Yang Zhao"", ""Xingwang Zhang"", ""Xiaolei Yang"", ""Yong Chen"", ""Zema Chu"", ""Qiufeng Ye"", ""Xingxing Li"", ""Zhigang Yin"", ""Jingbi You""]","Jiang, Q., Zhao, Y., Zhang, X. et al. Surface passivation of perovskite film for efficient solar cells. Nat. Photonics13, 460–466 (2019).",32000,18,520,aplusplus,10.1038/s41566-019-0398-2,https://doi.org/10.1038/s41566-019-0398-2,,7,nphoton,nature photonics,1554076800,2019-04-01,lasers-leds-and-light-sources;solar-cells,https://www.nature.com/articles/s41566-019-0398-2,13
article,Coherent steering of nonlinear chiral valley photons with a synthetic Au–WS2 metasurface,"<p>Two-dimensional transition metal dichalcogenides (TMDCs) present extraordinary nonlinearities and direct bandgaps at the K and K&#8242; valleys. These valleys can be optically manipulated through, for example, plasmon&#8211;valley-exciton coupling with spin-dependent photoluminescence. However, the weak coherence between the pumping and emission makes exploring nonlinear valleytronic devices based on TMDCs challenging. Here, we show that a synthetic metasurface, which entangles the phase and spin of light, can simultaneously enhance and manipulate nonlinear valley-locked chiral emission in monolayer tungsten disulfide (WS<sub>2</sub>) at room temperature. The second-harmonic valley photons, accessed and coherently pumped by light, with a spin-related geometric phase imparted by a gold (Au) metasurface, are separated and routed to predetermined directions in free space. In addition, the nonlinear photons with the same spin as the incident light are steered owing to the critical spin&#8211;valley-locked nonlinear selection rule of WS<sub>2</sub> in our designed metasurface. Our synthetic TMDC&#8211;metasurface interface may facilitate advanced room-temperature and free-space nonlinear, quantum and valleytronic nanodevices.</p>",,"[{""address"": ""Department of Electrical and Computer Engineering, National University of Singapore, Singapore, Singapore"", ""authors"": [""Guangwei Hu"", "",\u00a0He-Xiu Xu"", ""\u00a0&\u00a0Cheng-Wei Qiu""]}, {""address"": ""Wuhan National Laboratory for Optoelectronics and School of Physics, Huazhong University of Science and Technology, Wuhan, China"", ""authors"": [""Xuanmiao Hong"", "",\u00a0Kai Wang"", "",\u00a0Wenchao Zhao"", "",\u00a0Weiwei Liu"", "",\u00a0Bing Wang"", ""\u00a0&\u00a0Peixiang Lu""]}, {""address"": ""Institute of Materials Research and Engineering, A*STAR (Agency for Science, Technology and Research), Singapore, Singapore"", ""authors"": [""Jing Wu""]}, {""address"": ""School of Physics and Astronomy, University of Birmingham, Birmingham, UK"", ""authors"": [""Shuang Zhang""]}, {""address"": ""Departamento de F\u00edsica Te\u00f3rica de la Materia Condensada and Condensed Matter Physics Center (IFIMAC), Universidad Aut\u00f3noma de Madrid, Madrid, Spain"", ""authors"": [""Francisco Garcia-Vidal""]}, {""address"": ""Donostia International Physics Center (DIPC), Donostia/San Sebastian, Spain"", ""authors"": [""Francisco Garcia-Vidal""]}, {""address"": ""Laboratory of Optical Information Technology, Wuhan Institute of Technology, Wuhan, China"", ""authors"": [""Peixiang Lu""]}]",False,"[""Guangwei Hu"", ""Xuanmiao Hong"", ""Kai Wang"", ""Jing Wu"", ""He-Xiu Xu"", ""Wenchao Zhao"", ""Weiwei Liu"", ""Shuang Zhang"", ""Francisco Garcia-Vidal"", ""Bing Wang"", ""Peixiang Lu"", ""Cheng-Wei Qiu""]","Hu, G., Hong, X., Wang, K. et al. Coherent steering of nonlinear chiral valley photons with a synthetic Au–WS2metasurface. Nat. Photonics13, 467–472 (2019).",9319,6,36,aplusplus,10.1038/s41566-019-0399-1,https://doi.org/10.1038/s41566-019-0399-1,,7,nphoton,nature photonics,1554076800,2019-04-01,nanophotonics-and-plasmonics;nanoscale-materials;nonlinear-optics;optical-materials-and-structures,https://www.nature.com/articles/s41566-019-0399-1,13
article,Ultraviolet–visible–near-infrared optical properties of amyloid fibrils shed light on amyloidogenesis,"<p>Amyloid fibres attract considerable interest due to their biological role in neurodegenerative diseases and their potential as functional biomaterials. Here, we describe an intrinsic signal of amyloid fibres in the near-infrared range. When combined with their recently reported blue luminescence, it paves the way towards new blueprints for the label-free detection of amyloid deposits in in vitro and in vivo contexts. The blue luminescence allows for staining-free characterization of amyloid deposits in human samples. The near-infrared signal offers promising prospects for innovative diagnostic strategies for neurodegenerative diseases&#8212;to improve medical care and for the development of new therapies. As a proof of concept, we demonstrate direct detection of amyloid deposits within brains of living, aged mice with Alzheimer&#8217;s disease using non-invasive and contrast-agent-free imaging. Ultraviolet&#8211;visible&#8211;near-infrared optical properties of amyloids open new research avenues for amyloidosis as well as for next-generation biophotonic devices.</p>",,"[{""address"": ""Univ. Grenoble Alpes, CEA, CNRS, IRIG-LCBM, Grenoble, France"", ""authors"": [""Jonathan Pansieri"", "",\u00a0Sun-Jae Lee"", "",\u00a0Ana\u00eblle Rongier"", "",\u00a0Christel Marquette"", ""\u00a0&\u00a0Vincent Forge""]}, {""address"": ""Institute for Advanced Biosciences, Univ. Grenoble Alpes - INSERM U1209 - CNRS UMR5309, Grenoble, France"", ""authors"": [""V\u00e9ronique Josserand"", "",\u00a0M\u00e9lanie Guidetti"", "",\u00a0Julien Vollaire"", ""\u00a0&\u00a0Jean-Luc Coll""]}, {""address"": ""Univ. Grenoble Alpes, CEA, CNRS, IRIG-SyMMES, Grenoble, France"", ""authors"": [""Sun-Jae Lee"", "",\u00a0Ana\u00eblle Rongier"", "",\u00a0Daniel Imbert"", ""\u00a0&\u00a0Patrice Rannou""]}, {""address"": ""INSERM U1039, La Tronche, France"", ""authors"": [""Marcelle Moulin Sallanon""]}, {""address"": ""Univ. Grenoble-Alpes, Grenoble, France"", ""authors"": [""Marcelle Moulin Sallanon""]}, {""address"": ""Department of Mental Health and Psychiatry, University Hospitals and University of Geneva School of Medicine, Geneva, Switzerland"", ""authors"": [""Enik\u00f6 K\u00f6vari""]}, {""address"": ""European Synchrotron Radiation Facility, Grenoble, France"", ""authors"": [""Thomas G. Dane""]}, {""address"": ""Universit\u00e9 de Cergy-Pontoise, I-MAT FD4122, ERRMECe, Cergy-Pontoise, France"", ""authors"": [""Charlotte Vendrely""]}, {""address"": ""Univ. Grenoble Alpes, CNRS, Grenoble INP, LMGP, Grenoble, France"", ""authors"": [""Charlotte Vendrely"", ""\u00a0&\u00a0Odette Chaix-Pluchery""]}, {""address"": ""TIMC-IMAG, CNRS 5525, Univ. Grenoble-Alpes, Grenoble, France"", ""authors"": [""Arnold Fertin"", ""\u00a0&\u00a0Yves Usson""]}]",False,"[""Jonathan Pansieri"", ""V\u00e9ronique Josserand"", ""Sun-Jae Lee"", ""Ana\u00eblle Rongier"", ""Daniel Imbert"", ""Marcelle Moulin Sallanon"", ""Enik\u00f6 K\u00f6vari"", ""Thomas G. Dane"", ""Charlotte Vendrely"", ""Odette Chaix-Pluchery"", ""M\u00e9lanie Guidetti"", ""Julien Vollaire"", ""Arnold Fertin"", ""Yves Usson"", ""Patrice Rannou"", ""Jean-Luc Coll"", ""Christel Marquette"", ""Vincent Forge""]","Pansieri, J., Josserand, V., Lee, S. et al. Ultraviolet–visible–near-infrared optical properties of amyloid fibrils shed light on amyloidogenesis. Nat. Photonics13, 473–479 (2019).",3823,17,9,aplusplus,10.1038/s41566-019-0422-6,https://doi.org/10.1038/s41566-019-0422-6,,7,nphoton,nature photonics,1557705600,2019-05-13,bioluminescence-imaging;biophotonics;biophysics;imaging-and-sensing;optical-imaging,https://www.nature.com/articles/s41566-019-0422-6,13
article,Interferometric scattering microscopy reveals microsecond nanoscopic protein motion on a live cell membrane,"<p>Many of the biological functions of a cell are dictated by the intricate motion of proteins within its membrane over a spatial range of nanometres to tens of micrometres and time intervals of microseconds to minutes. This rich parameter space is not accessible by fluorescence microscopy, but it is within reach of interferometric scattering (iSCAT) particle tracking. However, as iSCAT is sensitive even to single unlabelled proteins, it is often accompanied by a large speckle-like background, which poses a substantial challenge for its application to cellular imaging. Here, we employ a new image processing approach to overcome this difficulty and demonstrate tracking of transmembrane epidermal growth factor receptors with nanometre precision in all three dimensions at up to microsecond speeds and for durations of tens of minutes. We provide examples of nanoscale motion and confinement in ubiquitous processes such as diffusion in the plasma membrane, transport on filopodia and rotational motion during endocytosis.</p>",,"[{""address"": ""Max-Planck-Zentrum f\u00fcr Physik und Medizin, Erlangen, Germany"", ""authors"": [""Richard W. Taylor"", "",\u00a0Reza Gholami Mahmoodabadi"", "",\u00a0Alexandra Schambony"", ""\u00a0&\u00a0Vahid Sandoghdar""]}, {""address"": ""Max Planck Institute for the Science of Light, Erlangen, Germany"", ""authors"": [""Richard W. Taylor"", "",\u00a0Reza Gholami Mahmoodabadi"", ""\u00a0&\u00a0Vahid Sandoghdar""]}, {""address"": ""Department of Biology, Friedrich Alexander University Erlangen\u2013Nuremberg, Erlangen, Germany"", ""authors"": [""Verena Rauschenberger"", "",\u00a0Andreas Giessl"", ""\u00a0&\u00a0Alexandra Schambony""]}, {""address"": ""Department of Physics, Friedrich Alexander University Erlangen\u2013Nuremberg, Erlangen, Germany"", ""authors"": [""Vahid Sandoghdar""]}]",False,"[""Richard W. Taylor"", ""Reza Gholami Mahmoodabadi"", ""Verena Rauschenberger"", ""Andreas Giessl"", ""Alexandra Schambony"", ""Vahid Sandoghdar""]","Taylor, R.W., Mahmoodabadi, R.G., Rauschenberger, V. et al. Interferometric scattering microscopy reveals microsecond nanoscopic protein motion on a live cell membrane. Nat. Photonics13, 480–487 (2019).",6237,32,18,aplusplus,10.1038/s41566-019-0414-6,https://doi.org/10.1038/s41566-019-0414-6,,7,nphoton,nature photonics,1555286400,2019-04-15,biophysics;interference-microscopy,https://www.nature.com/articles/s41566-019-0414-6,13
